08.01.2025 cр – Москва, бард-клуб "Гнездо глухаря"
L2025-01-08_ballada,01,L2025-01-08, ballada,false,
L2025-01-08_chuzhaj2,02,L2025-01-08, chuzhaj2,false,
L2025-01-08_istorija,03,L2025-01-08, istorija,false,
L2025-01-08_romans2,04,L2025-01-08, romans2,false,
L2025-01-08_serenada,05,L2025-01-08, serenada,false,
L2025-01-08_ryba,06,L2025-01-08, ryba,false,
L2025-01-08_2001,07,L2025-01-08, 2001,false,
L2025-01-08_dopoezda,08,L2025-01-08, dopoezda,false,
L2025-01-08_kuznechiki,09,L2025-01-08, kuznechiki,false,
L2025-01-08_chumka,10,L2025-01-08, chumka,false,
L2025-01-08_ubykagol,11,L2025-01-08, ubykagol,false,
L2025-01-08_shum,12,L2025-01-08, shum,false,
L2025-01-08_deja,13,L2025-01-08, deja,false,
L2025-01-08_krasnye,14,L2025-01-08, krasnye,false,
L2025-01-08_skolko,15,L2025-01-08, skolko,false,
L2025-01-08_adleucon,16,L2025-01-08, adleucon,false,
L2025-01-08_madlen,17,L2025-01-08, madlen,false,
L2025-01-08_esli,18,L2025-01-08, esli,false,
L2025-01-08_hrustal,19,L2025-01-08, hrustal,false,
L2025-01-08_zoosad,20,L2025-01-08, zoosad,false,
L2025-01-08_sharmans,21,L2025-01-08, sharmans,false,
L2025-01-08_udachny,22,L2025-01-08, udachny,false,
L2025-01-08_baltijsk,23,L2025-01-08, baltijsk,false,
L2025-01-08_totosego,24,L2025-01-08, totosego,false,
L2025-01-08_chepuxa,25,L2025-01-08, chepuxa,false,
L2025-01-08_nerazmen,26,L2025-01-08, nerazmen,false,

15.12.2024 вc – Москва, бард-клуб "Гнездо глухаря", дуэт (клавиши), премьера
L2024-12-15_rusalka,01,L2024-12-15, rusalka,true,
L2024-12-15_burja,02,L2024-12-15, burja,false,
L2024-12-15_descensu,03,L2024-12-15, descensu,false,
L2024-12-15_brodjagi,04,L2024-12-15, brodjagi,false,
L2024-12-15_sentenci,05,L2024-12-15, sentenci,false,
L2024-12-15_aerodrom,06,L2024-12-15, aerodrom,false,
L2024-12-15_lunnaja,07,L2024-12-15, lunnaja,false,
L2024-12-15_cirkachk,08,L2024-12-15, cirkachk,false,
L2024-12-15_vpoxodny,09,L2024-12-15, vpoxodny,false,
L2024-12-15_switzerl,10,L2024-12-15, switzerl,false,
L2024-12-15_skolko,11,L2024-12-15, skolko,true,
L2024-12-15_posesche,12,L2024-12-15, posesche,false,
L2024-12-15_podzname,13,L2024-12-15, podzname,false,
---
L2024-12-15_kalejdos,14,L2024-12-15, kalejdos,false,
L2024-12-15_spros,15,L2024-12-15, spros,false,
L2024-12-15_opyattor,16,L2024-12-15, opyattor,false,
L2024-12-15_okean,17,L2024-12-15, okean,false,
L2024-12-15_shkolat1,18,L2024-12-15, shkolat1,false,
L2024-12-15_muzhajsj,19,L2024-12-15, muzhajsj,false,
L2024-12-15_marija,20,L2024-12-15, marija,false,
L2024-12-15_zoosad,21,L2024-12-15, zoosad,false,
L2024-12-15_kchemuis,22,L2024-12-15, kchemuis,false,
L2024-12-15_hrustal,23,L2024-12-15, hrustal,false,
L2024-12-15_dusha,24,L2024-12-15, dusha,false,
L2024-12-15_sharmans,25,L2024-12-15, sharmans,false,

16.11.2024 сб – Москва, бард-клуб "Гнездо глухаря"
L2024-11-16_ryba,01,L2024-11-16, ryba,false,
L2024-11-16_1991,02,L2024-11-16, 1991,false,
L2024-11-16_panorama,03,L2024-11-16, panorama,false,
L2024-11-16_gonistos,04,L2024-11-16, gonistos,false,
L2024-11-16_akoektop,05,L2024-11-16, akoektop,false,
L2024-11-16_romans2,06,L2024-11-16, romans2,false,
L2024-11-16_peterbur,07,L2024-11-16, peterbur,false,
L2024-11-16_volhonka,08,L2024-11-16, volhonka,false,
L2024-11-16_gdetytep,09,L2024-11-16, gdetytep,false,
L2024-11-16_shkolat2,10,L2024-11-16, shkolat2,false,
L2024-11-16_madlen,11,L2024-11-16, madlen,false,
L2024-11-16_udachny,12,L2024-11-16, udachny,false,
L2024-11-16_totosego,13,L2024-11-16, totosego,false,
---
L2024-11-16_dopoezda,14,L2024-11-16, dopoezda,false,
L2024-11-16_suhumi,15,L2024-11-16, suhumi,false,
L2024-11-16_shum,16,L2024-11-16, shum,false,
L2024-11-16_adleucon,17,L2024-11-16, adleucon,false,
L2024-11-16_baltijsk,18,L2024-11-16, baltijsk,false,
L2024-11-16_kudanena,19,L2024-11-16, kudanena,false,
L2024-11-16_navescha,20,L2024-11-16, navescha,false,
L2024-11-16_kuspehuv,21,L2024-11-16, kuspehuv,false,
L2024-11-16_nadvuhk,22,L2024-11-16, nadvuhk,false,
L2024-11-16_esli,23,L2024-11-16, esli,false,
L2024-11-16_pesenkao,24,L2024-11-16, pesenkao,false,
L2024-11-16_chepuxa,25,L2024-11-16, chepuxa,false,

29.09.2024 вс – Санкт-Петербург, бард-клуб "Гнездо глухаря"
L2024-09-29_zaklinan,01,L2024-09-29, zaklinan,false,
L2024-09-29_dendensk,02,L2024-09-29, dendensk,false,
L2024-09-29_panorama,03,L2024-09-29, panorama,false,
L2024-09-29_proscha4,04,L2024-09-29, proscha4,false,
L2024-09-29_adleucon,05,L2024-09-29, adleucon,false,
L2024-09-29_gonistos,06,L2024-09-29, gonistos,false,
L2024-09-29_nadvuhk,07,L2024-09-29, nadvuhk,false,
L2024-09-29_volk,08,L2024-09-29, volk,false,
L2024-09-29_chteniem,09,L2024-09-29, chteniem,false,
L2024-09-29_voslavug,10,L2024-09-29, voslavug,false,
L2024-09-29_udachny,11,L2024-09-29, udachny,false,
L2024-09-29_chumka,12,L2024-09-29, chumka,false,
L2024-09-29_nezabyva,13,L2024-09-29, nezabyva,false,
L2024-09-29_deja,14,L2024-09-29, deja,false,
L2024-09-29_kuznechiki,15,L2024-09-29, kuznechiki,false,
L2024-09-29_romans2,16,L2024-09-29, romans2,false,
L2024-09-29_serenada,17,L2024-09-29, serenada,false,
L2024-09-29_vpoxodny,18,L2024-09-29, vpoxodny,false,
L2024-09-29_shum,19,L2024-09-29, shum,false,
L2024-09-29_kanonov,20,L2024-09-29, kanonov,false,
L2024-09-29_pamjativ,21,L2024-09-29, pamjativ,false,
L2024-09-29_sharmans,22,L2024-09-29, sharmans,false,
L2024-09-29_esli,23,L2024-09-29, esli,false,
L2024-09-29_baltijsk,24,L2024-09-29, baltijsk,false,
L2024-09-29_totosego,25,L2024-09-29, totosego,false,
L2024-09-29_chepuxa,26,L2024-09-29, chepuxa,false,
L2024-09-29_nerazmen,27,L2024-09-29, nerazmen,false,

23.09.2024 пн – Москва, бард-клуб "Гнездо глухаря", дуэт (гитара), премьера
L2024-09-23_kibitka,01,L2024-09-23, kibitka,false,
L2024-09-23_romans1,02,L2024-09-23, romans1,false,
L2024-09-23_adleucon,03,L2024-09-23, adleucon,false,
L2024-09-23_paris,04,L2024-09-23, paris,false,
L2024-09-23_opyatpar,05,L2024-09-23, opyatpar,false,
L2024-09-23_marija,06,L2024-09-23, marija,false,
L2024-09-23_kchemuis,07,L2024-09-23, kchemuis,false,
L2024-09-23_vrjadli,08,L2024-09-23, vrjadli,false,
L2024-09-23_bereg,09,L2024-09-23, bereg,false,
L2024-09-23_proscha4,10,L2024-09-23, proscha4,false,
L2024-09-23_temapoko,11,L2024-09-23, temapoko,false,
L2024-09-23_serenada,12,L2024-09-23, serenada,false,
L2024-09-23_ljubov,13,L2024-09-23, ljubov,false,
L2024-09-23_farmacev,14,L2024-09-23, farmacev,false,
L2024-09-23_balagan2,15,L2024-09-23, balagan2,false,
---
L2024-09-23_navsejz1,16,L2024-09-23, navsejz1,false,
L2024-09-23_konecned,17,L2024-09-23, konecned,false,
L2024-09-23_aneta,18,L2024-09-23, aneta,false,
L2024-09-23_nenadoby,19,L2024-09-23, nenadoby,false,
L2024-09-23_plach,20,L2024-09-23, plach,true,
L2024-09-23_korablik,21,L2024-09-23, korablik,false,
L2024-09-23_chtobyat,22,L2024-09-23, chtobyat,false,
L2024-09-23_sezondoz,23,L2024-09-23, sezondoz,false,
L2024-09-23_kovcheg,24,L2024-09-23, kovcheg,false,
L2024-09-23_karavan,25,L2024-09-23, karavan,false,
L2024-09-23_proscha1,26,L2024-09-23, proscha1,false,
L2024-09-23_dusha,27,L2024-09-23, dusha,false,
L2024-09-23_vtornik,28,L2024-09-23, vtornik,false,
L2024-09-23_vosxodja,29,L2024-09-23, vosxodja,false,

20.08.2024 вт – Москва, бард-клуб "Гнездо глухаря"
L2024-08-20_krasnye,01,L2024-08-20, krasnye,false,
L2024-08-20_vpotokah,02,L2024-08-20, vpotokah,false,
L2024-08-20_suhumi,03,L2024-08-20, suhumi,false,
L2024-08-20_voslavug,04,L2024-08-20, voslavug,false,
L2024-08-20_kalejdos,05,L2024-08-20, kalejdos,false,
L2024-08-20_dopoezda,06,L2024-08-20, dopoezda,false,
L2024-08-20_kuznechiki,07,L2024-08-20, kuznechiki,false,
L2024-08-20_deja,08,L2024-08-20, deja,false,
L2024-08-20_ryba,09,L2024-08-20, ryba,false,
L2024-08-20_vpoxodny,10,L2024-08-20, vpoxodny,false,
L2024-08-20_nezabyva,11,L2024-08-20, nezabyva,false,
L2024-08-20_stixiopr,12,L2024-08-20, stixiopr,false,
L2024-08-20_temapoleta,13,L2024-08-20, temapoleta,false,
L2024-08-20_udachny,14,L2024-08-20, udachny,false,
L2024-08-20_totosego,15,L2024-08-20, totosego,false,
---
L2024-08-20_volk,16,L2024-08-20, volk,false,
L2024-08-20_chteniem,17,L2024-08-20, chteniem,false,
L2024-08-20_nadvuhk,18,L2024-08-20, nadvuhk,false,
L2024-08-20_kuspehuv,19,L2024-08-20, kuspehuv,false,
L2024-08-20_hrustal,20,L2024-08-20, hrustal,false,
L2024-08-20_baltijsk,21,L2024-08-20, baltijsk,false,
L2024-08-20_alliluja,22,L2024-08-20, alliluja,false,
L2024-08-20_esli,23,L2024-08-20, esli,false,
L2024-08-20_ubykagol,24,L2024-08-20, ubykagol,false,
L2024-08-20_sharmans,25,L2024-08-20, sharmans,false,
L2024-08-20_chepuxa,26,L2024-08-20, chepuxa,false,

06.07.2024 сб – Москва, бард-клуб "Гнездо глухаря"
L2024-07-06_ryba,01,L2024-07-06, ryba,false,
L2024-07-06_dopoezda,02,L2024-07-06, dopoezda,false,
L2024-07-06_suhumi,03,L2024-07-06, suhumi,false,
L2024-07-06_volk,04,L2024-07-06, volk,false,
L2024-07-06_kuznechiki,05,L2024-07-06, kuznechiki,false,
L2024-07-06_akoektop,06,L2024-07-06, akoektop,false,
L2024-07-06_propadu,07,L2024-07-06, propadu,false,
L2024-07-06_gonistos,08,L2024-07-06, gonistos,false,
L2024-07-06_kanonov,09,L2024-07-06, kanonov,false,
L2024-07-06_pamjativ,10,L2024-07-06, pamjativ,false,
L2024-07-06_peyzazh,11,L2024-07-06, peyzazh,false,
L2024-07-06_udachny,12,L2024-07-06, udachny,false,
L2024-07-06_totosego,13,L2024-07-06, totosego,false,
---
L2024-07-06_avtoparo,14,L2024-07-06, avtoparo,false,
L2024-07-06_izpepla,15,L2024-07-06, izpepla,false,
L2024-07-06_2001,16,L2024-07-06, 2001,false,
L2024-07-06_voslavug,17,L2024-07-06, voslavug,false,
L2024-07-06_deja,18,L2024-07-06, deja,false,
L2024-07-06_chteniem,19,L2024-07-06, chteniem,false,
L2024-07-06_hrustal,20,L2024-07-06, hrustal,false,
L2024-07-06_baltijsk,21,L2024-07-06, baltijsk,false,
L2024-07-06_alliluja,22,L2024-07-06, alliluja,false,
L2024-07-06_romans2,23,L2024-07-06, romans2,false,
L2024-07-06_chepuxa,24,L2024-07-06, chepuxa,false,
L2024-07-06_sharmans,25,L2024-07-06, sharmans,false,

02.06.2024 вс – США, Kensington, MD, клуб "БардЭльЕро"
L2024-06-02_dopoezda,01,L2024-06-02, dopoezda,false,
L2024-06-02_deja,02,L2024-06-02, deja,false,
L2024-06-02_shum,03,L2024-06-02, shum,false,
L2024-06-02_nadvuhk,04,L2024-06-02, nadvuhk,false,
L2024-06-02_gonistos,05,L2024-06-02, gonistos,false,
L2024-06-02_akoektop,06,L2024-06-02, akoektop,false,
L2024-06-02_izpepla,07,L2024-06-02, izpepla,false,
L2024-06-02_chteniem,08,L2024-06-02, chteniem,false,
L2024-06-02_chumka,09,L2024-06-02, chumka,false,
L2024-06-02_kto,10,L2024-06-02, kto,false,
L2024-06-02_kuspehuv,11,L2024-06-02, kuspehuv,false,
L2024-06-02_kudanena,12,L2024-06-02, kudanena,false,
L2024-06-02_madlen,13,L2024-06-02, madlen,false,
L2024-06-02_ballada,14,L2024-06-02, ballada,false,
L2024-06-02_uzhesli,15,L2024-06-02, uzhesli,false,
L2024-06-02_ryba,16,L2024-06-02, ryba,false,
L2024-06-02_hrustal,17,L2024-06-02, hrustal,false,
L2024-06-02_kanonov,18,L2024-06-02, kanonov,false,
L2024-06-02_baltijsk,19,L2024-06-02, baltijsk,false,
L2024-06-02_romans2,20,L2024-06-02, romans2,false,
L2024-06-02_totosego,21,L2024-06-02, totosego,false,
L2024-06-02_zoosad,22,L2024-06-02, zoosad,false,
L2024-06-02_sharmans,23,L2024-06-02, sharmans,false,
L2024-06-02_alliluja,24,L2024-06-02, alliluja,false,
L2024-06-02_nerazmen,25,L2024-06-02, nerazmen,false,

25.05.2024 сб – США, New Rochelle, NY
L2024-05-25_dopoezda,01,L2024-05-25, dopoezda,false,
L2024-05-25_zaklinan,02,L2024-05-25, zaklinan,false,
L2024-05-25_shum,03,L2024-05-25, shum,false,
L2024-05-25_nadvuhk,04,L2024-05-25, nadvuhk,false,
L2024-05-25_gonistos,05,L2024-05-25, gonistos,false,
L2024-05-25_shkolat2,06,L2024-05-25, shkolat2,false,
L2024-05-25_ballada,07,L2024-05-25, ballada,false,
L2024-05-25_chteniem,08,L2024-05-25, chteniem,false,
L2024-05-25_chumka,09,L2024-05-25, chumka,false,
L2024-05-25_kto,10,L2024-05-25, kto,false,
L2024-05-25_kuspehuv,11,L2024-05-25, kuspehuv,false,
L2024-05-25_kudanena,12,L2024-05-25, kudanena,false,
L2024-05-25_madlen,13,L2024-05-25, madlen,false,
L2024-05-25_krechi,14,L2024-05-25, krechi,false,
L2024-05-25_romansma,15,L2024-05-25, romansma,false,
---
L2024-05-25_ryba,16,L2024-05-25, ryba,false,
L2024-05-25_hrustal,17,L2024-05-25, hrustal,false,
L2024-05-25_kanonov,18,L2024-05-25, kanonov,false,
L2024-05-25_baltijsk,19,L2024-05-25, baltijsk,false,
L2024-05-25_drugoe,20,L2024-05-25, drugoe,false,
L2024-05-25_japodari,21,L2024-05-25, japodari,false,
L2024-05-25_uzhesli,22,L2024-05-25, uzhesli,false,
L2024-05-25_totosego,23,L2024-05-25, totosego,false,
L2024-05-25_zoosad,24,L2024-05-25, zoosad,false,
L2024-05-25_esli,10,L2024-05-25, esli,false,
L2024-05-25_sharmans,25,L2024-05-25, sharmans,false,
L2024-05-25_alliluja,26,L2024-05-25, alliluja,false,
L2024-05-25_nerazmen,27,L2024-05-25, nerazmen,false,

19.05.2024 вс – США, Boston, MA
L2024-05-19_dopoezda,01,L2024-05-19, dopoezda,false,
L2024-05-19_akoektop,02,L2024-05-19, akoektop,false,
L2024-05-19_podzname,03,L2024-05-19, podzname,false,
L2024-05-19_nadvuhk,04,L2024-05-19, nadvuhk,false,
L2024-05-19_izpepla,05,L2024-05-19, izpepla,false,
L2024-05-19_kuspehuv,06,L2024-05-19, kuspehuv,false,
L2024-05-19_voslavug,07,L2024-05-19, voslavug,false,
L2024-05-19_chteniem,08,L2024-05-19, chteniem,false,
L2024-05-19_chumka,09,L2024-05-19, chumka,false,
L2024-05-19_kto,10,L2024-05-19, kto,false,
L2024-05-19_peyzazh,11,L2024-05-19, peyzazh,false,
L2024-05-19_razvecht,12,L2024-05-19, razvecht,false,
L2024-05-19_ryba,13,L2024-05-19, ryba,false,
L2024-05-19_vpoxodny,14,L2024-05-19, vpoxodny,false,
L2024-05-19_shum,15,L2024-05-19, shum,false,
L2024-05-19_baltijsk,16,L2024-05-19, baltijsk,false,
L2024-05-19_kudanena,17,L2024-05-19, kudanena,false,
L2024-05-19_kanonov,18,L2024-05-19, kanonov,false,
L2024-05-19_pamjativ,19,L2024-05-19, pamjativ,false,
L2024-05-19_madlen,20,L2024-05-19, madlen,false,
L2024-05-19_japodari,21,L2024-05-19, japodari,false,
L2024-05-19_hrustal,22,L2024-05-19, hrustal,false,
L2024-05-19_esli,23,L2024-05-19, esli,false,
L2024-05-19_zoosad,24,L2024-05-19, zoosad,false,
L2024-05-19_sharmans,25,L2024-05-19, sharmans,false,
L2024-05-19_alliluja,26,L2024-05-19, alliluja,false,
L2024-05-19_totosego,27,L2024-05-19, totosego,false,

16.05.2024 чт – США, Cleveland, OH
L2024-05-16_dopoezda,01,L2024-05-16, dopoezda,false,
L2024-05-16_akoektop,02,L2024-05-16, akoektop,false,
L2024-05-16_ryba,03,L2024-05-16, ryba,false,
L2024-05-16_rodljuds,04,L2024-05-16, rodljuds,false,
L2024-05-16_razvecht,05,L2024-05-16, razvecht,false,
L2024-05-16_izpepla,06,L2024-05-16, izpepla,false,
L2024-05-16_nadvuhk,07,L2024-05-16, nadvuhk,false,
L2024-05-16_chumka,08,L2024-05-16, chumka,false,
L2024-05-16_kto,09,L2024-05-16, kto,false,
L2024-05-16_chteniem,10,L2024-05-16, chteniem,false,
L2024-05-16_peyzazh,11,L2024-05-16, peyzazh,false,
L2024-05-16_vpoxodny,12,L2024-05-16, vpoxodny,false,
L2024-05-16_aviapochta,13,L2024-05-16, aviapochta,false,
L2024-05-16_zastolnaya,14,L2024-05-16, zastolnaya,false,
L2024-05-16_itakvope,15,L2024-05-16, itakvope,false,
L2024-05-16_voslavug,16,L2024-05-16, voslavug,false,
L2024-05-16_kanonov,17,L2024-05-16, kanonov,false,
L2024-05-16_shum,18,L2024-05-16, shum,false,
L2024-05-16_totosego,19,L2024-05-16, totosego,false,
L2024-05-16_madlen,20,L2024-05-16, madlen,false,
L2024-05-16_navescha,21,L2024-05-16, navescha,false,
L2024-05-16_pamjativ,22,L2024-05-16, pamjativ,false,
L2024-05-16_hrustal,23,L2024-05-16, hrustal,false,
L2024-05-16_zoosad,24,L2024-05-16, zoosad,false,
L2024-05-16_sharmans,25,L2024-05-16, sharmans,false,
L2024-05-16_esli,26,L2024-05-16, esli,false,

14.05.2024 вт – США, Secaucus, NJ
L2024-05-14_podzname,01,L2024-05-14, podzname,false,
L2024-05-14_akoektop,02,L2024-05-14, akoektop,false,
L2024-05-14_zvezdoch,03,L2024-05-14, zvezdoch,false,
L2024-05-14_rodljuds,04,L2024-05-14, rodljuds,false,
L2024-05-14_razvecht,05,L2024-05-14, razvecht,false,
L2024-05-14_izpepla,06,L2024-05-14, izpepla,false,
L2024-05-14_nadvuhk,07,L2024-05-14, nadvuhk,false,
L2024-05-14_chumka,08,L2024-05-14, chumka,false,
L2024-05-14_kto,09,L2024-05-14, kto,false,
L2024-05-14_ryba,10,L2024-05-14, ryba,false,
L2024-05-14_suhumi,11,L2024-05-14, suhumi,false,
L2024-05-14_vpoxodny,12,L2024-05-14, vpoxodny,false,
L2024-05-14_kudanena,13,L2024-05-14, kudanena,false,
L2024-05-14_drugoe,14,L2024-05-14, drugoe,false,
L2024-05-14_voslavug,15,L2024-05-14, voslavug,false,
L2024-05-14_prosba,16,L2024-05-14, prosba,false,
L2024-05-14_avtoparo,17,L2024-05-14, avtoparo,false,
L2024-05-14_totosego,18,L2024-05-14, totosego,false,
L2024-05-14_madlen,19,L2024-05-14, madlen,false,
L2024-05-14_shum,20,L2024-05-14, shum,false,
L2024-05-14_kanonov,21,L2024-05-14, kanonov,false,
L2024-05-14_hrustal,22,L2024-05-14, hrustal,false,
L2024-05-14_chteniem,23,L2024-05-14, chteniem,false,
L2024-05-14_baltijsk,24,L2024-05-14, baltijsk,false,
L2024-05-14_esli,25,L2024-05-14, esli,false,
L2024-05-14_alliluja,26,L2024-05-14, alliluja,false,
L2024-05-14_sharmans,27,L2024-05-14, sharmans,false,
L2024-05-14_pesenkao,28,L2024-05-14, pesenkao,false,

02.05.2024 чт – Москва, бард-клуб "Гнездо глухаря"
L2024-05-02_krasnye,01,L2024-05-02, krasnye,false,
L2024-05-02_rodljuds,02,L2024-05-02, rodljuds,false,
L2024-05-02_zaklinan,03,L2024-05-02, zaklinan,false,
L2024-05-02_podzname,04,L2024-05-02, podzname,false,
L2024-05-02_akoektop,05,L2024-05-02, akoektop,false,
L2024-05-02_volk,06,L2024-05-02, volk,false,
L2024-05-02_zvezdoch,07,L2024-05-02, zvezdoch,false,
L2024-05-02_razvecht,08,L2024-05-02, razvecht,false,
L2024-05-02_izpepla,09,L2024-05-02, izpepla,false,
L2024-05-02_traviata,10,L2024-05-02, traviata,false,
L2024-05-02_kuspehuv,11,L2024-05-02, kuspehuv,false,
L2024-05-02_kudanena,12,L2024-05-02, kudanena,false,
L2024-05-02_kto,13,L2024-05-02, kto,false,
L2024-05-02_stixiopr,14,L2024-05-02, stixiopr,false,
L2024-05-02_vpoxodny,15,L2024-05-02, vpoxodny,false,
L2024-05-02_esli,16,L2024-05-02, esli,false,
L2024-05-02_totosego,17,L2024-05-02, totosego,false,
---
L2024-05-02_zhizn,18,L2024-05-02, zhizn,false,
L2024-05-02_romans2,19,L2024-05-02, romans2,false,
L2024-05-02_shum,20,L2024-05-02, shum,false,
L2024-05-02_kanonov,21,L2024-05-02, kanonov,false,
L2024-05-02_pamjativ,22,L2024-05-02, pamjativ,false,
L2024-05-02_hrustal,23,L2024-05-02, hrustal,false,
L2024-05-02_zoosad,24,L2024-05-02, zoosad,false,
L2024-05-02_madlen,25,L2024-05-02, madlen,false,
L2024-05-02_baltijsk,26,L2024-05-02, baltijsk,false,
L2024-05-02_alliluja,27,L2024-05-02, alliluja,false,
L2024-05-02_sharmans,28,L2024-05-02, sharmans,false,
L2024-05-02_chepuxa,29,L2024-05-02, chepuxa,false,

21.04.2024 вс – Санкт-Петербург, бард-клуб "Гнездо глухаря", вечерний
L2024-04-21-2-podzname,01,L2024-04-21-2,podzname,false,
L2024-04-21-2-akoektop,02,L2024-04-21-2,akoektop,false,
L2024-04-21-2-zvezdoch,03,L2024-04-21-2,zvezdoch,false,
L2024-04-21-2-razvecht,04,L2024-04-21-2,razvecht,false,
L2024-04-21-2-romans2,05,L2024-04-21-2,romans2,false,
L2024-04-21-2-prosba,06,L2024-04-21-2,prosba,false,
L2024-04-21-2-kuspehuv,07,L2024-04-21-2,kuspehuv,false,
L2024-04-21-2-traviata,08,L2024-04-21-2,traviata,false,
L2024-04-21-2-hrustal,09,L2024-04-21-2,hrustal,false,
L2024-04-21-2-kudanena,10,L2024-04-21-2,kudanena,false,
L2024-04-21-2-stixiopr,11,L2024-04-21-2,stixiopr,false,
L2024-04-21-2-vpoxodny,12,L2024-04-21-2,vpoxodny,false,
L2024-04-21-2-chtonam,13,L2024-04-21-2,chtonam,false,
L2024-04-21-2-totosego,14,L2024-04-21-2,totosego,false,
---
L2024-04-21-2-zhizn,15,L2024-04-21-2,zhizn,false,
L2024-04-21-2-chuzhaj2,16,L2024-04-21-2,chuzhaj2,false,
L2024-04-21-2-udachny,17,L2024-04-21-2,udachny,false,
L2024-04-21-2-propadu,18,L2024-04-21-2,propadu,false,
L2024-04-21-2-baltijsk,19,L2024-04-21-2,baltijsk,false,
L2024-04-21-2-esli,20,L2024-04-21-2,esli,false,
L2024-04-21-2-zoosad,21,L2024-04-21-2,zoosad,false,
L2024-04-21-2-madlen,22,L2024-04-21-2,madlen,false,
L2024-04-21-2-chepuxa,23,L2024-04-21-2,chepuxa,false,
L2024-04-21-2-sharmans,24,L2024-04-21-2,sharmans,false,
L2024-04-21-2-pesenkao,25,L2024-04-21-2,pesenkao,false,

21.04.2024 вс – Санкт-Петербург, бард-клуб "Гнездо глухаря", дневной
L2024-04-21-1-ryba,01,L2024-04-21-2,ryba,false,
L2024-04-21-1-deja,02,L2024-04-21-2,deja,false,
L2024-04-21-1-peyzazh,03,L2024-04-21-2,peyzazh,false,
L2024-04-21-1-suhumi,04,L2024-04-21-2,suhumi,false,
L2024-04-21-1-kto,05,L2024-04-21-2,kto,false,
L2024-04-21-1-chumka,06,L2024-04-21-2,chumka,false,
L2024-04-21-1-chteniem,07,L2024-04-21-2,chteniem,false,
L2024-04-21-1-nadvuhk,08,L2024-04-21-2,nadvuhk,false,
L2024-04-21-1-izpepla,09,L2024-04-21-2,izpepla,false,
L2024-04-21-1-stenyusv,10,L2024-04-21-2,stenyusv,false,
L2024-04-21-1-krechi,11,L2024-04-21-2,krechi,false,
L2024-04-21-1-romansma,12,L2024-04-21-2,romansma,false,
L2024-04-21-1-itakvope,13,L2024-04-21-2,itakvope,false,
L2024-04-21-1-zastolnaya,14,L2024-04-21-2,zastolnaya,false,
---
L2024-04-21-1-dopoezda,15,L2024-04-21-2,dopoezda,false,
L2024-04-21-1-avtoparo,16,L2024-04-21-2,avtoparo,false,
L2024-04-21-1-nezabyva,17,L2024-04-21-2,nezabyva,false,
L2024-04-21-1-japodari,18,L2024-04-21-2,japodari,false,
L2024-04-21-1-volk,19,L2024-04-21-2,volk,false,
L2024-04-21-1-tirbayard,20,L2024-04-21-2,tirbayard,false,
L2024-04-21-1-shum,21,L2024-04-21-2,shum,false,
L2024-04-21-1-kanonov,22,L2024-04-21-2,kanonov,false,
L2024-04-21-1-pamjativ,23,L2024-04-21-2,pamjativ,false,
L2024-04-21-1-alliluja,24,L2024-04-21-2,alliluja,false,
L2024-04-21-1-nerazmen,25,L2024-04-21-2,nerazmen,false,

07.04.2024 вс – Германия, Карлсруэ, Anne Frank Haus
L2024-04-07_volk,01,L2024-04-07, volk,false,
L2024-04-07_zhizn,02,L2024-04-07, zhizn,false,
L2024-04-07_krasnye,03,L2024-04-07, krasnye,false,
L2024-04-07_voslavug,04,L2024-04-07, voslavug,false,
L2024-04-07_suhumi,05,L2024-04-07, suhumi,false,
L2024-04-07_peyzazh,06,L2024-04-07, peyzazh,false,
L2024-04-07_chteniem,07,L2024-04-07, chteniem,false,
L2024-04-07_razvecht,08,L2024-04-07, razvecht,false,
L2024-04-07_chumka,09,L2024-04-07, chumka,false,
L2024-04-07_japodari,10,L2024-04-07, japodari,false,
L2024-04-07_aviapochta,11,L2024-04-07, aviapochta,false,
L2024-04-07_baltijsk,12,L2024-04-07, baltijsk,false,
L2024-04-07_prosba,13,L2024-04-07, prosba,false,
L2024-04-07_itakvope,14,L2024-04-07, itakvope,false,
L2024-04-07_zastolnaya,15,L2024-04-07, zastolnaya,false,
---
L2024-04-07_dopoezda,16,L2024-04-07, dopoezda,false,
L2024-04-07_avtoparo,17,L2024-04-07, avtoparo,false,
L2024-04-07_ryba,18,L2024-04-07, ryba,false,
L2024-04-07_udachny,19,L2024-04-07, udachny,false,
L2024-04-07_madlen,20,L2024-04-07, madlen,false,
L2024-04-07_deja,21,L2024-04-07, deja,false,
L2024-04-07_nezabyva,22,L2024-04-07, nezabyva,false,
L2024-04-07_pamjativ,23,L2024-04-07, pamjativ,false,
L2024-04-07_sharmans,24,L2024-04-07, sharmans,false,
L2024-04-07_totosego,25,L2024-04-07, totosego,false,
L2024-04-07_alliluja,26,L2024-04-07, alliluja,false,
L2024-04-07_esli,27,L2024-04-07, esli,false,
L2024-04-07_pesenkao,28,L2024-04-07, pesenkao,false,
L2024-04-07_nerazmen,29,L2024-04-07, nerazmen,false,

03.04.2024 ср – Москва, бард-клуб "Гнездо глухаря"
L2024-04-03_volk,01,L2024-04-03, volk,false,
L2024-04-03_zhizn,02,L2024-04-03, zhizn,false,
L2024-04-03_krasnye,03,L2024-04-03, krasnye,false,
L2024-04-03_dopoezda,04,L2024-04-03, dopoezda,false,
L2024-04-03_suhumi,05,L2024-04-03, suhumi,false,
L2024-04-03_chumka,06,L2024-04-03, chumka,false,
L2024-04-03_razvecht,07,L2024-04-03, razvecht,false,
L2024-04-03_madlen,08,L2024-04-03, madlen,false,
L2024-04-03_navescha,09,L2024-04-03, navescha,false,
L2024-04-03_baltijsk,10,L2024-04-03, baltijsk,false,
L2024-04-03_chtonam,11,L2024-04-03, chtonam,false,
L2024-04-03_itakvope,12,L2024-04-03, itakvope,false,
L2024-04-03_zastolnaya,13,L2024-04-03, zastolnaya,false,
---
L2024-04-03_avtoparo,14,L2024-04-03, avtoparo,false,
L2024-04-03_pamjativ,15,L2024-04-03, pamjativ,false,
L2024-04-03_deja,16,L2024-04-03, deja,false,
L2024-04-03_ryba,17,L2024-04-03, ryba,false,
L2024-04-03_japodari,18,L2024-04-03, japodari,false,
L2024-04-03_voslavug,19,L2024-04-03, voslavug,false,
L2024-04-03_udachny,20,L2024-04-03, udachny,false,
L2024-04-03_sharmans,21,L2024-04-03, sharmans,false,
L2024-04-03_alliluja,22,L2024-04-03, alliluja,false,
L2024-04-03_totosego,23,L2024-04-03, totosego,false,
L2024-04-03_pesenkao,24,L2024-04-03, pesenkao,false,

24.02.2024 сб – Москва, бард-клуб "Гнездо глухаря", дуэт (клавиши), 2 премьеры
L2024-02-24_kibitka,01,L2024-02-24, kibitka,false,
L2024-02-24_podzname,02,L2024-02-24, podzname,false,
L2024-02-24_switzerl,03,L2024-02-24, switzerl,false,
L2024-02-24_descensu,04,L2024-02-24, descensu,false,
L2024-02-24_opyattor,05,L2024-02-24, opyattor,false,
L2024-02-24_burja,06,L2024-02-24, burja,false,
L2024-02-24_rozhdest,07,L2024-02-24, rozhdest,false,
L2024-02-24_drugajaz,08,L2024-02-24, drugajaz,false,
L2024-02-24_brodjagi,09,L2024-02-24, brodjagi,false,
L2024-02-24_zoosad,10,L2024-02-24, zoosad,true,
L2024-02-24_chtovpred,11,L2024-02-24, chtovpred,false,
L2024-02-24_madlen,12,L2024-02-24, madlen,true,
L2024-02-24_sentenci,13,L2024-02-24, sentenci,false,
L2024-02-24_hrustal,14,L2024-02-24, hrustal,false,
---
L2024-02-24_zaliv,15,L2024-02-24, zaliv,false,
L2024-02-24_marija,16,L2024-02-24, marija,false,
L2024-02-24_muzhajsj,17,L2024-02-24, muzhajsj,false,
L2024-02-24_okean,18,L2024-02-24, okean,false,
L2024-02-24_shkolat1,19,L2024-02-24, shkolat1,false,
L2024-02-24_eccehomo,20,L2024-02-24, eccehomo,false,
L2024-02-24_kchemuis,21,L2024-02-24, kchemuis,false,
L2024-02-24_lunnaja,22,L2024-02-24, lunnaja,false,
L2024-02-24_posesche,23,L2024-02-24, posesche,false,
L2024-02-24_dusha,24,L2024-02-24, dusha,false,
L2024-02-24_sharmans,25,L2024-02-24, sharmans,false,

28.01.2024 вс – Москва, бард-клуб "Гнездо глухаря"
L2024-01-28_zaklinan,01,L2024-01-28, zaklinan,false,
L2024-01-28_dopoezda,02,L2024-01-28, dopoezda,false,
L2024-01-28_uzhesli,03,L2024-01-28, uzhesli,false,
L2024-01-28_peyzazh,04,L2024-01-28, peyzazh,false,
L2024-01-28_deja,05,L2024-01-28, deja,false,
L2024-01-28_temapoleta,06,L2024-01-28, temapoleta,false,
L2024-01-28_stixiopr,07,L2024-01-28, stixiopr,false,
L2024-01-28_vpoxodny,08,L2024-01-28, vpoxodny,false,
L2024-01-28_volk,09,L2024-01-28, volk,false,
L2024-01-28_japodari,10,L2024-01-28, japodari,false,
L2024-01-28_shum,11,L2024-01-28, shum,false,
L2024-01-28_prosba,12,L2024-01-28, prosba,false,
L2024-01-28_voslavug,13,L2024-01-28, voslavug,false,
L2024-01-28_totosego,14,L2024-01-28, totosego,false,
---
L2024-01-28_podzname,15,L2024-01-28, podzname,false,
L2024-01-28_traviata,16,L2024-01-28, traviata,false,
L2024-01-28_chumka,17,L2024-01-28, chumka,false,
L2024-01-28_nadvuhk,18,L2024-01-28, nadvuhk,false,
L2024-01-28_baltijsk,19,L2024-01-28, baltijsk,false,
L2024-01-28_ryba,20,L2024-01-28, ryba,false,
L2024-01-28_nezabyva,21,L2024-01-28, nezabyva,false,
L2024-01-28_suhumi,22,L2024-01-28, suhumi,false,
L2024-01-28_sharmans,23,L2024-01-28, sharmans,false,
L2024-01-28_alliluja,24,L2024-01-28, alliluja,false,
L2024-01-28_nerazmen,25,L2024-01-28, nerazmen,false,

03.01.2024 ср – Москва, бард-клуб "Гнездо глухаря"
L2024-01-03_rusalka,01,L2024-01-03, rusalka,false,
L2024-01-03_chuzhaj2,02,L2024-01-03, chuzhaj2,false,
L2024-01-03_peterbur,03,L2024-01-03, peterbur,false,
L2024-01-03_proschanie,04,L2024-01-03, proschanie,false,
L2024-01-03_baltijsk,05,L2024-01-03, baltijsk,false,
L2024-01-03_volhonka,06,L2024-01-03, volhonka,false,
L2024-01-03_godshel,07,L2024-01-03, godshel,false,
L2024-01-03_krasnye,08,L2024-01-03, krasnye,false,
L2024-01-03_dendensk,09,L2024-01-03, dendensk,false,
L2024-01-03_fontanka,10,L2024-01-03, fontanka,false,
L2024-01-03_1991,11,L2024-01-03, 1991,false,
L2024-01-03_vademecu,12,L2024-01-03, vademecu,false,
L2024-01-03_aviapochta,13,L2024-01-03, aviapochta,false,
L2024-01-03_piter,14,L2024-01-03, piter,false,
---
L2024-01-03_rodljuds,15,L2024-01-03, rodljuds,false,
L2024-01-03_shum,16,L2024-01-03, shum,false,
L2024-01-03_prosba,17,L2024-01-03, prosba,false,
L2024-01-03_itakvope,18,L2024-01-03, itakvope,false,
L2024-01-03_krechi,19,L2024-01-03, krechi,false,
L2024-01-03_romans2,20,L2024-01-03, romans2,false,
L2024-01-03_chteniem,21,L2024-01-03, chteniem,false,
L2024-01-03_nadvuhk,22,L2024-01-03, nadvuhk,false,
L2024-01-03_sharmans,23,L2024-01-03, sharmans,false,
L2024-01-03_pesenkao,24,L2024-01-03, pesenkao,false,
L2024-01-03_chepuxa,25,L2024-01-03, chepuxa,false,

18.12.2023 пн – Кипр, Лимассол, зал "Киклос"
L2023-12-18_dopoezda,01,L2023-12-18, dopoezda,false,
L2023-12-18_zaklinan,02,L2023-12-18, zaklinan,false,
L2023-12-18_ryba,03,L2023-12-18, ryba,false,
L2023-12-18_aviapochta,04,L2023-12-18, aviapochta,false,
L2023-12-18_suhumi,05,L2023-12-18, suhumi,false,
L2023-12-18_peterbur,06,L2023-12-18, peterbur,false,
L2023-12-18_proschanie,07,L2023-12-18, proschanie,false,
L2023-12-18_baltijsk,08,L2023-12-18, baltijsk,false,
L2023-12-18_peyzazh,09,L2023-12-18, peyzazh,false,
L2023-12-18_chteniem,10,L2023-12-18, chteniem,false,
L2023-12-18_chumka,11,L2023-12-18, chumka,false,
L2023-12-18_traviata,12,L2023-12-18, traviata,false,
L2023-12-18_izpepla,13,L2023-12-18, izpepla,false,
L2023-12-18_itakvope,14,L2023-12-18, itakvope,false,
L2023-12-18_totosego,15,L2023-12-18, totosego,false,
L2023-12-18_nezabyva,16,L2023-12-18, nezabyva,false,
L2023-12-18_kuspehuv,17,L2023-12-18, kuspehuv,false,
L2023-12-18_romans2,18,L2023-12-18, romans2,false,
L2023-12-18_shum,19,L2023-12-18, shum,false,
L2023-12-18_pamjativ,20,L2023-12-18, pamjativ,false,
L2023-12-18_sharmans,21,L2023-12-18, sharmans,false,
L2023-12-18_esli,22,L2023-12-18, esli,false,
L2023-12-18_chepuxa,23,L2023-12-18, chepuxa,false,
L2023-12-18_nerazmen,24,L2023-12-18, nerazmen,false,
L2023-12-18_alliluja,25,L2023-12-18, alliluja,false,

15.12.2023 пт – США, Somerset, NJ, Villagers Theatre
L2023-12-15_dopoezda,01,L2023-12-15, dopoezda,false,
L2023-12-15_avtoparo,02,L2023-12-15, avtoparo,false,
L2023-12-15_zaklinan,03,L2023-12-15, zaklinan,false,
L2023-12-15_ryba,04,L2023-12-15, ryba,false,
L2023-12-15_aviapochta,05,L2023-12-15, aviapochta,false,
L2023-12-15_fontanka,06,L2023-12-15, fontanka,false,
L2023-12-15_proschanie,07,L2023-12-15, proschanie,false,
L2023-12-15_baltijsk,08,L2023-12-15, baltijsk,false,
L2023-12-15_peyzazh,09,L2023-12-15, peyzazh,false,
L2023-12-15_chteniem,10,L2023-12-15, chteniem,false,
L2023-12-15_duet,11,L2023-12-15, duet,false,
L2023-12-15_chtonam,12,L2023-12-15, chtonam,false,
L2023-12-15_itakvope,13,L2023-12-15, itakvope,false,
L2023-12-15_zastolnaya,14,L2023-12-15, zastolnaya,false,
---
L2023-12-15_krasnye,15,L2023-12-15, krasnye,false,
L2023-12-15_nezabyva,16,L2023-12-15, nezabyva,false,
L2023-12-15_1991,17,L2023-12-15, 1991,false,
L2023-12-15_totosego,18,L2023-12-15, totosego,false,
L2023-12-15_shum,19,L2023-12-15, shum,false,
L2023-12-15_prosba,20,L2023-12-15, prosba,false,
L2023-12-15_nadvuhk,21,L2023-12-15, nadvuhk,false,
L2023-12-15_ubykagol,22,L2023-12-15, ubykagol,false,
L2023-12-15_sharmans,23,L2023-12-15, sharmans,false,
L2023-12-15_chepuxa,24,L2023-12-15, chepuxa,false,
L2023-12-15_nerazmen,25,L2023-12-15, nerazmen,false,
L2023-12-15_pesenkao,26,L2023-12-15, pesenkao,false,

09.12.2023 сб – США, Moorestown, NJ, домашний концерт на вилле Курица
L2023-12-09_dopoezda,01,L2023-12-09, dopoezda,false,
L2023-12-09_podzname,02,L2023-12-09, podzname,false,
L2023-12-09_volk,03,L2023-12-09, volk,false,
L2023-12-09_suhumi,04,L2023-12-09, suhumi,false,
L2023-12-09_voslavug,05,L2023-12-09, voslavug,false,
L2023-12-09_peyzazh,06,L2023-12-09, peyzazh,false,
L2023-12-09_baltijsk,07,L2023-12-09, baltijsk,false,
L2023-12-09_traviata,08,L2023-12-09, traviata,false,
L2023-12-09_izpepla,09,L2023-12-09, izpepla,false,
L2023-12-09_nadvuhk,10,L2023-12-09, nadvuhk,false,
L2023-12-09_chteniem,11,L2023-12-09, chteniem,false,
L2023-12-09_chumka,12,L2023-12-09, chumka,false,
L2023-12-09_udachny,13,L2023-12-09, udachny,false,
L2023-12-09_totosego,14,L2023-12-09, totosego,false,
---
L2023-12-09_kuznechiki,15,L2023-12-09, kuznechiki,false,
L2023-12-09_nezabyva,16,L2023-12-09, nezabyva,false,
L2023-12-09_vpoxodny,17,L2023-12-09, vpoxodny,false,
L2023-12-09_romans2,18,L2023-12-09, romans2,false,
L2023-12-09_shum,19,L2023-12-09, shum,false,
L2023-12-09_stixiopr,20,L2023-12-09, stixiopr,false,
L2023-12-09_pamjativ,21,L2023-12-09, pamjativ,false,
L2023-12-09_sharmans,22,L2023-12-09, sharmans,false,
L2023-12-09_temapoleta,23,L2023-12-09, temapoleta,false,
L2023-12-09_pesenkao,24,L2023-12-09, pesenkao,false,
L2023-12-09_alliluja,25,L2023-12-09, alliluja,false,

03.12.2023 вс – США, Boston, MA
L2023-12-03_krasnye,01,L2023-12-03, krasnye,false,
L2023-12-03_dopoezda,02,L2023-12-03, dopoezda,false,
L2023-12-03_panorama,03,L2023-12-03, panorama,false,
L2023-12-03_kuspehuv,04,L2023-12-03, kuspehuv,false,
L2023-12-03_peterbur,05,L2023-12-03, peterbur,false,
L2023-12-03_proschanie,06,L2023-12-03, proschanie,false,
L2023-12-03_baltijsk,07,L2023-12-03, baltijsk,false,
L2023-12-03_chumka,08,L2023-12-03, chumka,false,
L2023-12-03_deja,09,L2023-12-03, deja,false,
L2023-12-03_romans2,10,L2023-12-03, romans2,false,
L2023-12-03_shkolat2,11,L2023-12-03, shkolat2,false,
L2023-12-03_peyzazh,12,L2023-12-03, peyzazh,false,
L2023-12-03_navescha,13,L2023-12-03, navescha,false,
L2023-12-03_vpoxodny,14,L2023-12-03, vpoxodny,false,
L2023-12-03_nezabyva,15,L2023-12-03, nezabyva,false,
L2023-12-03_krechi,16,L2023-12-03, krechi,false,
L2023-12-03_itakvope,17,L2023-12-03, itakvope,false,
L2023-12-03_zastolnaya,18,L2023-12-03, zastolnaya,false,
L2023-12-03_ubykagol,19,L2023-12-03, ubykagol,false,
L2023-12-03_voslavug,20,L2023-12-03, voslavug,false,
L2023-12-03_totosego,21,L2023-12-03, totosego,false,
L2023-12-03_pamjativ,22,L2023-12-03, pamjativ,false,
L2023-12-03_shum,23,L2023-12-03, shum,false,
L2023-12-03_podzname,24,L2023-12-03, podzname,false,
L2023-12-03_nerazmen,25,L2023-12-03, nerazmen,false,
L2023-12-03_chepuxa,26,L2023-12-03, chepuxa,false,

25.11.2023 пн – США, Port Monmouth, NJ
L2023-11-25_nadvuhk,01,L2023-11-25, nadvuhk,false,
L2023-11-25_chuzhaj2,02,L2023-11-25, chuzhaj2,false,
L2023-11-25_zaklinan,03,L2023-11-25, zaklinan,false,
L2023-11-25_voslavug,04,L2023-11-25, voslavug,false,
L2023-11-25_razvecht,05,L2023-11-25, razvecht,false,
L2023-11-25_chumka,06,L2023-11-25, chumka,false,
L2023-11-25_deja,07,L2023-11-25, deja,false,
L2023-11-25_romans2,08,L2023-11-25, romans2,false,
L2023-11-25_podzname,09,L2023-11-25, podzname,false,
L2023-11-25_baltijsk,10,L2023-11-25, baltijsk,false,
L2023-11-25_peyzazh,11,L2023-11-25, peyzazh,false,
L2023-11-25_chteniem,12,L2023-11-25, chteniem,false,
L2023-11-25_nezabyva,13,L2023-11-25, nezabyva,false,
L2023-11-25_esli,14,L2023-11-25, esli,false,
---
L2023-11-25_suhumi,15,L2023-11-25, suhumi,false,
L2023-11-25_dopoezda,16,L2023-11-25, dopoezda,false,
L2023-11-25_kuspehuv,17,L2023-11-25, kuspehuv,false,
L2023-11-25_japodari,18,L2023-11-25, japodari,false,
L2023-11-25_stixiopr,19,L2023-11-25, stixiopr,false,
L2023-11-25_alliluja,20,L2023-11-25, alliluja,false,
L2023-11-25_volk,21,L2023-11-25, volk,false,
L2023-11-25_totosego,22,L2023-11-25, totosego,false,
L2023-11-25_pamjativ,23,L2023-11-25, pamjativ,false,
L2023-11-25_shum,24,L2023-11-25, shum,false,
L2023-11-25_udachny,25,L2023-11-25, udachny,false,
L2023-11-25_sharmans,26,L2023-11-25, sharmans,false,
L2023-11-25_chepuxa,27,L2023-11-25, chepuxa,false,
L2023-11-25_nerazmen,28,L2023-11-25, nerazmen,false,
L2023-11-25_pesenkao,29,L2023-11-25, pesenkao,false,

09.11.2023 чт – Москва, ЦАП
L2023-11-09_1992,01,L2023-11-09, 1992,false,
L2023-11-09_podzname,02,L2023-11-09, podzname,false,
L2023-11-09_avtoparo,03,L2023-11-09, avtoparo,false,
L2023-11-09_krasnye,04,L2023-11-09, krasnye,false,
L2023-11-09_propadu,05,L2023-11-09, propadu,false,
L2023-11-09_chteniem,06,L2023-11-09, chteniem,false,
L2023-11-09_gdetytep,07,L2023-11-09, gdetytep,false,
L2023-11-09_odnazhdy,08,L2023-11-09, odnazhdy,false,
L2023-11-09_duet,09,L2023-11-09, duet,false,
L2023-11-09_kuspehuv,10,L2023-11-09, kuspehuv,false,
L2023-11-09_volhonka,11,L2023-11-09, volhonka,false,
L2023-11-09_proschanie,12,L2023-11-09, proschanie,false,
L2023-11-09_dopoezda,13,L2023-11-09, dopoezda,false,
L2023-11-09_japodari,14,L2023-11-09, japodari,false,
L2023-11-09_baltijsk,15,L2023-11-09, baltijsk,false,
L2023-11-09_romans2,16,L2023-11-09, romans2,false,
L2023-11-09_shum,17,L2023-11-09, shum,false,
L2023-11-09_ryba,18,L2023-11-09, ryba,false,
L2023-11-09_suhumi,19,L2023-11-09, suhumi,false,
L2023-11-09_volk,20,L2023-11-09, volk,false,
L2023-11-09_pamjativ,21,L2023-11-09, pamjativ,false,
L2023-11-09_stixiopr,22,L2023-11-09, stixiopr,false,
L2023-11-09_totosego,23,L2023-11-09, totosego,false,
L2023-11-09_alliluja,24,L2023-11-09, alliluja,false,
L2023-11-09_sharmans,25,L2023-11-09, sharmans,false,
L2023-11-09_pesenkao,26,L2023-11-09, pesenkao,false,

30.10.2023 пн – Москва, бард-клуб "Гнездо глухаря"
L2023-10-30_krasnye,01,L2023-10-30, krasnye,false,
L2023-10-30_odnazhdy,02,L2023-10-30, odnazhdy,false,
L2023-10-30_ryba,03,L2023-10-30, ryba,false,
L2023-10-30_rodljuds,04,L2023-10-30, rodljuds,false,
L2023-10-30_peyzazh,05,L2023-10-30, peyzazh,false,
L2023-10-30_chteniem,06,L2023-10-30, chteniem,false,
L2023-10-30_nadvuhk,07,L2023-10-30, nadvuhk,false,
L2023-10-30_gdetytep,08,L2023-10-30, gdetytep,false,
L2023-10-30_shkolat2,09,L2023-10-30, shkolat2,false,
L2023-10-30_romans2,10,L2023-10-30, romans2,false,
L2023-10-30_deja,11,L2023-10-30, deja,false,
L2023-10-30_fridrih,12,L2023-10-30, fridrih,false,
L2023-10-30_proschanie,13,L2023-10-30, proschanie,false,
L2023-10-30_baltijsk,14,L2023-10-30, baltijsk,false,
L2023-10-30_peterbur,15,L2023-10-30, peterbur,false,
L2023-10-30_shum,16,L2023-10-30, shum,false,
---
L2023-10-30_dopoezda,17,L2023-10-30, dopoezda,false,
L2023-10-30_suhumi,18,L2023-10-30, suhumi,false,
L2023-10-30_volk,19,L2023-10-30, volk,false,
L2023-10-30_pamjativ,20,L2023-10-30, pamjativ,false,
L2023-10-30_totosego,21,L2023-10-30, totosego,false,
L2023-10-30_alliluja,22,L2023-10-30, alliluja,false,
L2023-10-30_esli,23,L2023-10-30, esli,false,
L2023-10-30_udachny,24,L2023-10-30, udachny,false,
L2023-10-30_sharmans,25,L2023-10-30, sharmans,false,
L2023-10-30_pesenkao,26,L2023-10-30, pesenkao,false,

30.09.2023 сб – Москва, бард-клуб "Гнездо глухаря"
L2023-09-30_dopoezda,01,L2023-09-30, dopoezda,false,
L2023-09-30_odnazhdy,02,L2023-09-30, odnazhdy,false,
L2023-09-30_zaklinan,03,L2023-09-30, zaklinan,false,
L2023-09-30_chuzhaj2,04,L2023-09-30, chuzhaj2,false,
L2023-09-30_chteniem,05,L2023-09-30, chteniem,false,
L2023-09-30_temapoleta,06,L2023-09-30, temapoleta,false,
L2023-09-30_razvecht,07,L2023-09-30, razvecht,false,
L2023-09-30_romans2,08,L2023-09-30, romans2,false,
L2023-09-30_deja,09,L2023-09-30, deja,false,
L2023-09-30_proschanie,10,L2023-09-30, proschanie,false,
L2023-09-30_propadu,11,L2023-09-30, propadu,false,
L2023-09-30_tirbayard,12,L2023-09-30, tirbayard,false,
L2023-09-30_krechi,13,L2023-09-30, krechi,false,
L2023-09-30_zastolnaya,14,L2023-09-30, zastolnaya,false,
---
L2023-09-30_chtonam,15,L2023-09-30, chtonam,false,
L2023-09-30_volk,16,L2023-09-30, volk,false,
L2023-09-30_totosego,17,L2023-09-30, totosego,false,
L2023-09-30_ryba,18,L2023-09-30, ryba,false,
L2023-09-30_japodari,19,L2023-09-30, japodari,false,
L2023-09-30_ubykagol,20,L2023-09-30, ubykagol,false,
L2023-09-30_baltijsk,21,L2023-09-30, baltijsk,false,
L2023-09-30_esli,22,L2023-09-30, esli,false,
L2023-09-30_alliluja,23,L2023-09-30, alliluja,false,
L2023-09-30_sharmans,24,L2023-09-30, sharmans,false,
L2023-09-30_chepuxa,25,L2023-09-30, chepuxa,false,
L2023-09-30_nerazmen,26,L2023-09-30, nerazmen,false,

19.09.2023 вт – Санкт-Петербург, бард-клуб "Гнездо глухаря"
L2023-09-19_1992,01,L2023-09-19, 1992,false,
L2023-09-19_odnazhdy,02,L2023-09-19, odnazhdy,false,
L2023-09-19_ryba,03,L2023-09-19, ryba,false,
L2023-09-19_chuzhaj2,04,L2023-09-19, chuzhaj2,false,
L2023-09-19_suhumi,05,L2023-09-19, suhumi,false,
L2023-09-19_peyzazh,06,L2023-09-19, peyzazh,false,
L2023-09-19_razvecht,07,L2023-09-19, razvecht,false,
L2023-09-19_temapoleta,08,L2023-09-19, temapoleta,false,
L2023-09-19_stixiopr,09,L2023-09-19, stixiopr,false,
L2023-09-19_ballada,10,L2023-09-19, ballada,false,
L2023-09-19_stenyusv,11,L2023-09-19, stenyusv,false,
L2023-09-19_traviata,12,L2023-09-19, traviata,false,
L2023-09-19_izpepla,13,L2023-09-19, izpepla,false,
L2023-09-19_vpoxodny,14,L2023-09-19, vpoxodny,false,
L2023-09-19_shum,15,L2023-09-19, shum,false,
L2023-09-19_totosego,16,L2023-09-19, totosego,false,
---
L2023-09-19_zhizn,17,L2023-09-19, zhizn,false,
L2023-09-19_volk,18,L2023-09-19, volk,false,
L2023-09-19_chteniem,19,L2023-09-19, chteniem,false,
L2023-09-19_chumka,20,L2023-09-19, chumka,false,
L2023-09-19_nadvuhk,21,L2023-09-19, nadvuhk,false,
L2023-09-19_ubykagol,22,L2023-09-19, ubykagol,false,
L2023-09-19_nezabyva,23,L2023-09-19, nezabyva,false,
L2023-09-19_baltijsk,24,L2023-09-19, baltijsk,false,
L2023-09-19_pamjativ,25,L2023-09-19, pamjativ,false,
L2023-09-19_sharmans,26,L2023-09-19, sharmans,false,
L2023-09-19_chepuxa,27,L2023-09-19, chepuxa,false,
L2023-09-19_nerazmen,28,L2023-09-19, nerazmen,false,

26.08.2023 пн – Москва, бард-клуб "Гнездо глухаря"
L2023-08-26_kuznechiki,01,L2023-08-26, kuznechiki,false,
L2023-08-26_zhizn,02,L2023-08-26, zhizn,false,
L2023-08-26_1992,03,L2023-08-26, 1992,false,
L2023-08-26_suhumi,04,L2023-08-26, suhumi,false,
L2023-08-26_peyzazh,05,L2023-08-26, peyzazh,false,
L2023-08-26_podzname,06,L2023-08-26, podzname,false,
L2023-08-26_stixiopr,06,L2023-08-26, stixiopr,false,
L2023-08-26_vpotokah,07,L2023-08-26, vpotokah,false,
L2023-08-26_pamjativ,08,L2023-08-26, pamjativ,false,
L2023-08-26_ballada,09,L2023-08-26, ballada,false,
L2023-08-26_stenyusv,10,L2023-08-26, stenyusv,false,
L2023-08-26_nadvuhk,11,L2023-08-26, nadvuhk,false,
L2023-08-26_nezabyva,12,L2023-08-26, nezabyva,false,
L2023-08-26_shum,13,L2023-08-26, shum,false,
---
L2023-08-26_volk,14,L2023-08-26, volk,false,
L2023-08-26_totosego,15,L2023-08-26, totosego,false,
L2023-08-26_voslavug,16,L2023-08-26, voslavug,false,
L2023-08-26_vpoxodny,17,L2023-08-26, vpoxodny,false,
L2023-08-26_romans2,18,L2023-08-26, romans2,false,
L2023-08-26_chteniem,19,L2023-08-26, chteniem,false,
L2023-08-26_esli,20,L2023-08-26, esli,false,
L2023-08-26_navescha,21,L2023-08-26, navescha,false,
L2023-08-26_baltijsk,22,L2023-08-26, baltijsk,false,
L2023-08-26_alliluja,23,L2023-08-26, alliluja,false,
L2023-08-26_sharmans,24,L2023-08-26, sharmans,false,
L2023-08-26_chepuxa,25,L2023-08-26, chepuxa,false,

08.07.2023 сб – Москва, бард-клуб "Гнездо глухаря", премьера
L2023-07-08_dopoezda,01,L2023-07-08, dopoezda,false,
L2023-07-08_odnazhdy,02,L2023-07-08, odnazhdy,false,
L2023-07-08_ryba,03,L2023-07-08, ryba,false,
L2023-07-08_navescha,04,L2023-07-08, navescha,false,
L2023-07-08_kalejdos,05,L2023-07-08, kalejdos,false,
L2023-07-08_kuznechiki,06,L2023-07-08, kuznechiki,false,
L2023-07-08_stixiopr,07,L2023-07-08, stixiopr,false,
L2023-07-08_shum,08,L2023-07-08, shum,true,
L2023-07-08_prosba,09,L2023-07-08, prosba,false,
L2023-07-08_peyzazh,10,L2023-07-08, peyzazh,false,
L2023-07-08_chteniem,11,L2023-07-08, chteniem,false,
L2023-07-08_esli,12,L2023-07-08, esli,false,
L2023-07-08_izpepla,13,L2023-07-08, izpepla,false,
L2023-07-08_voslavug,14,L2023-07-08, voslavug,false,
L2023-07-08_totosego,15,L2023-07-08, totosego,false,
---
L2023-07-08_zhizn,16,L2023-07-08, zhizn,false,
L2023-07-08_volk,17,L2023-07-08, volk,false,
L2023-07-08_kuspehuv,18,L2023-07-08, kuspehuv,false,
L2023-07-08_krasnye,19,L2023-07-08, krasnye,false,
L2023-07-08_sharmans,20,L2023-07-08, sharmans,false,
L2023-07-08_pamjativ,21,L2023-07-08, pamjativ,false,
L2023-07-08_chumka,22,L2023-07-08, chumka,false,
L2023-07-08_vpoxodny,23,L2023-07-08, vpoxodny,false,
L2023-07-08_shkolat2,24,L2023-07-08, shkolat2,false,
L2023-07-08_stenyusv,25,L2023-07-08, stenyusv,false,
L2023-07-08_chepuxa,26,L2023-07-08, chepuxa,false,

29.05.2023 пн – Москва, бард-клуб "Гнездо глухаря", дуэт (гитара)
L2023-05-29_Paris,01,L2023-05-29, Paris,false,
L2023-05-29_navsejz1,02,L2023-05-29, navsejz1,false,
L2023-05-29_poshlyj,03,L2023-05-29, poshlyj,false,
L2023-05-29_temapoko,04,L2023-05-29, temapoko,false,
L2023-05-29_vrjadli,05,L2023-05-29, vrjadli,false,
L2023-05-29_opyatpar,06,L2023-05-29, opyatpar,false,
L2023-05-29_sezondoz,07,L2023-05-29, sezondoz,false,
L2023-05-29_chtobyat,08,L2023-05-29, chtobyat,false,
L2023-05-29_marija,09,L2023-05-29, marija,false,
L2023-05-29_kovcheg,10,L2023-05-29, kovcheg,false,
L2023-05-29_romans1,11,L2023-05-29, romans1,false,
L2023-05-29_kchemuis,12,L2023-05-29, kchemuis,false,
L2023-05-29_konecned,13,L2023-05-29, konecned,false,
L2023-05-29_nastojas,14*,L2023-05-29, nastojas,false,
L2023-05-29_odnazkim,15*,L2023-05-29, odnazkim,false,
---
L2023-05-29_kibitka,16,L2023-05-29, kibitka,false,
L2023-05-29_adleucon,17,L2023-05-29, adleucon,false,
L2023-05-29_eccehomo,18,L2023-05-29, eccehomo,false,
L2023-05-29_bereg,19,L2023-05-29, bereg,false,
L2023-05-29_proscha1,20,L2023-05-29, proscha1,false,
L2023-05-29_karavan,21,L2023-05-29, karavan,false,
L2023-05-29_voslavug,22,L2023-05-29, voslavug,false,
L2023-05-29_sharmans,23,L2023-05-29, sharmans,false,
L2023-05-29_dusha,24,L2023-05-29, dusha,false,
L2023-05-29_vtornik,25,L2023-05-29, vtornik,false,
L2023-05-29_korablik,26,L2023-05-29, korablik,false,

14.05.2023 вс – Санкт-Петербург, бард-клуб "Гнездо глухаря"
L2023-05-14_dopoezda,01,L2023-05-14, dopoezda,false,
L2023-05-14_zaklinan,02,L2023-05-14, zaklinan,false,
L2023-05-14_krasnye,03,L2023-05-14, krasnye,false,
L2023-05-14_podzname,04,L2023-05-14, podzname,false,
L2023-05-14_stenyusv,05,L2023-05-14, stenyusv,false,
L2023-05-14_shkolat2,06,L2023-05-14, shkolat2,false,
L2023-05-14_itakvope,07,L2023-05-14, itakvope,false,
L2023-05-14_krechi,08,L2023-05-14, krechi,false,
L2023-05-14_volk,09,L2023-05-14, volk,false,
L2023-05-14_2001,10,L2023-05-14, 2001,false,
L2023-05-14_propadu,11,L2023-05-14, propadu,false,
L2023-05-14_rodljuds,12,L2023-05-14, rodljuds,false,
L2023-05-14_aviapochta,13,L2023-05-14, aviapochta,false,
---
L2023-05-14_odnazhdy,14,L2023-05-14, odnazhdy,false,
L2023-05-14_kuspehuv,15,L2023-05-14, kuspehuv,false,
L2023-05-14_izpepla,16,L2023-05-14, izpepla,false,
L2023-05-14_vpoxodny,17,L2023-05-14, vpoxodny,false,
L2023-05-14_temapoleta,18,L2023-05-14, temapoleta,false,
L2023-05-14_chteniem,19,L2023-05-14, chteniem,false,
L2023-05-14_esli,20,L2023-05-14, esli,false,
L2023-05-14_hrustal,21,L2023-05-14, hrustal,false,
L2023-05-14_chuzhaj2,22,L2023-05-14, chuzhaj2,false,
L2023-05-14_alliluja,23,L2023-05-14, alliluja,false,
L2023-05-14_sharmans,24,L2023-05-14, sharmans,false,
L2023-05-14_chepuxa,25,L2023-05-14, chepuxa,false,
L2023-05-14_nerazmen,26,L2023-05-14, nerazmen,false,

11.05.2023 чт – Санкт-Петербург, бард-клуб "Гнездо глухаря"
L2023-05-11_ryba,01,L2023-05-11, ryba,false,
L2023-05-11_nezabyva,02,L2023-05-11, nezabyva,false,
L2023-05-11_deja,03,L2023-05-11, deja,false,
L2023-05-11_kuznechiki,04,L2023-05-11, kuznechiki,false,
L2023-05-11_udachny,05,L2023-05-11, udachny,false,
L2023-05-11_traviata,06,L2023-05-11, traviata,false,
L2023-05-11_izpepla,07,L2023-05-11, izpepla,false,
L2023-05-11_tirbayard,08,L2023-05-11, tirbayard,false,
L2023-05-11_duet,09,L2023-05-11, duet,false,
L2023-05-11_chtonam,10,L2023-05-11, chtonam,false,
L2023-05-11_pamjativ,11,L2023-05-11, pamjativ,false,
L2023-05-11_navescha,12,L2023-05-11, navescha,false,
---
L2023-05-11_kalejdos,13,L2023-05-11, kalejdos,false,
L2023-05-11_voslavug,14,L2023-05-11, voslavug,false,
L2023-05-11_suhumi,15,L2023-05-11, suhumi,false,
L2023-05-11_peyzazh,16,L2023-05-11, peyzazh,false,
L2023-05-11_baltijsk,17,L2023-05-11, baltijsk,false,
L2023-05-11_hrustal,18,L2023-05-11, hrustal,false,
L2023-05-11_esli,19,L2023-05-11, esli,false,
L2023-05-11_volhonka,20,L2023-05-11, volhonka,false,
L2023-05-11_vpoxodny,21,L2023-05-11, vpoxodny,false,
L2023-05-11_1992,22,L2023-05-11, 1992,false,
L2023-05-11_romans2,23,L2023-05-11, romans2,false,
L2023-05-11_nerazmen,24,L2023-05-11, nerazmen,false,

24.04.2023 пн – Москва, бард-клуб "Гнездо глухаря"
L2023-04-24_dopoezda,01,L2023-04-24, dopoezda,false,
L2023-04-24_1991,02,L2023-04-24, 1991,false,
L2023-04-24_krasnye,03,L2023-04-24, krasnye,false,
L2023-04-24_temapoleta,04,L2023-04-24, temapoleta,false,
L2023-04-24_chteniem,05,L2023-04-24, chteniem,false,
L2023-04-24_traviata,06,L2023-04-24, traviata,false,
L2023-04-24_izpepla,07,L2023-04-24, izpepla,false,
L2023-04-24_chtonam,08,L2023-04-24, chtonam,false,
L2023-04-24_shkolat2,09,L2023-04-24, shkolat2,false,
L2023-04-24_stenyusv,10,L2023-04-24, stenyusv,false,
L2023-04-24_krechi,11,L2023-04-24, krechi,false,
L2023-04-24_zastolnaya,12,L2023-04-24, zastolnaya,false,
L2023-04-24_aviapochta,13,L2023-04-24, aviapochta,false,
---
L2023-04-24_ryba,14,L2023-04-24, ryba,false,
L2023-04-24_nezabyva,15,L2023-04-24, nezabyva,false,
L2023-04-24_udachny,16,L2023-04-24, udachny,false,
L2023-04-24_chuzhaj2,17,L2023-04-24, chuzhaj2,false,
L2023-04-24_deja,18,L2023-04-24, deja,false,
L2023-04-24_baltijsk,19,L2023-04-24, baltijsk,false,
L2023-04-24_hrustal,20,L2023-04-24, hrustal,false,
L2023-04-24_stixiopr,21,L2023-04-24, stixiopr,false,
L2023-04-24_sharmans,22,L2023-04-24, sharmans,false,
L2023-04-24_esli,23,L2023-04-24, esli,false,
L2023-04-24_chepuxa,24,L2023-04-24, chepuxa,false,

20.03.2023 пн – Москва, бард-клуб "Гнездо глухаря"
L2023-03-20_volk,01,L2023-03-20, volk,false,
L2023-03-20_krasnye,02,L2023-03-20, krasnye,false,
L2023-03-20_ryba,03,L2023-03-20, ryba,false,
L2023-03-20_odnazhdy,04,L2023-03-20, odnazhdy,false,
L2023-03-20_proschanie,05,L2023-03-20, proschanie,false,
L2023-03-20_kogdaned,06,L2023-03-20, kogdaned,false,
L2023-03-20_1991,07,L2023-03-20, 1991,false,
L2023-03-20_dopoezda,08,L2023-03-20, dopoezda,false,
L2023-03-20_deja,09,L2023-03-20, deja,false,
L2023-03-20_sokolnik,10,L2023-03-20, sokolnik,false,
L2023-03-20_kalejdos,11,L2023-03-20, kalejdos,false,
L2023-03-20_peyzazh,12,L2023-03-20, peyzazh,false,
L2023-03-20_baltijsk,13,L2023-03-20, baltijsk,false,
L2023-03-20_navescha,14,L2023-03-20, navescha,false,
---
L2023-03-20_podzname,15,L2023-03-20, podzname,false,
L2023-03-20_udachny,16,L2023-03-20, udachny,false,
L2023-03-20_romans2,17,L2023-03-20, romans2,false,
L2023-03-20_hrustal,18,L2023-03-20, hrustal,false,
L2023-03-20_voslavug,19,L2023-03-20, voslavug,false,
L2023-03-20_ubykagol,20,L2023-03-20, ubykagol,false,
L2023-03-20_esli,21,L2023-03-20, esli,false,
L2023-03-20_sharmans,22,L2023-03-20, sharmans,false,
L2023-03-20_alliluja,23,L2023-03-20, alliluja,false,
L2023-03-20_temapoleta,24,L2023-03-20, temapoleta,false,
L2023-03-20_chepuxa,25,L2023-03-20, chepuxa,false,
L2023-03-20_nerazmen,26,L2023-03-20, nerazmen,false,

13.02.2023 пн – Москва, бард-клуб "Гнездо глухаря"
L2023-02-13_1992,01,L2023-02-13, 1992,false,
L2023-02-13_zhizn,02,L2023-02-13, zhizn,false,
L2023-02-13_kuznechiki,03,L2023-02-13, kuznechiki,false,
L2023-02-13_drugoe,04,L2023-02-13, drugoe,false,
L2023-02-13_tirbayard,05,L2023-02-13, tirbayard,false,
L2023-02-13_propadu,06,L2023-02-13, propadu,false,
L2023-02-13_krasnye,07,L2023-02-13, krasnye,false,
L2023-02-13_nezabyva,08,L2023-02-13, nezabyva,false,
L2023-02-13_chteniem,09,L2023-02-13, chteniem,false,
L2023-02-13_proschanie,10,L2023-02-13, proschanie,false,
L2023-02-13_fontanka,11,L2023-02-13, fontanka,false,
L2023-02-13_volhonka,12,L2023-02-13, volhonka,false,
L2023-02-13_itakvope,13,L2023-02-13, itakvope,false,
L2023-02-13_krechi,14,L2023-02-13, krechi,false,
L2023-02-13_sentenci,15,L2023-02-13, sentenci,false,
---
L2023-02-13_chuzhaj2,16,L2023-02-13, chuzhaj2,false,
L2023-02-13_zaklinan,17,L2023-02-13, zaklinan,false,
L2023-02-13_romans2,18,L2023-02-13, romans2,false,
L2023-02-13_1991,19,L2023-02-13, 1991,false,
L2023-02-13_alliluja,20,L2023-02-13, alliluja,false,
L2023-02-13_voslavug,21,L2023-02-13, voslavug,false,
L2023-02-13_hrustal,22,L2023-02-13, hrustal,false,
L2023-02-13_volk,23,L2023-02-13, volk,false,
L2023-02-13_navescha,24,L2023-02-13, navescha,false,
L2023-02-13_pamjativ,25,L2023-02-13, pamjativ,false,
L2023-02-13_sharmans,26,L2023-02-13, sharmans,false,
L2023-02-13_esli,27,L2023-02-13, esli,false,
L2023-02-13_chepuxa,28,L2023-02-13, chepuxa,false,

12.02.2023 вс – Москва, бард-клуб "Гнездо глухаря" (малый зал)
L2023-02-12_kuznechiki,01,L2023-02-12, kuznechiki,false,
L2023-02-12_ryba,02,L2023-02-12, ryba,false,
L2023-02-12_volk,03,L2023-02-12, volk,false,
L2023-02-12_shkolat2,04,L2023-02-12, shkolat2,false,
L2023-02-12_zaliv,05,L2023-02-12, zaliv,false,
L2023-02-12_peyzazh,06,L2023-02-12, peyzazh,false,
L2023-02-12_1991,07,L2023-02-12, 1991,false,
L2023-02-12_odnazhdy,08,L2023-02-12, odnazhdy,false,
L2023-02-12_nezabyva,09,L2023-02-12, nezabyva,false,
L2023-02-12_vpoxodny,10,L2023-02-12, vpoxodny,false,
L2023-02-12_voslavug,11,L2023-02-12, voslavug,false,
L2023-02-12_ubykagol,12,L2023-02-12, ubykagol,false,
L2023-02-12_stixiopr,13,L2023-02-12, stixiopr,false,
L2023-02-12_aviapochta,14,L2023-02-12, aviapochta,false,
L2023-02-12_zastolnaya,15,L2023-02-12, zastolnaya,false,
---
L2023-02-12_chuzhaj2,16,L2023-02-12, chuzhaj2,false,
L2023-02-12_dopoezda,17,L2023-02-12, dopoezda,false,
L2023-02-12_propadu,18,L2023-02-12, propadu,false,
L2023-02-12_hrustal,19,L2023-02-12, hrustal,false,
L2023-02-12_kuspehuv,20,L2023-02-12, kuspehuv,false,
L2023-02-12_esli,21,L2023-02-12, esli,false,
L2023-02-12_pamjativ,22,L2023-02-12, pamjativ,false,
L2023-02-12_chtonam,23,L2023-02-12, chtonam,false,
L2023-02-12_alliluja,24,L2023-02-12, alliluja,false,
L2023-02-12_sharmans,25,L2023-02-12, sharmans,false,
L2023-02-12_chepuxa,26,L2023-02-12, chepuxa,false,
L2023-02-12_nerazmen,27,L2023-02-12, nerazmen,false,


05.12.2022 пн – Москва, бард-клуб "Гнездо глухаря" (малый зал), текст
L2022-12-05_chuzhaj2,01,L2022-12-05, chuzhaj2,false,
L2022-12-05_zhizn,02,L2022-12-05, zhizn,false,
L2022-12-05_propadu,03,L2022-12-05, propadu,false,
L2022-12-05_peterbur,04,L2022-12-05, peterbur,false,
L2022-12-05_butafor,05,L2022-12-05, butafor,false,
L2022-12-05_nezabyva,06,L2022-12-05, nezabyva,false,
L2022-12-05_vpoxodny,07,L2022-12-05, vpoxodny,false,
L2022-12-05_drugoe,08,L2022-12-05, drugoe,false,
L2022-12-05_dopoezda,09,L2022-12-05, dopoezda,false,
L2022-12-05_suhumi,10,L2022-12-05, suhumi,false,
L2022-12-05_voslavug,11,L2022-12-05, voslavug,false,
L2022-12-05_ubykagol,12,L2022-12-05, ubykagol,false,
L2022-12-05_navescha,13,L2022-12-05, navescha,false,
L2022-12-05_esli,14,L2022-12-05, esli,false,
L2022-12-05_chtonam,15,L2022-12-05, chtonam,false,
---
L2022-12-05_kuznechiki,16,L2022-12-05, kuznechiki,false,
L2022-12-05_stixiopr,17,L2022-12-05, stixiopr,false,
L2022-12-05_proschanie,18,L2022-12-05, proschanie,false,
L2022-12-05_volk,19,L2022-12-05, volk,false,
L2022-12-05_romans2,20,L2022-12-05, romans2,false,
@L2022-12-05_hrustal,21,L2022-12-05, hrustal,false,(обновлённый текст)
L2022-12-05_kuspehuv,22,L2022-12-05, kuspehuv,false,
L2022-12-05_alliluja,23,L2022-12-05, alliluja,false,
L2022-12-05_sharmans,24,L2022-12-05, sharmans,false,
L2022-12-05_pamjativ,25,L2022-12-05, pamjativ,false,
L2022-12-05_chepuxa,26,L2022-12-05, chepuxa,false,
L2022-12-05_pesenkao,27,L2022-12-05, pesenkao,false,

22.11.2022 вт – Москва, бард-клуб "Гнездо глухаря", дуэт (клавиши), премьера
L2022-11-22_descensu,01,L2022-11-22, descensu,false,
L2022-11-22_cirkachk,02,L2022-11-22, cirkachk,false,
L2022-11-22_marija,03,L2022-11-22, marija,false,
L2022-11-22_muzhajsj,04,L2022-11-22, muzhajsj,false,
L2022-11-22_rozhdest,05,L2022-11-22, rozhdest,false,
L2022-11-22_spros,06,L2022-11-22, spros,false,
L2022-11-22_voslavug,07,L2022-11-22, voslavug,false,
L2022-11-22_hrustal,08,L2022-11-22, hrustal,true,
L2022-11-22_lunnaja,09,L2022-11-22, lunnaja,false,
L2022-11-22_okean,10,L2022-11-22, okean,false,
L2022-11-22_shkolat1,11,L2022-11-22, shkolat1,false,
L2022-11-22_kchemuis,12,L2022-11-22, kchemuis,false,
L2022-11-22_alliluja,13,L2022-11-22, alliluja,false,
L2022-11-22_proscha2,14,L2022-11-22, proscha2,false,
---
L2022-11-22_kibitka,15,L2022-11-22, kibitka,false,
L2022-11-22_posesche,16,L2022-11-22, posesche,false,
L2022-11-22_longran,17*,L2022-11-22, longran,false,
L2022-11-22_veternm,18*,L2022-11-22, veternm,false,
L2022-11-22_chtovpred,19,L2022-11-22, chtovpred,false,
L2022-11-22_kanonov,20,L2022-11-22, kanonov,false,
L2022-11-22_sharmans,21,L2022-11-22, sharmans,false,
L2022-11-22_vtornik,22,L2022-11-22, vtornik,false,
L2022-11-22_dusha,23,L2022-11-22, dusha,false,
L2022-11-22_kolybeln,24,L2022-11-22, kolybeln,false,

17.11.2022 чт – Москва, ЦАП
L2022-11-17_ryba,01,L2022-11-17, ryba,false,
L2022-11-17_volk,02,L2022-11-17, volk,false,
L2022-11-17_udachny,03,L2022-11-17, udachny,false,
L2022-11-17_dopoezda,04,L2022-11-17, dopoezda,false,
L2022-11-17_suhumi,05,L2022-11-17, suhumi,false,
L2022-11-17_peyzazh,06,L2022-11-17, peyzazh,false,
L2022-11-17_deja,07,L2022-11-17, deja,false,
L2022-11-17_voslavug,08,L2022-11-17, voslavug,false,
L2022-11-17_fontanka,09,L2022-11-17, fontanka,false,
L2022-11-17_proschanie,10,L2022-11-17, proschanie,false,
L2022-11-17_ubykagol,11,L2022-11-17, ubykagol,false,
L2022-11-17_spros,12,L2022-11-17, spros,false,
L2022-11-17_stixiopr,13,L2022-11-17, stixiopr,false,
L2022-11-17_kuznechiki,14,L2022-11-17, kuznechiki,false,
L2022-11-17_alliluja,15,L2022-11-17, alliluja,false,
L2022-11-17_vpoxodny,16,L2022-11-17, vpoxodny,false,
L2022-11-17_nezabyva,17,L2022-11-17, nezabyva,false,
L2022-11-17_kuspehuv,18,L2022-11-17, kuspehuv,false,
L2022-11-17_chteniem,19,L2022-11-17, chteniem,false,
L2022-11-17_sharmans,20,L2022-11-17, sharmans,false,
L2022-11-17_esli,21,L2022-11-17, esli,false,
L2022-11-17_pesenkao,22,L2022-11-17, pesenkao,false,

29.10.2022 сб – Москва, бард-клуб "Гнездо глухаря"
L2022-10-29_1992,01,L2022-10-29, 1992,false,
L2022-10-29_kuznechiki,02,L2022-10-29, kuznechiki,false,
L2022-10-29_udachny,03,L2022-10-29, udachny,false,
L2022-10-29_volk,04,L2022-10-29, volk,false,
L2022-10-29_traviata,05,L2022-10-29, traviata,false,
L2022-10-29_suhumi,06,L2022-10-29, suhumi,false,
L2022-10-29_zvezdoch,07,L2022-10-29, zvezdoch,false,
L2022-10-29_deja,08,L2022-10-29, deja,false,
L2022-10-29_temapoleta,09,L2022-10-29, temapoleta,false,
L2022-10-29_dopoezda,10,L2022-10-29, dopoezda,false,
L2022-10-29_aviapochta,11,L2022-10-29, aviapochta,false,
L2022-10-29_zastolnaya,12,L2022-10-29, zastolnaya,false,
L2022-10-29_moekoro2,13,L2022-10-29, moekoro2,false,
L2022-10-29_krechi,14,L2022-10-29, krechi,false,
L2022-10-29_sentenci,15,L2022-10-29, sentenci,false,
---
L2022-10-29_ryba,16,L2022-10-29, ryba,false,
L2022-10-29_spros,17,L2022-10-29, spros,false,
L2022-10-29_voslavug,18,L2022-10-29, voslavug,false,
L2022-10-29_nazimnej,19,L2022-10-29, nazimnej,false,
L2022-10-29_ubykagol,20,L2022-10-29, ubykagol,false,
L2022-10-29_proschanie,21,L2022-10-29, proschanie,false,
L2022-10-29_alliluja,22,L2022-10-29, alliluja,false,
L2022-10-29_sharmans,23,L2022-10-29, sharmans,false,
L2022-10-29_pamjativ,24,L2022-10-29, pamjativ,false,
L2022-10-29_pesenkao,24,L2022-10-29, pesenkao,false,

26.09.2022 пн – Москва, бард-клуб "Гнездо глухаря", премьера
L2022-09-26_ryba,01,L2022-09-26, ryba,false,
L2022-09-26_kuznechiki,02,L2022-09-26, kuznechiki,false,
L2022-09-26_udachny,03,L2022-09-26, udachny,false,
L2022-09-26_volk,04,L2022-09-26, volk,false,
L2022-09-26_traviata,05,L2022-09-26, traviata,false,
L2022-09-26_butafor,06,L2022-09-26, butafor,true,
L2022-09-26_zaliv,07,L2022-09-26, zaliv,false,
L2022-09-26_suhumi,08,L2022-09-26, suhumi,false,
L2022-09-26_dopoezda,09,L2022-09-26, dopoezda,false,
L2022-09-26_volhonka,10,L2022-09-26, volhonka,false,
L2022-09-26_1991,11,L2022-09-26, 1991,false,
L2022-09-26_krasnye,12,L2022-09-26, krasnye,false,
L2022-09-26_proschanie,13,L2022-09-26, proschanie,false,
L2022-09-26_deja,14,L2022-09-26, deja,false,
L2022-09-26_mneniche,15,L2022-09-26, mneniche,false,
---
L2022-09-26_ubykagol,16,L2022-09-26, ubykagol,false,
L2022-09-26_spros,17,L2022-09-26, spros,false,
L2022-09-26_voslavug,18,L2022-09-26, voslavug,false,
L2022-09-26_kuspehuv,19,L2022-09-26, kuspehuv,false,
L2022-09-26_vpoxodny,20,L2022-09-26, vpoxodny,false,
L2022-09-26_peyzazh,21,L2022-09-26, peyzazh,false,
L2022-09-26_alliluja,22,L2022-09-26, alliluja,false,
L2022-09-26_sharmans,23,L2022-09-26, sharmans,false,
L2022-09-26_pamjativ,24,L2022-09-26, pamjativ,false,
L2022-09-26_pesenkao,25,L2022-09-26, pesenkao,false,

11.09.2022 вс – Санкт-Петербург, бард-клуб "Гнездо глухаря", 2 премьеры
L2022-09-11_ryba,01,L2022-09-11, ryba,false,
L2022-09-11_volk,02,L2022-09-11, volk,false,
L2022-09-11_udachny,03,L2022-09-11, udachny,false,
L2022-09-11_kuznechiki,04,L2022-09-11, kuznechiki,false,
L2022-09-11_mytischi,05,L2022-09-11, mytischi,true,
L2022-09-11_zaliv,06,L2022-09-11, zaliv,false,
L2022-09-11_peyzazh,07,L2022-09-11, peyzazh,false,
L2022-09-11_traviata,08,L2022-09-11, traviata,false,
L2022-09-11_volhonka,09,L2022-09-11, volhonka,false,
L2022-09-11_uzhesli,10,L2022-09-11, uzhesli,false,
L2022-09-11_dopoezda,11,L2022-09-11, dopoezda,false,
L2022-09-11_suhumi,12,L2022-09-11, suhumi,false,
L2022-09-11_aviapochta,13,L2022-09-11, aviapochta,false,
L2022-09-11_zastolnaya,14,L2022-09-11, zastolnaya,false,
L2022-09-11_sentenci,15,L2022-09-11, sentenci,false,
---
L2022-09-11_1991,16,L2022-09-11, 1991,false,
L2022-09-11_vpoxodny,17,L2022-09-11, vpoxodny,false,
L2022-09-11_chuzhaj2,18,L2022-09-11, chuzhaj2,false,
L2022-09-11_baltijsk,19,L2022-09-11, baltijsk,false,
L2022-09-11_spros,20,L2022-09-11, spros,true,
L2022-09-11_zvezdoch,21,L2022-09-11, zvezdoch,false,
L2022-09-11_alliluja,22,L2022-09-11, alliluja,false,
L2022-09-11_voslavug,23,L2022-09-11, voslavug,false,
L2022-09-11_ubykagol,24,L2022-09-11, ubykagol,false,
L2022-09-11_chtonam,25,L2022-09-11, chtonam,false,
L2022-09-11_pamjativ,26,L2022-09-11, pamjativ,false,
L2022-09-11_sharmans,27,L2022-09-11, sharmans,false,
L2022-09-11_chepuxa,28,L2022-09-11, chepuxa,false,

01.08.2022 пн – Москва, бард-клуб "Гнездо глухаря"
L2022-08-01_kuznechiki,01,L2022-08-01, kuznechiki,false,
L2022-08-01_zhizn,02,L2022-08-01, zhizn,false,
L2022-08-01_zaliv,03,L2022-08-01, zaliv,false,
L2022-08-01_peyzazh,04,L2022-08-01, peyzazh,false,
L2022-08-01_zatemzhe,05,L2022-08-01, zatemzhe,false,
L2022-08-01_zvezdoch,06,L2022-08-01, zvezdoch,false,
L2022-08-01_volhonka,07,L2022-08-01, volhonka,false,
L2022-08-01_uzhesli,08,L2022-08-01, uzhesli,false,
L2022-08-01_vpoxodny,09,L2022-08-01, vpoxodny,false,
L2022-08-01_nezabyva,10,L2022-08-01, nezabyva,false,
L2022-08-01_suhumi,11,L2022-08-01, suhumi,false,
L2022-08-01_dopoezda,12,L2022-08-01, dopoezda,false,
L2022-08-01_ubykagol,13,L2022-08-01, ubykagol,false,
L2022-08-01_pesenkao,14,L2022-08-01, pesenkao,false,
---
L2022-08-01_chuzhaj2,15,L2022-08-01, chuzhaj2,false,
L2022-08-01_udachny,16,L2022-08-01, udachny,false,
L2022-08-01_ryba,17,L2022-08-01, ryba,false,
L2022-08-01_shkolat2,18,L2022-08-01, shkolat2,false,
L2022-08-01_voslavug,19,L2022-08-01, voslavug,false,
L2022-08-01_deja,20,L2022-08-01, deja,false,
L2022-08-01_nadvuhk,21,L2022-08-01, nadvuhk,false,
L2022-08-01_baltijsk,22,L2022-08-01, baltijsk,false,
L2022-08-01_pamjativ,23,L2022-08-01, pamjativ,false,
L2022-08-01_sharmans,24,L2022-08-01, sharmans,false,
L2022-08-01_zaklinan,25,L2022-08-01, zaklinan,false,

06.06.2022 пн – Москва, бард-клуб "Гнездо глухаря", премьера
L2022-06-06_1992,01,L2022-06-06, 1992,false,
L2022-06-06_odnazhdy,02,L2022-06-06, odnazhdy,false,
L2022-06-06_mneniche,03,L2022-06-06, mneniche,false,
L2022-06-06_duet,04,L2022-06-06, duet,false,
L2022-06-06_voslavug,05,L2022-06-06, voslavug,false,
L2022-06-06_vpoxodny,06,L2022-06-06, vpoxodny,false,
L2022-06-06_nezabyva,07,L2022-06-06, nezabyva,false,
L2022-06-06_baltijsk,08,L2022-06-06, baltijsk,false,
L2022-06-06_navescha,09,L2022-06-06, navescha,false,
L2022-06-06_peyzazh,10,L2022-06-06, peyzazh,false,
L2022-06-06_dopoezda,11,L2022-06-06, dopoezda,false,
L2022-06-06_zvezdyip,12,L2022-06-06, zvezdyip,false,
L2022-06-06_krechi,13,L2022-06-06, krechi,true,
L2022-06-06_itakvope,14,L2022-06-06, itakvope,false,
L2022-06-06_alliluja,15,L2022-06-06, alliluja,false,
---
L2022-06-06_ryba,16,L2022-06-06, ryba,false,
L2022-06-06_volhonka,17,L2022-06-06, volhonka,false,
L2022-06-06_kuspehuv,18,L2022-06-06, kuspehuv,false,
L2022-06-06_volk,19,L2022-06-06, volk,false,
L2022-06-06_udachny,20,L2022-06-06, udachny,false,
L2022-06-06_kuznechiki,21,L2022-06-06, kuznechiki,false,
L2022-06-06_deja,22,L2022-06-06, deja,false,
L2022-06-06_propadu,23,L2022-06-06, propadu,false,
L2022-06-06_nadvuhk,24,L2022-06-06, nadvuhk,false,
L2022-06-06_sharmans,25,L2022-06-06, sharmans,false,
L2022-06-06_chepuxa,26,L2022-06-06, chepuxa,false,

15.05.2022 вс – Санкт-Петербург, бард-клуб "Гнездо глухаря", вечерний
L2022-05-15-2-ryba,01,L2022-05-15-2,ryba,false,
L2022-05-15-2-odnazhdy,02,L2022-05-15-2,odnazhdy,false,
L2022-05-15-2-volhonka,03,L2022-05-15-2,volhonka,false,
L2022-05-15-2-stenyusv,04,L2022-05-15-2,stenyusv,false,
L2022-05-15-2-istorija,05,L2022-05-15-2,istorija,false,
L2022-05-15-2-duet,06,L2022-05-15-2,duet,false,
L2022-05-15-2-kuznechiki,07,L2022-05-15-2,kuznechiki,false,
L2022-05-15-2-ballada,08,L2022-05-15-2,ballada,false,
L2022-05-15-2-podzname,09,L2022-05-15-2,podzname,false,
L2022-05-15-2-etiglaza,10,L2022-05-15-2,etiglaza,false,
L2022-05-15-2-drugoe,11,L2022-05-15-2,drugoe,false,
L2022-05-15-2-aviapochta,12,L2022-05-15-2,aviapochta,false,
L2022-05-15-2-zastolnaya,13,L2022-05-15-2,zastolnaya,false,
---
L2022-05-15-2-zhizn,14,L2022-05-15-2,zhizn,false,
L2022-05-15-2-chuzhaj2,15,L2022-05-15-2,chuzhaj2,false,
L2022-05-15-2-zaliv,16,L2022-05-15-2,zaliv,false,
L2022-05-15-2-ubykagol,17,L2022-05-15-2,ubykagol,false,
L2022-05-15-2-traviata,18,L2022-05-15-2,traviata,false,
L2022-05-15-2-suhumi,19,L2022-05-15-2,suhumi,false,
L2022-05-15-2-navescha,20,L2022-05-15-2,navescha,false,
L2022-05-15-2-peyzazh,21,L2022-05-15-2,peyzazh,false,
L2022-05-15-2-esli,22,L2022-05-15-2,esli,false,
L2022-05-15-2-shkolat2,23,L2022-05-15-2,shkolat2,false,
L2022-05-15-2-sharmans,24,L2022-05-15-2,sharmans,false,
L2022-05-15-2-chepuxa,25,L2022-05-15-2,chepuxa,false,

15.05.2022 вс – Санкт-Петербург, бард-клуб "Гнездо глухаря", дневной
L2022-05-15-1-krasnye,01,L2022-05-15-1,krasnye,false,
L2022-05-15-1-1991,02,L2022-05-15-1,1991,false,
L2022-05-15-1-cirkachk,03,L2022-05-15-1,cirkachk,false,
L2022-05-15-1-tirbayard,04,L2022-05-15-1,tirbayard,false,
L2022-05-15-1-volk,05,L2022-05-15-1,volk,false,
L2022-05-15-1-desyatpe,06,L2022-05-15-1,desyatpe,false,
L2022-05-15-1-vpoxodny,07,L2022-05-15-1,vpoxodny,false,
L2022-05-15-1-nezabyva,08,L2022-05-15-1,nezabyva,false,
L2022-05-15-1-deja,09,L2022-05-15-1,deja,false,
L2022-05-15-1-dopoezda,10,L2022-05-15-1,dopoezda,false,
L2022-05-15-1-kalejdos,11,L2022-05-15-1,kalejdos,false,
L2022-05-15-1-chumka,12,L2022-05-15-1,chumka,false,
L2022-05-15-1-kto,13,L2022-05-15-1,kto,false,
L2022-05-15-1-voslavug,14,L2022-05-15-1,voslavug,false,
L2022-05-15-1-stixiopr,15,L2022-05-15-1,stixiopr,false,
L2022-05-15-1-alliluja,16,L2022-05-15-1,alliluja,false,
---
L2022-05-15-1-udachny,17,L2022-05-15-1,udachny,false,
L2022-05-15-1-propadu,18,L2022-05-15-1,propadu,false,
L2022-05-15-1-romans2,19,L2022-05-15-1,romans2,false,
L2022-05-15-1-baltijsk,20,L2022-05-15-1,baltijsk,false,
L2022-05-15-1-panorama,21,L2022-05-15-1,panorama,false,
L2022-05-15-1-temapoleta,22,L2022-05-15-1,temapoleta,false,
L2022-05-15-1-chteniem,23,L2022-05-15-1,chteniem,false,
L2022-05-15-1-zaklinan,24,L2022-05-15-1,zaklinan,false,
L2022-05-15-1-pamjativ,25,L2022-05-15-1,pamjativ,false,
L2022-05-15-1-nadvuhk,26,L2022-05-15-1,nadvuhk,false,
L2022-05-15-1-mneniche,27,L2022-05-15-1,mneniche,false,
L2022-05-15-1-nerazmen,28,L2022-05-15-1,nerazmen,false,

07.05.2022 сб – Москва, бард-клуб "Гнездо глухаря" (малый зал), премьера
L2022-05-07_ryba,01,L2022-05-07, ryba,false,
L2022-05-07_kuznechiki,02,L2022-05-07, kuznechiki,false,
L2022-05-07_alliluja,03,L2022-05-07, alliluja,false,
L2022-05-07_krasnye,04,L2022-05-07, krasnye,false,
L2022-05-07_volk,05,L2022-05-07, volk,false,
L2022-05-07_vpoxodny,06,L2022-05-07, vpoxodny,false,
L2022-05-07_nezabyva,07,L2022-05-07, nezabyva,false,
L2022-05-07_dopoezda,08,L2022-05-07, dopoezda,false,
L2022-05-07_deja,09,L2022-05-07, deja,false,
L2022-05-07_kalejdos,10,L2022-05-07, kalejdos,false,
L2022-05-07_chumka,11,L2022-05-07, chumka,true,
L2022-05-07_kto,12,L2022-05-07, kto,false,
L2022-05-07_stixiopr,13,L2022-05-07, stixiopr,false,
L2022-05-07_aviapochta,14,L2022-05-07, aviapochta,false,
L2022-05-07_zastolnaya,15,L2022-05-07, zastolnaya,false,
L2022-05-07_sentenci,16,L2022-05-07, sentenci,false,
L2022-05-07_udachny,17,L2022-05-07, udachny,false,
L2022-05-07_propadu,18,L2022-05-07, propadu,false,
L2022-05-07_podzname,19,L2022-05-07, podzname,false,
L2022-05-07_baltijsk,20,L2022-05-07, baltijsk,false,
L2022-05-07_panorama,21,L2022-05-07, panorama,false,
L2022-05-07_temapoleta,22,L2022-05-07, temapoleta,false,
L2022-05-07_chteniem,23,L2022-05-07, chteniem,false,
L2022-05-07_mneniche,24,L2022-05-07, mneniche,false,
L2022-05-07_pamjativ,25,L2022-05-07, pamjativ,false,
L2022-05-07_sharmans,26,L2022-05-07, sharmans,false,

04.04.2022 пн – Москва, бард-клуб "Гнездо глухаря", дуэт (гитара), 3 премьеры
L2022-04-04_navsejz1,01,L2022-04-04, navsejz1,false,
L2022-04-04_molitva,02,L2022-04-04, molitva,false,
L2022-04-04_kibitka,03,L2022-04-04, kibitka,false,
L2022-04-04_opyatpar,04,L2022-04-04, opyatpar,false,
L2022-04-04_temapoko,05,L2022-04-04, temapoko,false,
L2022-04-04_vrjadli,06,L2022-04-04, vrjadli,false,
L2022-04-04_chtobyat,07,L2022-04-04, chtobyat,false,
L2022-04-04_marija,08,L2022-04-04, marija,false,
L2022-04-04_konspekt,09,L2022-04-04, konspekt,true,
L2022-04-04_proscha1,10,L2022-04-04, proscha1,false,
L2022-04-04_sezondoz,11,L2022-04-04, sezondoz,false,
L2022-04-04_kchemuis,12,L2022-04-04, kchemuis,false,
L2022-04-04_lunanm,13*,L2022-04-04, lunanm,false,
L2022-04-04_etazhens,14*,L2022-04-04, etazhens,false,
L2022-04-04_chaikile,15*,L2022-04-04, chaikile,false,
L2022-04-04_pesnzizi,16*,L2022-04-04, pesnzizi,false,
---
L2022-04-04_peyzazh,17,L2022-04-04, peyzazh,true,
L2022-04-04_aviapochta,18,L2022-04-04, aviapochta,true,
L2022-04-04_farmacev,19,L2022-04-04, farmacev,false,
L2022-04-04_balagan2,20,L2022-04-04, balagan2,false,
L2022-04-04_sharmans,21,L2022-04-04, sharmans,false,
L2022-04-04_kovcheg,22,L2022-04-04, kovcheg,false,
L2022-04-04_karavan,23,L2022-04-04, karavan,false,
L2022-04-04_puskaj,24,L2022-04-04, puskaj,false,
L2022-04-04_korablik,25,L2022-04-04, korablik,false,
L2022-04-04_vtornik,26,L2022-04-04, vtornik,false,
L2022-04-04_vosxodja,27,L2022-04-04, vosxodja,false,

13.02.2022 вс – Москва, бард-клуб "Гнездо глухаря" (малый зал), премьера
L2022-02-13_1992,01,L2022-02-13, 1992,false,
L2022-02-13_traviata,02,L2022-02-13, traviata,false,
L2022-02-13_drugoe,03,L2022-02-13, drugoe,false,
L2022-02-13_dopoezda,04,L2022-02-13, dopoezda,false,
L2022-02-13_mneniche,05,L2022-02-13, mneniche,false,
L2022-02-13_kuznechiki,06,L2022-02-13, kuznechiki,false,
L2022-02-13_romans2,07,L2022-02-13, romans2,false,
L2022-02-13_podzname,08,L2022-02-13, podzname,false,
L2022-02-13_sovsemne,09,L2022-02-13, sovsemne,false,
L2022-02-13_vpoxodny,10,L2022-02-13, vpoxodny,false,
L2022-02-13_prosba,11,L2022-02-13, prosba,false,
L2022-02-13_chteniem,12,L2022-02-13, chteniem,false,
L2022-02-13_kto,13,L2022-02-13, kto,true,
L2022-02-13_baltijsk,14,L2022-02-13, baltijsk,false,
L2022-02-13_chtonam,15,L2022-02-13, chtonam,false,
---
L2022-02-13_pamjativ,16,L2022-02-13, pamjativ,false,
L2022-02-13_kuspehuv,17,L2022-02-13, kuspehuv,false,
L2022-02-13_rodljuds,18,L2022-02-13, rodljuds,false,
L2022-02-13_panorama,19,L2022-02-13, panorama,false,
L2022-02-13_nezabyva,20,L2022-02-13, nezabyva,false,
L2022-02-13_alliluja,21,L2022-02-13, alliluja,false,
L2022-02-13_voslavug,22,L2022-02-13, voslavug,false,
L2022-02-13_pesenkao,23,L2022-02-13, pesenkao,false,
L2022-02-13_sharmans,24,L2022-02-13, sharmans,false,
L2022-02-13_totosego,25,L2022-02-13, totosego,false,

10.01.2022 пн – Москва, бард-клуб "Гнездо глухаря"
L2022-01-10_mneniche,01,L2022-01-10, mneniche,false,
L2022-01-10_drugoe,02,L2022-01-10, drugoe,false,
L2022-01-10_dopoezda,03,L2022-01-10, dopoezda,false,
L2022-01-10_navescha,04,L2022-01-10, navescha,false,
L2022-01-10_kuznechiki,05,L2022-01-10, kuznechiki,false,
L2022-01-10_udachny,06,L2022-01-10, udachny,false,
L2022-01-10_stenyusv,07,L2022-01-10, stenyusv,false,
L2022-01-10_baltijsk,08,L2022-01-10, baltijsk,false,
L2022-01-10_vpoxodny,09,L2022-01-10, vpoxodny,false,
L2022-01-10_prosba,10,L2022-01-10, prosba,false,
L2022-01-10_nadvuhk,11,L2022-01-10, nadvuhk,false,
L2022-01-10_chteniem,12,L2022-01-10, chteniem,false,
L2022-01-10_esli,13,L2022-01-10, esli,false,
L2022-01-10_alliluja,14,L2022-01-10, alliluja,false,
L2022-01-10_chepuxa,15,L2022-01-10, chepuxa,false,
---
L2022-01-10_ryba,16,L2022-01-10, ryba,false,
L2022-01-10_godshel,17,L2022-01-10, godshel,false,
L2022-01-10_nezabyva,18,L2022-01-10, nezabyva,false,
L2022-01-10_pamjativ,19,L2022-01-10, pamjativ,false,
L2022-01-10_zaklinan,20,L2022-01-10, zaklinan,false,
L2022-01-10_voslavug,21,L2022-01-10, voslavug,false,
L2022-01-10_panorama,22,L2022-01-10, panorama,false,
L2022-01-10_sharmans,23,L2022-01-10, sharmans,false,
L2022-01-10_odnazhdy,24,L2022-01-10, odnazhdy,false,
L2022-01-10_pesenkao,25,L2022-01-10, pesenkao,false,
L2022-01-10_trubach,26,L2022-01-10, trubach,false,

08.11.2021 пн – Москва, бард-клуб "Гнездо глухаря"
L2021-11-08_nadeyus,01,L2021-11-08, nadeyus,false,
L2021-11-08_chuzhaj2,02,L2021-11-08, chuzhaj2,false,
L2021-11-08_nadvuhk,03,L2021-11-08, nadvuhk,false,
L2021-11-08_stixiopr,04,L2021-11-08, stixiopr,false,
L2021-11-08_dopoezda,05,L2021-11-08, dopoezda,false,
L2021-11-08_ballada,06,L2021-11-08, ballada,false,
L2021-11-08_drugoe,07,L2021-11-08, drugoe,false,
L2021-11-08_kuznechiki,08,L2021-11-08, kuznechiki,false,
L2021-11-08_baltijsk,09,L2021-11-08, baltijsk,false,
L2021-11-08_vpoxodny,10,L2021-11-08, vpoxodny,false,
L2021-11-08_neznajuk,11,L2021-11-08, neznajuk,false,
L2021-11-08_voslavug,12,L2021-11-08, voslavug,false,
L2021-11-08_esli,13,L2021-11-08, esli,false,
L2021-11-08_alliluja,14,L2021-11-08, alliluja,false,
---
L2021-11-08_pamjativ,15,L2021-11-08, pamjativ,false,
L2021-11-08_korablik,16,L2021-11-08, korablik,false,
L2021-11-08_zvezdoch,17,L2021-11-08, zvezdoch,false,
L2021-11-08_udachny,18,L2021-11-08, udachny,false,
L2021-11-08_stenyusv,19,L2021-11-08, stenyusv,false,
L2021-11-08_chteniem,20,L2021-11-08, chteniem,false,
L2021-11-08_mneniche,21,L2021-11-08, mneniche,false,
L2021-11-08_pesenkao,22,L2021-11-08, pesenkao,false,
L2021-11-08_chepuxa,23,L2021-11-08, chepuxa,false,
L2021-11-08_sharmans,24,L2021-11-08, sharmans,false,
L2021-11-08_prosba,25,L2021-11-08, prosba,false,
L2021-11-08_totosego,26,L2021-11-08, totosego,false,
L2021-11-08_trubach,27,L2021-11-08, trubach,false,

30.09.2021 чт – Санкт-Петербург, бард-клуб "Гнездо глухаря"
L2021-09-30_kuznechiki,01,L2021-09-30, kuznechiki,false,
L2021-09-30_ryba,02,L2021-09-30, ryba,false,
L2021-09-30_podzname,03,L2021-09-30, podzname,false,
L2021-09-30_zanaves,04,L2021-09-30, zanaves,false,
L2021-09-30_volk,05,L2021-09-30, volk,false,
L2021-09-30_baltijsk,06,L2021-09-30, baltijsk,false,
L2021-09-30_alliluja,07,L2021-09-30, alliluja,false,
L2021-09-30_1991,08,L2021-09-30, 1991,false,
L2021-09-30_izpepla,09,L2021-09-30, izpepla,false,
L2021-09-30_razvecht,10,L2021-09-30, razvecht,false,
L2021-09-30_esli,11,L2021-09-30, esli,false,
L2021-09-30_kuspehuv,12,L2021-09-30, kuspehuv,false,
L2021-09-30_itakdruz,13,L2021-09-30, itakdruz,false,
L2021-09-30_solidnys,14,L2021-09-30, solidnys,false,
L2021-09-30_itakvope,15,L2021-09-30, itakvope,false,
L2021-09-30_zastolnaya,16,L2021-09-30, zastolnaya,false,
---
L2021-09-30_panorama,17,L2021-09-30, panorama,false,
L2021-09-30_nezabyva,18,L2021-09-30, nezabyva,false,
L2021-09-30_chteniem,19,L2021-09-30, chteniem,false,
L2021-09-30_prosba,20,L2021-09-30, prosba,false,
L2021-09-30_mneniche,21,L2021-09-30, mneniche,false,
L2021-09-30_chepuxa,22,L2021-09-30, chepuxa,false,
L2021-09-30_chtonam,23,L2021-09-30, chtonam,false,
L2021-09-30_pamjativ,24,L2021-09-30, pamjativ,false,
L2021-09-30_sharmans,25,L2021-09-30, sharmans,false,
L2021-09-30_trubach,26,L2021-09-30, trubach,false,

27.09.2021 пн – Москва, бард-клуб "Гнездо глухаря"
L2021-09-27_zaklinan,01,L2021-09-27, zaklinan,false,
L2021-09-27_ryba,02,L2021-09-27, ryba,false,
L2021-09-27_razvecht,03,L2021-09-27, razvecht,false,
L2021-09-27_podzname,04,L2021-09-27, podzname,false,
L2021-09-27_volk,05,L2021-09-27, volk,false,
L2021-09-27_shkolat2,06,L2021-09-27, shkolat2,false,
L2021-09-27_izpepla,07,L2021-09-27, izpepla,false,
L2021-09-27_alliluja,08,L2021-09-27, alliluja,false,
L2021-09-27_baltijsk,09,L2021-09-27, baltijsk,false,
L2021-09-27_esli,10,L2021-09-27, esli,false,
L2021-09-27_kuznechiki,11,L2021-09-27, kuznechiki,false,
L2021-09-27_1991,12,L2021-09-27, 1991,false,
L2021-09-27_prosba,13,L2021-09-27, prosba,false,
L2021-09-27_itakvope,14,L2021-09-27, itakvope,false,
L2021-09-27_zastolnaya,15,L2021-09-27, zastolnaya,false,
---
L2021-09-27_avtoparo,16,L2021-09-27, avtoparo,false,
L2021-09-27_panorama,17,L2021-09-27, panorama,false,
L2021-09-27_zanaves,18,L2021-09-27, zanaves,false,
L2021-09-27_nezabyva,19,L2021-09-27, nezabyva,false,
L2021-09-27_chteniem,20,L2021-09-27, chteniem,false,
L2021-09-27_kuspehuv,21,L2021-09-27, kuspehuv,false,
L2021-09-27_dopoezda,22,L2021-09-27, dopoezda,false,
L2021-09-27_mneniche,23,L2021-09-27, mneniche,false,
L2021-09-27_chepuxa,24,L2021-09-27, chepuxa,false,
L2021-09-27_trubach,25,L2021-09-27, trubach,false,

21.08.2021 сб – Москва, бард-клуб "Гнездо глухаря" (малый зал), текст
L2021-08-21_nadeyus,01,L2021-08-21, nadeyus,false,
L2021-08-21_podzname,02,L2021-08-21, podzname,false,
L2021-08-21_razvecht,03,L2021-08-21, razvecht,false,
L2021-08-21_kordebal,04,L2021-08-21, kordebal,false,
L2021-08-21_volk,05,L2021-08-21, volk,false,
L2021-08-21_solidnys,06,L2021-08-21, solidnys,false,
L2021-08-21_kalejdos,07,L2021-08-21, kalejdos,false,
L2021-08-21_nazimnej,08,L2021-08-21, nazimnej,false,
L2021-08-21_baltijsk,09,L2021-08-21, baltijsk,false,
L2021-08-21_esli,10,L2021-08-21, esli,false,
L2021-08-21_bukvynak,11,L2021-08-21, bukvynak,false,
L2021-08-21_chtonam,12,L2021-08-21, chtonam,false,(обновлённый текст)
---
L2021-08-21_panorama,13,L2021-08-21, panorama,false,
L2021-08-21_zanaves,14,L2021-08-21, zanaves,false,
L2021-08-21_nezabyva,15,L2021-08-21, nezabyva,false,
L2021-08-21_chteniem,16,L2021-08-21, chteniem,false,
L2021-08-21_kuspehuv,17,L2021-08-21, kuspehuv,false,
L2021-08-21_alliluja,18,L2021-08-21, alliluja,false,
L2021-08-21_mneniche,19,L2021-08-21, mneniche,false,
L2021-08-21_totosego,20,L2021-08-21, totosego,false,
L2021-08-21_sharmans,21,L2021-08-21, sharmans,false,
L2021-08-21_chepuxa,22,L2021-08-21, chepuxa,false,
L2021-08-21_trubach,23,L2021-08-21, trubach,false,

19.07.2021 пн – Москва, бард-клуб "Гнездо глухаря", дуэт (клавиши), 3 премьеры
L2021-07-19_sharmans,01,L2021-07-19, sharmans,false,
L2021-07-19_muzhajsj,02,L2021-07-19, muzhajsj,false,
L2021-07-19_cirkachk,03,L2021-07-19, cirkachk,false,
L2021-07-19_serenada,04,L2021-07-19, serenada,false,
L2021-07-19_vjuga,05,L2021-07-19, vjuga,false,
L2021-07-19_posesche,06,L2021-07-19, posesche,false,
L2021-07-19_vbelojmg,07,L2021-07-19, vbelojmg,false,
L2021-07-19_povodyr,08,L2021-07-19, povodyr,false,
L2021-07-19_etoja,09,L2021-07-19, etoja,false,
L2021-07-19_marija,10,L2021-07-19, marija,false,
L2021-07-19_kanonov,11,L2021-07-19, kanonov,true,
L2021-07-19_chtovpred,12,L2021-07-19, chtovpred,true,
L2021-07-19_chtonam,13,L2021-07-19, chtonam,true,
L2021-07-19_eccehomo,14,L2021-07-19, eccehomo,false,
---
L2021-07-19_kibitka,15,L2021-07-19, kibitka,false,
L2021-07-19_proscha2,16,L2021-07-19, proscha2,false,
L2021-07-19_andante,17,L2021-07-19, andante,false,
L2021-07-19_eschemla,18,L2021-07-19, eschemla,false,
L2021-07-19_aerodrom,19,L2021-07-19, aerodrom,false,
L2021-07-19_vpoxodny,20,L2021-07-19, vpoxodny,false,
L2021-07-19_brodjagi,21,L2021-07-19, brodjagi,false,
L2021-07-19_trojka,22,L2021-07-19, trojka,false,
L2021-07-19_dusha,23,L2021-07-19, dusha,false,
L2021-07-19_trubach,24,L2021-07-19, trubach,false,
L2021-07-19_kolybeln,25,L2021-07-19, kolybeln,false,

17.05.2021 пн – Москва, бард-клуб "Гнездо глухаря"
L2021-05-17_dopoezda,01,L2021-05-17, dopoezda,false,
L2021-05-17_kuznechiki,02,L2021-05-17, kuznechiki,false,
L2021-05-17_sovsemne,03,L2021-05-17, sovsemne,false,
L2021-05-17_volk,04,L2021-05-17, volk,false,
L2021-05-17_itakdruz,05,L2021-05-17, itakdruz,false,
L2021-05-17_ryba,06,L2021-05-17, ryba,false,
L2021-05-17_fontanka,07,L2021-05-17, fontanka,false,
L2021-05-17_baltijsk,08,L2021-05-17, baltijsk,false,
L2021-05-17_shkolat2,09,L2021-05-17, shkolat2,false,
L2021-05-17_proschanie,10,L2021-05-17, proschanie,false,
L2021-05-17_volhonka,11,L2021-05-17, volhonka,false,
L2021-05-17_stixiopr,12,L2021-05-17, stixiopr,false,
L2021-05-17_bukvynak,13,L2021-05-17, bukvynak,false,
L2021-05-17_pamjativ,14,L2021-05-17, pamjativ,false,
---
L2021-05-17_panorama,15,L2021-05-17, panorama,false,
L2021-05-17_nezabyva,16,L2021-05-17, nezabyva,false,
L2021-05-17_udachny,17,L2021-05-17, udachny,false,
L2021-05-17_stenyusv,18,L2021-05-17, stenyusv,false,
L2021-05-17_adleucon,19,L2021-05-17, adleucon,false,
L2021-05-17_navescha,20,L2021-05-17, navescha,false,
L2021-05-17_nadvuhk,21,L2021-05-17, nadvuhk,false,
L2021-05-17_mneniche,22,L2021-05-17, mneniche,false,
L2021-05-17_totosego,23,L2021-05-17, totosego,false,
L2021-05-17_sharmans,24,L2021-05-17, sharmans,false,
L2021-05-17_chepuxa,25,L2021-05-17, chepuxa,false,

03.04.2021 сб – Москва, бард-клуб "Гнездо глухаря", дуэт (клавиши), премьера
L2021-04-03_kibitka,01,L2021-04-03, kibitka,false,
L2021-04-03_burja,02,L2021-04-03, burja,false,
L2021-04-03_rozhdest,03,L2021-04-03, rozhdest,false,
L2021-04-03_rusalka,04,L2021-04-03, rusalka,false,
L2021-04-03_alliluja,05,L2021-04-03, alliluja,false,
L2021-04-03_marija,06,L2021-04-03, marija,false,
L2021-04-03_podzname,07,L2021-04-03, podzname,false,
L2021-04-03_lunnaja,08,L2021-04-03, lunnaja,false,
L2021-04-03_teplyj,09,L2021-04-03, teplyj,false,
L2021-04-03_tirbayard,10,L2021-04-03, tirbayard,false,
L2021-04-03_switzerl,11,L2021-04-03, switzerl,false,
L2021-04-03_vpoxodny,12,L2021-04-03, vpoxodny,false,
L2021-04-03_brodjagi,13,L2021-04-03, brodjagi,false,
L2021-04-03_sentenci,14,L2021-04-03, sentenci,false,
---
L2021-04-03_sharmans,15,L2021-04-03, sharmans,false,
L2021-04-03_izpepla,16,L2021-04-03, izpepla,false,
L2021-04-03_zaliv,17,L2021-04-03, zaliv,false,
L2021-04-03_kogdaby,18,L2021-04-03, (М. Стародубцев) kogdaby,false,
L2021-04-03_solidnys,19,L2021-04-03, solidnys,true,
L2021-04-03_voslavug,20,L2021-04-03, voslavug,false,
L2021-04-03_muzhajsj,21,L2021-04-03, muzhajsj,false,
L2021-04-03_okean,22,L2021-04-03, okean,false,
L2021-04-03_shkolat1,23,L2021-04-03, shkolat1,false,
L2021-04-03_opyattor,24,L2021-04-03, opyattor,false,
L2021-04-03_descensu,25,L2021-04-03, descensu,false,
L2021-04-03_dusha,26,L2021-04-03, dusha,false,
L2021-04-03_kolybeln,27,L2021-04-03, kolybeln,false,

13.03.2021 сб – Москва, бард-клуб "Гнездо глухаря" (малый зал), премьера
L2021-03-13_deja,01,L2021-03-13, deja,false,
L2021-03-13_dopoezda,02,L2021-03-13, dopoezda,false,
L2021-03-13_krasnye,03,L2021-03-13, krasnye,false,
L2021-03-13_kuznechiki,04,L2021-03-13, kuznechiki,false,
L2021-03-13_1995,05,L2021-03-13, 1995,false,
L2021-03-13_drugoe,06,L2021-03-13, drugoe,false,
L2021-03-13_moekoro3,07,L2021-03-13, moekoro3,false,
L2021-03-13_kalejdos,08,L2021-03-13, kalejdos,false,
L2021-03-13_nezabyva,09,L2021-03-13, nezabyva,false,
L2021-03-13_stixiopr,10,L2021-03-13, stixiopr,false,
L2021-03-13_zastolnaya,11,L2021-03-13, zastolnaya,false,
L2021-03-13_romansma,12,L2021-03-13, romansma,false,
L2021-03-13_kadril,13,L2021-03-13, kadril,false,
L2021-03-13_itakvope,14,L2021-03-13, itakvope,true,
L2021-03-13_piter,15,L2021-03-13, piter,false,
---
L2021-03-13_adleucon,16,L2021-03-13, adleucon,false,
L2021-03-13_voslavug,17,L2021-03-13, voslavug,false,
L2021-03-13_prosba,18,L2021-03-13, prosba,false,
L2021-03-13_kogdakaz,19,L2021-03-13, kogdakaz,false,
L2021-03-13_traviata,20,L2021-03-13, traviata,false,
L2021-03-13_baltijsk,21,L2021-03-13, baltijsk,false,
L2021-03-13_ryba,22,L2021-03-13, ryba,false,
L2021-03-13_zaklinan,23,L2021-03-13, zaklinan,false,
L2021-03-13_esli,24,L2021-03-13, esli,false,
L2021-03-13_mneniche,25,L2021-03-13, mneniche,false,
L2021-03-13_alliluja,26,L2021-03-13, alliluja,false,
L2021-03-13_sharmans,27,L2021-03-13, sharmans,false,
L2021-03-13_trubach,28,L2021-03-13, trubach,false,

26.02.2021 пн – Красногорск, домашний концерт у А. Гавриленко
L2021-02-26_dopoezda,01,L2021-02-26, dopoezda,false,
L2021-02-26_udachny,02,L2021-02-26, udachny,false,
L2021-02-26_kuznechiki,03,L2021-02-26, kuznechiki,false,
L2021-02-26_1995,04,L2021-02-26, 1995,false,
L2021-02-26_poslexol,05,L2021-02-26, poslexol,false,
L2021-02-26_sustavy,06,L2021-02-26, sustavy,false,
L2021-02-26_moekoro3,07,L2021-02-26, moekoro3,false,
L2021-02-26_kordebal,08,L2021-02-26, kordebal,false,
L2021-02-26_nezabyva,09,L2021-02-26, nezabyva,false,
L2021-02-26_stixiopr,10,L2021-02-26, stixiopr,false,
L2021-02-26_voslavug,12,L2021-02-26, voslavug,false,
L2021-02-26_fontanka,11,L2021-02-26, fontanka,false,
L2021-02-26_deja,13,L2021-02-26, deja,false,
L2021-02-26_sharmans,14,L2021-02-26, sharmans,false,
L2021-02-26_adleucon,15,L2021-02-26, adleucon,false,
L2021-02-26_pamjativ,16,L2021-02-26, pamjativ,false,
L2021-02-26_ryba,17,L2021-02-26, ryba,false,
L2021-02-26_shkolat2,18,L2021-02-26, shkolat2,false,
L2021-02-26_traviata,19,L2021-02-26, traviata,false,
L2021-02-26_baltijsk,20,L2021-02-26, baltijsk,false,
L2021-02-26_volhonka,21,L2021-02-26, volhonka,false,
L2021-02-26_stenyusv,22,L2021-02-26, stenyusv,false,
L2021-02-26_prenebre,23,L2021-02-26, prenebre,false,
L2021-02-26_prosba,24,L2021-02-26, prosba,false,
L2021-02-26_mneniche,25,L2021-02-26, mneniche,false,
L2021-02-26_alliluja,26,L2021-02-26, alliluja,false,
L2021-02-26_chepuxa,27,L2021-02-26, chepuxa,false,
L2021-02-26_nerazmen,28,L2021-02-26, nerazmen,false,
L2021-02-26_trubach,29,L2021-02-26, trubach,false,

08.02.2021 пн – Москва, бард-клуб "Гнездо глухаря", премьера, текст
L2021-02-08_udachny,01,L2021-02-08, udachny,false,
L2021-02-08_gdetytep,02,L2021-02-08, gdetytep,false,
L2021-02-08_okolotok,03,L2021-02-08, okolotok,false,(обновлённый текст)
L2021-02-08_zaklinan,04,L2021-02-08, zaklinan,false,
L2021-02-08_neuzheli,05,L2021-02-08, neuzheli,false,
L2021-02-08_chepuxa,06,L2021-02-08, chepuxa,false,
L2021-02-08_nezabyva,07,L2021-02-08, nezabyva,false,
L2021-02-08_kuspehuv,08,L2021-02-08, kuspehuv,true,
L2021-02-08_dopoezda,09,L2021-02-08, dopoezda,false,
L2021-02-08_suhumi,10,L2021-02-08, suhumi,false,
L2021-02-08_propadu,11,L2021-02-08, propadu,false,
L2021-02-08_voslavug,12,L2021-02-08, voslavug,false,
L2021-02-08_deja,13,L2021-02-08, deja,false,
L2021-02-08_sharmans,14,L2021-02-08, sharmans,false,
---
L2021-02-08_vrjadli,15,L2021-02-08, vrjadli,false,
L2021-02-08_shkolat2,16,L2021-02-08, shkolat2,false,
L2021-02-08_pamjativ,17,L2021-02-08, pamjativ,false,
L2021-02-08_zanaves,18,L2021-02-08, zanaves,false,
L2021-02-08_temapoleta,19,L2021-02-08, temapoleta,false,
L2021-02-08_stixiopr,20,L2021-02-08, stixiopr,false,
L2021-02-08_volhonka,21,L2021-02-08, volhonka,false,
L2021-02-08_alliluja,22,L2021-02-08, alliluja,false,
L2021-02-08_mneniche,23,L2021-02-08, mneniche,false,
L2021-02-08_esli,24,L2021-02-08, esli,false,
L2021-02-08_pesenkao,25,L2021-02-08, pesenkao,false,
L2021-02-08_korablik,26,L2021-02-08, korablik,false,

09.11.2020 пн – Москва, бард-клуб "Гнездо глухаря", дуэт (гитара), премьера
L2020-11-09_navsejz1,01,L2020-11-09, navsejz1,false,
L2020-11-09_adleucon,02,L2020-11-09, adleucon,false,
L2020-11-09_vrjadli,03,L2020-11-09, vrjadli,false,
L2020-11-09_romans1,04,L2020-11-09, romans1,false,
L2020-11-09_kovcheg,05,L2020-11-09, kovcheg,false,
L2020-11-09_bereg,06,L2020-11-09, bereg,false,
L2020-11-09_vekaplyv,07,L2020-11-09, vekaplyv,false,
L2020-11-09_marija,08,L2020-11-09, marija,false,
L2020-11-09_paris,09,L2020-11-09, paris,false,
L2020-11-09_opyatpar,10,L2020-11-09, opyatpar,false,
L2020-11-09_aneta,11,L2020-11-09, aneta,false,
L2020-11-09_kolodec,12,L2020-11-09, kolodec,true,
L2020-11-09_okrainy,13*,L2020-11-09, okrainy,false,
L2020-11-09_ljubov,14,L2020-11-09, ljubov,false,
L2020-11-09_romansma,15,L2020-11-09, romansma,false,
L2020-11-09_svidanie,16,L2020-11-09, svidanie,false,
L2020-11-09_farmacev,17,L2020-11-09, farmacev,false,
---
L2020-11-09_sezondoz,18,L2020-11-09, sezondoz,false,
L2020-11-09_nenadoby,19,L2020-11-09, nenadoby,false,
L2020-11-09_konecned,20,L2020-11-09, konecned,false,
L2020-11-09_proschan,21,L2020-11-09, proschan,false,
L2020-11-09_karavan,22,L2020-11-09, karavan,false,
L2020-11-09_puskaj,23,L2020-11-09, puskaj,false,
L2020-11-09_kchemuis,24,L2020-11-09, kchemuis,false,
L2020-11-09_korablik,25,L2020-11-09, korablik,false,
L2020-11-09_vtornik,26,L2020-11-09, vtornik,false,
L2020-11-09_vosxodja,27,L2020-11-09, vosxodja,false,

21.09.2020 пн – Москва, бард-клуб "Гнездо глухаря", текст
L2020-09-21_ryba,01,L2020-09-21, ryba,false,
L2020-09-21_panorama,02,L2020-09-21, panorama,false,
L2020-09-21_1992,03,L2020-09-21, 1992,false,
L2020-09-21_volhonka,04,L2020-09-21, volhonka,false,
L2020-09-21_godshel,05,L2020-09-21, godshel,false,
L2020-09-21_vpoxodny,06,L2020-09-21, vpoxodny,false,
L2020-09-21_fontanka,07,L2020-09-21, fontanka,false,
L2020-09-21_proschanie,08,L2020-09-21, proschanie,false,
L2020-09-21_dopoezda,09,L2020-09-21, dopoezda,false,
L2020-09-21_baltijsk,10,L2020-09-21, baltijsk,false,
L2020-09-21_navescha,11,L2020-09-21, navescha,false,
L2020-09-21_bukvynak,12,L2020-09-21, bukvynak,false,
L2020-09-21_pamjativ,13,L2020-09-21, pamjativ,false,
L2020-09-21_chepuxa,14,L2020-09-21, chepuxa,false,
---
L2020-09-21_mneniche,15,L2020-09-21, mneniche,false,
L2020-09-21_totosego,16,L2020-09-21, totosego,false,
L2020-09-21_etiglaza,17,L2020-09-21, etiglaza,false,
L2020-09-21_temapoleta,18,L2020-09-21, temapoleta,false,
L2020-09-21_voslavug,19,L2020-09-21, voslavug,false,
L2020-09-21_chteniem,20,L2020-09-21, chteniem,false,(обновлённый текст)
L2020-09-21_esli,21,L2020-09-21, esli,false,
L2020-09-21_shkolat2,22,L2020-09-21, shkolat2,false,
L2020-09-21_sharmans,23,L2020-09-21, sharmans,false,
L2020-09-21_zaklinan,24,L2020-09-21, zaklinan,false,
L2020-09-21_trubach,25,L2020-09-21, trubach,false,

12.09.2020 сб – Москва, бард-клуб "Гнездо глухаря" (малый зал), 3 премьеры
L2020-09-12_kuznechiki,01,L2020-09-12, kuznechiki,false,
L2020-09-12_udachny,02,L2020-09-12, udachny,false,
L2020-09-12_ryba,03,L2020-09-12, ryba,false,
L2020-09-12_zanaves,04,L2020-09-12, zanaves,true,
L2020-09-12_okolotok,05,L2020-09-12, okolotok,true,
L2020-09-12_kalejdos,06,L2020-09-12, kalejdos,false,
L2020-09-12_duet,07,L2020-09-12, duet,false,
L2020-09-12_vpoxodny,08,L2020-09-12, vpoxodny,false,
L2020-09-12_dopoezda,09,L2020-09-12, dopoezda,false,
L2020-09-12_fontanka,10,L2020-09-12, fontanka,false,
L2020-09-12_nezabyva,11,L2020-09-12, nezabyva,false,
L2020-09-12_krasnye,12,L2020-09-12, krasnye,false,
L2020-09-12_drugoe,13,L2020-09-12, drugoe,false,
L2020-09-12_totosego,14,L2020-09-12, totosego,false,
---
L2020-09-12_volhonka,15,L2020-09-12, volhonka,false,
L2020-09-12_podzname,16,L2020-09-12, podzname,false,
L2020-09-12_stixiopr,17,L2020-09-12, stixiopr,false,
L2020-09-12_deja,18,L2020-09-12, deja,false,
L2020-09-12_temapoleta,19,L2020-09-12, temapoleta,false,
L2020-09-12_chteniem,20,L2020-09-12, chteniem,true,
L2020-09-12_voslavug,21,L2020-09-12, voslavug,false,
L2020-09-12_mneniche,22,L2020-09-12, mneniche,false,
L2020-09-12_esli,23,L2020-09-12, esli,false,
L2020-09-12_alliluja,24,L2020-09-12, alliluja,false,
L2020-09-12_baltijsk,25,L2020-09-12, baltijsk,false,
L2020-09-12_shkolat2,26,L2020-09-12, shkolat2,false,
L2020-09-12_sharmans,27,L2020-09-12, sharmans,false,
L2020-09-12_trubach,28,L2020-09-12, trubach,false,

10.03.2020 вт – Москва, бард-клуб "Гнездо глухаря"
L2020-03-10_kuznechiki,01,L2020-03-10, kuznechiki,false,
L2020-03-10_alliluja,02,L2020-03-10, alliluja,false,
L2020-03-10_kalejdos,03,L2020-03-10, kalejdos,false,
L2020-03-10_adleucon,04,L2020-03-10, adleucon,false,
L2020-03-10_esli,05,L2020-03-10, esli,false,
L2020-03-10_uzhenera,06,L2020-03-10, uzhenera,false,
L2020-03-10_volhonka,07,L2020-03-10, volhonka,false,
L2020-03-10_brodjagi,08,L2020-03-10, brodjagi,false,
L2020-03-10_izpepla,09,L2020-03-10, izpepla,false,
L2020-03-10_vpoxodny,10,L2020-03-10, vpoxodny,false,
L2020-03-10_fontanka,11,L2020-03-10, fontanka,false,
L2020-03-10_stixiopr,12,L2020-03-10, stixiopr,false,
L2020-03-10_sharmans,13,L2020-03-10, sharmans,false,
L2020-03-10_piter,14,L2020-03-10, piter,false,
L2020-03-10_zastolnaya,15,L2020-03-10, zastolnaya,false,
---
L2020-03-10_podzname,16,L2020-03-10, podzname,false,
L2020-03-10_nadvuhk,17,L2020-03-10, nadvuhk,false,
L2020-03-10_navescha,18,L2020-03-10, navescha,false,
L2020-03-10_sovsemne,19,L2020-03-10, sovsemne,false,
L2020-03-10_duet,20,L2020-03-10, duet,false,
L2020-03-10_deja,21,L2020-03-10, deja,false,
L2020-03-10_kogdakaz,22,L2020-03-10, kogdakaz,false,
L2020-03-10_voslavug,23,L2020-03-10, voslavug,false,
L2020-03-10_shkolat2,24,L2020-03-10, shkolat2,false,
L2020-03-10_kudanena,25,L2020-03-10, kudanena,false,
L2020-03-10_totosego,26,L2020-03-10, totosego,false,
L2020-03-10_trubach,27,L2020-03-10, trubach,false,

16.02.2020 вс – Москва, клуб-ресторан "Сан-Диего"
L2020-02-16_ryba,01,L2020-02-16, ryba,false,
L2020-02-16_adleucon,02,L2020-02-16, adleucon,false,
L2020-02-16_panorama,03,L2020-02-16, panorama,false,
L2020-02-16_mneniche,04,L2020-02-16, mneniche,false,
L2020-02-16_esli,05,L2020-02-16, esli,false,
L2020-02-16_volhonka,06,L2020-02-16, volhonka,false,
L2020-02-16_kalejdos,07,L2020-02-16, kalejdos,false,
L2020-02-16_nezabyva,08,L2020-02-16, nezabyva,false,
L2020-02-16_neuzheli,09,L2020-02-16, neuzheli,false,
L2020-02-16_alliluja,10,L2020-02-16, alliluja,false,
L2020-02-16_vpoxodny,11,L2020-02-16, vpoxodny,false,
L2020-02-16_kuznechiki,12,L2020-02-16, kuznechiki,false,
L2020-02-16_razvecht,13,L2020-02-16, razvecht,false,
L2020-02-16_duet,14,L2020-02-16, duet,false,
L2020-02-16_shkolat2,15,L2020-02-16, shkolat2,false,
L2020-02-16_sharmans,16,L2020-02-16, sharmans,false,
L2020-02-16_zaklinan,17,L2020-02-16, zaklinan,false,
L2020-02-16_dopoezda,18,L2020-02-16, dopoezda,false,
L2020-02-16_deja,19,L2020-02-16, deja,false,
L2020-02-16_totosego,20,L2020-02-16, totosego,false,
L2020-02-16_nadvuhk,21,L2020-02-16, nadvuhk,false,
L2020-02-16_baltijsk,22,L2020-02-16, baltijsk,false,
L2020-02-16_krasnye,23,L2020-02-16, krasnye,false,
L2020-02-16_voslavug,24,L2020-02-16, voslavug,false,
L2020-02-16_pamjativ,25,L2020-02-16, pamjativ,false,
L2020-02-16_chepuxa,26,L2020-02-16, chepuxa,false,
L2020-02-16_nerazmen,27,L2020-02-16, nerazmen,false,
L2020-02-16_trubach,28,L2020-02-16, trubach,false,

09.01.2020 чт – Москва, бард-клуб "Гнездо глухаря"
L2020-01-09_istorija,01,L2020-01-09, istorija,false,
L2020-01-09_propadu,02,L2020-01-09, propadu,false,
L2020-01-09_volhonka,03,L2020-01-09, volhonka,false,
L2020-01-09_kalejdos,04,L2020-01-09, kalejdos,false,
L2020-01-09_nezabyva,05,L2020-01-09, nezabyva,false,
L2020-01-09_etiglaza,06,L2020-01-09, etiglaza,false,
L2020-01-09_vpoxodny,07,L2020-01-09, vpoxodny,false,
L2020-01-09_ochnulsj,08,L2020-01-09, ochnulsj,false,
L2020-01-09_kuznechiki,09,L2020-01-09, kuznechiki,false,
L2020-01-09_duet,10,L2020-01-09, duet,false,
L2020-01-09_bukvynak,11,L2020-01-09, bukvynak,false,
L2020-01-09_shkolat2,12,L2020-01-09, shkolat2,false,
---
L2020-01-09_ryba,13,L2020-01-09, ryba,false,
L2020-01-09_dopoezda,14,L2020-01-09, dopoezda,false,
L2020-01-09_zaklinan,15,L2020-01-09, zaklinan,false,
L2020-01-09_sharmans,16,L2020-01-09, sharmans,false,
L2020-01-09_netlubez,17,L2020-01-09, netlubez,false,
L2020-01-09_voslavug,18,L2020-01-09, voslavug,false,
L2020-01-09_nebyvaet,19,L2020-01-09, nebyvaet,false,
L2020-01-09_pamjativ,20,L2020-01-09, pamjativ,false,
L2020-01-09_chepuxa,21,L2020-01-09, chepuxa,false,
L2020-01-09_nerazmen,22,L2020-01-09, nerazmen,false,

02.12.2019 пн – Москва, бард-клуб "Гнездо глухаря"
L2019-12-02_mneniche,01,L2019-12-02, mneniche,false,
L2019-12-02_krasnye,02,L2019-12-02, krasnye,false,
L2019-12-02_voslavug,03,L2019-12-02, voslavug,false,
L2019-12-02_baltijsk,04,L2019-12-02, baltijsk,false,
L2019-12-02_izpepla,05,L2019-12-02, izpepla,false,
L2019-12-02_kogdakaz,06,L2019-12-02, kogdakaz,false,
L2019-12-02_dopoezda,07,L2019-12-02, dopoezda,false,
L2019-12-02_suhumi,08,L2019-12-02, suhumi,false,
L2019-12-02_zaliv,09,L2019-12-02, zaliv,false,
L2019-12-02_drugoe,10,L2019-12-02, drugoe,false,
L2019-12-02_desyatpe,11,L2019-12-02, desyatpe,false,
L2019-12-02_volk,12,L2019-12-02, volk,false,
L2019-12-02_godshel,13,L2019-12-02, godshel,false,
L2019-12-02_ubykagol,14,L2019-12-02, ubykagol,false,
L2019-12-02_totosego,15,L2019-12-02, totosego,false,
---
L2019-12-02_pesenkao,16,L2019-12-02, pesenkao,false,
L2019-12-02_sharmans,17,L2019-12-02, sharmans,false,
L2019-12-02_pamjativ,18,L2019-12-02, pamjativ,false,
L2019-12-02_zaklinan,19,L2019-12-02, zaklinan,false,
L2019-12-02_shkolat2,20,L2019-12-02, shkolat2,false,
L2019-12-02_stenyusv,21,L2019-12-02, stenyusv,false,
L2019-12-02_avstrali,22,L2019-12-02, avstrali,false,
L2019-12-02_chepuxa,23,L2019-12-02, chepuxa,false,
L2019-12-02_nerazmen,24,L2019-12-02, nerazmen,false,
L2019-12-02_trubach,25,L2019-12-02, trubach,false,

16.10.2019 ср – США, Fair Lawn, NJ
L2019-10-16_kordebal,01,L2019-10-16, kordebal,false,
L2019-10-16_ryba,02,L2019-10-16, ryba,false,
L2019-10-16_zaliv,03,L2019-10-16, zaliv,false,
L2019-10-16_kalejdos,04,L2019-10-16, kalejdos,false,
L2019-10-16_dopoezda,05,L2019-10-16, dopoezda,false,
L2019-10-16_suhumi,06,L2019-10-16, suhumi,false,
L2019-10-16_fridrih,07,L2019-10-16, fridrih,false,
L2019-10-16_zaklinan,08,L2019-10-16, zaklinan,false,
L2019-10-16_nazimnej,09,L2019-10-16, nazimnej,false,
L2019-10-16_sovsemne,10,L2019-10-16, sovsemne,false,
L2019-10-16_volk,11,L2019-10-16, volk,false,
L2019-10-16_kogdakaz,12,L2019-10-16, kogdakaz,false,
L2019-10-16_izpepla,13,L2019-10-16, izpepla,false,
L2019-10-16_baltijsk,14,L2019-10-16, baltijsk,false,
L2019-10-16_totosego,15,L2019-10-16, totosego,false,
L2019-10-16_stenyusv,16,L2019-10-16, stenyusv,false,
L2019-10-16_peterbur,17,L2019-10-16, peterbur,false,
L2019-10-16_navescha,18,L2019-10-16, navescha,false,
L2019-10-16_shkolat2,19,L2019-10-16, shkolat2,false,
L2019-10-16_pamjativ,20,L2019-10-16, pamjativ,false,
L2019-10-16_sharmans,21,L2019-10-16, sharmans,false,
L2019-10-16_chepuxa,22,L2019-10-16, chepuxa,false,
L2019-10-16_voslavug,23,L2019-10-16, voslavug,false,
L2019-10-16_trubach,24,L2019-10-16, trubach,false,
L2019-10-16_pesenkao,25,L2019-10-16, pesenkao,false,

07.10.2019 пн – Москва, бард-клуб "Гнездо глухаря"
L2019-10-07_kordebal,01,L2019-10-07, kordebal,false,
L2019-10-07_ryba,02,L2019-10-07, ryba,false,
L2019-10-07_zaliv,03,L2019-10-07, zaliv,false,
L2019-10-07_kalejdos,04,L2019-10-07, kalejdos,false,
L2019-10-07_kogdaned,05,L2019-10-07, kogdaned,false,
L2019-10-07_proschanie,06,L2019-10-07, proschanie,false,
L2019-10-07_dopoezda,07,L2019-10-07, dopoezda,false,
L2019-10-07_suhumi,08,L2019-10-07, suhumi,false,
L2019-10-07_fridrih,09,L2019-10-07, fridrih,false,
L2019-10-07_volk,10,L2019-10-07, volk,false,
L2019-10-07_kogdakaz,11,L2019-10-07, kogdakaz,false,
L2019-10-07_izpepla,12,L2019-10-07, izpepla,false,
L2019-10-07_baltijsk,13,L2019-10-07, baltijsk,false,
L2019-10-07_totosego,14,L2019-10-07, totosego,false,
---
L2019-10-07_1992,15,L2019-10-07, 1992,false,
L2019-10-07_nadpis,16,L2019-10-07, nadpis,false,
L2019-10-07_sovsemne,17,L2019-10-07, sovsemne,false,
L2019-10-07_peterbur,18,L2019-10-07, peterbur,false,
L2019-10-07_stenyusv,19,L2019-10-07, stenyusv,false,
L2019-10-07_navescha,20,L2019-10-07, navescha,false,
L2019-10-07_zaklinan,21,L2019-10-07, zaklinan,false,
L2019-10-07_voslavug,22,L2019-10-07, voslavug,false,
L2019-10-07_pamjativ,23,L2019-10-07, pamjativ,false,
L2019-10-07_sharmans,24,L2019-10-07, sharmans,false,
L2019-10-07_chepuxa,25,L2019-10-07, chepuxa,false,
L2019-10-07_trubach,26,L2019-10-07, trubach,false,

24.09.2019 вт – Москва, офис СТД, 4 премьеры
L2019-09-24_samsebe,01,L2019-09-24, samsebe,false,
L2019-09-24_godshel,02,L2019-09-24, godshel,false,
L2019-09-24_razvecht,03,L2019-09-24, razvecht,false,
L2019-09-24_stenyusv,04,L2019-09-24, stenyusv,false,
L2019-09-24_kogdakaz,05,L2019-09-24, kogdakaz,true,
L2019-09-24_nazimnej,06,L2019-09-24, nazimnej,false,
L2019-09-24_baltijsk,07,L2019-09-24, baltijsk,false,
L2019-09-24_bystrov2,08,L2019-09-24, bystrov2,false,
L2019-09-24_sovsemne,09,L2019-09-24, sovsemne,false,
L2019-09-24_brodjagi,10,L2019-09-24, brodjagi,false,
L2019-09-24_vsetvoic,11,L2019-09-24, vsetvoic,false,
L2019-09-24_izpepla,12,L2019-09-24, izpepla,true,
L2019-09-24_pamjativ,13,L2019-09-24, pamjativ,false,
L2019-09-24_propalpr,14,L2019-09-24, propalpr,true,
L2019-09-24_sharmans,15,L2019-09-24, sharmans,false,
L2019-09-24_kudanena,16,L2019-09-24, kudanena,true,
L2019-09-24_chepuxa,17,L2019-09-24, chepuxa,false,
L2019-09-24_voslavug,18,L2019-09-24, voslavug,false,
L2019-09-24_totosego,19,L2019-09-24, totosego,false,

19.08.2019 пн – Москва, бард-клуб "Гнездо глухаря"
L2019-08-19_ryba,01,L2019-08-19, ryba,false,
L2019-08-19_nadeyus,02,L2019-08-19, nadeyus,false,
L2019-08-19_pesenkao,03,L2019-08-19, pesenkao,false,
L2019-08-19_temapoleta,04,L2019-08-19, temapoleta,false,
L2019-08-19_adleucon,05,L2019-08-19, adleucon,false,
L2019-08-19_neuzheli,06,L2019-08-19, neuzheli,false,
L2019-08-19_nezabyva,07,L2019-08-19, nezabyva,false,
L2019-08-19_suhumi,08,L2019-08-19, suhumi,false,
L2019-08-19_dopoezda,09,L2019-08-19, dopoezda,false,
L2019-08-19_nazimnej,10,L2019-08-19, nazimnej,false,
L2019-08-19_stenyusv,11,L2019-08-19, stenyusv,false,
L2019-08-19_shkolat2,12,L2019-08-19, shkolat2,false,
L2019-08-19_volhonka,13,L2019-08-19, volhonka,false,
---
L2019-08-19_kuznechiki,14,L2019-08-19, kuznechiki,false,
L2019-08-19_duet,15,L2019-08-19, duet,false,
L2019-08-19_mneniche,16,L2019-08-19, mneniche,false,
L2019-08-19_totosego,17,L2019-08-19, totosego,false,
L2019-08-19_razvecht,18,L2019-08-19, razvecht,false,
L2019-08-19_podzname,19,L2019-08-19, podzname,false,
L2019-08-19_nadvuhk,20,L2019-08-19, nadvuhk,false,
L2019-08-19_voslavug,21,L2019-08-19, voslavug,false,
L2019-08-19_pamjativ,22,L2019-08-19, pamjativ,false,
L2019-08-19_bukvynak,23,L2019-08-19, bukvynak,false,
L2019-08-19_sharmans,24,L2019-08-19, sharmans,false,
L2019-08-19_trubach,25,L2019-08-19, trubach,false,

24.06.2019 пн – Москва, бард-клуб "Гнездо глухаря"
L2019-06-24_nadeyus,01,L2019-06-24, nadeyus,false,
L2019-06-24_pesenkao,02,L2019-06-24, pesenkao,false,
L2019-06-24_temapoleta,03,L2019-06-24, temapoleta,false,
L2019-06-24_kalejdos,04,L2019-06-24, kalejdos,false,
L2019-06-24_traviata,05,L2019-06-24, traviata,false,
L2019-06-24_duet,06,L2019-06-24, duet,false,
L2019-06-24_netlubez,07,L2019-06-24, netlubez,false,
L2019-06-24_fontanka,08,L2019-06-24, fontanka,false,
L2019-06-24_proschanie,09,L2019-06-24, proschanie,false,
L2019-06-24_adleucon,10,L2019-06-24, adleucon,false,
L2019-06-24_vsetvoic,11,L2019-06-24, vsetvoic,false,
L2019-06-24_navescha,12,L2019-06-24, navescha,false,
L2019-06-24_neuzheli,13,L2019-06-24, neuzheli,false,
---
L2019-06-24_cirkachk,14,L2019-06-24, cirkachk,false,
L2019-06-24_tirbayard,15,L2019-06-24, tirbayard,false,
L2019-06-24_voslavug,16,L2019-06-24, voslavug,false,
L2019-06-24_eastcoast,17,L2019-06-24, eastcoast,false,
L2019-06-24_baltijsk,18,L2019-06-24, baltijsk,false,
L2019-06-24_stenyusv,19,L2019-06-24, stenyusv,false,
L2019-06-24_podzname,20,L2019-06-24, podzname,false,
L2019-06-24_razvecht,21,L2019-06-24, razvecht,false,
L2019-06-24_sharmans,22,L2019-06-24, sharmans,false,
L2019-06-24_nadvuhk,23,L2019-06-24, nadvuhk,false,
L2019-06-24_totosego,24,L2019-06-24, totosego,false,

08.06.2019 сб – Москва, кафе "Ex:Libris"
L2019-06-08_dopoezda,01,L2019-06-08, dopoezda,false,
L2019-06-08_instrukc,02,L2019-06-08, instrukc,false,
L2019-06-08_drugoe,03,L2019-06-08, drugoe,false,
L2019-06-08_dendensk,04,L2019-06-08, dendensk,false,
L2019-06-08_nadvuhk,05,L2019-06-08, nadvuhk,false,
L2019-06-08_baltijsk,06,L2019-06-08, baltijsk,false,
L2019-06-08_panorama,07,L2019-06-08, panorama,false,
L2019-06-08_razvecht,08,L2019-06-08, razvecht,false,
L2019-06-08_chuzhaj2,09,L2019-06-08, chuzhaj2,false,
L2019-06-08_suhumi,10,L2019-06-08, suhumi,false,
L2019-06-08_chuzhaj1,11,L2019-06-08, chuzhaj1,false,
L2019-06-08_volhonka,12,L2019-06-08, volhonka,false,
L2019-06-08_sovsemne,13,L2019-06-08, sovsemne,false,
L2019-06-08_krasnye,14,L2019-06-08, krasnye,false,
L2019-06-08_desyatpe,15,L2019-06-08, desyatpe,false,
L2019-06-08_voslavug,16,L2019-06-08, voslavug,false,
L2019-06-08_totosego,17,L2019-06-08, totosego,false,
L2019-06-08_mneniche,18,L2019-06-08, mneniche,false,
L2019-06-08_prosba,19,L2019-06-08, prosba,false,
L2019-06-08_ryba,20,L2019-06-08, ryba,false,
L2019-06-08_pamjativ,21,L2019-06-08, pamjativ,false,
L2019-06-08_bukvynak,22,L2019-06-08, bukvynak,false,
L2019-06-08_avstrali,23,L2019-06-08, avstrali,false,

01.06.2019 сб – Таллинн, Таллиннский университет
L2019-06-01_unknown,01,L2019-06-01, unknown,false,
L2019-06-01_udachny,02,L2019-06-01, udachny,false,
L2019-06-01_ryba,03,L2019-06-01, ryba,false,
L2019-06-01_nezabyva,04,L2019-06-01, nezabyva,false,
L2019-06-01_nadvuhk,05,L2019-06-01, nadvuhk,false,
L2019-06-01_panorama,06,L2019-06-01, panorama,false,
L2019-06-01_1995,07,L2019-06-01, 1995,false,
L2019-06-01_sovsemne,08,L2019-06-01, sovsemne,false,
L2019-06-01_dopoezda,09,L2019-06-01, dopoezda,false,
L2019-06-01_suhumi,10,L2019-06-01, suhumi,false,
L2019-06-01_dendensk,11,L2019-06-01, dendensk,false,
L2019-06-01_neuzheli,12,L2019-06-01, neuzheli,false,
L2019-06-01_totosego,13,L2019-06-01, totosego,false,
L2019-06-01_mneniche,14,L2019-06-01, mneniche,false,
L2019-06-01_baltijsk,15,L2019-06-01, baltijsk,false,
L2019-06-01_vpoxodny,16,L2019-06-01, vpoxodny,false,
L2019-06-01_desyatpe,17,L2019-06-01, desyatpe,false,
L2019-06-01_razvecht,18,L2019-06-01, razvecht,false,
L2019-06-01_pamjativ,19,L2019-06-01, pamjativ,false,
L2019-06-01_bukvynak,20,L2019-06-01, bukvynak,false,
L2019-06-01_trubach,21,L2019-06-01, trubach,false,

30.04.2019 вт – Москва, бард-клуб "Гнездо глухаря"
L2019-04-30_1992,01,L2019-04-30, 1992,false,
L2019-04-30_kordebal,02,L2019-04-30, kordebal,false,
L2019-04-30_ryba,03,L2019-04-30, ryba,false,
L2019-04-30_ballada,04,L2019-04-30, ballada,false,
L2019-04-30_baltijsk,05,L2019-04-30, baltijsk,false,
L2019-04-30_zvezdoch,06,L2019-04-30, zvezdoch,false,
L2019-04-30_nezabyva,07,L2019-04-30, nezabyva,false,
L2019-04-30_totosego,08,L2019-04-30, totosego,false,
L2019-04-30_drugoe,09,L2019-04-30, drugoe,false,
L2019-04-30_propadu,10,L2019-04-30, propadu,false,
L2019-04-30_kogdaned,11,L2019-04-30, kogdaned,false,
L2019-04-30_vsetvoic,12,L2019-04-30, vsetvoic,false,
L2019-04-30_nadpis,13,L2019-04-30, nadpis,false,
L2019-04-30_voslavug,14,L2019-04-30, voslavug,false,
---
L2019-04-30_zaklinan,15,L2019-04-30, zaklinan,false,
L2019-04-30_krasnye,16,L2019-04-30, krasnye,false,
L2019-04-30_neznajuk,17,L2019-04-30, neznajuk,false,
L2019-04-30_nadvuhk,18,L2019-04-30, nadvuhk,false,
L2019-04-30_stenyusv,19,L2019-04-30, stenyusv,false,
L2019-04-30_razvecht,20,L2019-04-30, razvecht,false,
L2019-04-30_sharmans,21,L2019-04-30, sharmans,false,
L2019-04-30_pamjativ,22,L2019-04-30, pamjativ,false,
L2019-04-30_neuzheli,23,L2019-04-30, neuzheli,false,
L2019-04-30_chepuxa,24,L2019-04-30, chepuxa,false,
L2019-04-30_nerazmen,25,L2019-04-30, nerazmen,false,

06.04.2019 сб – Германия, Карлсруэ, Evangelische Studierendengemeinde
L2019-04-06_nadeyus,01,L2019-04-06, nadeyus,false,
L2019-04-06_panorama,02,L2019-04-06, panorama,false,
L2019-04-06_duet,03,L2019-04-06, duet,false,
L2019-04-06_zvezdoch,04,L2019-04-06, zvezdoch,false,
L2019-04-06_udachny,05,L2019-04-06, udachny,false,
L2019-04-06_netlubez,06,L2019-04-06, netlubez,false,
L2019-04-06_nezabyva,07,L2019-04-06, nezabyva,false,
L2019-04-06_totosego,08,L2019-04-06, totosego,false,
L2019-04-06_drugoe,09,L2019-04-06, drugoe,false,
L2019-04-06_propadu,10,L2019-04-06, propadu,false,
L2019-04-06_nadvuhk,11,L2019-04-06, nadvuhk,false,
L2019-04-06_shkolat2,12,L2019-04-06, shkolat2,false,
L2019-04-06_romansma,13,L2019-04-06, romansma,false,
L2019-04-06_zastolnaya,14,L2019-04-06, zastolnaya,false,
---
L2019-04-06_baltijsk,15,L2019-04-06, baltijsk,false,
L2019-04-06_1995,16,L2019-04-06, 1995,false,
L2019-04-06_neuzheli,17,L2019-04-06, neuzheli,false,
L2019-04-06_zaklinan,18,L2019-04-06, zaklinan,false,
L2019-04-06_stenyusv,19,L2019-04-06, stenyusv,false,
L2019-04-06_kogdaned,20,L2019-04-06, kogdaned,false,
L2019-04-06_razvecht,21,L2019-04-06, razvecht,false,
L2019-04-06_chuzhaj2,22,L2019-04-06, chuzhaj2,false,
L2019-04-06_sharmans,23,L2019-04-06, sharmans,false,
L2019-04-06_pamjativ,24,L2019-04-06, pamjativ,false,
L2019-04-06_bukvynak,25,L2019-04-06, bukvynak,false,
L2019-04-06_nerazmen,25,L2019-04-06, nerazmen,false,
L2019-04-06_trubach,26,L2019-04-06, trubach,false,

25.03.2019 пн – Москва, бард-клуб "Гнездо глухаря", дуэт (клавиши)
L2019-03-25_kibitka,01,L2019-03-25, kibitka,false,
L2019-03-25_podzname,02,L2019-03-25, podzname,false,
L2019-03-25_kalejdos,03,L2019-03-25, kalejdos,false,
L2019-03-25_marija,04,L2019-03-25, marija,false,
L2019-03-25_teplyj,05,L2019-03-25, teplyj,false,
L2019-03-25_lunnaja,06,L2019-03-25, lunnaja,false,
L2019-03-25_vpoxodny,07,L2019-03-25, vpoxodny,false,
L2019-03-25_brodjagi,08,L2019-03-25, brodjagi,false,
L2019-03-25_sentenci,09,L2019-03-25, sentenci,false,
L2019-03-25_povodyr,10,L2019-03-25, povodyr,false,
L2019-03-25_muzhajsj,11,L2019-03-25, muzhajsj,false,
L2019-03-25_okean,12,L2019-03-25, okean,false,
L2019-03-25_shkolat1,13,L2019-03-25, shkolat1,false,
L2019-03-25_nasreten,14*,L2019-03-25, nasreten,false,
L2019-03-25_veselsol,15*,L2019-03-25, veselsol,false,
L2019-03-25_zagitarn,16*,L2019-03-25, zagitarn,false,
---
L2019-03-25_burja,17,L2019-03-25, burja,false,
L2019-03-25_opyattor,18,L2019-03-25, opyattor,false,
L2019-03-25_drugajaz,19,L2019-03-25, drugajaz,false,
L2019-03-25_andante,20,L2019-03-25, andante,false,
L2019-03-25_voslavug,21,L2019-03-25, voslavug,false,
L2019-03-25_descensu,22,L2019-03-25, descensu,false,
L2019-03-25_posesche,23,L2019-03-25, posesche,false,
L2019-03-25_eccehomo,24,L2019-03-25, eccehomo,false,
L2019-03-25_zaliv,25,L2019-03-25, zaliv,false,
L2019-03-25_sharmans,26,L2019-03-25, sharmans,false,
L2019-03-25_trubach,27,L2019-03-25, trubach,false,
L2019-03-25_kolybeln,28,L2019-03-25, kolybeln,false,

23.02.2019 сб – Москва, бард-клуб "Гнездо глухаря" (малый зал)
L2019-02-23_duet,01,L2019-02-23, duet,false,
L2019-02-23_kalejdos,02,L2019-02-23, kalejdos,false,
L2019-02-23_volk,03,L2019-02-23, volk,false,
L2019-02-23_etiglaza,04,L2019-02-23, etiglaza,false,
L2019-02-23_panorama,05,L2019-02-23, panorama,false,
L2019-02-23_1992,06,L2019-02-23, 1992,false,
L2019-02-23_kinemat2,07,L2019-02-23, kinemat2,false,
L2019-02-23_propadu,08,L2019-02-23, propadu,false,
L2019-02-23_shkolat2,09,L2019-02-23, shkolat2,false,
L2019-02-23_stenyusv,10,L2019-02-23, stenyusv,false,
L2019-02-23_nadvuhk,11,L2019-02-23, nadvuhk,false,
L2019-02-23_romans2,12,L2019-02-23, romans2,false,
---
L2019-02-23_adleucon,13,L2019-02-23, adleucon,false,
L2019-02-23_ryba,14,L2019-02-23, ryba,false,
L2019-02-23_deja,15,L2019-02-23, deja,false,
L2019-02-23_chuzhaj2,16,L2019-02-23, chuzhaj2,false,
L2019-02-23_udachny,17,L2019-02-23, udachny,false,
L2019-02-23_sustavy,18,L2019-02-23, sustavy,false,
L2019-02-23_razvecht,19,L2019-02-23, razvecht,false,
L2019-02-23_nezabyva,20,L2019-02-23, nezabyva,false,
L2019-02-23_fontanka,21,L2019-02-23, fontanka,false,
L2019-02-23_sharmans,22,L2019-02-23, sharmans,false,
L2019-02-23_pamjativ,23,L2019-02-23, pamjativ,false,
L2019-02-23_chepuxa,24,L2019-02-23, chepuxa,false,
L2019-02-23_nerazmen,25,L2019-02-23, nerazmen,false,

09.02.2019 сб – Москва, кафе "Ex:Libris"
L2019-02-09_neuzheli,01,L2019-02-09, neuzheli,false,
L2019-02-09_ryba,02,L2019-02-09, ryba,false,
L2019-02-09_nadeyus,03,L2019-02-09, nadeyus,false,
L2019-02-09_panorama,04,L2019-02-09, panorama,false,
L2019-02-09_uzhesli,05,L2019-02-09, uzhesli,false,
L2019-02-09_kuznechiki,06,L2019-02-09, kuznechiki,false,
L2019-02-09_propadu,07,L2019-02-09, propadu,false,
L2019-02-09_shkolat2,08,L2019-02-09, shkolat2,false,
L2019-02-09_stenyusv,09,L2019-02-09, stenyusv,false,
L2019-02-09_nadvuhk,10,L2019-02-09, nadvuhk,false,
L2019-02-09_baltijsk,11,L2019-02-09, baltijsk,false,
L2019-02-09_adleucon,12,L2019-02-09, adleucon,false,
---
L2019-02-09_sovsemne,13,L2019-02-09, sovsemne,false,
L2019-02-09_volhonka,14,L2019-02-09, volhonka,false,
L2019-02-09_chuzhaj2,15,L2019-02-09, chuzhaj2,false,
L2019-02-09_udachny,16,L2019-02-09, udachny,false,
L2019-02-09_nezabyva,17,L2019-02-09, nezabyva,false,
L2019-02-09_razvecht,18,L2019-02-09, razvecht,false,
L2019-02-09_sustavy,19,L2019-02-09, sustavy,false,
L2019-02-09_navescha,20,L2019-02-09, navescha,false,
L2019-02-09_mneniche,21,L2019-02-09, mneniche,false,
L2019-02-09_sharmans,22,L2019-02-09, sharmans,false,
L2019-02-09_chepuxa,23,L2019-02-09, chepuxa,false,
L2019-02-09_nerazmen,24,L2019-02-09, nerazmen,false,
L2019-02-09_trubach,25,L2019-02-09, trubach,false,

09.01.2019 ср – Москва, бард-клуб "Гнездо глухаря", дуэт (гитара)
L2019-01-09_romans1,01,L2019-01-09, romans1,false,
L2019-01-09_paris,02,L2019-01-09, paris,false,
L2019-01-09_opyatpar,03,L2019-01-09, opyatpar,false,
L2019-01-09_vrjadli,04,L2019-01-09, vrjadli,false,
L2019-01-09_molitva,05,L2019-01-09, molitva,false,
L2019-01-09_slezazol,06,L2019-01-09, slezazol,false,
L2019-01-09_proschan,07,L2019-01-09, proschan,false,
L2019-01-09_natrinad,08,L2019-01-09, natrinad,false,
L2019-01-09_bereg,09,L2019-01-09, bereg,false,
L2019-01-09_alliluja,10,L2019-01-09, alliluja,false,
L2019-01-09_aneta,11,L2019-01-09, aneta,false,
L2019-01-09_interme3,12,L2019-01-09, interme3,false,
L2019-01-09_korablik,13,L2019-01-09, korablik,false,
---
L2019-01-09_kovcheg,14,L2019-01-09, kovcheg,false,
L2019-01-09_puskaj,15,L2019-01-09, puskaj,false,
L2019-01-09_nenadoby,16,L2019-01-09, nenadoby,false,
L2019-01-09_karavan,17,L2019-01-09, karavan,false,
L2019-01-09_arbatsko,18*,L2019-01-09, arbatsko,false,
L2019-01-09_nochprin,19*,L2019-01-09, nochprin,false,
L2019-01-09_poplubil,20*,L2019-01-09, poplubil,false,
L2019-01-09_kchemuis,21,L2019-01-09, kchemuis,false,
L2019-01-09_sezondoz,22,L2019-01-09, sezondoz,false,
L2019-01-09_temapoko,23,L2019-01-09, temapoko,false,
L2019-01-09_vtornik,24,L2019-01-09, vtornik,false,
L2019-01-09_kolybelb,25,L2019-01-09, kolybelb,false,
L2019-01-09_vosxodja,26,L2019-01-09, vosxodja,false,

08.12.2018 сб – Москва, бард-клуб "Гнездо глухаря"
L2018-12-08_suhumi,01,L2018-12-08, suhumi,false,
L2018-12-08_pavlovsk,02,L2018-12-08, pavlovsk,false,
L2018-12-08_epilog,03,L2018-12-08, epilog,false,
L2018-12-08_zaliv,04,L2018-12-08, zaliv,false,
L2018-12-08_proscha4,05,L2018-12-08, proscha4,false,
L2018-12-08_poslexol,06,L2018-12-08, poslexol,false,
L2018-12-08_chuzhaj2,07,L2018-12-08, chuzhaj2,false,
L2018-12-08_adleucon,08,L2018-12-08, adleucon,false,
L2018-12-08_baltijsk,09,L2018-12-08, baltijsk,false,
L2018-12-08_1995,10,L2018-12-08, 1995,false,
L2018-12-08_voslavug,11,L2018-12-08, voslavug,false,
L2018-12-08_nadvuhk,12,L2018-12-08, nadvuhk,false,
L2018-12-08_sovsemne,13,L2018-12-08, sovsemne,false,
L2018-12-08_totosego,14,L2018-12-08, totosego,false,
---
L2018-12-08_nadeyus,15,L2018-12-08, nadeyus,false,
L2018-12-08_neuzheli,16,L2018-12-08, neuzheli,false,
L2018-12-08_prosba,17,L2018-12-08, prosba,false,
L2018-12-08_kakojkos,18,L2018-12-08, kakojkos,false,
L2018-12-08_etodolzh,19,L2018-12-08, etodolzh,false,
L2018-12-08_nezabyva,20,L2018-12-08, nezabyva,false,
L2018-12-08_razvecht,21,L2018-12-08, razvecht,false,
L2018-12-08_pamjativ,22,L2018-12-08, pamjativ,false,
L2018-12-08_zaklinan,23,L2018-12-08, zaklinan,false,
L2018-12-08_sharmans,24,L2018-12-08, sharmans,false,
L2018-12-08_chepuxa,25,L2018-12-08, chepuxa,false,
L2018-12-08_trubach,26,L2018-12-08, trubach,false,

17.11.2018 сб – США, San Francisco, CA
L2018-11-17_nadeyus,01,L2018-11-17, nadeyus,false,
L2018-11-17_ryba,02,L2018-11-17, ryba,false,
L2018-11-17_nezabyva,03,L2018-11-17, nezabyva,false,
L2018-11-17_istorija,04,L2018-11-17, istorija,false,
L2018-11-17_kalejdos,05,L2018-11-17, kalejdos,false,
L2018-11-17_zaliv,06,L2018-11-17, zaliv,false,
L2018-11-17_sovsemne,07,L2018-11-17, sovsemne,false,
L2018-11-17_1995,08,L2018-11-17, 1995,false,
L2018-11-17_baltijsk,09,L2018-11-17, baltijsk,false,
L2018-11-17_adleucon,10,L2018-11-17, adleucon,false,
L2018-11-17_suhumi,11,L2018-11-17, suhumi,false,
L2018-11-17_dopoezda,12,L2018-11-17, dopoezda,false,
L2018-11-17_mneniche,13,L2018-11-17, mneniche,false,
L2018-11-17_kogdajab,14,L2018-11-17, kogdajab,false,
L2018-11-17_romansma,15,L2018-11-17, romansma,false,
L2018-11-17_panorama,16,L2018-11-17, panorama,false,
---
L2018-11-17_duet,17,L2018-11-17, duet,false,
L2018-11-17_pamjativ,18,L2018-11-17, pamjativ,false,
L2018-11-17_sharmans,19,L2018-11-17, sharmans,false,
L2018-11-17_samsebe,20,L2018-11-17, samsebe,false,
L2018-11-17_kuznechiki,21,L2018-11-17, kuznechiki,false,
L2018-11-17_stixiopr,22,L2018-11-17, stixiopr,false,
L2018-11-17_shkolat2,23,L2018-11-17, shkolat2,false,
L2018-11-17_navescha,24,L2018-11-17, navescha,false,
L2018-11-17_chuzhaj2,25,L2018-11-17, chuzhaj2,false,
L2018-11-17_razvecht,26,L2018-11-17, razvecht,false,
L2018-11-17_voslavug,27,L2018-11-17, voslavug,false,
L2018-11-17_zaklinan,28,L2018-11-17, zaklinan,false,
L2018-11-17_nerazmen,29,L2018-11-17, nerazmen,false,
L2018-11-17_trubach,30,L2018-11-17, trubach,false,

09.11.2018 пт – США, Manhattan, NY
L2018-11-09_ryba,01,L2018-11-09, ryba,false,
L2018-11-09_nezabyva,02,L2018-11-09, nezabyva,false,
L2018-11-09_istorija,03,L2018-11-09, istorija,false,
L2018-11-09_kalejdos,04,L2018-11-09, kalejdos,false,
L2018-11-09_godshel,05,L2018-11-09, godshel,false,
L2018-11-09_1995,06,L2018-11-09, 1995,false,
L2018-11-09_baltijsk,07,L2018-11-09, baltijsk,false,
L2018-11-09_adleucon,08,L2018-11-09, adleucon,false,
L2018-11-09_mneniche,09,L2018-11-09, mneniche,false,
L2018-11-09_sovsemne,10,L2018-11-09, sovsemne,false,
L2018-11-09_hotyaizr,11,L2018-11-09, hotyaizr,false,
L2018-11-09_kogdajab,12,L2018-11-09, kogdajab,false,
L2018-11-09_romansma,13,L2018-11-09, romansma,false,
L2018-11-09_zastolnaya,14,L2018-11-09, zastolnaya,false,
L2018-11-09_panorama,15,L2018-11-09, panorama,false,
L2018-11-09_bukvynak,16,L2018-11-09, bukvynak,false,
L2018-11-09_pamjativ,17,L2018-11-09, pamjativ,false,
L2018-11-09_sharmans,18,L2018-11-09, sharmans,false,
L2018-11-09_samsebe,19,L2018-11-09, samsebe,false,
L2018-11-09_neuzheli,20,L2018-11-09, neuzheli,false,
L2018-11-09_razvecht,21,L2018-11-09, razvecht,false,
L2018-11-09_chuzhaj2,22,L2018-11-09, chuzhaj2,false,
L2018-11-09_zaklinan,23,L2018-11-09, zaklinan,false,
L2018-11-09_nerazmen,24,L2018-11-09, nerazmen,false,
L2018-11-09_trubach,25,L2018-11-09, trubach,false,

29.10.2018 пн – Москва, бард-клуб "Гнездо глухаря"
L2018-10-29_ryba,01,L2018-10-29, ryba,false,
L2018-10-29_nezabyva,02,L2018-10-29, nezabyva,false,
L2018-10-29_istorija,03,L2018-10-29, istorija,false,
L2018-10-29_deklarac,04,L2018-10-29, deklarac,false,
L2018-10-29_chuzhaj2,05,L2018-10-29, chuzhaj2,false,
L2018-10-29_bystrov2,06,L2018-10-29, bystrov2,false,
L2018-10-29_sovsemne,07,L2018-10-29, sovsemne,false,
L2018-10-29_brodjagi,08,L2018-10-29, brodjagi,false,
L2018-10-29_duet,09,L2018-10-29, duet,false,
L2018-10-29_samsebe,10,L2018-10-29, samsebe,false,
L2018-10-29_traviata,11,L2018-10-29, traviata,false,
L2018-10-29_sharmans,12,L2018-10-29, sharmans,false,
L2018-10-29_kadril,13,L2018-10-29, kadril,false,
L2018-10-29_romansma,14,L2018-10-29, romansma,false,
L2018-10-29_zastolnaya,15,L2018-10-29, zastolnaya,false,
---
L2018-10-29_godshel,16,L2018-10-29, godshel,false,
L2018-10-29_zaliv,17,L2018-10-29, zaliv,false,
L2018-10-29_kordebal,18,L2018-10-29, kordebal,false,
L2018-10-29_propadu,19,L2018-10-29, propadu,false,
L2018-10-29_razvecht,20,L2018-10-29, razvecht,false,
L2018-10-29_totosego,21,L2018-10-29, totosego,false,
L2018-10-29_shkolat2,22,L2018-10-29, shkolat2,false,
L2018-10-29_voslavug,23,L2018-10-29, voslavug,false,
L2018-10-29_zaklinan,24,L2018-10-29, zaklinan,false,
L2018-10-29_nerazmen,25,L2018-10-29, nerazmen,false,
L2018-10-29_trubach,26,L2018-10-29, trubach,false,

20.10.2018 сб – Минск, домашний концерт у И. и А. Горбач дуэт (гитара), премьера
L2018-10-29_mysvjaza,01*,L2018-10-29, mysvjaza,false,
L2018-10-29_sadvolsh,02*,L2018-10-29, sadvolsh,false,
L2018-10-29_gorizont,03*,L2018-10-29, gorizont,false,
L2018-10-29_vremjaid,04*,L2018-10-29, vremjaid,false,
L2018-10-29_dolinanm,05*,L2018-10-29, dolinanm,false,
L2018-10-29_dvasilue,06*,L2018-10-29, dvasilue,false,
L2018-10-29_mastergr,07*,L2018-10-29, mastergr,false,
L2018-10-29_polovodj,08*,L2018-10-29, polovodj,false,
L2018-10-29_axtrubym,09*,L2018-10-29, axtrubym,false,
L2018-10-29_prokotel,10*,L2018-10-29, prokotel,false,
L2018-10-29_axmalmn,11*,L2018-10-29, axmalmn,false,
L2018-10-29_sletalis,12*,L2018-10-29, sletalis,false,
L2018-10-29_arbatsko,13*,L2018-10-29, arbatsko,false,
L2018-10-29_nepokorn,14*,L2018-10-29, nepokorn,false,
L2018-10-29_nuchemte,15*,L2018-10-29, nuchemte,false,
L2018-10-29_sovestbl,16*,L2018-10-29, sovestbl,false,
L2018-10-29_kchemuis,17,L2018-10-29, kchemuis,true,
L2018-10-29_oderjimy,18*,L2018-10-29, oderjimy,false,
L2018-10-29_sitzevyj,19*,L2018-10-29, sitzevyj,false,
L2018-10-29_tyvoschu,20*,L2018-10-29, tyvoschu,false,
L2018-10-29_birjuzov,21*,L2018-10-29, birjuzov,false,
L2018-10-29_javnovpo,22*,L2018-10-29, javnovpo,false,
L2018-10-29_rybachka,23*,L2018-10-29, rybachka,false,
L2018-10-29_tyvchemv,24*,L2018-10-29, tyvchemv,false,
L2018-10-29_ometro,25*,L2018-10-29, ometro,false,
L2018-10-29_smozarto,26*,L2018-10-29, smozarto,false,
L2018-10-29_yavysele,27*,L2018-10-29, yavysele,false,
L2018-10-29_vsemuvre,28*,L2018-10-29, vsemuvre,false,
L2018-10-29_nebudemx,29*,L2018-10-29, nebudemx,false,

19.10.2018 пт – Минск, домашний концерт у И. и А. Горбач
L2018-10-19_ubykagol,01,L2018-10-19, ubykagol,false,
L2018-10-19_samsebe,02,L2018-10-19, samsebe,false,
L2018-10-19_traviata,03,L2018-10-19, traviata,false,
L2018-10-19_deklarac,04,L2018-10-19, deklarac,false,
L2018-10-19_godshel,05,L2018-10-19, godshel,false,
L2018-10-19_istorija,06,L2018-10-19, istorija,false,
L2018-10-19_propadu,07,L2018-10-19, propadu,false,
L2018-10-19_bystrov,08,L2018-10-19, bystrov,false,
L2018-10-19_bystrov2,09,L2018-10-19, bystrov2,false,
L2018-10-19_sovsemne,10,L2018-10-19, sovsemne,false,
L2018-10-19_duet,11,L2018-10-19, duet,false,
L2018-10-19_navescha,12,L2018-10-19, navescha,false,
L2018-10-19_nadvuhk,13,L2018-10-19, nadvuhk,false,
---
L2018-10-19_romansma,14,L2018-10-19, romansma,false,
L2018-10-19_zastolnaya,15,L2018-10-19, zastolnaya,false,
L2018-10-19_prenebre,16,L2018-10-19, prenebre,false,
L2018-10-19_zaliv,17,L2018-10-19, zaliv,false,
L2018-10-19_avtoparo,18,L2018-10-19, avtoparo,false,
L2018-10-19_vekaplyv,19,L2018-10-19, vekaplyv,false,
L2018-10-19_razvecht,20,L2018-10-19, razvecht,false,
L2018-10-19_neuzheli,21,L2018-10-19, neuzheli,false,
L2018-10-19_epilog,22,L2018-10-19, epilog,false,
L2018-10-19_zaklinan,23,L2018-10-19, zaklinan,false,
L2018-10-19_sharmans,24,L2018-10-19, sharmans,false,
L2018-10-19_alliluja,25,L2018-10-19, alliluja,false,

29.09.2018 сб – Мурманск
L2018-09-29_rusalka,01,L2018-09-29, rusalka,false,
L2018-09-29_kuznechiki,02,L2018-09-29, kuznechiki,false,
L2018-09-29_samsebe,03,L2018-09-29, samsebe,false,
L2018-09-29_godshel,04,L2018-09-29, godshel,false,
L2018-09-29_kupljubi,05,L2018-09-29, kupljubi,false,
L2018-09-29_stixiopr,06,L2018-09-29, stixiopr,false,
L2018-09-29_vpoxodny,07,L2018-09-29, vpoxodny,false,
L2018-09-29_desyatpe,08,L2018-09-29, desyatpe,false,
L2018-09-29_1995,09,L2018-09-29, 1995,false,
L2018-09-29_kalejdos,10,L2018-09-29, kalejdos,false,
L2018-09-29_zaliv,11,L2018-09-29, zaliv,false,
L2018-09-29_kogdajab,12,L2018-09-29, kogdajab,false,
L2018-09-29_sovsemne,13,L2018-09-29, sovsemne,false,
L2018-09-29_romansma,14,L2018-09-29, romansma,false,
L2018-09-29_zastolnaya,15,L2018-09-29, zastolnaya,false,
---
L2018-09-29_panorama,16,L2018-09-29, panorama,false,
L2018-09-29_dendensk,17,L2018-09-29, dendensk,false,
L2018-09-29_nezabyva,18,L2018-09-29, nezabyva,false,
L2018-09-29_deja,19,L2018-09-29, deja,false,
L2018-09-29_chuzhaj2,20,L2018-09-29, chuzhaj2,false,
L2018-09-29_neuzheli,21,L2018-09-29, neuzheli,false,
L2018-09-29_razvecht,22,L2018-09-29, razvecht,false,
L2018-09-29_shkolat2,23,L2018-09-29, shkolat2,false,
L2018-09-29_voslavug,24,L2018-09-29, voslavug,false,
L2018-09-29_zaklinan,25,L2018-09-29, zaklinan,false,
L2018-09-29_sharmans,26,L2018-09-29, sharmans,false,
L2018-09-29_totosego,27,L2018-09-29, totosego,false,
L2018-09-29_trubach,28,L2018-09-29, trubach,false,

21.09.2018 пт – Санкт-Петербург, КЗ "У Финляндского"
L2018-09-21_rusalka,01,L2018-09-21, rusalka,false,
L2018-09-21_kupljubi,02,L2018-09-21, kupljubi,false,
L2018-09-21_samsebe,03,L2018-09-21, samsebe,false,
L2018-09-21_godshel,04,L2018-09-21, godshel,false,
L2018-09-21_1995,05,L2018-09-21, 1995,false,
L2018-09-21_stixiopr,06,L2018-09-21, stixiopr,false,
L2018-09-21_vpoxodny,07,L2018-09-21, vpoxodny,false,
L2018-09-21_desyatpe,08,L2018-09-21, desyatpe,false,
L2018-09-21_baltijsk,09,L2018-09-21, baltijsk,false,
L2018-09-21_zaliv,10,L2018-09-21, zaliv,false,
L2018-09-21_rodljuds,11,L2018-09-21, rodljuds,false,
L2018-09-21_kogdajab,12,L2018-09-21, kogdajab,false,
L2018-09-21_sovsemne,13,L2018-09-21, sovsemne,false,
L2018-09-21_romansma,14,L2018-09-21, romansma,false,
L2018-09-21_zastolnaya,15,L2018-09-21, zastolnaya,false,
---
L2018-09-21_dendensk,16,L2018-09-21, dendensk,false,
L2018-09-21_ryba,17,L2018-09-21, ryba,false,
L2018-09-21_nezabyva,18,L2018-09-21, nezabyva,false,
L2018-09-21_deja,19,L2018-09-21, deja,false,
L2018-09-21_hotyaizr,20,L2018-09-21, hotyaizr,false,
L2018-09-21_chuzhaj2,21,L2018-09-21, chuzhaj2,false,
L2018-09-21_razvecht,22,L2018-09-21, razvecht,false,
L2018-09-21_shkolat2,23,L2018-09-21, shkolat2,false,
L2018-09-21_voslavug,24,L2018-09-21, voslavug,false,
L2018-09-21_kalejdos,25,L2018-09-21, kalejdos,false,
L2018-09-21_sharmans,26,L2018-09-21, sharmans,false,
L2018-09-21_alliluja,27,L2018-09-21, alliluja,false,
L2018-09-21_totosego,28,L2018-09-21, totosego,false,

03.09.2018 пн – Москва, бард-клуб "Гнездо глухаря"
L2018-09-03_podzname,01,L2018-09-03, podzname,false,
L2018-09-03_adleucon,02,L2018-09-03, adleucon,false,
L2018-09-03_japodari,03,L2018-09-03, japodari,false,
L2018-09-03_kovcheg,04,L2018-09-03, kovcheg,false,
L2018-09-03_kogdajab,05,L2018-09-03, kogdajab,false,
L2018-09-03_zaliv,06,L2018-09-03, zaliv,false,
L2018-09-03_baltijsk,07,L2018-09-03, baltijsk,false,
L2018-09-03_rodljuds,08,L2018-09-03, rodljuds,false,
L2018-09-03_1995,09,L2018-09-03, 1995,false,
L2018-09-03_propadu,10,L2018-09-03, propadu,false,
L2018-09-03_kuznechiki,11,L2018-09-03, kuznechiki,false,
L2018-09-03_serenada,12,L2018-09-03, serenada,false,
L2018-09-03_volhonka,13,L2018-09-03, volhonka,false,
L2018-09-03_mneniche,14,L2018-09-03, mneniche,false,
L2018-09-03_sovsemne,15,L2018-09-03, sovsemne,false,
L2018-09-03_razvecht,16,L2018-09-03, razvecht,false,
---
L2018-09-03_totosego,17,L2018-09-03, totosego,false,
L2018-09-03_nezabyva,18,L2018-09-03, nezabyva,false,
L2018-09-03_nadvuhk,19,L2018-09-03, nadvuhk,false,
L2018-09-03_dopoezda,20,L2018-09-03, dopoezda,false,
L2018-09-03_suhumi,21,L2018-09-03, suhumi,false,
L2018-09-03_deja,22,L2018-09-03, deja,false,
L2018-09-03_chepuxa,23,L2018-09-03, chepuxa,false,
L2018-09-03_ryba,24,L2018-09-03, ryba,false,
L2018-09-03_kalejdos,25,L2018-09-03, kalejdos,false,
L2018-09-03_sharmans,26,L2018-09-03, sharmans,false,
L2018-09-03_stixiopr,27,L2018-09-03, stixiopr,false,
L2018-09-03_vpoxodny,28,L2018-09-03, vpoxodny,false,
L2018-09-03_voslavug,29,L2018-09-03, voslavug,false,
L2018-09-03_pesenkao,30,L2018-09-03, pesenkao,false,
L2018-09-03_trubach,32,L2018-09-03, trubach,false,

14.07.2018 сб – Москва, бард-клуб "Гнездо глухаря", премьера
L2018-07-14_serenada,01,L2018-07-14, serenada,false,
L2018-07-14_kuznechiki,02,L2018-07-14, kuznechiki,false,
L2018-07-14_vsetvoic,03,L2018-07-14, vsetvoic,false,
L2018-07-14_adleucon,04,L2018-07-14, adleucon,false,
L2018-07-14_godshel,05,L2018-07-14, godshel,false,
L2018-07-14_dendensk,06,L2018-07-14, dendensk,false,
L2018-07-14_volhonka,07,L2018-07-14, volhonka,false,
L2018-07-14_udachny,08,L2018-07-14, udachny,false,
L2018-07-14_propadu,09,L2018-07-14, propadu,false,
L2018-07-14_sovsemne,10,L2018-07-14, sovsemne,false,
L2018-07-14_romansma,11,L2018-07-14, romansma,false,
L2018-07-14_zastolnaya,12,L2018-07-14, zastolnaya,false,
---
L2018-07-14_nadeyus,13,L2018-07-14, nadeyus,false,
L2018-07-14_ryba,14,L2018-07-14, ryba,false,
L2018-07-14_proschanie,15,L2018-07-14, proschanie,false,
L2018-07-14_razvecht,16,L2018-07-14, razvecht,true,
L2018-07-14_shkolat2,17,L2018-07-14, shkolat2,false,
L2018-07-14_zaliv,18,L2018-07-14, zaliv,false,
L2018-07-14_baltijsk,19,L2018-07-14, baltijsk,false,
L2018-07-14_epilog,20,L2018-07-14, epilog,false,
L2018-07-14_sharmans,21,L2018-07-14, sharmans,false,
L2018-07-14_chepuxa,22,L2018-07-14, chepuxa,false,
L2018-07-14_nerazmen,23,L2018-07-14, nerazmen,false,

04.06.2018 пн – Москва, бард-клуб "Гнездо глухаря", премьера
L2018-06-04_mneniche,01,L2018-06-04, mneniche,false,
L2018-06-04_kuznechiki,02,L2018-06-04, kuznechiki,false,
L2018-06-04_stixiopr,03,L2018-06-04, stixiopr,false,
L2018-06-04_esli,04,L2018-06-04, esli,false,
L2018-06-04_godshel,05,L2018-06-04, godshel,false,
L2018-06-04_panorama,06,L2018-06-04, panorama,false,
L2018-06-04_volhonka,07,L2018-06-04, volhonka,false,
L2018-06-04_udachny,08,L2018-06-04, udachny,false,
L2018-06-04_vpoxodny,09,L2018-06-04, vpoxodny,false,
L2018-06-04_sharmans,10,L2018-06-04, sharmans,false,
L2018-06-04_orodine,11,L2018-06-04, orodine,false,
L2018-06-04_kogdajab,12,L2018-06-04, kogdajab,false,
L2018-06-04_sovsemne,13,L2018-06-04, sovsemne,true,
L2018-06-04_totosego,14,L2018-06-04, totosego,false,
---
L2018-06-04_tirbayard,15,L2018-06-04, tirbayard,false,
L2018-06-04_ryba,16,L2018-06-04, ryba,false,
L2018-06-04_suhumi,17,L2018-06-04, suhumi,false,
L2018-06-04_chuzhaj2,18,L2018-06-04, chuzhaj2,false,
L2018-06-04_nadvuhk,19,L2018-06-04, nadvuhk,false,
L2018-06-04_baltijsk,20,L2018-06-04, baltijsk,false,
L2018-06-04_kalejdos,21,L2018-06-04, kalejdos,false,
L2018-06-04_desyatpe,22,L2018-06-04, desyatpe,false,
L2018-06-04_shkolat2,23,L2018-06-04, shkolat2,false,
L2018-06-04_chepuxa,24,L2018-06-04, chepuxa,false,
L2018-06-04_trubach,25,L2018-06-04, trubach,false,

13.05.2018 вс – США, Ann Arbor, MI
L2018-05-13_kuznechiki,01,L2018-05-13, kuznechiki,false,
L2018-05-13_nadvuhk,02,L2018-05-13, nadvuhk,false,
L2018-05-13_panorama,03,L2018-05-13, panorama,false,
L2018-05-13_nadeyus,04,L2018-05-13, nadeyus,false,
L2018-05-13_desyatpe,05,L2018-05-13, desyatpe,false,
L2018-05-13_zatemzhe,06,L2018-05-13, zatemzhe,false,
L2018-05-13_temapoleta,07,L2018-05-13, temapoleta,false,
L2018-05-13_udachny,08,L2018-05-13, udachny,false,
L2018-05-13_krasnye,09,L2018-05-13, krasnye,false,
L2018-05-13_godshel,10,L2018-05-13, godshel,false,
L2018-05-13_fontanka,11,L2018-05-13, fontanka,false,
L2018-05-13_samsebe,12,L2018-05-13, samsebe,false,
L2018-05-13_vpoxodny,13,L2018-05-13, vpoxodny,false,
L2018-05-13_neuzheli,14,L2018-05-13, neuzheli,false,
L2018-05-13_hotyaizr,15,L2018-05-13, hotyaizr,false,
L2018-05-13_peterbur,16,L2018-05-13, peterbur,false,
L2018-05-13_esli,17,L2018-05-13, esli,false,
L2018-05-13_zaklinan,18,L2018-05-13, zaklinan,false,
L2018-05-13_bukvynak,19,L2018-05-13, bukvynak,false,
L2018-05-13_pamjativ,20,L2018-05-13, pamjativ,false,
L2018-05-13_sharmans,21,L2018-05-13, sharmans,false,
L2018-05-13_chepuxa,22,L2018-05-13, chepuxa,false,
L2018-05-13_totosego,23,L2018-05-13, totosego,false,
L2018-05-13_nerazmen,24,L2018-05-13, nerazmen,false,

24.04.2018 вт – Москва, ЦАП, текст
L2018-04-24_nadeyus,01,L2018-04-24, nadeyus,false,
L2018-04-24_panorama,02,L2018-04-24, panorama,false,
L2018-04-24_neuzheli,03,L2018-04-24, neuzheli,false,
L2018-04-24_udachny,04,L2018-04-24, udachny,false,
L2018-04-24_desyatpe,05,L2018-04-24, desyatpe,false,
L2018-04-24_zatemzhe,06,L2018-04-24, zatemzhe,false,
L2018-04-24_temapoleta,07,L2018-04-24, temapoleta,false,
L2018-04-24_samsebe,08,L2018-04-24, samsebe,false,
L2018-04-24_fontanka,09,L2018-04-24, fontanka,false,
L2018-04-24_ubykagol,10,L2018-04-24, ubykagol,false,
L2018-04-24_godshel,11,L2018-04-24, godshel,false,
L2018-04-24_krasnye,12,L2018-04-24, krasnye,false,
L2018-04-24_vpoxodny,13,L2018-04-24, vpoxodny,false,
L2018-04-24_peterbur,14,L2018-04-24, peterbur,false,
L2018-04-24_sharmans,15,L2018-04-24, sharmans,false,
L2018-04-24_nadvuhk,16,L2018-04-24, nadvuhk,false,
L2018-04-24_zaklinan,17,L2018-04-24, zaklinan,false,
L2018-04-24_esli,18,L2018-04-24, esli,false,
L2018-04-24_chepuxa,19,L2018-04-24, chepuxa,false,
L2018-04-24_hotyaizr,20,L2018-04-24, hotyaizr,false,(обновлённый текст)
L2018-04-24_totosego,21,L2018-04-24, totosego,false,
L2018-04-24_nerazmen,22,L2018-04-24, nerazmen,false,

05.04.2018 чт – Москва, бард-клуб "Гнездо глухаря" (малый зал)
L2018-04-05_1992,01,L2018-04-05, 1992,false,
L2018-04-05_peshkom,02,L2018-04-05, peshkom,false,
L2018-04-05_dopoezda,03,L2018-04-05, dopoezda,false,
L2018-04-05_suhumi,04,L2018-04-05, suhumi,false,
L2018-04-05_temapoleta,05,L2018-04-05, temapoleta,false,
L2018-04-05_pavlovsk,06,L2018-04-05, pavlovsk,false,
L2018-04-05_peterbur,07,L2018-04-05, peterbur,false,
L2018-04-05_drugoe,08,L2018-04-05, drugoe,false,
L2018-04-05_godshel,09,L2018-04-05, godshel,false,
L2018-04-05_udachny,10,L2018-04-05, udachny,false,
L2018-04-05_krasnye,11,L2018-04-05, krasnye,false,
L2018-04-05_nadvuhk,12,L2018-04-05, nadvuhk,false,
---
L2018-04-05_zaklinan,13,L2018-04-05, zaklinan,false,
L2018-04-05_fridrih,14,L2018-04-05, fridrih,false,
L2018-04-05_serenada,15,L2018-04-05, serenada,false,
L2018-04-05_esli,16,L2018-04-05, esli,false,
L2018-04-05_japodari,17,L2018-04-05, japodari,false,
L2018-04-05_kalejdos,18,L2018-04-05, kalejdos,false,
L2018-04-05_navescha,19,L2018-04-05, navescha,false,
L2018-04-05_chepuxa,20,L2018-04-05, chepuxa,false,
L2018-04-05_pamjativ,21,L2018-04-05, pamjativ,false,
L2018-04-05_sharmans,22,L2018-04-05, sharmans,false,
L2018-04-05_totosego,23,L2018-04-05, totosego,false,

04.03.2018 вс – Москва, бард-клуб "Гнездо глухаря"
L2018-03-04_serenada,01,L2018-03-04, serenada,false,
L2018-03-04_traviata,02,L2018-03-04, traviata,false,
L2018-03-04_kogdaned,03,L2018-03-04, kogdaned,false,
L2018-03-04_desyatpe,04,L2018-03-04, desyatpe,false,
L2018-03-04_propadu,05,L2018-03-04, propadu,false,
L2018-03-04_dopoezda,06,L2018-03-04, dopoezda,false,
L2018-03-04_alliluja,07,L2018-03-04, alliluja,false,
L2018-03-04_vrjadli,08,L2018-03-04, vrjadli,false,
L2018-03-04_avtoparo,09,L2018-03-04, avtoparo,false,
L2018-03-04_samsebe,10,L2018-03-04, samsebe,false,
L2018-03-04_kupljubi,11,L2018-03-04, kupljubi,false,
L2018-03-04_pamjativ,12,L2018-03-04, pamjativ,false,
L2018-03-04_piter,13,L2018-03-04, piter,false,
L2018-03-04_romansma,14,L2018-03-04, romansma,false,
L2018-03-04_zastolnaya,15,L2018-03-04, zastolnaya,false,
---
L2018-03-04_nezabyva,16,L2018-03-04, nezabyva,false,
L2018-03-04_istorija,17,L2018-03-04, istorija,false,
L2018-03-04_esli,18,L2018-03-04, esli,false,
L2018-03-04_panorama,19,L2018-03-04, panorama,false,
L2018-03-04_zaklinan,20,L2018-03-04, zaklinan,false,
L2018-03-04_sharmans,21,L2018-03-04, sharmans,false,
L2018-03-04_kalejdos,22,L2018-03-04, kalejdos,false,
L2018-03-04_trubach,23,L2018-03-04, trubach,false,
L2018-03-04_vademecu,24,L2018-03-04, vademecu,false,
L2018-03-04_nadvuhk,25,L2018-03-04, nadvuhk,false,
L2018-03-04_pesenkao,26,L2018-03-04, pesenkao,false,

29.01.2018 пн – Москва, бард-клуб "Гнездо глухаря"
L2018-01-29_volk,01,L2018-01-29, volk,false,
L2018-01-29_kuznechiki,02,L2018-01-29, kuznechiki,false,
L2018-01-29_ballada,03,L2018-01-29, ballada,false,
L2018-01-29_volhonka,04,L2018-01-29, volhonka,false,
L2018-01-29_mneniche,05,L2018-01-29, mneniche,false,
L2018-01-29_voslavug,06,L2018-01-29, voslavug,false,
L2018-01-29_adleucon,07,L2018-01-29, adleucon,false,
L2018-01-29_baltijsk,08,L2018-01-29, baltijsk,false,
L2018-01-29_temapoleta,09,L2018-01-29, temapoleta,false,
L2018-01-29_udachny,10,L2018-01-29, udachny,false,
L2018-01-29_ryba,11,L2018-01-29, ryba,false,
L2018-01-29_kordebal,12,L2018-01-29, kordebal,false,
L2018-01-29_esli,13,L2018-01-29, esli,false,
L2018-01-29_panorama,14,L2018-01-29, panorama,false,
---
L2018-01-29_avtoparo,15,L2018-01-29, avtoparo,false,
L2018-01-29_epilog,16,L2018-01-29, epilog,false,
L2018-01-29_drugoe,17,L2018-01-29, drugoe,false,
L2018-01-29_vpoxodny,18,L2018-01-29, vpoxodny,false,
L2018-01-29_proschanie,19,L2018-01-29, proschanie,false,
L2018-01-29_zaklinan,20,L2018-01-29, zaklinan,false,
L2018-01-29_nadvuhk,21,L2018-01-29, nadvuhk,false,
L2018-01-29_sharmans,22,L2018-01-29, sharmans,false,
L2018-01-29_chepuxa,23,L2018-01-29, chepuxa,false,
L2018-01-29_nerazmen,24,L2018-01-29, nerazmen,false,
L2018-01-29_totosego,25,L2018-01-29, totosego,false,

03.12.2017 вс – США, Philadelphia, PA, магазин "Книжник"
L2017-12-03_rusalka,01,L2017-12-03, rusalka,false,
L2017-12-03_nezabyva,02,L2017-12-03, nezabyva,false,
L2017-12-03_romansma,03,L2017-12-03, romansma,false,
L2017-12-03_zastolnaya,04,L2017-12-03, zastolnaya,false,
L2017-12-03_kogdaned,05,L2017-12-03, kogdaned,false,
L2017-12-03_shkolat2,06,L2017-12-03, shkolat2,false,
L2017-12-03_voslavug,07,L2017-12-03, voslavug,false,
L2017-12-03_adleucon,08,L2017-12-03, adleucon,false,
L2017-12-03_vpoxodny,09,L2017-12-03, vpoxodny,false,
L2017-12-03_gdetytep,10,L2017-12-03, gdetytep,false,
L2017-12-03_duet,11,L2017-12-03, duet,false,
L2017-12-03_samsebe,12,L2017-12-03, samsebe,false,
L2017-12-03_nerazmen,13,L2017-12-03, nerazmen,false,
L2017-12-03_totosego,14,L2017-12-03, totosego,false,
---
L2017-12-03_podzname,15,L2017-12-03, podzname,false,
L2017-12-03_proschanie,16,L2017-12-03, proschanie,false,
L2017-12-03_udachny,17,L2017-12-03, udachny,false,
L2017-12-03_stenyusv,18,L2017-12-03, stenyusv,false,
L2017-12-03_epilog,19,L2017-12-03, epilog,false,
L2017-12-03_japodari,20,L2017-12-03, japodari,false,
L2017-12-03_avstrali,21,L2017-12-03, avstrali,false,
L2017-12-03_pamjativ,22,L2017-12-03, pamjativ,false,
L2017-12-03_sharmans,23,L2017-12-03, sharmans,false,
L2017-12-03_pesenkao,24,L2017-12-03, pesenkao,false,

28.11.2017 вт – США, Fair Lawn, NJ
L2017-11-28_serenada,01,L2017-11-28, serenada,false,
L2017-11-28_rusalka,02,L2017-11-28, rusalka,false,
L2017-11-28_nezabyva,03,L2017-11-28, nezabyva,false,
L2017-11-28_peterbur,04,L2017-11-28, peterbur,false,
L2017-11-28_proschanie,05,L2017-11-28, proschanie,false,
L2017-11-28_kogdaned,06,L2017-11-28, kogdaned,false,
L2017-11-28_shkolat2,07,L2017-11-28, shkolat2,false,
L2017-11-28_voslavug,08,L2017-11-28, voslavug,false,
L2017-11-28_adleucon,09,L2017-11-28, adleucon,false,
L2017-11-28_baltijsk,10,L2017-11-28, baltijsk,false,
L2017-11-28_vpoxodny,11,L2017-11-28, vpoxodny,false,
L2017-11-28_gdetytep,12,L2017-11-28, gdetytep,false,
L2017-11-28_samsebe,13,L2017-11-28, samsebe,false,
L2017-11-28_nerazmen,14,L2017-11-28, nerazmen,false,
L2017-11-28_totosego,15,L2017-11-28, totosego,false,
L2017-11-28_stenyusv,16,L2017-11-28, stenyusv,false,
L2017-11-28_panorama,17,L2017-11-28, panorama,false,
L2017-11-28_udachny,18,L2017-11-28, udachny,false,
L2017-11-28_pesenkao,19,L2017-11-28, pesenkao,false,
L2017-11-28_epilog,20,L2017-11-28, epilog,false,
L2017-11-28_nadvuhk,21,L2017-11-28, nadvuhk,false,
L2017-11-28_zaklinan,22,L2017-11-28, zaklinan,false,
L2017-11-28_pamjativ,23,L2017-11-28, pamjativ,false,
L2017-11-28_sharmans,24,L2017-11-28, sharmans,false,

22.11.2017 ср – Москва, бард-клуб "Гнездо глухаря", 2 премьеры
L2017-11-22_serenada,01,L2017-11-22, serenada,false,
L2017-11-22_rusalka,02,L2017-11-22, rusalka,false,
L2017-11-22_nezabyva,03,L2017-11-22, nezabyva,false,
L2017-11-22_peterbur,04,L2017-11-22, peterbur,false,
L2017-11-22_proschanie,05,L2017-11-22, proschanie,false,
L2017-11-22_kogdaned,06,L2017-11-22, kogdaned,false,
L2017-11-22_shkolat2,07,L2017-11-22, shkolat2,false,
L2017-11-22_voslavug,08,L2017-11-22, voslavug,false,
L2017-11-22_adleucon,09,L2017-11-22, adleucon,false,
L2017-11-22_baltijsk,10,L2017-11-22, baltijsk,false,
L2017-11-22_vpoxodny,11,L2017-11-22, vpoxodny,false,
L2017-11-22_esli,12,L2017-11-22, esli,false,
L2017-11-22_samsebe,13,L2017-11-22, samsebe,true,
L2017-11-22_nerazmen,14,L2017-11-22, nerazmen,false,
L2017-11-22_totosego,15,L2017-11-22, totosego,false,
---
L2017-11-22_ubykagol,16,L2017-11-22, ubykagol,false,
L2017-11-22_panorama,17,L2017-11-22, panorama,false,
L2017-11-22_udachny,18,L2017-11-22, udachny,false,
L2017-11-22_stenyusv,19,L2017-11-22, stenyusv,false,
L2017-11-22_zatemzhe,20,L2017-11-22, zatemzhe,false,
L2017-11-22_hotyaizr,21,L2017-11-22, hotyaizr,true,
L2017-11-22_chepuxa,22,L2017-11-22, chepuxa,false,
L2017-11-22_nadvuhk,23,L2017-11-22, nadvuhk,false,
L2017-11-22_zaklinan,24,L2017-11-22, zaklinan,false,
L2017-11-22_pamjativ,25,L2017-11-22, pamjativ,false,
L2017-11-22_sharmans,26,L2017-11-22, sharmans,false,

28.10.2017 сб – Оренбург, Областной театр кукол
L2017-10-28_nadeyus,01,L2017-10-28, nadeyus,false,
L2017-10-28_voslavug,02,L2017-10-28, voslavug,false,
L2017-10-28_adleucon,03,L2017-10-28, adleucon,false,
L2017-10-28_rusalka,04,L2017-10-28, rusalka,false,
L2017-10-28_vpoxodny,05,L2017-10-28, vpoxodny,false,
L2017-10-28_nezabyva,06,L2017-10-28, nezabyva,false,
L2017-10-28_japodari,07,L2017-10-28, japodari,false,
L2017-10-28_mneniche,08,L2017-10-28, mneniche,false,
L2017-10-28_udachny,09,L2017-10-28, udachny,false,
L2017-10-28_esli,10,L2017-10-28, esli,false,
L2017-10-28_kogdaned,11,L2017-10-28, kogdaned,false,
L2017-10-28_stenyusv,12,L2017-10-28, stenyusv,false,
L2017-10-28_navescha,13,L2017-10-28, navescha,false,
L2017-10-28_neuzheli,14,L2017-10-28, neuzheli,false,
---
L2017-10-28_kuznechiki,15,L2017-10-28, kuznechiki,false,
L2017-10-28_ubykagol,16,L2017-10-28, ubykagol,false,
L2017-10-28_panorama,17,L2017-10-28, panorama,false,
L2017-10-28_avtoparo,18,L2017-10-28, avtoparo,false,
L2017-10-28_podzname,19,L2017-10-28, podzname,false,
L2017-10-28_duet,20,L2017-10-28, duet,false,
L2017-10-28_fontanka,21,L2017-10-28, fontanka,false,
L2017-10-28_proschanie,22,L2017-10-28, proschanie,false,
L2017-10-28_zaklinan,23,L2017-10-28, zaklinan,false,
L2017-10-28_sharmans,24,L2017-10-28, sharmans,false,
L2017-10-28_pamjativ,25,L2017-10-28, pamjativ,false,
L2017-10-28_bukvynak,26,L2017-10-28, bukvynak,false,
L2017-10-28_totosego,27,L2017-10-28, totosego,false,

17.10.2017 вт – Москва, бард-клуб "Гнездо глухаря", дуэт (гитара), "Своё чужое
L2017-10-28_mysvjaza,01*,L2017-10-28, mysvjaza,false,
L2017-10-28_sadvolsh,02*,L2017-10-28, sadvolsh,false,
L2017-10-28_gorizont,03*,L2017-10-28, gorizont,false,
L2017-10-28_vremjaid,04*,L2017-10-28, vremjaid,false,
L2017-10-28_dolinanm,05*,L2017-10-28, dolinanm,false,
L2017-10-28_dvasilue,06*,L2017-10-28, dvasilue,false,
L2017-10-28_mastergr,07*,L2017-10-28, mastergr,false,
L2017-10-28_polovodj,08*,L2017-10-28, polovodj,false,
L2017-10-28_axtrubym,09*,L2017-10-28, axtrubym,false,
L2017-10-28_prokotel,10*,L2017-10-28, prokotel,false,
L2017-10-28_axmalmn,11*,L2017-10-28, axmalmn,false,
L2017-10-28_sletalis,12*,L2017-10-28, sletalis,false,
L2017-10-28_exdanapr,13*,L2017-10-28, exdanapr,false,
L2017-10-28_nepokorn,14*,L2017-10-28, nepokorn,false,
L2017-10-28_nuchemte,15*,L2017-10-28, nuchemte,false,
L2017-10-28_sovestbl,16*,L2017-10-28, sovestbl,false,
---
L2017-10-28_oderjimy,17*,L2017-10-28, oderjimy,false,
L2017-10-28_sitzevyj,18*,L2017-10-28, sitzevyj,false,
L2017-10-28_tyvoschu,19*,L2017-10-28, tyvoschu,false,
L2017-10-28_birjuzov,20*,L2017-10-28, birjuzov,false,
L2017-10-28_javnovpo,21*,L2017-10-28, javnovpo,false,
L2017-10-28_rybachka,22*,L2017-10-28, rybachka,false,
L2017-10-28_tyvchemv,23*,L2017-10-28, tyvchemv,false,
L2017-10-28_ometro,24*,L2017-10-28, ometro,false,
L2017-10-28_smozarto,25*,L2017-10-28, smozarto,false,
L2017-10-28_yavysele,26*,L2017-10-28, yavysele,false,
L2017-10-28_ishlodiv,27*,L2017-10-28, ishlodiv,false,
L2017-10-28_vsemuvre,28*,L2017-10-28, vsemuvre,false,
L2017-10-28_nebudemx,29*,L2017-10-28, nebudemx,false,

23.09.2017 сб – Санкт-Петербург, КЗ "У Финляндского"
L2017-09-23_ryba,01,L2017-09-23, ryba,false,
L2017-09-23_krasnye,02,L2017-09-23, krasnye,false,
L2017-09-23_temapoleta,03,L2017-09-23, temapoleta,false,
L2017-09-23_esli,04,L2017-09-23, esli,false,
L2017-09-23_kupljubi,05,L2017-09-23, kupljubi,false,
L2017-09-23_deklarac,06,L2017-09-23, deklarac,false,
L2017-09-23_vpoxodny,07,L2017-09-23, vpoxodny,false,
L2017-09-23_voslavug,08,L2017-09-23, voslavug,false,
L2017-09-23_rusalka,09,L2017-09-23, rusalka,false,
L2017-09-23_istorija,10,L2017-09-23, istorija,false,
L2017-09-23_stenyusv,11,L2017-09-23, stenyusv,false,
L2017-09-23_kuznechiki,12,L2017-09-23, kuznechiki,false,
L2017-09-23_bukvynak,13,L2017-09-23, bukvynak,false,
L2017-09-23_neuzheli,14,L2017-09-23, neuzheli,false,
---
L2017-09-23_mneniche,15,L2017-09-23, mneniche,false,
L2017-09-23_duet,16,L2017-09-23, duet,false,
L2017-09-23_serenada,17,L2017-09-23, serenada,false,
L2017-09-23_panorama,18,L2017-09-23, panorama,false,
L2017-09-23_avtoparo,19,L2017-09-23, avtoparo,false,
L2017-09-23_ubykagol,20,L2017-09-23, ubykagol,false,
L2017-09-23_fontanka,21,L2017-09-23, fontanka,false,
L2017-09-23_proschanie,22,L2017-09-23, proschanie,false,
L2017-09-23_zaklinan,23,L2017-09-23, zaklinan,false,
L2017-09-23_trubach,24,L2017-09-23, trubach,false,
L2017-09-23_kogdaned,25,L2017-09-23, kogdaned,false,
L2017-09-23_nerazmen,26,L2017-09-23, nerazmen,false,

14.08.2017 пн – Москва, бард-клуб "Гнездо глухаря"
L2017-08-14_mneniche,01,L2017-08-14, mneniche,false,
L2017-08-14_kuznechiki,02,L2017-08-14, kuznechiki,false,
L2017-08-14_baltijsk,03,L2017-08-14, baltijsk,false,
L2017-08-14_nezabyva,04,L2017-08-14, nezabyva,false,
L2017-08-14_vpoxodny,05,L2017-08-14, vpoxodny,false,
L2017-08-14_dopoezda,06,L2017-08-14, dopoezda,false,
L2017-08-14_japodari,07,L2017-08-14, japodari,false,
L2017-08-14_temapoleta,08,L2017-08-14, temapoleta,false,
L2017-08-14_zaklinan,09,L2017-08-14, zaklinan,false,
L2017-08-14_volhonka,10,L2017-08-14, volhonka,false,
L2017-08-14_romansma,11,L2017-08-14, romansma,false,
L2017-08-14_zastolnaya,12,L2017-08-14, zastolnaya,false,
L2017-08-14_sentenci,13,L2017-08-14, sentenci,false,
---
L2017-08-14_serenada,14,L2017-08-14, serenada,false,
L2017-08-14_krasnye,15,L2017-08-14, krasnye,false,
L2017-08-14_volk,16,L2017-08-14, volk,false,
L2017-08-14_ubykagol,17,L2017-08-14, ubykagol,false,
L2017-08-14_avtoparo,18,L2017-08-14, avtoparo,false,
L2017-08-14_voslavug,19,L2017-08-14, voslavug,false,
L2017-08-14_udachny,20,L2017-08-14, udachny,false,
L2017-08-14_panorama,21,L2017-08-14, panorama,false,
L2017-08-14_nadvuhk,22,L2017-08-14, nadvuhk,false,
L2017-08-14_bukvynak,23,L2017-08-14, bukvynak,false,
L2017-08-14_sharmans,24,L2017-08-14, sharmans,false,

02.07.2017 вс – Москва, бард-клуб "Гнездо глухаря"
L2017-07-02_ryba,01,L2017-07-02, ryba,false,
L2017-07-02_kogdaned,02,L2017-07-02, kogdaned,false,
L2017-07-02_1992,03,L2017-07-02, 1992,false,
L2017-07-02_istorija,04,L2017-07-02, istorija,false,
L2017-07-02_cirkachk,05,L2017-07-02, cirkachk,false,
L2017-07-02_vekaplyv,06,L2017-07-02, vekaplyv,false,
L2017-07-02_rusalka,07,L2017-07-02, rusalka,false,
L2017-07-02_peterbur,08,L2017-07-02, peterbur,false,
L2017-07-02_proschanie,09,L2017-07-02, proschanie,false,
L2017-07-02_shkolat2,10,L2017-07-02, shkolat2,false,
L2017-07-02_stenyusv,11,L2017-07-02, stenyusv,false,
L2017-07-02_ubykagol,12,L2017-07-02, ubykagol,false,
L2017-07-02_desyatpe,13,L2017-07-02, desyatpe,false,
L2017-07-02_tirbayard,14,L2017-07-02, tirbayard,false,
---
L2017-07-02_nadeyus,15,L2017-07-02, nadeyus,false,
L2017-07-02_prenebre,16,L2017-07-02, prenebre,false,
L2017-07-02_jachashu,17,L2017-07-02, jachashu,false,
L2017-07-02_navescha,18,L2017-07-02, navescha,false,
L2017-07-02_traviata,19,L2017-07-02, traviata,false,
L2017-07-02_propadu,20,L2017-07-02, propadu,false,
L2017-07-02_serenada,21,L2017-07-02, serenada,false,
L2017-07-02_vademecu,22,L2017-07-02, vademecu,false,
L2017-07-02_kovcheg,23,L2017-07-02, kovcheg,false,
L2017-07-02_pesenkao,24,L2017-07-02, pesenkao,false,

28.05.2017 вс – Москва, бард-клуб "Гнездо глухаря"
L2017-05-28_krasnye,01,L2017-05-28, krasnye,false,
L2017-05-28_dopoezda,02,L2017-05-28, dopoezda,false,
L2017-05-28_kuznechiki,03,L2017-05-28, kuznechiki,false,
L2017-05-28_dendensk,04,L2017-05-28, dendensk,false,
L2017-05-28_kordebal,05,L2017-05-28, kordebal,false,
L2017-05-28_volk,06,L2017-05-28, volk,false,
L2017-05-28_pesenkao,07,L2017-05-28, pesenkao,false,
L2017-05-28_nezabyva,08,L2017-05-28, nezabyva,false,
L2017-05-28_uzhenera,09,L2017-05-28, uzhenera,false,
L2017-05-28_stenyusv,10,L2017-05-28, stenyusv,false,
L2017-05-28_nichemun,11,L2017-05-28, nichemun,false,
L2017-05-28_duet,12,L2017-05-28, duet,false,
---
L2017-05-28_suhumi,13,L2017-05-28, suhumi,false,
L2017-05-28_adleucon,14,L2017-05-28, adleucon,false,
L2017-05-28_panorama,15,L2017-05-28, panorama,false,
L2017-05-28_baltijsk,16,L2017-05-28, baltijsk,false,
L2017-05-28_trubach,17,L2017-05-28, trubach,false,
L2017-05-28_voslavug,18,L2017-05-28, voslavug,false,
L2017-05-28_mneniche,19,L2017-05-28, mneniche,false,
L2017-05-28_nadvuhk,20,L2017-05-28, nadvuhk,false,
L2017-05-28_sharmans,21,L2017-05-28, sharmans,false,
L2017-05-28_esli,22,L2017-05-28, esli,false,
L2017-05-28_chepuxa,23,L2017-05-28, chepuxa,false,
L2017-05-28_nerazmen,24,L2017-05-28, nerazmen,false,

04.05.2017 чт – Норвегия, Осло
L2017-05-04_zhizn,01,L2017-05-04, zhizn,false,
L2017-05-04_podzname,02,L2017-05-04, podzname,false,
L2017-05-04_zatemzhe,03,L2017-05-04, zatemzhe,false,
L2017-05-04_kuznechiki,04,L2017-05-04, kuznechiki,false,
L2017-05-04_volhonka,05,L2017-05-04, volhonka,false,
L2017-05-04_dendensk,06,L2017-05-04, dendensk,false,
L2017-05-04_suhumi,07,L2017-05-04, suhumi,false,
L2017-05-04_dopoezda,08,L2017-05-04, dopoezda,false,
L2017-05-04_vpoxodny,09,L2017-05-04, vpoxodny,false,
L2017-05-04_nezabyva,10,L2017-05-04, nezabyva,false,
L2017-05-04_vsetvoic,11,L2017-05-04, vsetvoic,false,
L2017-05-04_adleucon,12,L2017-05-04, adleucon,false,
L2017-05-04_baltijsk,13,L2017-05-04, baltijsk,false,
L2017-05-04_trubach,14,L2017-05-04, trubach,false,
L2017-05-04_sharmans,15,L2017-05-04, sharmans,false,
L2017-05-04_udachny,16,L2017-05-04, udachny,false,
L2017-05-04_temapoleta,17,L2017-05-04, temapoleta,false,
L2017-05-04_stixiopr,18,L2017-05-04, stixiopr,false,
L2017-05-04_alliluja,19,L2017-05-04, alliluja,false,
L2017-05-04_voslavug,20,L2017-05-04, voslavug,false,
L2017-05-04_fontanka,21,L2017-05-04, fontanka,false,
L2017-05-04_pamjativ,22,L2017-05-04, pamjativ,false,
L2017-05-04_nadvuhk,23,L2017-05-04, nadvuhk,false,
L2017-05-04_esli,24,L2017-05-04, esli,false,
L2017-05-04_chepuxa,25,L2017-05-04, chepuxa,false,
L2017-05-04_nerazmen,26,L2017-05-04, nerazmen,false,
L2017-05-04_totosego,27,L2017-05-04, totosego,false,

29.04.2017 сб – Москва, бард-клуб "Гнездо глухаря", 2 премьеры
L2017-04-29_nadeyus,01,L2017-04-29, nadeyus,false,
L2017-04-29_peshkom,02,L2017-04-29, peshkom,false,
L2017-04-29_voslavug,03,L2017-04-29, voslavug,false,
L2017-04-29_udachny,04,L2017-04-29, udachny,false,
L2017-04-29_podzname,05,L2017-04-29, podzname,false,
L2017-04-29_ballada,06,L2017-04-29, ballada,false,
L2017-04-29_rodljuds,07,L2017-04-29, rodljuds,false,
L2017-04-29_dendensk,08,L2017-04-29, dendensk,false,
L2017-04-29_eastcoast,09,L2017-04-29, eastcoast,false,
L2017-04-29_pamjativ,10,L2017-04-29, pamjativ,false,
L2017-04-29_nadvuhk,11,L2017-04-29, nadvuhk,false,
---
L2017-04-29_dopoezda,12,L2017-04-29, dopoezda,false,
L2017-04-29_zaklinan,13,L2017-04-29, zaklinan,false,
L2017-04-29_temapoleta,14,L2017-04-29, temapoleta,false,
L2017-04-29_epilog,15,L2017-04-29, epilog,false,
L2017-04-29_sharmans,16,L2017-04-29, sharmans,false,
L2017-04-29_uzhenera,17,L2017-04-29, uzhenera,true,
L2017-04-29_stenyusv,18,L2017-04-29, stenyusv,true,
L2017-04-29_avstrali,19,L2017-04-29, avstrali,false,
L2017-04-29_nerazmen,20,L2017-04-29, nerazmen,false,
L2017-04-29_totosego,21,L2017-04-29, totosego,false,

02.04.2017 вс – Нижегородская обл, бард-фестиваль "Музыка сердец - X"
L2017-04-02_nerazmen,01,L2017-04-02, nerazmen,false,
L2017-04-02_deja,02,L2017-04-02, deja,false,
L2017-04-02_podzname,03,L2017-04-02, podzname,false,
L2017-04-02_baltijsk,04,L2017-04-02, baltijsk,false,
L2017-04-02_kuznechiki,05,L2017-04-02, kuznechiki,false,
L2017-04-02_adleucon,06,L2017-04-02, adleucon,false,
L2017-04-02_stixiopr,07,L2017-04-02, stixiopr,false,
L2017-04-02_temapoleta,08,L2017-04-02, temapoleta,false,
L2017-04-02_volhonka,09,L2017-04-02, volhonka,false,
L2017-04-02_mneniche,10,L2017-04-02, mneniche,false,
L2017-04-02_nezabyva,11,L2017-04-02, nezabyva,false,
L2017-04-02_suhumi,12,L2017-04-02, suhumi,false,
L2017-04-02_dopoezda,13,L2017-04-02, dopoezda,false,
L2017-04-02_nadvuhk,14,L2017-04-02, nadvuhk,false,
L2017-04-02_esli,15,L2017-04-02, esli,false,
L2017-04-02_sharmans,16,L2017-04-02, sharmans,false,
L2017-04-02_pamjativ,17,L2017-04-02, pamjativ,false,
L2017-04-02_neuzheli,18,L2017-04-02, neuzheli,false,
L2017-04-02_totosego,19,L2017-04-02, totosego,false,

13.03.2017 пн – Москва, бард-клуб "Гнездо глухаря"
L2017-03-13_deja,01,L2017-03-13, deja,false,
L2017-03-13_krasnye,02,L2017-03-13, krasnye,false,
L2017-03-13_deklarac,03,L2017-03-13, deklarac,false,
L2017-03-13_etiglaza,04,L2017-03-13, etiglaza,false,
L2017-03-13_rusalka,05,L2017-03-13, rusalka,false,
L2017-03-13_voslavug,06,L2017-03-13, voslavug,false,
L2017-03-13_etoneja,07,L2017-03-13, etoneja,false,
L2017-03-13_ryba,08,L2017-03-13, ryba,false,
L2017-03-13_japodari,09,L2017-03-13, japodari,false,
L2017-03-13_vechnoes,10,L2017-03-13, vechnoes,false,
L2017-03-13_volhonka,11,L2017-03-13, volhonka,false,
L2017-03-13_esli,12,L2017-03-13, esli,false,
L2017-03-13_sharmans,13,L2017-03-13, sharmans,false,
L2017-03-13_totosego,14,L2017-03-13, totosego,false,
---
L2017-03-13_pesenkao,15,L2017-03-13, pesenkao,false,
L2017-03-13_nadeyus,16,L2017-03-13, nadeyus,false,
L2017-03-13_nerazmen,17,L2017-03-13, nerazmen,false,
L2017-03-13_nadpis,18,L2017-03-13, nadpis,false,
L2017-03-13_volk,19,L2017-03-13, volk,false,
L2017-03-13_chepuxa,20,L2017-03-13, chepuxa,false,
L2017-03-13_bukvynak,21,L2017-03-13, bukvynak,false,
L2017-03-13_pamjativ,22,L2017-03-13, pamjativ,false,
L2017-03-13_piter,23,L2017-03-13, piter,false,
L2017-03-13_zastolnaya,24,L2017-03-13, zastolnaya,false,

10.01.2017 вт – Москва, бард-клуб "Гнездо глухаря"
L2017-01-10_pesenkao,01,L2017-01-10, pesenkao,false,
L2017-01-10_nezabyva,02,L2017-01-10, nezabyva,false,
L2017-01-10_udachny,03,L2017-01-10, udachny,false,
L2017-01-10_kogoljub,04,L2017-01-10, kogoljub,false,
L2017-01-10_voslavug,05,L2017-01-10, voslavug,false,
L2017-01-10_kupljubi,06,L2017-01-10, kupljubi,false,
L2017-01-10_baltijsk,07,L2017-01-10, baltijsk,false,
L2017-01-10_adleucon,08,L2017-01-10, adleucon,false,
L2017-01-10_mneniche,09,L2017-01-10, mneniche,false,
L2017-01-10_vrjadli,10,L2017-01-10, vrjadli,false,
L2017-01-10_romans2,11,L2017-01-10, romans2,false,
L2017-01-10_peterbur,12,L2017-01-10, peterbur,false,
L2017-01-10_esli,13,L2017-01-10, esli,false,
L2017-01-10_panorama,14,L2017-01-10, panorama,false,
---
L2017-01-10_krasnye,15,L2017-01-10, krasnye,false,
L2017-01-10_proschanie,16,L2017-01-10, proschanie,false,
L2017-01-10_kinemat2,17,L2017-01-10, kinemat2,false,
L2017-01-10_navescha,18,L2017-01-10, navescha,false,
L2017-01-10_zaklinan,19,L2017-01-10, zaklinan,false,
L2017-01-10_pamjativ,20,L2017-01-10, pamjativ,false,
L2017-01-10_sharmans,21,L2017-01-10, sharmans,false,
L2017-01-10_chepuxa,22,L2017-01-10, chepuxa,false,
L2017-01-10_nerazmen,23,L2017-01-10, nerazmen,false,
L2017-01-10_totosego,24,L2017-01-10, totosego,false,


16.12.2016 пт – Израиль, Гиватаим, "Театр Гиватаим"
L2016-12-16_panorama,01,L2016-12-16, panorama,false,
L2016-12-16_voslavug,02,L2016-12-16, voslavug,false,
L2016-12-16_suhumi,03,L2016-12-16, suhumi,false,
L2016-12-16_peterbur,04,L2016-12-16, peterbur,false,
L2016-12-16_proschanie,05,L2016-12-16, proschanie,false,
L2016-12-16_baltijsk,06,L2016-12-16, baltijsk,false,
L2016-12-16_1995,07,L2016-12-16, 1995,false,
L2016-12-16_vsetvoic,08,L2016-12-16, vsetvoic,false,
L2016-12-16_adleucon,09,L2016-12-16, adleucon,false,
L2016-12-16_kuznechiki,10,L2016-12-16, kuznechiki,false,
L2016-12-16_neradisp,11,L2016-12-16, neradisp,false,
L2016-12-16_nezabyva,12,L2016-12-16, nezabyva,false,
L2016-12-16_netlubez,13,L2016-12-16, netlubez,false,
L2016-12-16_etiglaza,14,L2016-12-16, etiglaza,false,
L2016-12-16_dopoezda,15,L2016-12-16, dopoezda,false,
L2016-12-16_pamjativ,16,L2016-12-16, pamjativ,false,
L2016-12-16_bukvynak,17,L2016-12-16, bukvynak,false,
L2016-12-16_sharmans,18,L2016-12-16, sharmans,false,
L2016-12-16_udachny,19,L2016-12-16, udachny,false,
L2016-12-16_pesenkao,20,L2016-12-16, pesenkao,false,
L2016-12-16_neuzheli,21,L2016-12-16, neuzheli,false,
L2016-12-16_esli,22,L2016-12-16, esli,false,
L2016-12-16_nerazmen,23,L2016-12-16, nerazmen,false,
L2016-12-16_totosego,24,L2016-12-16, totosego,false,

14.12.2016 ср – Израиль, Хайфа, зал "Бейтену"
L2016-12-14_krasnye,01,L2016-12-14, krasnye,false,
L2016-12-14_voslavug,02,L2016-12-14, voslavug,false,
L2016-12-14_suhumi,03,L2016-12-14, suhumi,false,
L2016-12-14_proschanie,04,L2016-12-14, proschanie,false,
L2016-12-14_volhonka,05,L2016-12-14, volhonka,false,
L2016-12-14_stixiopr,06,L2016-12-14, stixiopr,false,
L2016-12-14_nezabyva,07,L2016-12-14, nezabyva,false,
L2016-12-14_baltijsk,08,L2016-12-14, baltijsk,false,
L2016-12-14_kuznechiki,09,L2016-12-14, kuznechiki,false,
L2016-12-14_chepuxa,10,L2016-12-14, chepuxa,false,
L2016-12-14_esli,11,L2016-12-14, esli,false,
L2016-12-14_netlubez,12,L2016-12-14, netlubez,false,
L2016-12-14_pesenkao,13,L2016-12-14, pesenkao,false,
L2016-12-14_neuzheli,14,L2016-12-14, neuzheli,false,
---
L2016-12-14_zaklinan,15,L2016-12-14, zaklinan,false,
L2016-12-14_gdetytep,16,L2016-12-14, gdetytep,false,
L2016-12-14_vsetvoic,17,L2016-12-14, vsetvoic,false,
L2016-12-14_adleucon,18,L2016-12-14, adleucon,false,
L2016-12-14_sharmans,19,L2016-12-14, sharmans,false,
L2016-12-14_udachny,20,L2016-12-14, udachny,false,
L2016-12-14_pamjativ,21,L2016-12-14, pamjativ,false,
L2016-12-14_bukvynak,22,L2016-12-14, bukvynak,false,
L2016-12-14_nerazmen,23,L2016-12-14, nerazmen,false,
L2016-12-14_totosego,24,L2016-12-14, totosego,false,

11.11.2016 пт – США, Seattle, WA
L2016-11-11_krasnye,01,L2016-11-11, krasnye,false,
L2016-11-11_voslavug,02,L2016-11-11, voslavug,false,
L2016-11-11_suhumi,03,L2016-11-11, suhumi,false,
L2016-11-11_dopoezda,04,L2016-11-11, dopoezda,false,
L2016-11-11_fontanka,05,L2016-11-11, fontanka,false,
L2016-11-11_proschanie,06,L2016-11-11, proschanie,false,
L2016-11-11_baltijsk,07,L2016-11-11, baltijsk,false,
L2016-11-11_adleucon,08,L2016-11-11, adleucon,false,
L2016-11-11_vsetvoic,09,L2016-11-11, vsetvoic,false,
L2016-11-11_etiglaza,10,L2016-11-11, etiglaza,false,
L2016-11-11_kuznechiki,11,L2016-11-11, kuznechiki,false,
L2016-11-11_chepuxa,12,L2016-11-11, chepuxa,false,
L2016-11-11_nerazmen,13,L2016-11-11, nerazmen,false,
L2016-11-11_volhonka,14,L2016-11-11, volhonka,false,
L2016-11-11_esli,15,L2016-11-11, esli,false,
---
L2016-11-11_nadeyus,16,L2016-11-11, nadeyus,false,
L2016-11-11_neuzheli,17,L2016-11-11, neuzheli,false,
L2016-11-11_zaklinan,18,L2016-11-11, zaklinan,false,
L2016-11-11_temapoleta,19,L2016-11-11, temapoleta,false,
L2016-11-11_stixiopr,20,L2016-11-11, stixiopr,false,
L2016-11-11_pesenkao,21,L2016-11-11, pesenkao,false,
L2016-11-11_mneniche,22,L2016-11-11, mneniche,false,
L2016-11-11_sharmans,23,L2016-11-11, sharmans,false,
L2016-11-11_avstrali,24,L2016-11-11, avstrali,false,
L2016-11-11_pamjativ,25,L2016-11-11, pamjativ,false,
L2016-11-11_bukvynak,26,L2016-11-11, bukvynak,false,
L2016-11-11_totosego,27,L2016-11-11, totosego,false,

01.11.2016 вт – Москва, бард-клуб "Гнездо глухаря", дуэт (клавиши)
L2016-11-01_rusalka,01,L2016-11-01, rusalka,false,
L2016-11-01_podzname,02,L2016-11-01, podzname,false,
L2016-11-01_etoja,03,L2016-11-01, etoja,false,
L2016-11-01_switzerl,04,L2016-11-01, switzerl,false,
L2016-11-01_descensu,05,L2016-11-01, descensu,false,
L2016-11-01_zaliv,06,L2016-11-01, zaliv,false,
L2016-11-01_rozhdest,07,L2016-11-01, rozhdest,false,
L2016-11-01_vpoxodny,08,L2016-11-01, vpoxodny,false,
L2016-11-01_posesche,09,L2016-11-01, posesche,false,
L2016-11-01_sentenci,10,L2016-11-01, sentenci,false,
L2016-11-01_chinatow,11,L2016-11-01, chinatow,false,
L2016-11-01_okean,12,L2016-11-01, okean,false,
L2016-11-01_opyattor,13,L2016-11-01, opyattor,false,
---
L2016-11-01_marija,14,L2016-11-01, marija,false,
L2016-11-01_drugajaz,15,L2016-11-01, drugajaz,false,
L2016-11-01_andante,16,L2016-11-01, andante,false,
L2016-11-01_lunnaja,17,L2016-11-01, lunnaja,false,
L2016-11-01_teplyj,18,L2016-11-01, teplyj,false,
L2016-11-01_eccehomo,19,L2016-11-01, eccehomo,false,
L2016-11-01_muzhajsj,20,L2016-11-01, muzhajsj,false,
L2016-11-01_shkolat1,21,L2016-11-01, shkolat1,false,
L2016-11-01_trubach,22,L2016-11-01, trubach,false,
L2016-11-01_kolybeln,23,L2016-11-01, kolybeln,false,

02.10.2016 вс – Москва, бард-клуб "Гнездо глухаря" (малый зал)
L2016-10-02_nadeyus,01,L2016-10-02, nadeyus,false,
L2016-10-02_chuzhaj2,02,L2016-10-02, chuzhaj2,false,
L2016-10-02_1990,03,L2016-10-02, 1990,false,
L2016-10-02_peterbur,04,L2016-10-02, peterbur,false,
L2016-10-02_gdetytep,05,L2016-10-02, gdetytep,false,
L2016-10-02_vsetvoic,06,L2016-10-02, vsetvoic,false,
L2016-10-02_nezabyva,07,L2016-10-02, nezabyva,false,
L2016-10-02_baltijsk,08,L2016-10-02, baltijsk,false,
L2016-10-02_sokolnik,09,L2016-10-02, sokolnik,false,
L2016-10-02_kakojkos,10,L2016-10-02, kakojkos,false,
L2016-10-02_nerazmen,11,L2016-10-02, nerazmen,false,
L2016-10-02_pochtina,12,L2016-10-02, pochtina,false,
L2016-10-02_avstrali,13,L2016-10-02, avstrali,false,
---
L2016-10-02_udachny,14,L2016-10-02, udachny,false,
L2016-10-02_nadvuhk,15,L2016-10-02, nadvuhk,false,
L2016-10-02_kinemat2,16,L2016-10-02, kinemat2,false,
L2016-10-02_zavescha,17,L2016-10-02, zavescha,false,
L2016-10-02_japodari,18,L2016-10-02, japodari,false,
L2016-10-02_vademecu,19,L2016-10-02, vademecu,false,
L2016-10-02_sharmans,20,L2016-10-02, sharmans,false,
L2016-10-02_chepuxa,21,L2016-10-02, chepuxa,false,
L2016-10-02_esli,22,L2016-10-02, esli,false,
L2016-10-02_totosego,23,L2016-10-02, totosego,false,

22.09.2016 чт – Санкт-Петербург, КЗ "У Финляндского"
L2016-09-22_nadeyus,01,L2016-09-22, nadeyus,false,
L2016-09-22_podzname,02,L2016-09-22, podzname,false,
L2016-09-22_volk,03,L2016-09-22, volk,false,
L2016-09-22_suhumi,04,L2016-09-22, suhumi,false,
L2016-09-22_1995,05,L2016-09-22, 1995,false,
L2016-09-22_vsetvoic,06,L2016-09-22, vsetvoic,false,
L2016-09-22_adleucon,07,L2016-09-22, adleucon,false,
L2016-09-22_baltijsk,08,L2016-09-22, baltijsk,false,
L2016-09-22_dopoezda,09,L2016-09-22, dopoezda,false,
L2016-09-22_netlubez,10,L2016-09-22, netlubez,false,
L2016-09-22_nezabyva,11,L2016-09-22, nezabyva,false,
L2016-09-22_etiglaza,12,L2016-09-22, etiglaza,false,
L2016-09-22_volhonka,13,L2016-09-22, volhonka,false,
L2016-09-22_stixiopr,14,L2016-09-22, stixiopr,false,
L2016-09-22_udachny,15,L2016-09-22, udachny,false,
L2016-09-22_neuzheli,16,L2016-09-22, neuzheli,false,
---
L2016-09-22_japodari,17,L2016-09-22, japodari,false,
L2016-09-22_nadvuhk,18,L2016-09-22, nadvuhk,false,
L2016-09-22_pesenkao,19,L2016-09-22, pesenkao,false,
L2016-09-22_zaliv,20,L2016-09-22, zaliv,false,
L2016-09-22_navescha,21,L2016-09-22, navescha,false,
L2016-09-22_gdetytep,22,L2016-09-22, gdetytep,false,
L2016-09-22_shkolat2,23,L2016-09-22, shkolat2,false,
L2016-09-22_sharmans,24,L2016-09-22, sharmans,false,
L2016-09-22_pamjativ,25,L2016-09-22, pamjativ,false,
L2016-09-22_bukvynak,26,L2016-09-22, bukvynak,false,
L2016-09-22_neradisp,27,L2016-09-22, neradisp,false,
L2016-09-22_totosego,28,L2016-09-22, totosego,false,

09.09.2016 пт – Киев, Республиканский Дом актёра
L2016-09-09_podzname,01,L2016-09-09, podzname,false,
L2016-09-09_dopoezda,02,L2016-09-09, dopoezda,false,
L2016-09-09_nadeyus,03,L2016-09-09, nadeyus,false,
L2016-09-09_pesenkao,04,L2016-09-09, pesenkao,false,
L2016-09-09_netlubez,05,L2016-09-09, netlubez,false,
L2016-09-09_nezabyva,06,L2016-09-09, nezabyva,false,
L2016-09-09_fontanka,07,L2016-09-09, fontanka,false,
L2016-09-09_proschanie,08,L2016-09-09, proschanie,false,
L2016-09-09_baltijsk,09,L2016-09-09, baltijsk,false,
L2016-09-09_adleucon,10,L2016-09-09, adleucon,false,
L2016-09-09_stixiopr,11,L2016-09-09, stixiopr,false,
L2016-09-09_etiglaza,12,L2016-09-09, etiglaza,false,
L2016-09-09_temapoleta,13,L2016-09-09, temapoleta,false,
L2016-09-09_udachny,14,L2016-09-09, udachny,false,
L2016-09-09_neuzheli,15,L2016-09-09, neuzheli,false,
---
L2016-09-09_ryba,16,L2016-09-09, ryba,false,
L2016-09-09_suhumi,17,L2016-09-09, suhumi,false,
L2016-09-09_nadvuhk,18,L2016-09-09, nadvuhk,false,
L2016-09-09_shkolat2,19,L2016-09-09, shkolat2,false,
L2016-09-09_zaliv,20,L2016-09-09, zaliv,false,
L2016-09-09_gdetytep,21,L2016-09-09, gdetytep,false,
L2016-09-09_korablik,22,L2016-09-09, korablik,false,
L2016-09-09_zatemzhe,23,L2016-09-09, zatemzhe,false,
L2016-09-09_bukvynak,24,L2016-09-09, bukvynak,false,
L2016-09-09_pamjativ,25,L2016-09-09, pamjativ,false,
L2016-09-09_sharmans,26,L2016-09-09, sharmans,false,
L2016-09-09_totosego,27,L2016-09-09, totosego,false,

07.09.2016 ср – Харьков, Дом учёных
L2016-09-07_nerazmen,01,L2016-09-07, nerazmen,false,
L2016-09-07_peterbur,02,L2016-09-07, peterbur,false,
L2016-09-07_proschanie,03,L2016-09-07, proschanie,false,
L2016-09-07_baltijsk,04,L2016-09-07, baltijsk,false,
L2016-09-07_dopoezda,05,L2016-09-07, dopoezda,false,
L2016-09-07_vpoxodny,06,L2016-09-07, vpoxodny,false,
L2016-09-07_nezabyva,07,L2016-09-07, nezabyva,false,
L2016-09-07_netlubez,08,L2016-09-07, netlubez,false,
L2016-09-07_romans2,09,L2016-09-07, romans2,false,
L2016-09-07_podzname,10,L2016-09-07, podzname,false,
L2016-09-07_adleucon,11,L2016-09-07, adleucon,false,
L2016-09-07_stixiopr,12,L2016-09-07, stixiopr,false,
L2016-09-07_udachny,13,L2016-09-07, udachny,false,
L2016-09-07_neuzheli,14,L2016-09-07, neuzheli,false,
L2016-09-07_pesenkao,15,L2016-09-07, pesenkao,false,
---
L2016-09-07_suhumi,16,L2016-09-07, suhumi,false,
L2016-09-07_shkolat2,17,L2016-09-07, shkolat2,false,
L2016-09-07_gdetytep,18,L2016-09-07, gdetytep,false,
L2016-09-07_zaklinan,19,L2016-09-07, zaklinan,false,
L2016-09-07_nadvuhk,20,L2016-09-07, nadvuhk,false,
L2016-09-07_sharmans,21,L2016-09-07, sharmans,false,
L2016-09-07_pamjativ,22,L2016-09-07, pamjativ,false,
L2016-09-07_esli,23,L2016-09-07, esli,false,
L2016-09-07_alliluja,24,L2016-09-07, alliluja,false,
L2016-09-07_totosego,25,L2016-09-07, totosego,false,
L2016-09-07_vishnevo,26,L2016-09-07, vishnevo,false,

04.09.2016 вс – Москва, бард-клуб "Гнездо глухаря"
L2016-09-04_kordebal,01,L2016-09-04, kordebal,false,
L2016-09-04_volk,02,L2016-09-04, volk,false,
L2016-09-04_nadvuhk,03,L2016-09-04, nadvuhk,false,
L2016-09-04_volhonka,04,L2016-09-04, volhonka,false,
L2016-09-04_netlubez,05,L2016-09-04, netlubez,false,
L2016-09-04_peterbur,06,L2016-09-04, peterbur,false,
L2016-09-04_vsetvoic,07,L2016-09-04, vsetvoic,false,
L2016-09-04_etiglaza,08,L2016-09-04, etiglaza,false,
L2016-09-04_udachny,09,L2016-09-04, udachny,false,
L2016-09-04_esli,10,L2016-09-04, esli,false,
L2016-09-04_podzname,11,L2016-09-04, podzname,false,
L2016-09-04_baltijsk,12,L2016-09-04, baltijsk,false,
L2016-09-04_alliluja,13,L2016-09-04, alliluja,false,
L2016-09-04_stixiopr,14,L2016-09-04, stixiopr,false,
L2016-09-04_panorama,15,L2016-09-04, panorama,false,
---
L2016-09-04_uzhesli,16,L2016-09-04, uzhesli,false,
L2016-09-04_shkolat2,17,L2016-09-04, shkolat2,false,
L2016-09-04_gdetytep,18,L2016-09-04, gdetytep,false,
L2016-09-04_zaklinan,19,L2016-09-04, zaklinan,false,
L2016-09-04_proschanie,20,L2016-09-04, proschanie,false,
L2016-09-04_adleucon,21,L2016-09-04, adleucon,false,
L2016-09-04_celoelet,22,L2016-09-04, celoelet,false,
L2016-09-04_vechnoes,23,L2016-09-04, vechnoes,false,
L2016-09-04_naivnopo,24,L2016-09-04, naivnopo,false,
L2016-09-04_sharmans,25,L2016-09-04, sharmans,false,
L2016-09-04_totosego,26,L2016-09-04, totosego,false,

16.08.2016 вт – Москва, бард-клуб "Гнездо глухаря", дуэт (гитара)
L2016-08-16_kibitka,01,L2016-08-16, kibitka,false,
L2016-08-16_paris,02,L2016-08-16, paris,false,
L2016-08-16_navsejz1,03,L2016-08-16, navsejz1,false,
L2016-08-16_romans1,04,L2016-08-16, romans1,false,
L2016-08-16_opyatpar,05,L2016-08-16, opyatpar,false,
L2016-08-16_proschan,06,L2016-08-16, proschan,false,
L2016-08-16_karavan,07,L2016-08-16, karavan,false,
L2016-08-16_sezondoz,08,L2016-08-16, sezondoz,false,
L2016-08-16_balagan2,09,L2016-08-16, balagan2,false,
L2016-08-16_svidanie,10,L2016-08-16, svidanie,false,
L2016-08-16_romansma,11,L2016-08-16, romansma,false,
L2016-08-16_ljubov,12,L2016-08-16, ljubov,false,
L2016-08-16_farmacev,13,L2016-08-16, farmacev,false,
L2016-08-16_birjuzov,14*,L2016-08-16, birjuzov,false,
L2016-08-16_tyvchemv,15*,L2016-08-16, tyvchemv,false,
L2016-08-16_tyvoschu,16*,L2016-08-16, tyvoschu,false,
---
L2016-08-16_korablik,17,L2016-08-16, korablik,false,
L2016-08-16_konecned,18,L2016-08-16, konecned,false,
L2016-08-16_nenadoby,19,L2016-08-16, nenadoby,false,
L2016-08-16_puskaj,20,L2016-08-16, puskaj,false,
L2016-08-16_marija,21,L2016-08-16, marija,false,
L2016-08-16_vekaplyv,22,L2016-08-16, vekaplyv,false,
L2016-08-16_sharmans,23,L2016-08-16, sharmans,false,
L2016-08-16_vtornik,24,L2016-08-16, vtornik,false,
L2016-08-16_kolybeln,25,L2016-08-16, kolybeln,false,
L2016-08-16_vosxodja,26,L2016-08-16, vosxodja,false,

22.07.2016 пт – Москва, бард-клуб "Гнездо глухаря"
L2016-07-22_kuznechiki,01,L2016-07-22, kuznechiki,false,
L2016-07-22_nadeyus,02,L2016-07-22, nadeyus,false,
L2016-07-22_volk,03,L2016-07-22, volk,false,
L2016-07-22_suhumi,04,L2016-07-22, suhumi,false,
L2016-07-22_voslavug,05,L2016-07-22, voslavug,false,
L2016-07-22_japodari,06,L2016-07-22, japodari,false,
L2016-07-22_fontanka,07,L2016-07-22, fontanka,false,
L2016-07-22_proschanie,08,L2016-07-22, proschanie,false,
L2016-07-22_baltijsk,09,L2016-07-22, baltijsk,false,
L2016-07-22_volhonka,10,L2016-07-22, volhonka,false,
L2016-07-22_dendensk,11,L2016-07-22, dendensk,false,
L2016-07-22_zatemzhe,12,L2016-07-22, zatemzhe,false,
L2016-07-22_shkolat2,13,L2016-07-22, shkolat2,false,
L2016-07-22_neuzheli,14,L2016-07-22, neuzheli,false,
---
L2016-07-22_krasnye,15,L2016-07-22, krasnye,false,
L2016-07-22_adleucon,16,L2016-07-22, adleucon,false,
L2016-07-22_navescha,17,L2016-07-22, navescha,false,
L2016-07-22_nerazmen,18,L2016-07-22, nerazmen,false,
L2016-07-22_chuzhaj1,19,L2016-07-22, chuzhaj1,false,
L2016-07-22_udachny,20,L2016-07-22, udachny,false,
L2016-07-22_esli,21,L2016-07-22, esli,false,
L2016-07-22_neradisp,22,L2016-07-22, neradisp,false,
L2016-07-22_chepuxa,23,L2016-07-22, chepuxa,false,
L2016-07-22_totosego,24,L2016-07-22, totosego,false,

29.06.2016 ср – Москва, театр Елены Камбуровой
L2016-06-29_1992,01,L2016-06-29, 1992,false,
L2016-06-29_podzname,02,L2016-06-29, podzname,false,
L2016-06-29_zhizn,03,L2016-06-29, zhizn,false,
L2016-06-29_cirkachk,04,L2016-06-29, cirkachk,false,
L2016-06-29_traviata,05,L2016-06-29, traviata,false,
L2016-06-29_vsetvoic,06,L2016-06-29, vsetvoic,false,
L2016-06-29_zaliv,07,L2016-06-29, zaliv,false,
L2016-06-29_propadu,08,L2016-06-29, propadu,false,
L2016-06-29_kogdaned,09,L2016-06-29, kogdaned,false,
L2016-06-29_kuznechiki,10,L2016-06-29, kuznechiki,false,
L2016-06-29_ubykagol,11,L2016-06-29, ubykagol,false,
L2016-06-29_shkolat2,12,L2016-06-29, shkolat2,false,
L2016-06-29_temapoleta,13,L2016-06-29, temapoleta,false,
L2016-06-29_udachny,14,L2016-06-29, udachny,false,
L2016-06-29_neuzheli,15,L2016-06-29, neuzheli,false,
L2016-06-29_vpoxodny,16,L2016-06-29, vpoxodny,false,
L2016-06-29_baltijsk,17,L2016-06-29, baltijsk,false,
L2016-06-29_nezabyva,18,L2016-06-29, nezabyva,false,
L2016-06-29_dopoezda,19,L2016-06-29, dopoezda,false,
L2016-06-29_nadvuhk,20,L2016-06-29, nadvuhk,false,
L2016-06-29_bukvynak,21,L2016-06-29, bukvynak,false,
L2016-06-29_pamjativ,22,L2016-06-29, pamjativ,false,
L2016-06-29_sharmans,23,L2016-06-29, sharmans,false,

31.05.2016 вт – Москва, бард-клуб "Гнездо глухаря"
L2016-05-31_ryba,01,L2016-05-31, ryba,false,
L2016-05-31_kordebal,02,L2016-05-31, kordebal,false,
L2016-05-31_dendensk,03,L2016-05-31, dendensk,false,
L2016-05-31_avtoparo,04,L2016-05-31, avtoparo,false,
L2016-05-31_suhumi,05,L2016-05-31, suhumi,false,
L2016-05-31_shkolat2,06,L2016-05-31, shkolat2,false,
L2016-05-31_gdetytep,07,L2016-05-31, gdetytep,false,
L2016-05-31_esli,08,L2016-05-31, esli,false,
L2016-05-31_volhonka,09,L2016-05-31, volhonka,false,
L2016-05-31_baltijsk,10,L2016-05-31, baltijsk,false,
L2016-05-31_nezabyva,11,L2016-05-31, nezabyva,false,
L2016-05-31_udachny,12,L2016-05-31, udachny,false,
L2016-05-31_pamjativ,13,L2016-05-31, pamjativ,false,
L2016-05-31_nadvuhk,14,L2016-05-31, nadvuhk,false,
L2016-05-31_naivnopo,15,L2016-05-31, naivnopo,false,
---
L2016-05-31_podzname,16,L2016-05-31, podzname,false,
L2016-05-31_zaklinan,17,L2016-05-31, zaklinan,false,
L2016-05-31_pochtina,18,L2016-05-31, pochtina,false,
L2016-05-31_stixiopr,19,L2016-05-31, stixiopr,false,
L2016-05-31_voslavug,20,L2016-05-31, voslavug,false,
L2016-05-31_peterbur,21,L2016-05-31, peterbur,false,
L2016-05-31_vechnoes,22,L2016-05-31, vechnoes,false,
L2016-05-31_totosego,23,L2016-05-31, totosego,false,
L2016-05-31_chepuxa,24,L2016-05-31, chepuxa,false,

24.04.2016 вс – США, Old Brookville, NY
L2016-04-24_krasnye,01,L2016-04-24, krasnye,false,
L2016-04-24_zhizn,02,L2016-04-24, zhizn,false,
L2016-04-24_proschanie,03,L2016-04-24, proschanie,false,
L2016-04-24_suhumi,04,L2016-04-24, suhumi,false,
L2016-04-24_dopoezda,05,L2016-04-24, dopoezda,false,
L2016-04-24_romans2,06,L2016-04-24, romans2,false,
L2016-04-24_udachny,07,L2016-04-24, udachny,false,
L2016-04-24_nezabyva,08,L2016-04-24, nezabyva,false,
L2016-04-24_deja,09,L2016-04-24, deja,false,
L2016-04-24_baltijsk,10,L2016-04-24, baltijsk,false,
L2016-04-24_bukvynak,11,L2016-04-24, bukvynak,false,
L2016-04-24_pamjativ,12,L2016-04-24, pamjativ,false,
L2016-04-24_ryba,13,L2016-04-24, ryba,false,
L2016-04-24_adleucon,14,L2016-04-24, adleucon,false,
L2016-04-24_volhonka,15,L2016-04-24, volhonka,false,
---
L2016-04-24_kuznechiki,16,L2016-04-24, kuznechiki,false,
L2016-04-24_nesmogna,17,L2016-04-24, nesmogna,false,
L2016-04-24_zvezdoch,18,L2016-04-24, zvezdoch,false,
L2016-04-24_ubykagol,19,L2016-04-24, ubykagol,false,
L2016-04-24_pesenkao,20,L2016-04-24, pesenkao,false,
L2016-04-24_gdetytep,21,L2016-04-24, gdetytep,false,
L2016-04-24_alliluja,22,L2016-04-24, alliluja,false,
L2016-04-24_neuzheli,23,L2016-04-24, neuzheli,false,
L2016-04-24_nadvuhk,24,L2016-04-24, nadvuhk,false,
L2016-04-24_esli,25,L2016-04-24, esli,false,
L2016-04-24_sharmans,26,L2016-04-24, sharmans,false,
L2016-04-24_chepuxa,27,L2016-04-24, chepuxa,false,
L2016-04-24_nerazmen,28,L2016-04-24, nerazmen,false,

23.04.2016 сб – США, Brooklyn, NY
L2016-04-23_krasnye,01,L2016-04-23, krasnye,false,
L2016-04-23_dopoezda,02,L2016-04-23, dopoezda,false,
L2016-04-23_suhumi,03,L2016-04-23, suhumi,false,
L2016-04-23_rodljuds,04,L2016-04-23, rodljuds,false,
L2016-04-23_netlubez,05,L2016-04-23, netlubez,false,
L2016-04-23_nezabyva,06,L2016-04-23, nezabyva,false,
L2016-04-23_baltijsk,07,L2016-04-23, baltijsk,false,
L2016-04-23_volhonka,08,L2016-04-23, volhonka,false,
L2016-04-23_pamjativ,09,L2016-04-23, pamjativ,false,
L2016-04-23_bukvynak,10,L2016-04-23, bukvynak,false,
L2016-04-23_chepuxa,11,L2016-04-23, chepuxa,false,
L2016-04-23_neuzheli,12,L2016-04-23, neuzheli,false,
L2016-04-23_totosego,13,L2016-04-23, totosego,false,
---
L2016-04-23_vechnoes,14,L2016-04-23, vechnoes,false,
L2016-04-23_nadvuhk,15,L2016-04-23, nadvuhk,false,
L2016-04-23_esli,16,L2016-04-23, esli,false,
L2016-04-23_udachny,17,L2016-04-23, udachny,false,
L2016-04-23_gdetytep,18,L2016-04-23, gdetytep,false,
L2016-04-23_alliluja,19,L2016-04-23, alliluja,false,
L2016-04-23_voslavug,20,L2016-04-23, voslavug,false,
L2016-04-23_naivnopo,21,L2016-04-23, naivnopo,false,
L2016-04-23_brodjagi,22,L2016-04-23, brodjagi,false,
L2016-04-23_stixiopr,23,L2016-04-23, stixiopr,false,
L2016-04-23_shkolat2,24,L2016-04-23, shkolat2,false,
L2016-04-23_sharmans,25,L2016-04-23, sharmans,false,
L2016-04-23_pesenkao,26,L2016-04-23, pesenkao,false,

21.04.2016 чт – США, Boston, MA
L2016-04-21_nerazmen,01,L2016-04-21, nerazmen,false,
L2016-04-21_1995,02,L2016-04-21, 1995,false,
L2016-04-21_avtoparo,03,L2016-04-21, avtoparo,false,
L2016-04-21_zaliv,04,L2016-04-21, zaliv,false,
L2016-04-21_godshel,05,L2016-04-21, godshel,false,
L2016-04-21_volhonka,06,L2016-04-21, volhonka,false,
L2016-04-21_baltijsk,07,L2016-04-21, baltijsk,false,
L2016-04-21_netlubez,08,L2016-04-21, netlubez,false,
L2016-04-21_japodari,09,L2016-04-21, japodari,false,
L2016-04-21_nezabyva,10,L2016-04-21, nezabyva,false,
L2016-04-21_neuzheli,11,L2016-04-21, neuzheli,false,
L2016-04-21_chepuxa,12,L2016-04-21, chepuxa,false,
---
L2016-04-21_tirbayard,13,L2016-04-21, tirbayard,false,
L2016-04-21_avstrali,14,L2016-04-21, avstrali,false,
L2016-04-21_udachny,15,L2016-04-21, udachny,false,
L2016-04-21_rodljuds,16,L2016-04-21, rodljuds,false,
L2016-04-21_gdetytep,17,L2016-04-21, gdetytep,false,
L2016-04-21_brodjagi,18,L2016-04-21, brodjagi,false,
L2016-04-21_shkolat2,19,L2016-04-21, shkolat2,false,
L2016-04-21_neradisp,20,L2016-04-21, neradisp,false,
L2016-04-21_vechnoes,21,L2016-04-21, vechnoes,false,
L2016-04-21_totosego,22,L2016-04-21, totosego,false,

16.04.2016 сб – Москва, бард-клуб "Гнездо глухаря"
L2016-04-16_jachashu,01,L2016-04-16, jachashu,false,
L2016-04-16_tirbayard,02,L2016-04-16, tirbayard,false,
L2016-04-16_avtoparo,03,L2016-04-16, avtoparo,false,
L2016-04-16_volhonka,04,L2016-04-16, volhonka,false,
L2016-04-16_godshel,05,L2016-04-16, godshel,false,
L2016-04-16_adleucon,06,L2016-04-16, adleucon,false,
L2016-04-16_baltijsk,07,L2016-04-16, baltijsk,false,
L2016-04-16_totosego,08,L2016-04-16, totosego,false,
L2016-04-16_vekaplyv,09,L2016-04-16, vekaplyv,false,
L2016-04-16_udachny,10,L2016-04-16, udachny,false,
L2016-04-16_dopoezda,11,L2016-04-16, dopoezda,false,
L2016-04-16_piter,12,L2016-04-16, piter,false,
L2016-04-16_sentenci,13,L2016-04-16, sentenci,false,
L2016-04-16_svidanie,14,L2016-04-16, svidanie,false,
L2016-04-16_zastolnaya,15,L2016-04-16, zastolnaya,false,
---
L2016-04-16_gdetytep,16,L2016-04-16, gdetytep,false,
L2016-04-16_suhumi,17,L2016-04-16, suhumi,false,
L2016-04-16_sharmans,18,L2016-04-16, sharmans,false,
L2016-04-16_zaliv,19,L2016-04-16, zaliv,false,
L2016-04-16_rodljuds,20,L2016-04-16, rodljuds,false,
L2016-04-16_voslavug,21,L2016-04-16, voslavug,false,
L2016-04-16_krasnye,22,L2016-04-16, krasnye,false,
L2016-04-16_proschanie,23,L2016-04-16, proschanie,false,
L2016-04-16_chepuxa,24,L2016-04-16, chepuxa,false,
L2016-04-16_alliluja,25,L2016-04-16, alliluja,false,

16.03.2016 ср – Москва, бард-клуб "Гнездо глухаря"
L2016-03-16_menuet,01,L2016-03-16, menuet,false,
L2016-03-16_rusalka,02,L2016-03-16, rusalka,false,
L2016-03-16_kadril,03,L2016-03-16, kadril,false,
L2016-03-16_deklarac,04,L2016-03-16, deklarac,false,
L2016-03-16_volhonka,05,L2016-03-16, volhonka,false,
L2016-03-16_baltijsk,06,L2016-03-16, baltijsk,false,
L2016-03-16_zatemzhe,07,L2016-03-16, zatemzhe,false,
L2016-03-16_vpotokah,08,L2016-03-16, vpotokah,false,
L2016-03-16_krasnye,09,L2016-03-16, krasnye,false,
L2016-03-16_netlubez,10,L2016-03-16, netlubez,false,
L2016-03-16_nezabyva,11,L2016-03-16, nezabyva,false,
L2016-03-16_nadvuhk,12,L2016-03-16, nadvuhk,false,
L2016-03-16_totosego,13,L2016-03-16, totosego,false,
L2016-03-16_romansma,14,L2016-03-16, romansma,false,
---
L2016-03-16_esli,15,L2016-03-16, esli,false,
L2016-03-16_shkolat2,16,L2016-03-16, shkolat2,false,
L2016-03-16_udachny,17,L2016-03-16, udachny,false,
L2016-03-16_voslavug,18,L2016-03-16, voslavug,false,
L2016-03-16_naivnopo,19,L2016-03-16, naivnopo,false,
L2016-03-16_romans2,20,L2016-03-16, romans2,false,
L2016-03-16_vademecu,21,L2016-03-16, vademecu,false,
L2016-03-16_navescha,22,L2016-03-16, navescha,false,
L2016-03-16_vsetvoic,23,L2016-03-16, vsetvoic,false,
L2016-03-16_pesenkao,24,L2016-03-16, pesenkao,false,

11.03.2016 пт – Мурманск, Областной театр кукол
L2016-03-11_1992,01,L2016-03-11, 1992,false,
L2016-03-11_zhizn,02,L2016-03-11, zhizn,false,
L2016-03-11_ubykagol,03,L2016-03-11, ubykagol,false,
L2016-03-11_serenada,04,L2016-03-11, serenada,false,
L2016-03-11_kuznechiki,05,L2016-03-11, kuznechiki,false,
L2016-03-11_volhonka,06,L2016-03-11, volhonka,false,
L2016-03-11_zatemzhe,07,L2016-03-11, zatemzhe,false,
L2016-03-11_temapoleta,08,L2016-03-11, temapoleta,false,
L2016-03-11_stixiopr,09,L2016-03-11, stixiopr,false,
L2016-03-11_dendensk,10,L2016-03-11, dendensk,false,
L2016-03-11_krasnye,11,L2016-03-11, krasnye,false,
L2016-03-11_fontanka,12,L2016-03-11, fontanka,false,
L2016-03-11_nezabyva,13,L2016-03-11, nezabyva,false,
L2016-03-11_vpoxodny,14,L2016-03-11, vpoxodny,false,
L2016-03-11_odnazhdy,15,L2016-03-11, odnazhdy,false,
L2016-03-11_sharmans,16,L2016-03-11, sharmans,false,
---
L2016-03-11_podzname,17,L2016-03-11, podzname,false,
L2016-03-11_dopoezda,18,L2016-03-11, dopoezda,false,
L2016-03-11_suhumi,19,L2016-03-11, suhumi,false,
L2016-03-11_voslavug,20,L2016-03-11, voslavug,false,
L2016-03-11_adleucon,21,L2016-03-11, adleucon,false,
L2016-03-11_mneniche,22,L2016-03-11, mneniche,false,
L2016-03-11_deja,23,L2016-03-11, deja,false,
L2016-03-11_romans2,24,L2016-03-11, romans2,false,
L2016-03-11_totosego,25,L2016-03-11, totosego,false,
L2016-03-11_nadvuhk,26,L2016-03-11, nadvuhk,false,
L2016-03-11_esli,27,L2016-03-11, esli,false,
L2016-03-11_pamjativ,28,L2016-03-11, pamjativ,false,
L2016-03-11_chepuxa,29,L2016-03-11, chepuxa,false,
L2016-03-11_nerazmen,30,L2016-03-11, nerazmen,false,
L2016-03-11_trubach,31,L2016-03-11, trubach,false,

28.02.2016 вс – Австралия, Мельбурн
L2016-02-28_zhizn,01,L2016-02-28, zhizn,false,
L2016-02-28_sharmans,02,L2016-02-28, sharmans,false,
L2016-02-28_podzname,03,L2016-02-28, podzname,false,
L2016-02-28_suhumi,04,L2016-02-28, suhumi,false,
L2016-02-28_volk,05,L2016-02-28, volk,false,
L2016-02-28_krasnye,06,L2016-02-28, krasnye,false,
L2016-02-28_dendensk,07,L2016-02-28, dendensk,false,
L2016-02-28_zatemzhe,08,L2016-02-28, zatemzhe,false,
L2016-02-28_temapoleta,09,L2016-02-28, temapoleta,false,
L2016-02-28_ubykagol,10,L2016-02-28, ubykagol,false,
L2016-02-28_serenada,11,L2016-02-28, serenada,false,
L2016-02-28_peterbur,12,L2016-02-28, peterbur,false,
L2016-02-28_baltijsk,13,L2016-02-28, baltijsk,false,
L2016-02-28_kuznechiki,14,L2016-02-28, kuznechiki,false,
L2016-02-28_volhonka,15,L2016-02-28, volhonka,false,
L2016-02-28_esli,16,L2016-02-28, esli,false,
---
L2016-02-28_navescha,17,L2016-02-28, navescha,false,
L2016-02-28_mneniche,18,L2016-02-28, mneniche,false,
L2016-02-28_deja,19,L2016-02-28, deja,false,
L2016-02-28_ryba,10,L2016-02-28, ryba,false,
L2016-02-28_adleucon,11,L2016-02-28, adleucon,false,
L2016-02-28_vpoxodny,22,L2016-02-28, vpoxodny,false,
L2016-02-28_1995,23,L2016-02-28, 1995,false,
L2016-02-28_totosego,24,L2016-02-28, totosego,false,
L2016-02-28_pamjativ,25,L2016-02-28, pamjativ,false,
L2016-02-28_bukvynak,26,L2016-02-28, bukvynak,false,
L2016-02-28_chepuxa,27,L2016-02-28, chepuxa,false,
L2016-02-28_nerazmen,28,L2016-02-28, nerazmen,false,

20.02.2016 сб – Австралия, Сидней
L2016-02-20_sharmans,01,L2016-02-20, sharmans,false,
L2016-02-20_podzname,02,L2016-02-20, podzname,false,
L2016-02-20_serenada,03,L2016-02-20, serenada,false,
L2016-02-20_kuznechiki,04,L2016-02-20, kuznechiki,false,
L2016-02-20_volhonka,05,L2016-02-20, volhonka,false,
L2016-02-20_dendensk,06,L2016-02-20, dendensk,false,
L2016-02-20_odnazhdy,07,L2016-02-20, odnazhdy,false,
L2016-02-20_ubykagol,08,L2016-02-20, ubykagol,false,
L2016-02-20_romans2,09,L2016-02-20, romans2,false,
L2016-02-20_alliluja,10,L2016-02-20, alliluja,false,
L2016-02-20_baltijsk,11,L2016-02-20, baltijsk,false,
L2016-02-20_fontanka,12,L2016-02-20, fontanka,false,
L2016-02-20_stixiopr,13,L2016-02-20, stixiopr,false,
L2016-02-20_vademecu,14,L2016-02-20, vademecu,false,
---
L2016-02-20_ryba,15,L2016-02-20, ryba,false,
L2016-02-20_chepuxa,16,L2016-02-20, chepuxa,false,
L2016-02-20_dopoezda,17,L2016-02-20, dopoezda,false,
L2016-02-20_suhumi,18,L2016-02-20, suhumi,false,
L2016-02-20_vpoxodny,19,L2016-02-20, vpoxodny,false,
L2016-02-20_nezabyva,20,L2016-02-20, nezabyva,false,
L2016-02-20_deja,21,L2016-02-20, deja (не допел),false,
L2016-02-20_voslavug,22,L2016-02-20, voslavug,false,
L2016-02-20_adleucon,23,L2016-02-20, adleucon,false,
L2016-02-20_pamjativ,24,L2016-02-20, pamjativ,false,
L2016-02-20_vishnevo,25,L2016-02-20, vishnevo,false,
L2016-02-20_mneniche,26,L2016-02-20, mneniche,false,
L2016-02-20_totosego,27,L2016-02-20, totosego,false,
L2016-02-20_nerazmen,28,L2016-02-20, nerazmen,false,

15.02.2016 пн – Москва, бард-клуб "Гнездо глухаря" (малый зал)
L2016-02-15_volk,01,L2016-02-15, volk,false,
L2016-02-15_krasnye,02,L2016-02-15, krasnye,false,
L2016-02-15_vechnoes,03,L2016-02-15, vechnoes,false,
L2016-02-15_kupljubi,04,L2016-02-15, kupljubi,false,
L2016-02-15_pavlovsk,05,L2016-02-15, pavlovsk,false,
L2016-02-15_brodjagi,06,L2016-02-15, brodjagi,false,
L2016-02-15_deja,07,L2016-02-15, deja,false,
L2016-02-15_ubykagol,08,L2016-02-15, ubykagol,false,
L2016-02-15_nebyvaet,09,L2016-02-15, nebyvaet,false,
L2016-02-15_nesmogna,10,L2016-02-15, nesmogna,false,
L2016-02-15_propadu,11,L2016-02-15, propadu,false,
L2016-02-15_baltijsk,12,L2016-02-15, baltijsk,false,
L2016-02-15_fontanka,13,L2016-02-15, fontanka,false,
L2016-02-15_nadeyus,14,L2016-02-15, nadeyus,false,
---
L2016-02-15_ryba,15,L2016-02-15, ryba,false,
L2016-02-15_gonistos,16,L2016-02-15, gonistos,false,
L2016-02-15_japodari,17,L2016-02-15, japodari,false,
L2016-02-15_mneniche,18,L2016-02-15, mneniche,false,
L2016-02-15_udachny,19,L2016-02-15, udachny,false,
L2016-02-15_zvezdoch,20,L2016-02-15, zvezdoch,false,
L2016-02-15_neradisp,21,L2016-02-15, neradisp,false,
L2016-02-15_nerazmen,22,L2016-02-15, nerazmen,false,
L2016-02-15_totosego,23,L2016-02-15, totosego,false,

12.01.2016 вт – Москва, клуб-магазин "Гиперион", премьера
L2016-01-12_volk,01,L2016-01-12, volk,false,
L2016-01-12_kordebal,02,L2016-01-12, kordebal,false,
L2016-01-12_vechnoes,03,L2016-01-12, vechnoes,false,
L2016-01-12_desyatpe,04,L2016-01-12, desyatpe,false,
L2016-01-12_pavlovsk,05,L2016-01-12, pavlovsk,false,
L2016-01-12_zvezdoch,06,L2016-01-12, zvezdoch,false,
L2016-01-12_kogdaned,07,L2016-01-12, kogdaned,false,
L2016-01-12_vekaplyv,08,L2016-01-12, vekaplyv,false,
L2016-01-12_naivnopo,09,L2016-01-12, naivnopo,true,
L2016-01-12_odnazhdy,10,L2016-01-12, odnazhdy,false,
L2016-01-12_baltijsk,11,L2016-01-12, baltijsk,false,
L2016-01-12_etiglaza,12,L2016-01-12, etiglaza,false,
L2016-01-12_nebyvaet,13,L2016-01-12, nebyvaet,false,
L2016-01-12_ubykagol,14,L2016-01-12, ubykagol,false,
L2016-01-12_bystrov,15,L2016-01-12, bystrov,false,
L2016-01-12_bystrov2,16,L2016-01-12, bystrov2,false,
L2016-01-12_nesmogna,17,L2016-01-12, nesmogna,false,
L2016-01-12_neuzheli,18,L2016-01-12, neuzheli,false,
L2016-01-12_avtoparo,19,L2016-01-12, avtoparo,false,
L2016-01-12_shestsem,20,L2016-01-12, shestsem,false,
L2016-01-12_voslavug,21,L2016-01-12, voslavug,false,
L2016-01-12_udachny,22,L2016-01-12, udachny,false,
L2016-01-12_pamjativ,23,L2016-01-12, pamjativ,false,
L2016-01-12_akoektop,24,L2016-01-12, akoektop,false,
L2016-01-12_totosego,25,L2016-01-12, totosego,false,
L2016-01-12_trubach,26,L2016-01-12, trubach,false,

10.01.2016 вс – Москва, бард-клуб "Гнездо глухаря", 2 премьеры
L2016-01-10_kuznechiki,01,L2016-01-10, kuznechiki,false,
L2016-01-10_vechnoes,02,L2016-01-10, vechnoes,false,
L2016-01-10_zhizn,03,L2016-01-10, zhizn,false,
L2016-01-10_pavlovsk,04,L2016-01-10, pavlovsk,false,
L2016-01-10_peshkom,05,L2016-01-10, peshkom,false,
L2016-01-10_esli,06,L2016-01-10, esli,false,
L2016-01-10_odnazhdy,07,L2016-01-10, odnazhdy,false,
L2016-01-10_vekaplyv,08,L2016-01-10, vekaplyv,false,
L2016-01-10_kogdaned,09,L2016-01-10, kogdaned,false,
L2016-01-10_etiglaza,10,L2016-01-10, etiglaza,false,
L2016-01-10_serenada,11,L2016-01-10, serenada,false,
L2016-01-10_1995,12,L2016-01-10, 1995,false,
L2016-01-10_gdetytep,13,L2016-01-10, gdetytep,true,
L2016-01-10_neuzheli,14,L2016-01-10, neuzheli,false,
---
L2016-01-10_nerazmen,15,L2016-01-10, nerazmen,false,
L2016-01-10_kordebal,16,L2016-01-10, kordebal,false,
L2016-01-10_nezabyva,17,L2016-01-10, nezabyva,false,
L2016-01-10_podzname,18,L2016-01-10, podzname,false,
L2016-01-10_udachny,19,L2016-01-10, udachny,false,
L2016-01-10_voslavug,20,L2016-01-10, voslavug,false,
L2016-01-10_alliluja,21,L2016-01-10, alliluja,false,
L2016-01-10_baltijsk,22,L2016-01-10, baltijsk,false,
L2016-01-10_fontanka,23,L2016-01-10, fontanka,false,
L2016-01-10_vsetvoic,24,L2016-01-10, vsetvoic,false,
L2016-01-10_totosego,25,L2016-01-10, totosego,true,
L2016-01-10_pamjativ,26,L2016-01-10, pamjativ,false,

20.11.2015 пт – США, Bethesda, MD, клуб "БардАчок"
L2015-11-20_podzname,01,L2015-11-20, podzname,false,
L2015-11-20_1995,02,L2015-11-20, 1995,false,
L2015-11-20_zaliv,03,L2015-11-20, zaliv,false,
L2015-11-20_nadvuhk,04,L2015-11-20, nadvuhk,false,
L2015-11-20_godshel,05,L2015-11-20, godshel,false,
L2015-11-20_nezabyva,06,L2015-11-20, nezabyva,false,
L2015-11-20_adleucon,07,L2015-11-20, adleucon,false,
L2015-11-20_netlubez,08,L2015-11-20, netlubez,false,
L2015-11-20_neradisp,09,L2015-11-20, neradisp,false,
L2015-11-20_kalejdos,10,L2015-11-20, kalejdos,false,
L2015-11-20_vekaplyv,11,L2015-11-20, vekaplyv,false,
L2015-11-20_temapoleta,12,L2015-11-20, temapoleta,false,
L2015-11-20_akoektop,13,L2015-11-20, akoektop,false,
L2015-11-20_neuzheli,14,L2015-11-20, neuzheli,false,
---
L2015-11-20_alliluja,15,L2015-11-20, alliluja,false,
L2015-11-20_chuzhaj2,16,L2015-11-20, chuzhaj2,false,
L2015-11-20_shkolat2,17,L2015-11-20, shkolat2,false,
L2015-11-20_romans2,18,L2015-11-20, romans2,false,
L2015-11-20_nebyvaet,19,L2015-11-20, nebyvaet,false,
L2015-11-20_vsetvoic,20,L2015-11-20, vsetvoic,false,
L2015-11-20_bukvynak,21,L2015-11-20, bukvynak,false,
L2015-11-20_pamjativ,22,L2015-11-20, pamjativ,false,
L2015-11-20_sharmans,23,L2015-11-20, sharmans,false,
L2015-11-20_pesenkao,24,L2015-11-20, pesenkao,false,

16.11.2015 пн – Москва, бард-клуб "Гнездо глухаря"
L2015-11-16_podzname,01,L2015-11-16, podzname,false,
L2015-11-16_1995,02,L2015-11-16, 1995,false,
L2015-11-16_zaliv,03,L2015-11-16, zaliv,false,
L2015-11-16_godshel,04,L2015-11-16, godshel,false,
L2015-11-16_nezabyva,05,L2015-11-16, nezabyva,false,
L2015-11-16_udachny,06,L2015-11-16, udachny,false,
L2015-11-16_netlubez,07,L2015-11-16, netlubez,false,
L2015-11-16_neradisp,08,L2015-11-16, neradisp,false,
L2015-11-16_traviata,09,L2015-11-16, traviata,false,
L2015-11-16_vekaplyv,10,L2015-11-16, vekaplyv,false,
L2015-11-16_stixiopr,11,L2015-11-16, stixiopr,false,
L2015-11-16_temapoleta,12,L2015-11-16, temapoleta,false,
L2015-11-16_ubykagol,13,L2015-11-16, ubykagol,false,
L2015-11-16_neuzheli,14,L2015-11-16, neuzheli,false,
---
L2015-11-16_kovcheg,15,L2015-11-16, kovcheg,false,
L2015-11-16_nebyvaet,16,L2015-11-16, nebyvaet,false,
L2015-11-16_romans2,17,L2015-11-16, romans2,false,
L2015-11-16_vsetvoic,18,L2015-11-16, vsetvoic,false,
L2015-11-16_krasnye,19,L2015-11-16, krasnye,false,
L2015-11-16_voslavug,20,L2015-11-16, voslavug,false,
L2015-11-16_shkolat2,21,L2015-11-16, shkolat2,false,
L2015-11-16_pamjativ,22,L2015-11-16, pamjativ,false,
L2015-11-16_sharmans,23,L2015-11-16, sharmans,false,
L2015-11-16_pesenkao,24,L2015-11-16, pesenkao,false,

07.11.2015 сб – Великобритания, Лондон, Cruciform Building
L2015-11-07_sharmans,01,L2015-11-07, sharmans,false,
L2015-11-07_chuzhaj2,02,L2015-11-07, chuzhaj2,false,
L2015-11-07_zhizn,03,L2015-11-07, zhizn,false,
L2015-11-07_zatemzhe,04,L2015-11-07, zatemzhe,false,
L2015-11-07_kuznechiki,05,L2015-11-07, kuznechiki,false,
L2015-11-07_stixiopr,06,L2015-11-07, stixiopr,false,
L2015-11-07_temapoleta,07,L2015-11-07, temapoleta,false,
L2015-11-07_suhumi,08,L2015-11-07, suhumi,false,
L2015-11-07_nadvuhk,09,L2015-11-07, nadvuhk,false,
L2015-11-07_dopoezda,10,L2015-11-07, dopoezda,false,
L2015-11-07_vpoxodny,11,L2015-11-07, vpoxodny,false,
L2015-11-07_nezabyva,12,L2015-11-07, nezabyva,false,
L2015-11-07_mneniche,13,L2015-11-07, mneniche,false,
L2015-11-07_adleucon,14,L2015-11-07, adleucon,false,
L2015-11-07_dendensk,15,L2015-11-07, dendensk,false,
L2015-11-07_volhonka,16,L2015-11-07, volhonka,false,
L2015-11-07_fontanka,17,L2015-11-07, fontanka,false,
L2015-11-07_proschanie,18,L2015-11-07, proschanie,false,
L2015-11-07_baltijsk,19,L2015-11-07, baltijsk,false,
L2015-11-07_ryba,20,L2015-11-07, ryba,false,
L2015-11-07_chepuxa,21,L2015-11-07, chepuxa,false,
L2015-11-07_bukvynak,22,L2015-11-07, bukvynak,false,
L2015-11-07_pamjativ,23,L2015-11-07, pamjativ,false,
L2015-11-07_deja,24,L2015-11-07, deja,false,
L2015-11-07_romans2,25,L2015-11-07, romans2,false,
L2015-11-07_esli,26,L2015-11-07, esli,false,
L2015-11-07_navescha,27,L2015-11-07, navescha,false,
L2015-11-07_trubach,28,L2015-11-07, trubach,false,

26.10.2015 пн – Москва, бард-клуб "Гнездо глухаря"
L2015-10-26_kuznechiki,01,L2015-10-26, kuznechiki,false,
L2015-10-26_akoektop,02,L2015-10-26, akoektop,false,
L2015-10-26_chuzhaj2,03,L2015-10-26, chuzhaj2,false,
L2015-10-26_ballada,04,L2015-10-26, ballada,false,
L2015-10-26_peshkom,05,L2015-10-26, peshkom,false,
L2015-10-26_nezabyva,06,L2015-10-26, nezabyva,false,
L2015-10-26_mneniche,07,L2015-10-26, mneniche,false,
L2015-10-26_1995,08,L2015-10-26, 1995,false,
L2015-10-26_proschanie,09,L2015-10-26, proschanie,false,
L2015-10-26_piter,10,L2015-10-26, piter,false,
L2015-10-26_romansma,11,L2015-10-26, romansma,false,
L2015-10-26_kadril,12,L2015-10-26, kadril,false,
L2015-10-26_sentenci,13,L2015-10-26, sentenci,false,
L2015-10-26_zastolnaya,14,L2015-10-26, zastolnaya,false,
---
L2015-10-26_kordebal,15,L2015-10-26, kordebal,false,
L2015-10-26_vekaplyv,16,L2015-10-26, vekaplyv,false,
L2015-10-26_suhumi,17,L2015-10-26, suhumi,false,
L2015-10-26_esli,18,L2015-10-26, esli,false,
L2015-10-26_japodari,19,L2015-10-26, japodari,false,
L2015-10-26_romans2,20,L2015-10-26, romans2,false,
L2015-10-26_bukvynak,21,L2015-10-26, bukvynak,false,
L2015-10-26_pamjativ,22,L2015-10-26, pamjativ,false,
L2015-10-26_shkolat2,23,L2015-10-26, shkolat2,false,
L2015-10-26_zavescha,24,L2015-10-26, zavescha,false,
L2015-10-26_trubach,25,L2015-10-26, trubach,false,

06.10.2015 вт – Москва, бард-клуб "Гнездо глухаря", дуэт (клавиши)
L2015-10-06_sharmans,01,L2015-10-06, sharmans,false,
L2015-10-06_vjuga,02,L2015-10-06, vjuga,false,
L2015-10-06_burja,03,L2015-10-06, burja,false,
L2015-10-06_descensu,04,L2015-10-06, descensu,false,
L2015-10-06_voslavug,05,L2015-10-06, voslavug,false,
L2015-10-06_trojka,06,L2015-10-06, trojka,false,
L2015-10-06_vpoxodny,07,L2015-10-06, vpoxodny,false,
L2015-10-06_drugajaz,08,L2015-10-06, drugajaz,false,
L2015-10-06_teplyj,09,L2015-10-06, teplyj,false,
L2015-10-06_lunnaja,10,L2015-10-06, lunnaja,false,
L2015-10-06_muzhajsj,11,L2015-10-06, muzhajsj,false,
L2015-10-06_switzerl,12,L2015-10-06, switzerl,false,
L2015-10-06_sentenci,13,L2015-10-06, sentenci,false,
L2015-10-06_opyattor,14,L2015-10-06, opyattor,false,
---
L2015-10-06_marija,15,L2015-10-06, marija,false,
L2015-10-06_kalejdos,16,L2015-10-06, kalejdos,false,
L2015-10-06_rozhdest,17,L2015-10-06, rozhdest,false,
L2015-10-06_podzname,18,L2015-10-06, podzname,false,
L2015-10-06_brodjagi,19,L2015-10-06, brodjagi,false,
L2015-10-06_serenada,20,L2015-10-06, serenada,false,
L2015-10-06_alliluja,21,L2015-10-06, alliluja,false,
L2015-10-06_vbelojmg,22,L2015-10-06, vbelojmg,false,
L2015-10-06_okean,23,L2015-10-06, okean,false,
L2015-10-06_eccehomo,24,L2015-10-06, eccehomo,false,
L2015-10-06_dusha,25,L2015-10-06, dusha,false,
L2015-10-06_kolybeln,26,L2015-10-06, kolybeln,false,

09.09.2015 ср – Москва, бард-клуб "Гнездо глухаря"
L2015-09-09_tirbayard,01,L2015-09-09, tirbayard,false,
L2015-09-09_voslavug,02,L2015-09-09, voslavug,false,
L2015-09-09_serenada,03,L2015-09-09, serenada,false,
L2015-09-09_dendensk,04,L2015-09-09, dendensk,false,
L2015-09-09_volhonka,05,L2015-09-09, volhonka,false,
L2015-09-09_temapoleta,06,L2015-09-09, temapoleta,false,
L2015-09-09_suhumi,07,L2015-09-09, suhumi,false,
L2015-09-09_adleucon,08,L2015-09-09, adleucon,false,
L2015-09-09_netlubez,09,L2015-09-09, netlubez,false,
L2015-09-09_nezabyva,10,L2015-09-09, nezabyva,false,
L2015-09-09_chuzhaj1,11,L2015-09-09, chuzhaj1,false,
L2015-09-09_etiglaza,12,L2015-09-09, etiglaza,false,
L2015-09-09_fontanka,13,L2015-09-09, fontanka,false,
---
L2015-09-09_1991,14,L2015-09-09, 1991,false,
L2015-09-09_zaliv,15,L2015-09-09, zaliv,false,
L2015-09-09_proschanie,16,L2015-09-09, proschanie,false,
L2015-09-09_navescha,17,L2015-09-09, navescha,false,
L2015-09-09_sharmans,18,L2015-09-09, sharmans,false,
L2015-09-09_pamjativ,19,L2015-09-09, pamjativ,false,
L2015-09-09_baltijsk,20,L2015-09-09, baltijsk,false,
L2015-09-09_vpoxodny,21,L2015-09-09, vpoxodny,false,
L2015-09-09_esli,22,L2015-09-09, esli,false,
L2015-09-09_nerazmen,23,L2015-09-09, nerazmen,false,

03.09.2015 чт – Швейцария, Лозанна, Casona Latina
L2015-09-03_1991,01,L2015-09-03, 1991,false,
L2015-09-03_1992,02,L2015-09-03, 1992,false,
L2015-09-03_ryba,03,L2015-09-03, ryba,false,
L2015-09-03_volhonka,04,L2015-09-03, volhonka,false,
L2015-09-03_dendensk,05,L2015-09-03, dendensk,false,
L2015-09-03_dopoezda,06,L2015-09-03, dopoezda,false,
L2015-09-03_suhumi,07,L2015-09-03, suhumi,false,
L2015-09-03_adleucon,08,L2015-09-03, adleucon,false,
L2015-09-03_voslavug,09,L2015-09-03, voslavug,false,
L2015-09-03_serenada,10,L2015-09-03, serenada,false,
L2015-09-03_etiglaza,11,L2015-09-03, etiglaza,false,
L2015-09-03_temapoleta,12,L2015-09-03, temapoleta,false,
L2015-09-03_nadvuhk,13,L2015-09-03, nadvuhk,false,
L2015-09-03_netlubez,14,L2015-09-03, netlubez,false,
L2015-09-03_nezabyva,15,L2015-09-03, nezabyva,false,
L2015-09-03_nadpis,16,L2015-09-03, nadpis,false,
L2015-09-03_bukvynak,17,L2015-09-03, bukvynak,false,
L2015-09-03_zaliv,18,L2015-09-03, zaliv,false,
L2015-09-03_navescha,19,L2015-09-03, navescha,false,
L2015-09-03_kovcheg,20,L2015-09-03, kovcheg,false,
L2015-09-03_volk,21,L2015-09-03, volk,false,
L2015-09-03_fontanka,22,L2015-09-03, fontanka,false,
L2015-09-03_proschanie,23,L2015-09-03, proschanie,false,
L2015-09-03_baltijsk,24,L2015-09-03, baltijsk,false,

02.09.2015 ср – Швейцария, Женева, Salle Equitable
L2015-09-02_zhizn,01,L2015-09-02, zhizn,false,
L2015-09-02_ryba,02,L2015-09-02, ryba,false,
L2015-09-02_inicialy,03,L2015-09-02, inicialy,false,
L2015-09-02_zatemzhe,04,L2015-09-02, zatemzhe,false,
L2015-09-02_sharmans,05,L2015-09-02, sharmans,false,
L2015-09-02_proschanie,06,L2015-09-02, proschanie,false,
L2015-09-02_suhumi,07,L2015-09-02, suhumi,false,
L2015-09-02_adleucon,08,L2015-09-02, adleucon,false,
L2015-09-02_1995,09,L2015-09-02, 1995,false,
L2015-09-02_vrjadli,10,L2015-09-02, vrjadli,false,
L2015-09-02_serenada,11,L2015-09-02, serenada,false,
L2015-09-02_netlubez,12,L2015-09-02, netlubez,false,
L2015-09-02_tirbayard,13,L2015-09-02, tirbayard,false,
---
L2015-09-02_voslavug,14,L2015-09-02, voslavug,false,
L2015-09-02_vpoxodny,15,L2015-09-02, vpoxodny,false,
L2015-09-02_nezabyva,16,L2015-09-02, nezabyva,false,
L2015-09-02_zaliv,17,L2015-09-02, zaliv,false,
L2015-09-02_navescha,18,L2015-09-02, navescha,false,
L2015-09-02_bukvynak,19,L2015-09-02, bukvynak,false,
L2015-09-02_pamjativ,20,L2015-09-02, pamjativ,false,
L2015-09-02_nadvuhk,21,L2015-09-02, nadvuhk,false,
L2015-09-02_pesenkao,22,L2015-09-02, pesenkao,false,
L2015-09-02_chepuxa,23,L2015-09-02, chepuxa,false,

13.07.2015 пн – Москва, бард-клуб "Гнездо глухаря", премьера, текст
L2015-07-13_ryba,01,L2015-07-13, ryba,false,
L2015-07-13_inicialy,02,L2015-07-13, inicialy,false,
L2015-07-13_kuznechiki,03,L2015-07-13, kuznechiki,false,
L2015-07-13_chepuxa,04,L2015-07-13, chepuxa,false,
L2015-07-13_dendensk,05,L2015-07-13, dendensk,false,
L2015-07-13_kogdaned,06,L2015-07-13, kogdaned,false,
L2015-07-13_vrjadli,07,L2015-07-13, vrjadli,false,
L2015-07-13_romans2,08,L2015-07-13, romans2,false,
L2015-07-13_nesmogna,09,L2015-07-13, nesmogna,true,
L2015-07-13_dopoezda,10,L2015-07-13, dopoezda,false,
L2015-07-13_vpoxodny,11,L2015-07-13, vpoxodny,false,
L2015-07-13_nezabyva,12,L2015-07-13, nezabyva,false,
L2015-07-13_bystrov,13,L2015-07-13, bystrov,false,
L2015-07-13_bystrov2,14,L2015-07-13, bystrov2,false,
L2015-07-13_adleucon,15,L2015-07-13, adleucon,false,
L2015-07-13_pamjativ,16,L2015-07-13, pamjativ,false,
---
L2015-07-13_serenada,17,L2015-07-13, serenada,false,
L2015-07-13_volhonka,18,L2015-07-13, volhonka,false,
L2015-07-13_esli,19,L2015-07-13, esli,false,
L2015-07-13_nadvuhk,20,L2015-07-13, nadvuhk,false,
L2015-07-13_zatemzhe,21,L2015-07-13, zatemzhe,false,
L2015-07-13_temapoleta,22,L2015-07-13, temapoleta,false,
L2015-07-13_voslavug,23,L2015-07-13, voslavug,false,
L2015-07-13_avtoparo,24,L2015-07-13, avtoparo,false,
L2015-07-13_pochtina,25,L2015-07-13, pochtina,false,(обновлённый текст)
L2015-07-13_sharmans,26,L2015-07-13, sharmans,false,

09.07.2015 чт – Москва, клуб-магазин "Гиперион", 2 премьеры
L2015-07-09_serenada,01,L2015-07-09, serenada,false,
L2015-07-09_tirbayard,02,L2015-07-09, tirbayard,false,
L2015-07-09_dendensk,03,L2015-07-09, dendensk,false,
L2015-07-09_moekoro3,04,L2015-07-09, moekoro3,false,
L2015-07-09_temapoleta,05,L2015-07-09, temapoleta,false,
L2015-07-09_sokolnik,06,L2015-07-09, sokolnik,false,
L2015-07-09_1995,07,L2015-07-09, 1995,false,
L2015-07-09_voslavug,08,L2015-07-09, voslavug,false,
L2015-07-09_esli,09,L2015-07-09, esli,false,
L2015-07-09_adleucon,10,L2015-07-09, adleucon,false,
L2015-07-09_suhumi,11,L2015-07-09, suhumi,false,
L2015-07-09_zaliv,12,L2015-07-09, zaliv,false,
L2015-07-09_chepuxa,13,L2015-07-09, chepuxa,false,
L2015-07-09_escheya,14,L2015-07-09, escheya,true,
L2015-07-09_sharmans,15,L2015-07-09, sharmans,false,
L2015-07-09_nadvuhk,16,L2015-07-09, nadvuhk,false,
L2015-07-09_vpoxodny,17,L2015-07-09, vpoxodny,false,
L2015-07-09_nezabyva,18,L2015-07-09, nezabyva,false,
L2015-07-09_pochtina,19,L2015-07-09, pochtina,true,
L2015-07-09_1992,20,L2015-07-09, 1992,false,

24.05.2015 вс – США, Stony Brook, Long Island, NY
L2015-05-24_sharmans,01,L2015-05-24, sharmans,false,
L2015-05-24_deja,02,L2015-05-24, deja,false,
L2015-05-24_podzname,03,L2015-05-24, podzname,false,
L2015-05-24_stixiopr,04,L2015-05-24, stixiopr,false,
L2015-05-24_zatemzhe,05,L2015-05-24, zatemzhe,false,
L2015-05-24_vrjadli,06,L2015-05-24, vrjadli,false,
L2015-05-24_peterbur,07,L2015-05-24, peterbur,false,
L2015-05-24_baltijsk,08,L2015-05-24, baltijsk,false,
L2015-05-24_fontanka,09,L2015-05-24, fontanka,false,
L2015-05-24_voslavug,10,L2015-05-24, voslavug,false,
L2015-05-24_adleucon,11,L2015-05-24, adleucon,false,
L2015-05-24_suhumi,12,L2015-05-24, suhumi,false,
L2015-05-24_nadvuhk,13,L2015-05-24, nadvuhk,false,
L2015-05-24_mneniche,14,L2015-05-24, mneniche,false,
L2015-05-24_serenada,15,L2015-05-24, serenada,false,
L2015-05-24_ryba,16,L2015-05-24, ryba,false,
L2015-05-24_chepuxa,17,L2015-05-24, chepuxa,false,
L2015-05-24_temapoleta,18,L2015-05-24, temapoleta,false,
L2015-05-24_volhonka,19,L2015-05-24, volhonka,false,
L2015-05-24_1991,20,L2015-05-24, 1991,false,
L2015-05-24_vpoxodny,21,L2015-05-24, vpoxodny,false,
L2015-05-24_nezabyva,22,L2015-05-24, nezabyva,false,
L2015-05-24_neradisp,23,L2015-05-24, neradisp,false,
L2015-05-24_trubach,24,L2015-05-24, trubach,false,
L2015-05-24_pamjativ,25,L2015-05-24, pamjativ,false,
L2015-05-24_esli,26,L2015-05-24, esli,false,
L2015-05-24_nerazmen,27,L2015-05-24, nerazmen,false,

23.05.2015 сб – США, Fair Lawn, NJ, второй акт скрипка, гитара
L2015-05-23_zhizn,01,L2015-05-23, zhizn,false,
L2015-05-23_voslavug,02,L2015-05-23, voslavug,false,
L2015-05-23_stixiopr,03,L2015-05-23, stixiopr,false,
L2015-05-23_deja,04,L2015-05-23, deja,false,
L2015-05-23_netlubez,05,L2015-05-23, netlubez,false,
L2015-05-23_nezabyva,06,L2015-05-23, nezabyva,false,
L2015-05-23_chepuxa,07,L2015-05-23, chepuxa,false,
L2015-05-23_bukvynak,08,L2015-05-23, bukvynak,false,
L2015-05-23_sharmans,09,L2015-05-23, sharmans,false,
L2015-05-23_neradisp,10,L2015-05-23, neradisp,false,
L2015-05-23_piter,11,L2015-05-23, piter,false,
L2015-05-23_romansma,12,L2015-05-23, romansma,false,
L2015-05-23_zastolnaya,13,L2015-05-23, zastolnaya,false,
L2015-05-23_sentenci,14,L2015-05-23, sentenci,false,
--- Дмитрий Фиш (скрипка), Герман Кац (гитара)
L2015-05-23_nichemun,15,L2015-05-23, nichemun,false,
L2015-05-23_kuznechiki,16,L2015-05-23, kuznechiki,false,
L2015-05-23_ryba,17,L2015-05-23, ryba,false,
L2015-05-23_kogdaned,18,L2015-05-23, kogdaned,false,
L2015-05-23_dendensk,19,L2015-05-23, dendensk,false,
L2015-05-23_krasnye,20,L2015-05-23, krasnye,false,
L2015-05-23_dopoezda,21,L2015-05-23, dopoezda,false,
L2015-05-23_navescha,22,L2015-05-23, navescha,false,
L2015-05-23_volk,23,L2015-05-23, volk,false,
L2015-05-23_pamjativ,24,L2015-05-23, pamjativ,false,
L2015-05-23_esli,25,L2015-05-23, esli,false,
L2015-05-23_nerazmen,26,L2015-05-23, nerazmen,false,

17.05.2015 вс – Москва, бард-клуб "Гнездо глухаря" (малый зал)
L2015-05-17_zhizn,01,L2015-05-17, zhizn,false,
L2015-05-17_cirkachk,02,L2015-05-17, cirkachk,false,
L2015-05-17_sharmans,03,L2015-05-17, sharmans,false,
L2015-05-17_chepuxa,04,L2015-05-17, chepuxa,false,
L2015-05-17_ryba,05,L2015-05-17, ryba,false,
L2015-05-17_dopoezda,06,L2015-05-17, dopoezda,false,
L2015-05-17_moekoro3,07,L2015-05-17, moekoro3,false,
L2015-05-17_esli,08,L2015-05-17, esli,false,
L2015-05-17_navescha,09,L2015-05-17, navescha,false,
L2015-05-17_pamjativ,10,L2015-05-17, pamjativ,false,
L2015-05-17_piter,11,L2015-05-17, piter,false,
L2015-05-17_romansma,12,L2015-05-17, romansma,false,
L2015-05-17_zastolnaya,13,L2015-05-17, zastolnaya,false,
---
L2015-05-17_mneniche,14,L2015-05-17, mneniche,false,
L2015-05-17_krasnye,15,L2015-05-17, krasnye,false,
L2015-05-17_zaliv,16,L2015-05-17, zaliv,false,
L2015-05-17_pavlovsk,17,L2015-05-17, pavlovsk,false,
L2015-05-17_fontanka,18,L2015-05-17, fontanka,false,
L2015-05-17_stixiopr,19,L2015-05-17, stixiopr,false,
L2015-05-17_zatemzhe,20,L2015-05-17, zatemzhe,false,
L2015-05-17_neuzheli,21,L2015-05-17, neuzheli,false,
L2015-05-17_deja,22,L2015-05-17, deja,false,

28.04.2015 вт – Москва, бард-клуб "Гнездо глухаря", дуэт (гитара)
L2015-04-28_kibitka,01,L2015-04-28, kibitka,false,
L2015-04-28_paris,02,L2015-04-28, paris,false,
L2015-04-28_romans1,03,L2015-04-28, romans1,false,
L2015-04-28_sezondoz,04,L2015-04-28, sezondoz,false,
L2015-04-28_marija,05,L2015-04-28, marija,false,
L2015-04-28_kalejdos,06,L2015-04-28, kalejdos,false,
L2015-04-28_bolero1,07,L2015-04-28, bolero1,false,
L2015-04-28_temapoko,08,L2015-04-28, temapoko,false,
L2015-04-28_aneta,09,L2015-04-28, aneta,false,
L2015-04-28_vrjadli,10,L2015-04-28, vrjadli,false,
L2015-04-28_descensu,11,L2015-04-28, descensu,false,
L2015-04-28_proschan,12,L2015-04-28, proschan,false,
L2015-04-28_konecned,13,L2015-04-28, konecned,false,
L2015-04-28_vosxodja,14,L2015-04-28, vosxodja,false,
---
L2015-04-28_sharmans,15,L2015-04-28, sharmans,false,
L2015-04-28_puskaj,16,L2015-04-28, puskaj,false,
L2015-04-28_oderjimy,17*,L2015-04-28, oderjimy,false,
L2015-04-28_sadvolsh,18*,L2015-04-28, sadvolsh,false,
L2015-04-28_sletalis,19*,L2015-04-28, sletalis,false,
L2015-04-28_ishlodiv,20*,L2015-04-28, ishlodiv,false,
L2015-04-28_dusha,21,L2015-04-28, dusha,false,
L2015-04-28_karavan,22,L2015-04-28, karavan,false,
L2015-04-28_eccehomo,23,L2015-04-28, eccehomo,false,
L2015-04-28_korablik,24,L2015-04-28, korablik,false,
L2015-04-28_vtornik,25,L2015-04-28, vtornik,false,
L2015-04-28_kolybeln,26,L2015-04-28, kolybeln,false,

25.04.2015 сб – Москва, клуб-магазин "Гиперион", дуэт (гитара)
L2015-04-25_kibitka,01,L2015-04-25, kibitka,false,
L2015-04-25_paris,02,L2015-04-25, paris,false,
L2015-04-25_romans1,03,L2015-04-25, romans1,false,
L2015-04-25_sezondoz,04,L2015-04-25, sezondoz,false,
L2015-04-25_marija,05,L2015-04-25, marija,false,
L2015-04-25_kalejdos,06,L2015-04-25, kalejdos,false,
L2015-04-25_aneta,07,L2015-04-25, aneta,false,
L2015-04-25_proschan,08,L2015-04-25, proschan,false,
L2015-04-25_descensu,09,L2015-04-25, descensu,false,
L2015-04-25_vrjadli,10,L2015-04-25, vrjadli,false,
L2015-04-25_konecned,11,L2015-04-25, konecned,false,
L2015-04-25_vosxodja,12,L2015-04-25, vosxodja,false,
L2015-04-25_bolero1,13,L2015-04-25, bolero1,false,
L2015-04-25_temapoko,14,L2015-04-25, temapoko,false,
L2015-04-25_sharmans,15,L2015-04-25, sharmans,false,
L2015-04-25_puskaj,16,L2015-04-25, puskaj,false,
L2015-04-25_oderjimy,17*,L2015-04-25, oderjimy,false,
L2015-04-25_sadvolsh,18*,L2015-04-25, sadvolsh,false,
L2015-04-25_sletalis,19*,L2015-04-25, sletalis,false,
L2015-04-25_ishlodiv,20*,L2015-04-25, ishlodiv,false,
L2015-04-25_dusha,21,L2015-04-25, dusha,false,
L2015-04-25_karavan,22,L2015-04-25, karavan,false,
L2015-04-25_eccehomo,23,L2015-04-25, eccehomo,false,
L2015-04-25_korablik,24,L2015-04-25, korablik,false,
L2015-04-25_vtornik,25,L2015-04-25, vtornik,false,
L2015-04-25_kolybeln,26,L2015-04-25, kolybeln,false,

15.04.2015 ср – Москва, ЦАП
L2015-04-15_ryba,01,L2015-04-15, ryba,false,
L2015-04-15_1991,02,L2015-04-15, 1991,false,
L2015-04-15_romans2,03,L2015-04-15, romans2,false,
L2015-04-15_nadvuhk,04,L2015-04-15, nadvuhk,false,
L2015-04-15_suhumi,05,L2015-04-15, suhumi,false,
L2015-04-15_dopoezda,06,L2015-04-15, dopoezda,false,
L2015-04-15_voslavug,07,L2015-04-15, voslavug,false,
L2015-04-15_baltijsk,08,L2015-04-15, baltijsk,false,
L2015-04-15_fontanka,09,L2015-04-15, fontanka,false,
L2015-04-15_mneniche,10,L2015-04-15, mneniche,false,
L2015-04-15_adleucon,11,L2015-04-15, adleucon,false,
L2015-04-15_pamjativ,12,L2015-04-15, pamjativ,false,
L2015-04-15_sharmans,13,L2015-04-15, sharmans,false,
L2015-04-15_zatemzhe,14,L2015-04-15, zatemzhe,false,
L2015-04-15_volhonka,15,L2015-04-15, volhonka,false,
L2015-04-15_1992,16,L2015-04-15, 1992,false,
L2015-04-15_inicialy,17,L2015-04-15, inicialy,false,
L2015-04-15_podzname,18,L2015-04-15, podzname,false,
L2015-04-15_vsetvoic,19,L2015-04-15, vsetvoic,false,
L2015-04-15_pesenkao,20,L2015-04-15, pesenkao,false,
L2015-04-15_temapoleta,21,L2015-04-15, temapoleta,false,
L2015-04-15_deja,22,L2015-04-15, deja,false,
L2015-04-15_kovcheg,23,L2015-04-15, kovcheg,false,
L2015-04-15_nezabyva,24,L2015-04-15, nezabyva,false,
L2015-04-15_esli,25,L2015-04-15, esli,false,
L2015-04-15_nerazmen,26,L2015-04-15, nerazmen,false,

31.03.2015 вт – Москва, бард-клуб "Гнездо глухаря" (малый зал)
L2015-03-31_1992,01,L2015-03-31, 1992,false,
L2015-03-31_1991,02,L2015-03-31, 1991,false,
L2015-03-31_tirbayard,03,L2015-03-31, tirbayard,false,
L2015-03-31_baltijsk,04,L2015-03-31, baltijsk,false,
L2015-03-31_voslavug,05,L2015-03-31, voslavug,false,
L2015-03-31_uzhesli,06,L2015-03-31, uzhesli,false,
L2015-03-31_volhonka,07,L2015-03-31, volhonka,false,
L2015-03-31_dopoezda,08,L2015-03-31, dopoezda,false,
L2015-03-31_suhumi,09,L2015-03-31, suhumi,false,
L2015-03-31_deja,10,L2015-03-31, deja,false,
L2015-03-31_bukvynak,11,L2015-03-31, bukvynak,false,
L2015-03-31_pamjativ,12,L2015-03-31, pamjativ,false,
---
L2015-03-31_sharmans,13,L2015-03-31, sharmans,false,
L2015-03-31_avtoparo,14,L2015-03-31, avtoparo,false,
L2015-03-31_podzname,15,L2015-03-31, podzname,false,
L2015-03-31_nadvuhk,16,L2015-03-31, nadvuhk,false,
L2015-03-31_netlubez,17,L2015-03-31, netlubez,false,
L2015-03-31_nezabyva,18,L2015-03-31, nezabyva,false,
L2015-03-31_chepuxa,19,L2015-03-31, chepuxa,false,
L2015-03-31_trubach,20,L2015-03-31, trubach,false,
L2015-03-31_shkolat2,21,L2015-03-31, shkolat2,false,
L2015-03-31_neradisp,22,L2015-03-31, neradisp,false,
L2015-03-31_nerazmen,23,L2015-03-31, nerazmen,false,

02.03.2015 пн – Москва, бард-клуб "Гнездо глухаря", 2 премьеры
L2015-03-02_ryba,01,L2015-03-02, ryba,false,
L2015-03-02_1991,02,L2015-03-02, 1991,false,
L2015-03-02_navescha,03,L2015-03-02, navescha,false,
L2015-03-02_zatemzhe,04,L2015-03-02, zatemzhe,false,
L2015-03-02_proschanie,05,L2015-03-02, proschanie,false,
L2015-03-02_avtoparo,06,L2015-03-02, avtoparo,false,
L2015-03-02_romans2,07,L2015-03-02, romans2,false,
L2015-03-02_temapoleta,08,L2015-03-02, temapoleta,false,
L2015-03-02_volhonka,09,L2015-03-02, volhonka,false,
L2015-03-02_mezhetim,10,L2015-03-02, mezhetim,false,
L2015-03-02_dopoezda,11,L2015-03-02, dopoezda,false,
L2015-03-02_kovcheg,12,L2015-03-02, kovcheg,false,
L2015-03-02_pesenkao,13,L2015-03-02, pesenkao,false,
L2015-03-02_nezabyva,14,L2015-03-02, nezabyva,true,
L2015-03-02_shestsem,15,L2015-03-02, shestsem,true,
L2015-03-02_voslavug,16,L2015-03-02, voslavug,false,
---
L2015-03-02_1992,17,L2015-03-02, 1992,false,
L2015-03-02_adleucon,18,L2015-03-02, adleucon,false,
L2015-03-02_alliluja,19,L2015-03-02, alliluja,false,
L2015-03-02_baltijsk,20,L2015-03-02, baltijsk,false,
L2015-03-02_nadvuhk,21,L2015-03-02, nadvuhk,false,
L2015-03-02_podzname,22,L2015-03-02, podzname,false,
L2015-03-02_vsetvoic,23,L2015-03-02, vsetvoic,false,
L2015-03-02_inicialy,24,L2015-03-02, inicialy,false,
L2015-03-02_esli,25,L2015-03-02, esli,false,
L2015-03-02_pamjativ,26,L2015-03-02, pamjativ,false,

08.02.2015 вс – Москва, клуб-магазин "Гиперион", 2 премьеры
L2015-02-08_menuet,01,L2015-02-08, menuet,false,
L2015-02-08_zastolnaya,02,L2015-02-08, zastolnaya,false,
L2015-02-08_brodjagi,03,L2015-02-08, brodjagi,false,
L2015-02-08_kadril,04,L2015-02-08, kadril,false,
L2015-02-08_sentenci,05,L2015-02-08, sentenci,false,
L2015-02-08_1992,06,L2015-02-08, 1992,false,
L2015-02-08_mezhetim,07,L2015-02-08, mezhetim,false,
L2015-02-08_zavescha,08,L2015-02-08, zavescha,false,
L2015-02-08_vekaplyv,09,L2015-02-08, vekaplyv,false,
L2015-02-08_peterbur,10,L2015-02-08, peterbur,false,
L2015-02-08_baltijsk,11,L2015-02-08, baltijsk,false,
L2015-02-08_kogoljub,12,L2015-02-08, kogoljub,false,
L2015-02-08_volk,13,L2015-02-08, volk,false,
L2015-02-08_vpoxodny,14,L2015-02-08, vpoxodny,false,
L2015-02-08_dopoezda,15,L2015-02-08, dopoezda,false,
L2015-02-08_netlubez,16,L2015-02-08, netlubez,true,
L2015-02-08_inicialy,17,L2015-02-08, inicialy,false,
L2015-02-08_serenada,18,L2015-02-08, serenada,false,
L2015-02-08_deja,19,L2015-02-08, deja,false,
L2015-02-08_vsetvoic,20,L2015-02-08, vsetvoic,false,
L2015-02-08_pamjativ,21,L2015-02-08, pamjativ,false,
L2015-02-08_esli,22,L2015-02-08, esli,false,
L2015-02-08_neradisp,23,L2015-02-08, neradisp,true,

12.01.2015 пн – Москва, бард-клуб "Гнездо глухаря"
L2015-01-12_1992,01,L2015-01-12, 1992,false,
L2015-01-12_adleucon,02,L2015-01-12, adleucon,false,
L2015-01-12_deja,03,L2015-01-12, deja,false,
L2015-01-12_kuznechiki,04,L2015-01-12, kuznechiki,false,
L2015-01-12_ryba,05,L2015-01-12, ryba,false,
L2015-01-12_romans2,06,L2015-01-12, romans2,false,
L2015-01-12_suhumi,07,L2015-01-12, suhumi,false,
L2015-01-12_voslavug,08,L2015-01-12, voslavug,false,
L2015-01-12_drugoe,09,L2015-01-12, drugoe,false,
L2015-01-12_trubach,10,L2015-01-12, trubach,false,
L2015-01-12_serenada,11,L2015-01-12, serenada,false,
L2015-01-12_menuet,12,L2015-01-12, menuet,false,
L2015-01-12_brodjagi,13,L2015-01-12, brodjagi,false,
L2015-01-12_zastolnaya,14,L2015-01-12, zastolnaya,false,
---
L2015-01-12_podzname,15,L2015-01-12, podzname,false,
L2015-01-12_inicialy,16,L2015-01-12, inicialy,false,
L2015-01-12_avtoparo,17,L2015-01-12, avtoparo,false,
L2015-01-12_peterbur,18,L2015-01-12, peterbur,false,
L2015-01-12_chepuxa,19,L2015-01-12, chepuxa,false,
L2015-01-12_esli,20,L2015-01-12, esli,false,
L2015-01-12_mneniche,21,L2015-01-12, mneniche,false,
L2015-01-12_navescha,22,L2015-01-12, navescha,false,
L2015-01-12_pamjativ,23,L2015-01-12, pamjativ,false,
L2015-01-12_sharmans,24,L2015-01-12, sharmans,false,


2014 г. ▼ ▲

09.11.2014 вс – США, Mountain Brook, Al

07.11.2014 пт – США, Philadelphia, PA, магазин "Книжник"
L2014-11-07_1991,01,L2014-11-07, 1991,false,
L2014-11-07_adleucon,02,L2014-11-07, adleucon,false,
L2014-11-07_vpotokah,03,L2014-11-07, vpotokah,false,
L2014-11-07_vishnevo,04,L2014-11-07, vishnevo,false,
L2014-11-07_vrjadli,05,L2014-11-07, vrjadli,false,
L2014-11-07_istorija,06,L2014-11-07, istorija,false,
L2014-11-07_baltijsk,07,L2014-11-07, baltijsk,false,
L2014-11-07_dopoezda,08,L2014-11-07, dopoezda,false,
L2014-11-07_pavlovsk,09,L2014-11-07, pavlovsk,false,
L2014-11-07_proschanie,10,L2014-11-07, proschanie,false,
L2014-11-07_moekoro3,11,L2014-11-07, moekoro3,false,
L2014-11-07_suhumi,12,L2014-11-07, suhumi,false,
L2014-11-07_esli,13,L2014-11-07, esli,false,
L2014-11-07_pamjativ,14,L2014-11-07, pamjativ,false,
L2014-11-07_navescha,15,L2014-11-07, navescha,false,
L2014-11-07_nadeyus,16,L2014-11-07, nadeyus,false,
L2014-11-07_pesenkao,17,L2014-11-07, pesenkao,false,
L2014-11-07_podzname,18,L2014-11-07, podzname,false,
L2014-11-07_serenada,19,L2014-11-07, serenada,false,
L2014-11-07_treska,20,L2014-11-07, treska,false,
L2014-11-07_uzhesli,21,L2014-11-07, uzhesli,false,
L2014-11-07_sharmans,22,L2014-11-07, sharmans,false,
L2014-11-07_zatemzhe,23,L2014-11-07, zatemzhe,false,
L2014-11-07_nadpis,24,L2014-11-07, nadpis,false,
L2014-11-07_kovcheg,25,L2014-11-07, kovcheg,false,
L2014-11-07_kupljubi,26,L2014-11-07, kupljubi,false,

01.11.2014 сб – США, Boston, MA
L2014-11-01_serenada,01,L2014-11-01, serenada,false,
L2014-11-01_nadeyus,02,L2014-11-01, nadeyus,false,
L2014-11-01_vpotokah,03,L2014-11-01, vpotokah,false,
L2014-11-01_moekoro3,04,L2014-11-01, moekoro3,false,
L2014-11-01_dopoezda,05,L2014-11-01, dopoezda,false,
L2014-11-01_treska,06,L2014-11-01, treska,false,
L2014-11-01_1991,07,L2014-11-01, 1991,false,
L2014-11-01_vrjadli,08,L2014-11-01, vrjadli,false,
L2014-11-01_istorija,09,L2014-11-01, istorija,false,
L2014-11-01_baltijsk,10,L2014-11-01, baltijsk,false,
L2014-11-01_nadpis,11,L2014-11-01, nadpis,false,
L2014-11-01_kupljubi,12,L2014-11-01, kupljubi,false,
L2014-11-01_esli,13,L2014-11-01, esli,false,
L2014-11-01_romans2,14,L2014-11-01, romans2,false,
L2014-11-01_pesenkao,15,L2014-11-01, pesenkao,false,
---
L2014-11-01_kovcheg,16,L2014-11-01, kovcheg,false,
L2014-11-01_pavlovsk,17,L2014-11-01, pavlovsk,false,
L2014-11-01_proschanie,18,L2014-11-01, proschanie,false,
L2014-11-01_adleucon,19,L2014-11-01, adleucon,false,
L2014-11-01_navescha,20,L2014-11-01, navescha,false,
L2014-11-01_uzhesli,21,L2014-11-01, uzhesli,false,
L2014-11-01_podzname,22,L2014-11-01, podzname,false,
L2014-11-01_odnazhdy,23,L2014-11-01, odnazhdy,false,
L2014-11-01_suhumi,24,L2014-11-01, suhumi,false,
L2014-11-01_nerazmen,25,L2014-11-01, nerazmen,false,
L2014-11-01_bukvynak,26,L2014-11-01, bukvynak,false,
L2014-11-01_pamjativ,27,L2014-11-01, pamjativ,false,

31.10.2014 пт – США, Princeton, NJ
L2014-10-31_serenada,01,L2014-10-31, serenada,false,
L2014-10-31_kovcheg,02,L2014-10-31, kovcheg,false,
L2014-10-31_pesenkao,03,L2014-10-31, pesenkao,false,
L2014-10-31_moekoro3,04,L2014-10-31, moekoro3,false,
L2014-10-31_dopoezda,05,L2014-10-31, dopoezda,false,
L2014-10-31_treska,06,L2014-10-31, treska,false,
L2014-10-31_1991,07,L2014-10-31, 1991,false,
L2014-10-31_vrjadli,08,L2014-10-31, vrjadli,false,
L2014-10-31_istorija,09,L2014-10-31, istorija,false,
L2014-10-31_pavlovsk,10,L2014-10-31, pavlovsk,false,
L2014-10-31_proschanie,11,L2014-10-31, proschanie,false,
L2014-10-31_baltijsk,12,L2014-10-31, baltijsk,false,
L2014-10-31_zatemzhe,13,L2014-10-31, zatemzhe,false,
L2014-10-31_nadpis,14,L2014-10-31, nadpis,false,
L2014-10-31_kupljubi,15,L2014-10-31, kupljubi,false,
L2014-10-31_esli,16,L2014-10-31, esli,false,
---
L2014-10-31_ryba,17,L2014-10-31, ryba,false,
L2014-10-31_nadeyus,18,L2014-10-31, nadeyus,false,
L2014-10-31_vpotokah,19,L2014-10-31, vpotokah,false,
L2014-10-31_adleucon,20,L2014-10-31, adleucon,false,
L2014-10-31_navescha,21,L2014-10-31, navescha,false,
L2014-10-31_podzname,22,L2014-10-31, podzname,false,
L2014-10-31_volk,23,L2014-10-31, volk,false,
L2014-10-31_odnazhdy,24,L2014-10-31, odnazhdy,false,
L2014-10-31_suhumi,25,L2014-10-31, suhumi,false,
L2014-10-31_romans2,26,L2014-10-31, romans2,false,
L2014-10-31_uzhesli,27,L2014-10-31, uzhesli,false,
L2014-10-31_chepuxa,28,L2014-10-31, chepuxa,false,
L2014-10-31_nerazmen,29,L2014-10-31, nerazmen,false,

27.10.2014 пн – Москва, бард-клуб "Гнездо глухаря", текст
L2014-10-27_sharmans,01,L2014-10-27, sharmans,false,
L2014-10-27_pesenkao,02,L2014-10-27, pesenkao,false,
L2014-10-27_moekoro3,03,L2014-10-27, moekoro3,false,
L2014-10-27_jachashu,04,L2014-10-27, jachashu,false,
L2014-10-27_treska,05,L2014-10-27, treska,false,
L2014-10-27_1991,06,L2014-10-27, 1991,false,
L2014-10-27_vrjadli,07,L2014-10-27, vrjadli,false,
L2014-10-27_istorija,08,L2014-10-27, istorija,false,
L2014-10-27_dopoezda,09,L2014-10-27, dopoezda,false,
L2014-10-27_suhumi,10,L2014-10-27, suhumi,false,
L2014-10-27_adleucon,11,L2014-10-27, adleucon,false,
L2014-10-27_navescha,12,L2014-10-27, navescha,false,
L2014-10-27_stixiopr,13,L2014-10-27, stixiopr,false,
L2014-10-27_tirbayard,14,L2014-10-27, tirbayard,false,
---
L2014-10-27_serenada,15,L2014-10-27, serenada,false,
L2014-10-27_podzname,16,L2014-10-27, podzname,false,
L2014-10-27_godshel,17,L2014-10-27, godshel,false,(обновлённый текст)
L2014-10-27_romans2,18,L2014-10-27, romans2,false,
L2014-10-27_volk,19,L2014-10-27, volk,false,
L2014-10-27_odnazhdy,20,L2014-10-27, odnazhdy,false,
L2014-10-27_baltijsk,21,L2014-10-27, baltijsk,false,
L2014-10-27_bukvynak,22,L2014-10-27, bukvynak,false,
L2014-10-27_esli,23,L2014-10-27, esli,false,
L2014-10-27_chepuxa,24,L2014-10-27, chepuxa,false,
L2014-10-27_avstrali,25,L2014-10-27, avstrali,false,

11.10.2014 сб – Москва, коттеджный поселок "ВауТутинки"
L2014-10-11_nichemun,01,L2014-10-11, nichemun,false,
L2014-10-11_propadu,02,L2014-10-11, propadu,false,
L2014-10-11_istorija,03,L2014-10-11, istorija,false,
L2014-10-11_vrjadli,04,L2014-10-11, vrjadli,false,
L2014-10-11_etiglaza,05,L2014-10-11, etiglaza,false,
L2014-10-11_vpoxodny,06,L2014-10-11, vpoxodny,false,
L2014-10-11_sharmans,07,L2014-10-11, sharmans,false,
L2014-10-11_adleucon,08,L2014-10-11, adleucon,false,
L2014-10-11_suhumi,09,L2014-10-11, suhumi,false,
L2014-10-11_zatemzhe,10,L2014-10-11, zatemzhe,false,
L2014-10-11_vishnevo,11,L2014-10-11, vishnevo,false,
L2014-10-11_navescha,12,L2014-10-11, navescha,false,
L2014-10-11_stixiopr,13,L2014-10-11, stixiopr,false,
L2014-10-11_podzname,14,L2014-10-11, podzname,false,
L2014-10-11_odnazhdy,15,L2014-10-11, odnazhdy,false,
L2014-10-11_mneniche,16,L2014-10-11, mneniche,false,
L2014-10-11_romans2,17,L2014-10-11, romans2,false,
L2014-10-11_peterbur,18,L2014-10-11, peterbur,false,
L2014-10-11_baltijsk,19,L2014-10-11, baltijsk,false,
L2014-10-11_fontanka,20,L2014-10-11, fontanka,false,
L2014-10-11_esli,21,L2014-10-11, esli,false,
L2014-10-11_chepuxa,22,L2014-10-11, chepuxa,false,
L2014-10-11_pamjativ,23,L2014-10-11, pamjativ,false,
L2014-10-11_alliluja,24,L2014-10-11, alliluja,false,
L2014-10-11_nerazmen,25,L2014-10-11, nerazmen,false,

07.10.2014 вт – Москва, бард-клуб "Гнездо глухаря", дуэт (гитара)
L2014-10-07_kibitka,01,L2014-10-07, kibitka,false,
L2014-10-07_paris,02,L2014-10-07, paris,false,
L2014-10-07_romans1,03,L2014-10-07, romans1,false,
L2014-10-07_sezondoz,04,L2014-10-07, sezondoz,false,
L2014-10-07_marija,05,L2014-10-07, marija,false,
L2014-10-07_kalejdos,06,L2014-10-07, kalejdos,false,
L2014-10-07_navescha,07,L2014-10-07, navescha,false,
L2014-10-07_aneta,08,L2014-10-07, aneta,false,
L2014-10-07_navsejz1,09,L2014-10-07, navsejz1,false,
L2014-10-07_vrjadli,10,L2014-10-07, vrjadli,false,
L2014-10-07_proschan,11,L2014-10-07, proschan,false,
L2014-10-07_natrinad,12,L2014-10-07, natrinad,false,
L2014-10-07_puskaj,13,L2014-10-07, puskaj,false,
L2014-10-07_poshlyj,14,L2014-10-07, poshlyj,false,
L2014-10-07_kovcheg,15,L2014-10-07, kovcheg,false,
---
L2014-10-07_sharmans,16,L2014-10-07, sharmans,false,
L2014-10-07_konecned,17,L2014-10-07, konecned,false,
L2014-10-07_oderjimy,18*,L2014-10-07, oderjimy,false,
L2014-10-07_sadvolsh,19*,L2014-10-07, sadvolsh,false,
L2014-10-07_mysvjaza,20*,L2014-10-07, mysvjaza,false,
L2014-10-07_dusha,21,L2014-10-07, dusha,false,
L2014-10-07_karavan,22,L2014-10-07, karavan,false,
L2014-10-07_eccehomo,23,L2014-10-07, eccehomo,false,
L2014-10-07_korablik,24,L2014-10-07, korablik,false,
L2014-10-07_vtornik,25,L2014-10-07, vtornik,false,
L2014-10-07_kolybeln,26,L2014-10-07, kolybeln,false,
L2014-10-07_vosxodja,27,L2014-10-07, vosxodja,false,

27.09.2014 сб – Москва, клуб-магазин "Гиперион", 3 премьеры
L2014-09-27_sharmans,01,L2014-09-27, sharmans,false,
L2014-09-27_kordebal,02,L2014-09-27, kordebal,false,
L2014-09-27_pavlovsk,03,L2014-09-27, pavlovsk,false,
L2014-09-27_tirbayard,04,L2014-09-27, tirbayard,false,
L2014-09-27_1991,05,L2014-09-27, 1991,false,
L2014-09-27_esli,06,L2014-09-27, esli,false,
L2014-09-27_dopoezda,07,L2014-09-27, dopoezda,false,
L2014-09-27_bukvynak,08,L2014-09-27, bukvynak,true,
L2014-09-27_ryba,09,L2014-09-27, ryba,false,
L2014-09-27_rodljuds,10,L2014-09-27, rodljuds,false,
L2014-09-27_podzname,11,L2014-09-27, podzname,false,
L2014-09-27_nadeyus,12,L2014-09-27, nadeyus,false,
L2014-09-27_adleucon,13,L2014-09-27, adleucon,false,
L2014-09-27_treska,14,L2014-09-27, treska,true,
L2014-09-27_inicialy,15,L2014-09-27, inicialy,false,
L2014-09-27_serenada,16,L2014-09-27, serenada,false,
L2014-09-27_temapoleta,17,L2014-09-27, temapoleta,false,
L2014-09-27_zatemzhe,18,L2014-09-27, zatemzhe,false,
L2014-09-27_godshel,19,L2014-09-27, godshel,true,
L2014-09-27_volk,20,L2014-09-27, volk,false,
L2014-09-27_pamjativ,21,L2014-09-27, pamjativ,false,
L2014-09-27_nadvuhk,22,L2014-09-27, nadvuhk,false,
L2014-09-27_chepuxa,23,L2014-09-27, chepuxa,false,
L2014-09-27_trubach,24,L2014-09-27, trubach,false,

29.08.2014 пт – Москва, бард-клуб "Гнездо глухаря"
L2014-08-29_kordebal,01,L2014-08-29, kordebal,false,
L2014-08-29_pavlovsk,02,L2014-08-29, pavlovsk,false,
L2014-08-29_suhumi,03,L2014-08-29, suhumi,false,
L2014-08-29_dopoezda,04,L2014-08-29, dopoezda,false,
L2014-08-29_nadeyus,05,L2014-08-29, nadeyus,false,
L2014-08-29_cirkachk,06,L2014-08-29, cirkachk,false,
L2014-08-29_podzname,07,L2014-08-29, podzname,false,
L2014-08-29_baltijsk,08,L2014-08-29, baltijsk,false,
L2014-08-29_rodljuds,09,L2014-08-29, rodljuds,false,
L2014-08-29_esli,10,L2014-08-29, esli,false,
L2014-08-29_sharmans,11,L2014-08-29, sharmans,false,
L2014-08-29_piter,12,L2014-08-29, piter,false,
L2014-08-29_moekoro2,13,L2014-08-29, moekoro2,false,
L2014-08-29_zastolnaya,14,L2014-08-29, zastolnaya,false,
---
L2014-08-29_1992,15,L2014-08-29, 1992,false,
L2014-08-29_odnazhdy,16,L2014-08-29, odnazhdy,false,
L2014-08-29_adleucon,17,L2014-08-29, adleucon,false,
L2014-08-29_chibis,18,L2014-08-29, chibis,false,
L2014-08-29_vpoxodny,19,L2014-08-29, vpoxodny,false,
L2014-08-29_volk,20,L2014-08-29, volk,false,
L2014-08-29_nadvuhk,21,L2014-08-29, nadvuhk,false,
L2014-08-29_chepuxa,22,L2014-08-29, chepuxa,false,
L2014-08-29_alliluja,23,L2014-08-29, alliluja,false,
L2014-08-29_nerazmen,24,L2014-08-29, nerazmen,false,

26.07.2014 сб – Казахстан, Астана, фестиваль авторской песни
L2014-07-26_propadu,01,L2014-07-26, propadu,false,
L2014-07-26_nichemun,02,L2014-07-26, nichemun,false,
L2014-07-26_podzname,03,L2014-07-26, podzname,false,
L2014-07-26_suhumi,04,L2014-07-26, suhumi,false,
L2014-07-26_adleucon,05,L2014-07-26, adleucon,false,
L2014-07-26_kordebal,06,L2014-07-26, kordebal,false,
L2014-07-26_dopoezda,07,L2014-07-26, dopoezda,false,
L2014-07-26_krasnye,08,L2014-07-26, krasnye,false,
L2014-07-26_sharmans,09,L2014-07-26, sharmans,false,
L2014-07-26_peterbur,10,L2014-07-26, peterbur,false,
L2014-07-26_proschanie,11,L2014-07-26, proschanie,false,
L2014-07-26_jachashu,12,L2014-07-26, jachashu,false,
L2014-07-26_vekaplyv,13,L2014-07-26, vekaplyv,false,
L2014-07-26_vishnevo,14,L2014-07-26, vishnevo,false,
L2014-07-26_baltijsk,15,L2014-07-26, baltijsk,false,
L2014-07-26_dendensk,16,L2014-07-26, dendensk,false,
L2014-07-26_volhonka,17,L2014-07-26, volhonka,false,
L2014-07-26_rodljuds,18,L2014-07-26, rodljuds,false,
L2014-07-26_chepuxa,19,L2014-07-26, chepuxa,false,
L2014-07-26_serenada,20,L2014-07-26, serenada,false,
L2014-07-26_temapoleta,21,L2014-07-26, temapoleta,false,
L2014-07-26_esli,22,L2014-07-26, esli,false,
L2014-07-26_alliluja,23,L2014-07-26, alliluja,false,
L2014-07-26_nerazmen,24,L2014-07-26, nerazmen,false,

30.06.2014 пн – Москва, бард-клуб "Гнездо глухаря"
L2014-06-30_propadu,01,L2014-06-30, propadu,false,
L2014-06-30_peterbur,02,L2014-06-30, peterbur,false,
L2014-06-30_proschanie,03,L2014-06-30, proschanie,false,
L2014-06-30_baltijsk,04,L2014-06-30, baltijsk,false,
L2014-06-30_adleucon,05,L2014-06-30, adleucon,false,
L2014-06-30_kordebal,06,L2014-06-30, kordebal,false,
L2014-06-30_dendensk,07,L2014-06-30, dendensk,false,
L2014-06-30_votpodni,08,L2014-06-30, votpodni,false,
L2014-06-30_korablik,09,L2014-06-30, korablik,false,
L2014-06-30_nadpis,10,L2014-06-30, nadpis,false,
L2014-06-30_serenada,11,L2014-06-30, serenada,false,
L2014-06-30_nadvuhk,12,L2014-06-30, nadvuhk,false,
L2014-06-30_suhumi,13,L2014-06-30, suhumi,false,
L2014-06-30_vpotokah,14,L2014-06-30, vpotokah,false,
L2014-06-30_chepuxa,15,L2014-06-30, chepuxa,false,
---
L2014-06-30_jachashu,16,L2014-06-30, jachashu,false,
L2014-06-30_shkolat2,17,L2014-06-30, shkolat2,false,
L2014-06-30_dopoezda,18,L2014-06-30, dopoezda,false,
L2014-06-30_vishnevo,19,L2014-06-30, vishnevo,false,
L2014-06-30_avstrali,20,L2014-06-30, avstrali,false,
L2014-06-30_ryba,21,L2014-06-30, ryba,false,
L2014-06-30_pamjativ,22,L2014-06-30, pamjativ,false,
L2014-06-30_alliluja,23,L2014-06-30, alliluja,false,
L2014-06-30_nerazmen,24,L2014-06-30, nerazmen,false,

08.06.2014 вс – США, Irvine, CA, домашний концерт у А. Кискачи

06.06.2014 пт – США, Minneapolis, MN

02.06.2014 пн – США, Chicago, IL

01.06.2014 вс – США, Carmel, IN

31.05.2014 сб – США, Ann Arbor, MI
L2014-05-31_podzname,01,L2014-05-31, podzname,false,
L2014-05-31_peterbur,02,L2014-05-31, peterbur,false,
L2014-05-31_propadu,03,L2014-05-31, propadu,false,
L2014-05-31_proschanie,04,L2014-05-31, proschanie,false,
L2014-05-31_nichemun,05,L2014-05-31, nichemun,false,
L2014-05-31_shkolat2,06,L2014-05-31, shkolat2,false,
L2014-05-31_istorija,07,L2014-05-31, istorija,false,
L2014-05-31_baltijsk,08,L2014-05-31, baltijsk,false,
L2014-05-31_romans2,09,L2014-05-31, romans2,false,
L2014-05-31_serenada,10,L2014-05-31, serenada,false,
L2014-05-31_vpotokah,11,L2014-05-31, vpotokah,false,
L2014-05-31_nadvuhk,12,L2014-05-31, nadvuhk,false,
L2014-05-31_suhumi,13,L2014-05-31, suhumi,false,
L2014-05-31_vekaplyv,14,L2014-05-31, vekaplyv,false,
L2014-05-31_poslexol,15,L2014-05-31, poslexol,false,
L2014-05-31_uzhesli,16,L2014-05-31, uzhesli,false,
---
L2014-05-31_sharmans,17,L2014-05-31, sharmans,false,
L2014-05-31_mneniche,18,L2014-05-31, mneniche,false,
L2014-05-31_jachashu,19,L2014-05-31, jachashu,false,
L2014-05-31_nadpis,20,L2014-05-31, nadpis,false,
L2014-05-31_dendensk,21,L2014-05-31, dendensk,false,
L2014-05-31_navescha,22,L2014-05-31, navescha,false,
L2014-05-31_esli,23,L2014-05-31, esli,false,
L2014-05-31_chepuxa,24,L2014-05-31, chepuxa,false,
L2014-05-31_volk,25,L2014-05-31, volk,false,
L2014-05-31_pamjativ,26,L2014-05-31, pamjativ,false,
L2014-05-31_kogdaned,27,L2014-05-31, kogdaned,false,
L2014-05-31_nerazmen,28,L2014-05-31, nerazmen,false,

29.05.2014 чт – США, Cleveland, OH

27.05.2014 вт – США, Fair Lawn, NJ, второй акт скрипка, гитара
L2014-05-27_propadu,01,L2014-05-27, propadu,false,
L2014-05-27_podzname,02,L2014-05-27, podzname,false,
L2014-05-27_peterbur,03,L2014-05-27, peterbur,false,
L2014-05-27_proschanie,04,L2014-05-27, proschanie,false,
L2014-05-27_suhumi,05,L2014-05-27, suhumi,false,
L2014-05-27_vekaplyv,06,L2014-05-27, vekaplyv,false,
L2014-05-27_nadpis,07,L2014-05-27, nadpis,false,
L2014-05-27_sharmans,08,L2014-05-27, sharmans,false,
L2014-05-27_vpotokah,09,L2014-05-27, vpotokah,false,
L2014-05-27_nadvuhk,10,L2014-05-27, nadvuhk,false,
L2014-05-27_baltijsk,11,L2014-05-27, baltijsk,false,
L2014-05-27_shkolat2,12,L2014-05-27, shkolat2,false,
L2014-05-27_temapoleta,13,L2014-05-27, temapoleta,false,
L2014-05-27_uzhesli,14,L2014-05-27, uzhesli,false,
--- Дмитрий Фиш (скрипка), Герман Кац (гитара)
L2014-05-27_ryba,15,L2014-05-27, ryba,false,
L2014-05-27_krasnye,16,L2014-05-27, krasnye,false,
L2014-05-27_volk,17,L2014-05-27, volk,false,
L2014-05-27_nichemun,18,L2014-05-27, nichemun,false,
L2014-05-27_kuznechiki,19,L2014-05-27, kuznechiki,false,
L2014-05-27_dendensk,20,L2014-05-27, dendensk,false,
L2014-05-27_navescha,21,L2014-05-27, navescha,false,
L2014-05-27_esli,22,L2014-05-27, esli,false,
L2014-05-27_alliluja,23,L2014-05-27, alliluja,false,
L2014-05-27_dopoezda,24,L2014-05-27, dopoezda,false,
L2014-05-27_pamjativ,25,L2014-05-27, pamjativ,false,
L2014-05-27_kogdaned,26,L2014-05-27, kogdaned,false,
L2014-05-27_nerazmen,27,L2014-05-27, nerazmen,false,

20.05.2014 вт – Москва, бард-клуб "Гнездо глухаря" (малый зал), 2 премьеры
L2014-05-20_propadu,01,L2014-05-20, propadu,false,
L2014-05-20_nichemun,02,L2014-05-20, nichemun,false,
L2014-05-20_peterbur,03,L2014-05-20, peterbur,false,
L2014-05-20_dendensk,04,L2014-05-20, dendensk,false,
L2014-05-20_istorija,05,L2014-05-20, istorija,false,
L2014-05-20_suhumi,06,L2014-05-20, suhumi,false,
L2014-05-20_ryba,07,L2014-05-20, ryba,false,
L2014-05-20_navescha,08,L2014-05-20, navescha,false,
L2014-05-20_jachashu,09,L2014-05-20, jachashu,false,
L2014-05-20_volhonka,10,L2014-05-20, volhonka,false,
L2014-05-20_poslexol,11,L2014-05-20, poslexol,false,
L2014-05-20_sharmans,12,L2014-05-20, sharmans,false,
L2014-05-20_vpotokah,13,L2014-05-20, vpotokah,true,
L2014-05-20_romans2,14,L2014-05-20, romans2,false,
L2014-05-20_baltijsk,15,L2014-05-20, baltijsk,false,
L2014-05-20_shkolat2,16,L2014-05-20, shkolat2,false,
---
L2014-05-20_podzname,17,L2014-05-20, podzname,false,
L2014-05-20_votpodni,18,L2014-05-20, votpodni,false,
L2014-05-20_neuzheli,19,L2014-05-20, neuzheli,true,
L2014-05-20_temapoleta,20,L2014-05-20, temapoleta,false,
L2014-05-20_chepuxa,21,L2014-05-20, chepuxa,false,
L2014-05-20_dopoezda,22,L2014-05-20, dopoezda,false,
L2014-05-20_nadvuhk,23,L2014-05-20, nadvuhk,false,
L2014-05-20_mneniche,24,L2014-05-20, mneniche,false,
L2014-05-20_esli,25,L2014-05-20, esli,false,
L2014-05-20_alliluja,26,L2014-05-20, alliluja,false,
L2014-05-20_pamjativ,27,L2014-05-20, pamjativ,false,
L2014-05-20_nerazmen,28,L2014-05-20, nerazmen,false,
L2014-05-20_trubach,29,L2014-05-20, trubach,false,

27.04.2014 вс – Москва, клуб-магазин "Гиперион"
L2014-04-27_ryba,01,L2014-04-27, ryba,false,
L2014-04-27_deklarac,02,L2014-04-27, deklarac,false,
L2014-04-27_peterbur,03,L2014-04-27, peterbur,false,
L2014-04-27_proschanie,04,L2014-04-27, proschanie,false,
L2014-04-27_suhumi,05,L2014-04-27, suhumi,false,
L2014-04-27_dendensk,06,L2014-04-27, dendensk,false,
L2014-04-27_volhonka,07,L2014-04-27, volhonka,false,
L2014-04-27_jachashu,08,L2014-04-27, jachashu,false,
L2014-04-27_romans2,09,L2014-04-27, romans2,false,
L2014-04-27_istorija,10,L2014-04-27, istorija,false,
L2014-04-27_poslexol,11,L2014-04-27, poslexol,false,
L2014-04-27_shkolat2,12,L2014-04-27, shkolat2,false,
L2014-04-27_nadvuhk,13,L2014-04-27, nadvuhk,false,
L2014-04-27_sharmans,14,L2014-04-27, sharmans,false,
L2014-04-27_traviata,15,L2014-04-27, traviata,false,
L2014-04-27_uzhesli,16,L2014-04-27, uzhesli,false,
L2014-04-27_navescha,17,L2014-04-27, navescha,false,
L2014-04-27_baltijsk,18,L2014-04-27, baltijsk,false,
L2014-04-27_nadpis,19,L2014-04-27, nadpis,false,
L2014-04-27_temapoleta,20,L2014-04-27, temapoleta,false,
L2014-04-27_chepuxa,21,L2014-04-27, chepuxa,false,
L2014-04-27_vekaplyv,22,L2014-04-27, vekaplyv,false,
L2014-04-27_mneniche,23,L2014-04-27, mneniche,false,
L2014-04-27_esli,24,L2014-04-27, esli,false,
L2014-04-27_nerazmen,25,L2014-04-27, nerazmen,false,

21.04.2014 пн – Москва, бард-клуб "Гнездо глухаря", дуэт (гитара)
L2014-04-21_kibitka,01,L2014-04-21, kibitka,false,
L2014-04-21_romans1,02,L2014-04-21, romans1,false,
L2014-04-21_sezondoz,03,L2014-04-21, sezondoz,false,
L2014-04-21_kalejdos,04,L2014-04-21, kalejdos,false,
L2014-04-21_marija,05,L2014-04-21, marija,false,
L2014-04-21_adleucon,06,L2014-04-21, adleucon,false,
L2014-04-21_proschan,07,L2014-04-21, proschan,false,
L2014-04-21_serenada,08,L2014-04-21, serenada,false,
L2014-04-21_bereg,09,L2014-04-21, bereg,false,
L2014-04-21_kovcheg,10,L2014-04-21, kovcheg,false,
L2014-04-21_uzhesli,11,L2014-04-21, uzhesli,false,
L2014-04-21_svidanie,12,L2014-04-21, svidanie,false,
L2014-04-21_romansma,13,L2014-04-21, romansma,false,
L2014-04-21_ljubov,14,L2014-04-21, ljubov,false,
L2014-04-21_farmacev,15,L2014-04-21, farmacev,false,
---
L2014-04-21_ryba,16,L2014-04-21, ryba,false,
L2014-04-21_sharmans,17,L2014-04-21, sharmans,false,
L2014-04-21_yavysele,18*,L2014-04-21, yavysele,false,
L2014-04-21_ometro,19*,L2014-04-21, ometro,false,
L2014-04-21_poshlyj,20,L2014-04-21, poshlyj,false,
L2014-04-21_dusha,21,L2014-04-21, dusha,false,
L2014-04-21_navescha,22,L2014-04-21, navescha,false,
L2014-04-21_karavan,23,L2014-04-21, karavan,false,
L2014-04-21_eccehomo,24,L2014-04-21, eccehomo,false,
L2014-04-21_korablik,25,L2014-04-21, korablik,false,
L2014-04-21_vtornik,26,L2014-04-21, vtornik,false,
L2014-04-21_kolybelb,27,L2014-04-21, kolybelb,false,
L2014-04-21_vosxodja,28,L2014-04-21, vosxodja,false,

29.03.2014 сб – Ирландия, Дублин, Тринити Колледж
L2014-03-29_nichemun,01,L2014-03-29, nichemun,false,
L2014-03-29_sharmans,02,L2014-03-29, sharmans,false,
L2014-03-29_peterbur,03,L2014-03-29, peterbur,false,
L2014-03-29_proschanie,04,L2014-03-29, proschanie,false,
L2014-03-29_serenada,05,L2014-03-29, serenada,false,
L2014-03-29_dendensk,06,L2014-03-29, dendensk,false,
L2014-03-29_volhonka,07,L2014-03-29, volhonka,false,
L2014-03-29_ubykagol,08,L2014-03-29, ubykagol,false,
L2014-03-29_romans2,09,L2014-03-29, romans2,false,
L2014-03-29_istorija,10,L2014-03-29, istorija,false,
L2014-03-29_poslexol,11,L2014-03-29, poslexol,false,
L2014-03-29_sredneg2,12,L2014-03-29, sredneg2,false,
L2014-03-29_vrjadli,13,L2014-03-29, vrjadli,false,
L2014-03-29_stixiopr,14,L2014-03-29, stixiopr,false,
L2014-03-29_esli,15,L2014-03-29, esli,false,
---
L2014-03-29_ryba,16,L2014-03-29, ryba,false,
L2014-03-29_desyatpe,17,L2014-03-29, desyatpe,false,
L2014-03-29_etiglaza,18,L2014-03-29, etiglaza,false,
L2014-03-29_suhumi,19,L2014-03-29, suhumi,false,
L2014-03-29_nadvuhk,20,L2014-03-29, nadvuhk,false,
L2014-03-29_cirkachk,21,L2014-03-29, cirkachk,false,
L2014-03-29_chepuxa,22,L2014-03-29, chepuxa,false,
L2014-03-29_temapoleta,23,L2014-03-29, temapoleta,false,
L2014-03-29_baltijsk,24,L2014-03-29, baltijsk,false,
L2014-03-29_alliluja,25,L2014-03-29, alliluja,false,
L2014-03-29_vekaplyv,26,L2014-03-29, vekaplyv,false,
L2014-03-29_mneniche,27,L2014-03-29, mneniche,false,
L2014-03-29_pamjativ,28,L2014-03-29, pamjativ,false,
L2014-03-29_nerazmen,29,L2014-03-29, nerazmen,false,

03.03.2014 пн – Москва, бард-клуб "Гнездо глухаря"
L2014-03-03_ryba,01,L2014-03-03, ryba,false,
L2014-03-03_istorija,02,L2014-03-03, istorija,false,
L2014-03-03_romans2,03,L2014-03-03, romans2,false,
L2014-03-03_serenada,04,L2014-03-03, serenada,false,
L2014-03-03_peterbur,05,L2014-03-03, peterbur,false,
L2014-03-03_prenebre,06,L2014-03-03, prenebre,false,
L2014-03-03_krasnye,07,L2014-03-03, krasnye,false,
L2014-03-03_cirkachk,08,L2014-03-03, cirkachk,false,
L2014-03-03_desyatpe,09,L2014-03-03, desyatpe,false,
L2014-03-03_poslexol,10,L2014-03-03, poslexol,false,
L2014-03-03_vrjadli,11,L2014-03-03, vrjadli,false,
L2014-03-03_volhonka,12,L2014-03-03, volhonka,false,
L2014-03-03_stixiopr,13,L2014-03-03, stixiopr,false,
L2014-03-03_nadpis,14,L2014-03-03, nadpis,false,
L2014-03-03_vekaplyv,15,L2014-03-03, vekaplyv,false,
L2014-03-03_etiglaza,16,L2014-03-03, etiglaza,false,
---
L2014-03-03_jachashu,17,L2014-03-03, jachashu,false,
L2014-03-03_zatemzhe,18,L2014-03-03, zatemzhe,false,
L2014-03-03_temapoleta,19,L2014-03-03, temapoleta,false,
L2014-03-03_kogdaned,20,L2014-03-03, kogdaned,false,
L2014-03-03_vpoxodny,21,L2014-03-03, vpoxodny,false,
L2014-03-03_baltijsk,22,L2014-03-03, baltijsk,false,
L2014-03-03_alliluja,23,L2014-03-03, alliluja,false,
L2014-03-03_esli,24,L2014-03-03, esli,false,
L2014-03-03_trubach,25,L2014-03-03, trubach,false,
L2014-03-03_nerazmen,26,L2014-03-03, nerazmen,false,

12.01.2014 вс – Москва, бард-клуб "Гнездо глухаря"
L2014-01-12_nichemun,01,L2014-01-12, nichemun,false,
L2014-01-12_ubykagol,02,L2014-01-12, ubykagol,false,
L2014-01-12_1992,03,L2014-01-12, 1992,false,
L2014-01-12_etiglaza,04,L2014-01-12, etiglaza,false,
L2014-01-12_serenada,05,L2014-01-12, serenada,false,
L2014-01-12_proschanie,06,L2014-01-12, proschanie,false,
L2014-01-12_chepuxa,07,L2014-01-12, chepuxa,false,
L2014-01-12_vekaplyv,08,L2014-01-12, vekaplyv,false,
L2014-01-12_podzname,09,L2014-01-12, podzname,false,
L2014-01-12_kupljubi,10,L2014-01-12, kupljubi,false,
L2014-01-12_kuznechiki,11,L2014-01-12, kuznechiki,false,
L2014-01-12_esli,12,L2014-01-12, esli,false,
L2014-01-12_menuet,13,L2014-01-12, menuet,false,
L2014-01-12_piter,14,L2014-01-12, piter,false,
L2014-01-12_zastolnaya,15,L2014-01-12, zastolnaya,false,
---
L2014-01-12_sharmans,16,L2014-01-12, sharmans,false,
L2014-01-12_zhizn,17,L2014-01-12, zhizn,false,
L2014-01-12_romans2,18,L2014-01-12, romans2,false,
L2014-01-12_nebyvaet,19,L2014-01-12, nebyvaet,false,
L2014-01-12_vkoncevr,20,L2014-01-12, vkoncevr,false,
L2014-01-12_suhumi,21,L2014-01-12, suhumi,false,
L2014-01-12_nadvuhk,22,L2014-01-12, nadvuhk,false,
L2014-01-12_inicialy,23,L2014-01-12, inicialy,false,
L2014-01-12_trubach,24,L2014-01-12, trubach,false,
L2014-01-12_pamjativ,25,L2014-01-12, pamjativ,false,
L2014-01-12_nerazmen,26,L2014-01-12, nerazmen,false,


2013 г. ▼ ▲

09.12.2013 пн – Москва, бард-клуб "Гнездо глухаря", премьера
L2013-12-09_podzname,01,L2013-12-09, podzname,false,
L2013-12-09_zhizn,02,L2013-12-09, zhizn,false,
L2013-12-09_cirkachk,03,L2013-12-09, cirkachk,false,
L2013-12-09_moekoro3,04,L2013-12-09, moekoro3,false,
L2013-12-09_dendensk,05,L2013-12-09, dendensk,false,
L2013-12-09_volk,06,L2013-12-09, volk,false,
L2013-12-09_peterbur,07,L2013-12-09, peterbur,false,
L2013-12-09_baltijsk,08,L2013-12-09, baltijsk,false,
L2013-12-09_vekaplyv,09,L2013-12-09, vekaplyv,false,
L2013-12-09_serenada,10,L2013-12-09, serenada,false,
L2013-12-09_kupljubi,11,L2013-12-09, kupljubi,false,
L2013-12-09_vrjadli,12,L2013-12-09, vrjadli,false,
L2013-12-09_volhonka,13,L2013-12-09, volhonka,false,
L2013-12-09_proschanie,14,L2013-12-09, proschanie,false,
L2013-12-09_jachashu,15,L2013-12-09, jachashu,false,
---
L2013-12-09_ryba,16,L2013-12-09, ryba,false,
L2013-12-09_romans2,17,L2013-12-09, romans2,false,
L2013-12-09_kogdamen,18,L2013-12-09, kogdamen,false,
L2013-12-09_temapoleta,19,L2013-12-09, temapoleta,false,
L2013-12-09_pavlovsk,20,L2013-12-09, pavlovsk,false,
L2013-12-09_uzhesli,21,L2013-12-09, uzhesli,true,
L2013-12-09_vishnevo,22,L2013-12-09, vishnevo,false,
L2013-12-09_vsetvoic,23,L2013-12-09, vsetvoic,false,
L2013-12-09_suhumi,24,L2013-12-09, suhumi,false,
L2013-12-09_shkolat2,25,L2013-12-09, shkolat2,false,
L2013-12-09_nadvuhk,26,L2013-12-09, nadvuhk,false,
L2013-12-09_rydaytru,27,L2013-12-09, rydaytru,false,
L2013-12-09_trubach,28,L2013-12-09, trubach,false,

15.11.2013 пт – Израиль, Гиватаим, "Театр Гиватаим"
L2013-11-15_podzname,01,L2013-11-15, podzname,false,
L2013-11-15_zhizn,02,L2013-11-15, zhizn,false,
L2013-11-15_cirkachk,03,L2013-11-15, cirkachk,false,
L2013-11-15_votpodni,04,L2013-11-15, votpodni,false,
L2013-11-15_ryba,05,L2013-11-15, ryba,false,
L2013-11-15_1990,06,L2013-11-15, 1990,false,
L2013-11-15_volk,07,L2013-11-15, volk,false,
L2013-11-15_moekoro3,08,L2013-11-15, moekoro3,false,
L2013-11-15_poslexol,09,L2013-11-15, poslexol,false,
L2013-11-15_vekaplyv,10,L2013-11-15, vekaplyv,false,
L2013-11-15_serenada,11,L2013-11-15, serenada,false,
L2013-11-15_kupljubi,12,L2013-11-15, kupljubi,false,
L2013-11-15_vrjadli,13,L2013-11-15, vrjadli,false,
L2013-11-15_volhonka,14,L2013-11-15, volhonka,false,
L2013-11-15_proschanie,15,L2013-11-15, proschanie,false,
L2013-11-15_jachashu,16,L2013-11-15, jachashu,false,
L2013-11-15_kogdamen,17,L2013-11-15, kogdamen,false,
---
L2013-11-15_romans2,18,L2013-11-15, romans2,false,
L2013-11-15_etiglaza,19,L2013-11-15, etiglaza,false,
L2013-11-15_temapoleta,20,L2013-11-15, temapoleta,false,
L2013-11-15_chepuxa,21,L2013-11-15, chepuxa,false,
L2013-11-15_tirbayard,22,L2013-11-15, tirbayard,false,
L2013-11-15_vsetvoic,23,L2013-11-15, vsetvoic,false,
L2013-11-15_alliluja,24,L2013-11-15, alliluja (не допел),false,
L2013-11-15_mneniche,25,L2013-11-15, mneniche,false,
L2013-11-15_nadvuhk,26,L2013-11-15, nadvuhk,false,
L2013-11-15_vkoncevr,27,L2013-11-15, vkoncevr,false,
L2013-11-15_dopoezda,28,L2013-11-15, dopoezda,false,
L2013-11-15_suhumi,29,L2013-11-15, suhumi,false,
L2013-11-15_alliluja,30,L2013-11-15, alliluja,false,
L2013-11-15_sharmans,31,L2013-11-15, sharmans,false,
L2013-11-15_trubach,32,L2013-11-15, trubach,false,

14.11.2013 чт – Израиль, Хайфа, зал "Бейтену"
L2013-11-14_serenada,01,L2013-11-14, serenada,false,
L2013-11-14_podzname,02,L2013-11-14, podzname,false,
L2013-11-14_shkolat2,03,L2013-11-14, shkolat2,false,
L2013-11-14_vrjadli,04,L2013-11-14, vrjadli,false,
L2013-11-14_1990,05,L2013-11-14, 1990,false,
L2013-11-14_baltijsk,06,L2013-11-14, baltijsk,false,
L2013-11-14_moekoro3,07,L2013-11-14, moekoro3,false,
L2013-11-14_volk,08,L2013-11-14, volk,false,
L2013-11-14_kogdaned,09,L2013-11-14, kogdaned,false,
L2013-11-14_proschanie,10,L2013-11-14, proschanie,false,
L2013-11-14_kupljubi,11,L2013-11-14, kupljubi,false,
L2013-11-14_propadu,12,L2013-11-14, propadu,false,
L2013-11-14_votpodni,13,L2013-11-14, votpodni,false,
L2013-11-14_peterbur,14,L2013-11-14, peterbur,false,
L2013-11-14_kogdamen,15,L2013-11-14, kogdamen,false,
L2013-11-14_zatemzhe,16,L2013-11-14, zatemzhe,false,
L2013-11-14_temapoleta,17,L2013-11-14, temapoleta,false,
L2013-11-14_vsetvoic,18,L2013-11-14, vsetvoic,false,
L2013-11-14_traviata,19,L2013-11-14, traviata,false,
L2013-11-14_dopoezda,20,L2013-11-14, dopoezda,false,
L2013-11-14_pavlovsk,21,L2013-11-14, pavlovsk,false,
L2013-11-14_rydaytru,22,L2013-11-14, rydaytru,false,
L2013-11-14_nadvuhk,23,L2013-11-14, nadvuhk,false,
L2013-11-14_pamjativ,24,L2013-11-14, pamjativ,false,
L2013-11-14_suhumi,25,L2013-11-14, suhumi,false,
L2013-11-14_trubach,26,L2013-11-14, trubach,false,

13.11.2013 ср – Израиль, Иерусалим, зал "Гармония"
L2013-11-13_nichemun,01,L2013-11-13, nichemun,false,
L2013-11-13_podzname,02,L2013-11-13, podzname,false,
L2013-11-13_ballada,03,L2013-11-13, ballada,false,
L2013-11-13_votpodni,04,L2013-11-13, votpodni,false,
L2013-11-13_propadu,05,L2013-11-13, propadu,false,
L2013-11-13_kogdaned,06,L2013-11-13, kogdaned,false,
L2013-11-13_volk,07,L2013-11-13, volk,false,
L2013-11-13_istorija,08,L2013-11-13, istorija,false,
L2013-11-13_baltijsk,09,L2013-11-13, baltijsk,false,
L2013-11-13_peterbur,10,L2013-11-13, peterbur,false,
L2013-11-13_proschanie,11,L2013-11-13, proschanie,false,
L2013-11-13_serenada,12,L2013-11-13, serenada,false,
L2013-11-13_vrjadli,13,L2013-11-13, vrjadli,false,
L2013-11-13_suhumi,14,L2013-11-13, suhumi,false,
L2013-11-13_volhonka,15,L2013-11-13, volhonka,false,
L2013-11-13_1991,16,L2013-11-13, 1991,false,
L2013-11-13_kogdamen,17,L2013-11-13, kogdamen,false,
L2013-11-13_romans2,18,L2013-11-13, romans2,false,
L2013-11-13_zatemzhe,19,L2013-11-13, zatemzhe,false,
L2013-11-13_temapoleta,20,L2013-11-13, temapoleta,false,
L2013-11-13_shkolat2,21,L2013-11-13, shkolat2,false,
L2013-11-13_traviata,22,L2013-11-13, traviata,false,
L2013-11-13_vsetvoic,23,L2013-11-13, vsetvoic,false,
L2013-11-13_fontanka,24,L2013-11-13, fontanka,false,
L2013-11-13_pavlovsk,25,L2013-11-13, pavlovsk,false,
L2013-11-13_rydaytru,26,L2013-11-13, rydaytru,false,
L2013-11-13_nadvuhk,27,L2013-11-13, nadvuhk,false,
L2013-11-13_pamjativ,28,L2013-11-13, pamjativ,false,
L2013-11-13_esli,29,L2013-11-13, esli,false,
L2013-11-13_nerazmen,30,L2013-11-13, nerazmen,false,

23.10.2013 ср – Москва, бард-клуб "Гнездо глухаря"
L2013-10-23_zhizn,01,L2013-10-23, zhizn,false,
L2013-10-23_cirkachk,02,L2013-10-23, cirkachk,false,
L2013-10-23_istorija,03,L2013-10-23, istorija,false,
L2013-10-23_volk,04,L2013-10-23, volk,false,
L2013-10-23_kordebal,05,L2013-10-23, kordebal,false,
L2013-10-23_proschanie,06,L2013-10-23, proschanie,false,
L2013-10-23_1995,07,L2013-10-23, 1995,false,
L2013-10-23_kogdaned,08,L2013-10-23, kogdaned,false,
L2013-10-23_1990,09,L2013-10-23, 1990,false,
L2013-10-23_kupljubi,10,L2013-10-23, kupljubi,false,
L2013-10-23_poslexol,11,L2013-10-23, poslexol,false,
L2013-10-23_sentenci,12,L2013-10-23, sentenci,false,
L2013-10-23_zastolnaya,13,L2013-10-23, zastolnaya,false,
---
L2013-10-23_tirbayard,14,L2013-10-23, tirbayard,false,
L2013-10-23_moekoro3,15,L2013-10-23, moekoro3,false,
L2013-10-23_shkolat2,16,L2013-10-23, shkolat2,false,
L2013-10-23_chuzhaj2,17,L2013-10-23, chuzhaj2,false,
L2013-10-23_1991,18,L2013-10-23, 1991,false,
L2013-10-23_vademecu,19,L2013-10-23, vademecu,false,
L2013-10-23_rydaytru,20,L2013-10-23, rydaytru,false,
L2013-10-23_peterbur,21,L2013-10-23, peterbur,false,
L2013-10-23_esli,22,L2013-10-23, esli,false,
L2013-10-23_nerazmen,23,L2013-10-23, nerazmen,false,

19.10.2013 сб – Оренбург, Областной театр кукол
L2013-10-19_nichemun,01,L2013-10-19, nichemun,false,
L2013-10-19_sharmans,02,L2013-10-19, sharmans,false,
L2013-10-19_ballada,03,L2013-10-19, ballada,false,
L2013-10-19_romans2,04,L2013-10-19, romans2,false,
L2013-10-19_kuznechiki,05,L2013-10-19, kuznechiki,false,
L2013-10-19_stixiopr,06,L2013-10-19, stixiopr,false,
L2013-10-19_vrjadli,07,L2013-10-19, vrjadli,false,
L2013-10-19_1990,08,L2013-10-19, 1990,false,
L2013-10-19_kupljubi,09,L2013-10-19, kupljubi,false,
L2013-10-19_temapoleta,10,L2013-10-19, temapoleta,false,
L2013-10-19_chepuxa,11,L2013-10-19, chepuxa,false,
L2013-10-19_zatemzhe,12,L2013-10-19, zatemzhe,false,
L2013-10-19_volhonka,13,L2013-10-19, volhonka,false,
L2013-10-19_dendensk,14,L2013-10-19, dendensk,false,
L2013-10-19_nadvuhk,15,L2013-10-19, nadvuhk,false,
L2013-10-19_baltijsk,16,L2013-10-19, baltijsk,false,
L2013-10-19_trubach,17,L2013-10-19, trubach,false,
---
L2013-10-19_ryba,18,L2013-10-19, ryba,false,
L2013-10-19_vsetvoic,19,L2013-10-19, vsetvoic,false,
L2013-10-19_traviata,20,L2013-10-19, traviata,false,
L2013-10-19_suhumi,21,L2013-10-19, suhumi,false,
L2013-10-19_dopoezda,22,L2013-10-19, dopoezda,false,
L2013-10-19_vytakpyl,23*,L2013-10-19, vytakpyl,false,
L2013-10-19_ustaloju,24*,L2013-10-19, ustaloju,false,
L2013-10-19_desyatpe,25,L2013-10-19, desyatpe,false,
L2013-10-19_alliluja,26,L2013-10-19, alliluja,false,
L2013-10-19_serenada,27,L2013-10-19, serenada,false,
L2013-10-19_pamjativ,28,L2013-10-19, pamjativ,false,
L2013-10-19_esli,29,L2013-10-19, esli,false,
L2013-10-19_nerazmen,30,L2013-10-19, nerazmen,false,

07.10.2013 пн – Минск, КЗ "Минск" (малый зал), дуэт (гитара)
L2013-10-07_sharmans,01,L2013-10-07, sharmans,false,
L2013-10-07_navsejz1,02,L2013-10-07, navsejz1,false,
L2013-10-07_paris,03,L2013-10-07, paris,false,
L2013-10-07_romans1,04,L2013-10-07, romans1,false,
L2013-10-07_sezondoz,05,L2013-10-07, sezondoz,false,
L2013-10-07_marija,06,L2013-10-07, marija,false,
L2013-10-07_kuznechiki,07,L2013-10-07, kuznechiki,false,
L2013-10-07_vrjadli,08,L2013-10-07, vrjadli,false,
L2013-10-07_puskaj,09,L2013-10-07, puskaj,false,
L2013-10-07_serenada,10,L2013-10-07, serenada,false,
L2013-10-07_ryba,11,L2013-10-07, ryba,false,
L2013-10-07_proschan,12,L2013-10-07, proschan,false,
L2013-10-07_adleucon,13,L2013-10-07, adleucon,false,
L2013-10-07_poshlyj,14,L2013-10-07, poshlyj,false,
L2013-10-07_kovcheg,15,L2013-10-07, kovcheg,false,
---
L2013-10-07_kibitka,16,L2013-10-07, kibitka,false,
L2013-10-07_bereg,17,L2013-10-07, bereg,false,
L2013-10-07_vsemuvre,18*,L2013-10-07, vsemuvre,false,
L2013-10-07_mastergr,19*,L2013-10-07, mastergr,false,
L2013-10-07_nuchemte,20*,L2013-10-07, nuchemte,false,
L2013-10-07_smozarto,21*,L2013-10-07, smozarto,false,
L2013-10-07_voslavug,22,L2013-10-07, voslavug,false,
L2013-10-07_karavan,23,L2013-10-07, karavan,false,
L2013-10-07_eccehomo,24,L2013-10-07, eccehomo,false,
L2013-10-07_dusha,25,L2013-10-07, dusha,false,
L2013-10-07_korablik,26,L2013-10-07, korablik,false,
L2013-10-07_vtornik,27,L2013-10-07, vtornik,false,
L2013-10-07_kolybeln,28,L2013-10-07, kolybeln,false,
L2013-10-07_vosxodja,29,L2013-10-07, vosxodja,false,

03.10.2013 чт – Минск, КЗ "Минск" (малый зал)
L2013-10-03_nichemun,01,L2013-10-03, nichemun,false,
L2013-10-03_romans2,02,L2013-10-03, romans2,false,
L2013-10-03_istorija,03,L2013-10-03, istorija,false,
L2013-10-03_volk,04,L2013-10-03, volk,false,
L2013-10-03_votpodni,05,L2013-10-03, votpodni,false,
L2013-10-03_ballada,06,L2013-10-03, ballada,false,
L2013-10-03_podzname,07,L2013-10-03, podzname,false,
L2013-10-03_prenebre,08,L2013-10-03, prenebre,false,
L2013-10-03_kupljubi,09,L2013-10-03, kupljubi,false,
L2013-10-03_dendensk,10,L2013-10-03, dendensk,false,
L2013-10-03_suhumi,11,L2013-10-03, suhumi,false,
L2013-10-03_desyatpe,12,L2013-10-03, desyatpe,false,
L2013-10-03_alliluja,13,L2013-10-03, alliluja,false,
L2013-10-03_baltijsk,14,L2013-10-03, baltijsk,false,
L2013-10-03_etiglaza,15,L2013-10-03, etiglaza,false,
---
L2013-10-03_moekoro3,16,L2013-10-03, moekoro3,false,
L2013-10-03_proschanie,17,L2013-10-03, proschanie,false,
L2013-10-03_pavlovsk,18,L2013-10-03, pavlovsk,false,
L2013-10-03_schitime,19,L2013-10-03, schitime,false,
L2013-10-03_vsetvoic,20,L2013-10-03, vsetvoic,false,
L2013-10-03_zatemzhe,21,L2013-10-03, zatemzhe,false,
L2013-10-03_temapoleta,22,L2013-10-03, temapoleta,false,
L2013-10-03_stixiopr,23,L2013-10-03, stixiopr,false,
L2013-10-03_chepuxa,24,L2013-10-03, chepuxa,false,
L2013-10-03_dopoezda,25,L2013-10-03, dopoezda,false,
L2013-10-03_esli,26,L2013-10-03, esli,false,
L2013-10-03_trubach,27,L2013-10-03, trubach,false,
L2013-10-03_nerazmen,28,L2013-10-03, nerazmen,false,
L2013-10-03_pamjativ,29,L2013-10-03, pamjativ,false,

30.09.2013 пн – Москва, бард-клуб "Гнездо глухаря", дуэт (гитара)
L2013-09-30_kibitka,01,L2013-09-30, kibitka,false,
L2013-09-30_paris,02,L2013-09-30, paris,false,
L2013-09-30_navsejz1,03,L2013-09-30, navsejz1,false,
L2013-09-30_romans1,04,L2013-09-30, romans1,false,
L2013-09-30_sezondoz,05,L2013-09-30, sezondoz,false,
L2013-09-30_marija,06,L2013-09-30, marija,false,
L2013-09-30_kuznechiki,07,L2013-09-30, kuznechiki,false,
L2013-09-30_vrjadli,08,L2013-09-30, vrjadli,false,
L2013-09-30_puskaj,09,L2013-09-30, puskaj,false,
L2013-09-30_serenada,10,L2013-09-30, serenada,false,
L2013-09-30_ryba,11,L2013-09-30, ryba,false,
L2013-09-30_proschan,12,L2013-09-30, proschan,false,
L2013-09-30_adleucon,13,L2013-09-30, adleucon,false,
L2013-09-30_poshlyj,14,L2013-09-30, poshlyj,false,
L2013-09-30_kovcheg,15,L2013-09-30, kovcheg,false,
---
L2013-09-30_sharmans,16,L2013-09-30, sharmans,false,
L2013-09-30_molitva,17,L2013-09-30, molitva,false,
L2013-09-30_voslavug,18,L2013-09-30, voslavug,false,
L2013-09-30_karavan,19,L2013-09-30, karavan,false,
L2013-09-30_sitzevyj,20*,L2013-09-30, sitzevyj,false,
L2013-09-30_mastergr,21*,L2013-09-30, mastergr,false,
L2013-09-30_gorizont,22*,L2013-09-30, gorizont,false,
L2013-09-30_eccehomo,23,L2013-09-30, eccehomo,false,
L2013-09-30_dusha,24,L2013-09-30, dusha,false,
L2013-09-30_korablik,25,L2013-09-30, korablik,false,
L2013-09-30_vtornik,26,L2013-09-30, vtornik,false,
L2013-09-30_kolybelb,27,L2013-09-30, kolybelb,false,
L2013-09-30_vosxodja,28,L2013-09-30, vosxodja,false,

14.09.2013 сб – Германия, Мюнхен

13.09.2013 пт – Германия, Карлсруэ, Internationales Begegnungs Zentrum
L2013-09-13_1992,01,L2013-09-13, 1992,false,
L2013-09-13_nichemun,02,L2013-09-13, nichemun,false,
L2013-09-13_ubykagol,03,L2013-09-13, ubykagol,false,
L2013-09-13_podzname,04,L2013-09-13, podzname,false,
L2013-09-13_suhumi,05,L2013-09-13, suhumi,false,
L2013-09-13_dendensk,06,L2013-09-13, dendensk,false,
L2013-09-13_volhonka,07,L2013-09-13, volhonka,false,
L2013-09-13_kuznechiki,08,L2013-09-13, kuznechiki,false,
L2013-09-13_stixiopr,09,L2013-09-13, stixiopr,false,
L2013-09-13_traviata,10,L2013-09-13, traviata,false,
L2013-09-13_baltijsk,11,L2013-09-13, baltijsk,false,
L2013-09-13_temapoleta,12,L2013-09-13, temapoleta,false,
L2013-09-13_nadvuhk,13,L2013-09-13, nadvuhk,false,
L2013-09-13_ryba,14,L2013-09-13, ryba,false,
L2013-09-13_vpoxodny,15,L2013-09-13, vpoxodny,false,
L2013-09-13_mneniche,16,L2013-09-13, mneniche,false,
---
L2013-09-13_avtoparo,17,L2013-09-13, avtoparo,false,
L2013-09-13_sharmans,18,L2013-09-13, sharmans,false,
L2013-09-13_chepuxa,19,L2013-09-13, chepuxa,false,
L2013-09-13_dopoezda,20,L2013-09-13, dopoezda,false,
L2013-09-13_krasnye,21,L2013-09-13, krasnye,false,
L2013-09-13_propadu,22,L2013-09-13, propadu,false,
L2013-09-13_fontanka,23,L2013-09-13, fontanka,false,
L2013-09-13_romans2,24,L2013-09-13, romans2,false,
L2013-09-13_alliluja,25,L2013-09-13, alliluja,false,
L2013-09-13_vsetvoic,26,L2013-09-13, vsetvoic,false,
L2013-09-13_trubach,27,L2013-09-13, trubach,false,
L2013-09-13_pamjativ,28,L2013-09-13, pamjativ,false,
L2013-09-13_esli,29,L2013-09-13, esli,false,
L2013-09-13_nerazmen,30,L2013-09-13, nerazmen,false,

11.09.2013 ср – Швейцария, Женева, Uni-Bastions
L2013-09-11_1992,01,L2013-09-11, 1992,false,
L2013-09-11_ubykagol,02,L2013-09-11, ubykagol,false,
L2013-09-11_krasnye,03,L2013-09-11, krasnye,false,
L2013-09-11_podzname,04,L2013-09-11, podzname,false,
L2013-09-11_stixiopr,05,L2013-09-11, stixiopr,false,
L2013-09-11_dendensk,06,L2013-09-11, dendensk,false,
L2013-09-11_volhonka,07,L2013-09-11, volhonka,false,
L2013-09-11_kuznechiki,08,L2013-09-11, kuznechiki,false,
L2013-09-11_chepuxa,09,L2013-09-11, chepuxa,false,
L2013-09-11_propadu,10,L2013-09-11, propadu,false,
L2013-09-11_traviata,11,L2013-09-11, traviata,false,
L2013-09-11_temapoleta,12,L2013-09-11, temapoleta,false,
L2013-09-11_nadvuhk,13,L2013-09-11, nadvuhk,false,
L2013-09-11_sharmans,14,L2013-09-11, sharmans,false,
L2013-09-11_esli,15,L2013-09-11, esli,false,
L2013-09-11_vpoxodny,16,L2013-09-11, vpoxodny,false,
L2013-09-11_ryba,17,L2013-09-11, ryba,false,
L2013-09-11_fontanka,18,L2013-09-11, fontanka,false,
L2013-09-11_baltijsk,19,L2013-09-11, baltijsk,false,
L2013-09-11_dopoezda,20,L2013-09-11, dopoezda,false,
L2013-09-11_suhumi,21,L2013-09-11, suhumi,false,
L2013-09-11_alliluja,22,L2013-09-11, alliluja,false,
L2013-09-11_mneniche,23,L2013-09-11, mneniche,false,
L2013-09-11_trubach,24,L2013-09-11, trubach,false,
L2013-09-11_pamjativ,25,L2013-09-11, pamjativ,false,

08.09.2013 вс – Германия, Дортмунд

07.09.2013 сб – Германия, Ганновер

01.09.2013 вс – Германия, Марбург

20.08.2013 вт – Москва, бард-клуб "Гнездо глухаря"
L2013-08-20_1992,01,L2013-08-20, 1992,false,
L2013-08-20_odnazhdy,02,L2013-08-20, odnazhdy,false,
L2013-08-20_dendensk,03,L2013-08-20, dendensk,false,
L2013-08-20_nadvuhk,04,L2013-08-20, nadvuhk,false,
L2013-08-20_mneniche,05,L2013-08-20, mneniche,false,
L2013-08-20_stixiopr,06,L2013-08-20, stixiopr,false,
L2013-08-20_dopoezda,07,L2013-08-20, dopoezda,false,
L2013-08-20_kuznechiki,08,L2013-08-20, kuznechiki,false,
L2013-08-20_chepuxa,09,L2013-08-20, chepuxa,false,
L2013-08-20_propadu,10,L2013-08-20, propadu,false,
L2013-08-20_volhonka,11,L2013-08-20, volhonka,false,
L2013-08-20_temapoleta,12,L2013-08-20, temapoleta,false,
L2013-08-20_nichemun,13,L2013-08-20, nichemun,false,
L2013-08-20_vekaplyv,14,L2013-08-20, vekaplyv,false,
L2013-08-20_etiglaza,15,L2013-08-20, etiglaza,false,
L2013-08-20_sharmans,16,L2013-08-20, sharmans,false,
---
L2013-08-20_avtoparo,17,L2013-08-20, avtoparo,false,
L2013-08-20_ryba,18,L2013-08-20, ryba,false,
L2013-08-20_fontanka,19,L2013-08-20, fontanka,false,
L2013-08-20_baltijsk,20,L2013-08-20, baltijsk,false,
L2013-08-20_vpoxodny,21,L2013-08-20, vpoxodny,false,
L2013-08-20_vrjadli,22,L2013-08-20, vrjadli,false,
L2013-08-20_suhumi,23,L2013-08-20, suhumi,false,
L2013-08-20_vsetvoic,24,L2013-08-20, vsetvoic,false,
L2013-08-20_alliluja,25,L2013-08-20, alliluja,false,
L2013-08-20_pamjativ,26,L2013-08-20, pamjativ,false,
L2013-08-20_esli,27,L2013-08-20, esli,false,
L2013-08-20_trubach,28,L2013-08-20, trubach,false,
L2013-08-20_nerazmen,29,L2013-08-20, nerazmen,false,

03.06.2013 пн – Москва, бард-клуб "Гнездо глухаря"
L2013-06-03_1992,01,L2013-06-03, 1992,false,
L2013-06-03_etiglaza,02,L2013-06-03, etiglaza,false,
L2013-06-03_propadu,03,L2013-06-03, propadu,false,
L2013-06-03_odnazhdy,04,L2013-06-03, odnazhdy,false,
L2013-06-03_prenebre,05,L2013-06-03, prenebre,false,
L2013-06-03_volhonka,06,L2013-06-03, volhonka,false,
L2013-06-03_esli,07,L2013-06-03, esli,false,
L2013-06-03_baltijsk,08,L2013-06-03, baltijsk,false,
L2013-06-03_zatemzhe,09,L2013-06-03, zatemzhe,false,
L2013-06-03_volk,10,L2013-06-03, volk,false,
L2013-06-03_chepuxa,11,L2013-06-03, chepuxa,false,
L2013-06-03_dendensk,12,L2013-06-03, dendensk,false,
L2013-06-03_trubach,13,L2013-06-03, trubach,false,
L2013-06-03_mneniche,14,L2013-06-03, mneniche,false,
L2013-06-03_panorama,15,L2013-06-03, panorama,false,
---
L2013-06-03_avtoparo,16,L2013-06-03, avtoparo,false,
L2013-06-03_kuznechiki,17,L2013-06-03, kuznechiki,false,
L2013-06-03_rodljuds,18,L2013-06-03, rodljuds,false,
L2013-06-03_pamjativ,19,L2013-06-03, pamjativ,false,
L2013-06-03_stixiopr,20,L2013-06-03, stixiopr,false,
L2013-06-03_voslavug,21,L2013-06-03, voslavug,false,
L2013-06-03_nadvuhk,22,L2013-06-03, nadvuhk,false,
L2013-06-03_rydaytru,23,L2013-06-03, rydaytru,false,
L2013-06-03_shkolat2,24,L2013-06-03, shkolat2,false,
L2013-06-03_alliluja,25,L2013-06-03, alliluja,false,
L2013-06-03_inicialy,26,L2013-06-03, inicialy,false,
L2013-06-03_nerazmen,27,L2013-06-03, nerazmen,false,

28.04.2013 вс – Москва, бард-клуб "Гнездо глухаря", дуэт (гитара)
L2013-04-28_kibitka,01,L2013-04-28, kibitka,false,
L2013-04-28_paris,02,L2013-04-28, paris,false,
L2013-04-28_navsejz1,03,L2013-04-28, navsejz1,false,
L2013-04-28_romans1,04,L2013-04-28, romans1,false,
L2013-04-28_sezondoz,05,L2013-04-28, sezondoz,false,
L2013-04-28_marija,06,L2013-04-28, marija,false,
L2013-04-28_konecned,07,L2013-04-28, konecned,false,
L2013-04-28_poshlyj,08,L2013-04-28, poshlyj,false,
L2013-04-28_puskaj,09,L2013-04-28, puskaj,false,
L2013-04-28_serenada,10,L2013-04-28, serenada,false,
L2013-04-28_kovcheg,11,L2013-04-28, kovcheg,false,
L2013-04-28_interme3,12,L2013-04-28, interme3,false,
L2013-04-28_ljubov,13,L2013-04-28, ljubov,false,
L2013-04-28_farmacev,14,L2013-04-28, farmacev,false,
---
L2013-04-28_sharmans,15,L2013-04-28, sharmans,false,
L2013-04-28_bereg,16,L2013-04-28, bereg,false,
L2013-04-28_molitva,17,L2013-04-28, molitva,false,
L2013-04-28_voslavug,18,L2013-04-28, voslavug,false,
L2013-04-28_karavan,19,L2013-04-28, karavan,false,
L2013-04-28_dvasilue,20*,L2013-04-28, dvasilue,false,
L2013-04-28_nuchemte,21*,L2013-04-28, nuchemte,false,
L2013-04-28_smozarto,22*,L2013-04-28, smozarto,false,
L2013-04-28_eccehomo,23,L2013-04-28, eccehomo,false,
L2013-04-28_dusha,24,L2013-04-28, dusha,false,
L2013-04-28_korablik,25,L2013-04-28, korablik,false,
L2013-04-28_vtornik,26,L2013-04-28, vtornik,false,
L2013-04-28_kolybeln,27,L2013-04-28, kolybeln,false,
L2013-04-28_vosxodja,28,L2013-04-28, vosxodja,false,

12.04.2013 пт – Москва, РГДБ
L2013-04-12_deja,01,L2013-04-12, deja,false,
L2013-04-12_chuzhaj2,02,L2013-04-12, chuzhaj2,false,
L2013-04-12_nichemun,03,L2013-04-12, nichemun,false,
L2013-04-12_volk,04,L2013-04-12, volk,false,
L2013-04-12_inicialy,05,L2013-04-12, inicialy,false,
L2013-04-12_ryba,06,L2013-04-12, ryba,false,
L2013-04-12_suhumi,07,L2013-04-12, suhumi,false,
L2013-04-12_dopoezda,08,L2013-04-12, dopoezda,false,
L2013-04-12_desyatpe,09,L2013-04-12, desyatpe,false,
L2013-04-12_temapoleta,10,L2013-04-12, temapoleta,false,
L2013-04-12_nadeyus,11,L2013-04-12, nadeyus,false,
L2013-04-12_pavlovsk,12,L2013-04-12, pavlovsk,false,
L2013-04-12_peterbur,13,L2013-04-12, peterbur,false,
L2013-04-12_dendensk,14,L2013-04-12, dendensk,false,
L2013-04-12_tirbayard,15,L2013-04-12, tirbayard,false,
---
L2013-04-12_avtoparo,16,L2013-04-12, avtoparo,false,
L2013-04-12_baltijsk,17,L2013-04-12, baltijsk,false,
L2013-04-12_votpodni,18,L2013-04-12, votpodni,false,
L2013-04-12_1995,19,L2013-04-12, 1995,false,
L2013-04-12_chepuxa,20,L2013-04-12, chepuxa,false,
L2013-04-12_vrjadli,21,L2013-04-12, vrjadli,false,
L2013-04-12_romans2,22,L2013-04-12, romans2,false,
L2013-04-12_alliluja,23,L2013-04-12, alliluja,false,
L2013-04-12_pamjativ,24,L2013-04-12, pamjativ,false,
L2013-04-12_nadvuhk,25,L2013-04-12, nadvuhk,false,
L2013-04-12_proschalm,26,L2013-04-12, proschalm,false,
L2013-04-12_esli,27,L2013-04-12, esli,false,
L2013-04-12_nerazmen,28,L2013-04-12, nerazmen,false,

22.03.2013 пт – США, Mountain View, CA, Samovar Hall
L2013-03-22_ryba,01,L2013-03-22, ryba,false,
L2013-03-22_suhumi,02,L2013-03-22, suhumi,false,
L2013-03-22_1992,03,L2013-03-22, 1992,false,
L2013-03-22_stixiopr,04,L2013-03-22, stixiopr,false,
L2013-03-22_romans2,05,L2013-03-22, romans2,false,
L2013-03-22_alliluja,06,L2013-03-22, alliluja,false,
L2013-03-22_deklarac,07,L2013-03-22, deklarac,false,
L2013-03-22_kakojkos,08,L2013-03-22, kakojkos,false,
L2013-03-22_jachashu,09,L2013-03-22, jachashu,false,
L2013-03-22_vsetvoic,10,L2013-03-22, vsetvoic,false,
L2013-03-22_traviata,11,L2013-03-22, traviata,false,
L2013-03-22_kogdamen,12,L2013-03-22, kogdamen,false,
---
L2013-03-22_piter,13,L2013-03-22, piter,false,
L2013-03-22_kadril,14,L2013-03-22, kadril,false,
L2013-03-22_zastolnaya,15,L2013-03-22, zastolnaya,false,
L2013-03-22_nadeyus,16,L2013-03-22, nadeyus,false,
L2013-03-22_zvezdyip,17,L2013-03-22, zvezdyip,false,
L2013-03-22_volhonka,18,L2013-03-22, volhonka,false,
L2013-03-22_esli,19,L2013-03-22, esli,false,
L2013-03-22_pavlovsk,20,L2013-03-22, pavlovsk,false,
L2013-03-22_fontanka,21,L2013-03-22, fontanka,false,
L2013-03-22_vkoncevr,22,L2013-03-22, vkoncevr,false,
L2013-03-22_temapoleta,23,L2013-03-22, temapoleta,false,
L2013-03-22_nadvuhk,24,L2013-03-22, nadvuhk,false,

17.03.2013 вс – США, San Diego, CA

09.03.2013 сб – США, Houston, TX

06.03.2013 ср – США, Atlanta, GA

05.03.2013 вт – США, Chapel Hill, NC

03.03.2013 вс – США, Stamford, CT
L2013-03-03_sharmans,01,L2013-03-03, sharmans,false,
L2013-03-03_ryba,02,L2013-03-03, ryba,false,
L2013-03-03_deja,03,L2013-03-03, deja,false,
L2013-03-03_kakojkos,04,L2013-03-03, kakojkos,false,
L2013-03-03_jachashu,05,L2013-03-03, jachashu,false,
L2013-03-03_ubykagol,06,L2013-03-03, ubykagol,false,
L2013-03-03_kuznechiki,07,L2013-03-03, kuznechiki,false,
L2013-03-03_nadvuhk,08,L2013-03-03, nadvuhk,false,
L2013-03-03_serenada,09,L2013-03-03, serenada,false,
L2013-03-03_vekaplyv,10,L2013-03-03, vekaplyv,false,
L2013-03-03_suhumi,11,L2013-03-03, suhumi,false,
L2013-03-03_pavlovsk,12,L2013-03-03, pavlovsk,false,
L2013-03-03_kadril,13,L2013-03-03, kadril,false,
---
L2013-03-03_1992,14,L2013-03-03, 1992,false,
L2013-03-03_moekoro2,15,L2013-03-03, moekoro2,false,
L2013-03-03_piter,16,L2013-03-03, piter,false,
L2013-03-03_zastolnaya,17,L2013-03-03, zastolnaya,false,
L2013-03-03_mneniche,18,L2013-03-03, mneniche,false,
L2013-03-03_nadeyus,19,L2013-03-03, nadeyus,false,
L2013-03-03_temapoleta,20,L2013-03-03, temapoleta,false,
L2013-03-03_fontanka,21,L2013-03-03, fontanka (не допел),false,
L2013-03-03_esli,22,L2013-03-03, esli,false,
L2013-03-03_fontanka,23,L2013-03-03, fontanka,false,
L2013-03-03_baltijsk,24,L2013-03-03, baltijsk,false,
L2013-03-03_volhonka,25,L2013-03-03, volhonka,false,
L2013-03-03_nerazmen,26,L2013-03-03, nerazmen,false,
L2013-03-03_trubach,27,L2013-03-03, trubach,false,

02.03.2013 сб – США, Boston, MA

25.02.2013 пн – Москва, бард-клуб "Гнездо глухаря", премьера
L2013-02-25_ryba,01,L2013-02-25, ryba,false,
L2013-02-25_kakojkos,02,L2013-02-25, kakojkos,false,
L2013-02-25_duet,03,L2013-02-25, duet,false,
L2013-02-25_deja,04,L2013-02-25, deja,false,
L2013-02-25_1992,05,L2013-02-25, 1992,false,
L2013-02-25_rodljuds,06,L2013-02-25, rodljuds,false,
L2013-02-25_jachashu,07,L2013-02-25, jachashu,false,
L2013-02-25_kogdaned,08,L2013-02-25, kogdaned,false,
L2013-02-25_esli,09,L2013-02-25, esli,false,
L2013-02-25_pavlovsk,10,L2013-02-25, pavlovsk,true,
L2013-02-25_1991,11,L2013-02-25, 1991,false,
L2013-02-25_kadril,12,L2013-02-25, kadril,false,
L2013-02-25_moekoro2,13,L2013-02-25, moekoro2,false,
L2013-02-25_zastolnaya,14,L2013-02-25, zastolnaya,false,
L2013-02-25_piter,15,L2013-02-25, piter,false,
---
L2013-02-25_krasnye,16,L2013-02-25, krasnye,false,
L2013-02-25_kuznechiki,17,L2013-02-25, kuznechiki,false,
L2013-02-25_rydaytru,18,L2013-02-25, rydaytru,false,
L2013-02-25_nadvuhk,19,L2013-02-25, nadvuhk,false,
L2013-02-25_vsetvoic,20,L2013-02-25, vsetvoic,false,
L2013-02-25_alliluja,21,L2013-02-25, alliluja,false,
L2013-02-25_dendensk,22,L2013-02-25, dendensk,false,
L2013-02-25_trubach,23,L2013-02-25, trubach,false,
L2013-02-25_nerazmen,24,L2013-02-25, nerazmen,false,

09.01.2013 ср – Москва, бард-клуб "Гнездо глухаря", 2 премьеры
L2013-01-09_ubykagol,01,L2013-01-09, ubykagol,false,
L2013-01-09_sharmans,02,L2013-01-09, sharmans,false,
L2013-01-09_traviata,03,L2013-01-09, traviata,false,
L2013-01-09_serenada,04,L2013-01-09, serenada,false,
L2013-01-09_zvezdyip,05,L2013-01-09, zvezdyip,false,
L2013-01-09_deklarac,06,L2013-01-09, deklarac,false,
L2013-01-09_bystrov2,07,L2013-01-09, bystrov2,false,
L2013-01-09_tirbayard,08,L2013-01-09, tirbayard,false,
L2013-01-09_vpoxodny,09,L2013-01-09, vpoxodny,false,
L2013-01-09_desyatpe,10,L2013-01-09, desyatpe,false,
L2013-01-09_baltijsk,11,L2013-01-09, baltijsk,false,
L2013-01-09_podzname,12,L2013-01-09, podzname,false,
L2013-01-09_vkoncevr,13,L2013-01-09, vkoncevr,true,
L2013-01-09_ryba,14,L2013-01-09, ryba,false,
L2013-01-09_inicialy,15,L2013-01-09, inicialy,false,
---
L2013-01-09_suhumi,16,L2013-01-09, suhumi,false,
L2013-01-09_vekaplyv,17,L2013-01-09, vekaplyv,false,
L2013-01-09_volhonka,18,L2013-01-09, volhonka,false,
L2013-01-09_pamjativ,19,L2013-01-09, pamjativ,false,
L2013-01-09_jachashu,20,L2013-01-09, jachashu,false,
L2013-01-09_etodolzh,21,L2013-01-09, etodolzh,false,
L2013-01-09_stixiopr,22,L2013-01-09, stixiopr,false,
L2013-01-09_fontanka,23,L2013-01-09, fontanka,false,
L2013-01-09_mneniche,24,L2013-01-09, mneniche,false,
L2013-01-09_nadeyus,25,L2013-01-09, nadeyus,true,
L2013-01-09_romans2,26,L2013-01-09, romans2,false,
L2013-01-09_nerazmen,27,L2013-01-09, nerazmen,false,


2012 г. ▼ ▲

02.12.2012 вс – США, Los Angeles, CA

17.11.2012 сб – США, Kensington, MD

16.11.2012 пт – США, Philadelphia, PA

11.11.2012 вс – США, Princeton, NJ, Henry F.Pannell Learning Center
L2012-11-11_sharmans,01,L2012-11-11, sharmans,false,
L2012-11-11_podzname,02,L2012-11-11, podzname,false,
L2012-11-11_traviata,03,L2012-11-11, traviata,false,
L2012-11-11_romans2,04,L2012-11-11, romans2,false,
L2012-11-11_serenada,05,L2012-11-11, serenada,false,
L2012-11-11_etodolzh,06,L2012-11-11, etodolzh,false,
L2012-11-11_desyatpe,07,L2012-11-11, desyatpe,false,
L2012-11-11_propadu,08,L2012-11-11, propadu,false,
L2012-11-11_nadvuhk,09,L2012-11-11, nadvuhk,false,
L2012-11-11_vekaplyv,10,L2012-11-11, vekaplyv,false,
L2012-11-11_temapoleta,11,L2012-11-11, temapoleta,false,
L2012-11-11_alliluja,12,L2012-11-11, alliluja,false,
L2012-11-11_kuznechiki,13,L2012-11-11, kuznechiki,false,
L2012-11-11_baltijsk,14,L2012-11-11, baltijsk,false,
L2012-11-11_volhonka,15,L2012-11-11, volhonka,false,
---
L2012-11-11_avtoparo,16,L2012-11-11, avtoparo,false,
L2012-11-11_vsetvoic,17,L2012-11-11, vsetvoic,false,
L2012-11-11_trubach,18,L2012-11-11, trubach,false,
L2012-11-11_mneniche,19,L2012-11-11, mneniche,false,
L2012-11-11_nichemun,20,L2012-11-11, nichemun,false,
L2012-11-11_ubykagol,21,L2012-11-11, ubykagol,false,
L2012-11-11_stixiopr,22,L2012-11-11, stixiopr,false,
L2012-11-11_zvezdyip,23,L2012-11-11, zvezdyip,false,
L2012-11-11_fontanka,24,L2012-11-11, fontanka,false,
L2012-11-11_suhumi,25,L2012-11-11, suhumi,false,
L2012-11-11_pamjativ,26,L2012-11-11, pamjativ,false,
L2012-11-11_esli,27,L2012-11-11, esli,false,
L2012-11-11_nerazmen,28,L2012-11-11, nerazmen,false,

10.11.2012 сб – США, Morristown, NJ

09.11.2012 пт – США, Manhattan, NY

01.11.2012 чт – Москва, бард-клуб "Гнездо глухаря", дуэт (гитара)
L2012-11-01_kibitka,01,L2012-11-01, kibitka,false,
L2012-11-01_adleucon,02,L2012-11-01, adleucon,false,
L2012-11-01_navsejz1,03,L2012-11-01, navsejz1,false,
L2012-11-01_romans1,04,L2012-11-01, romans1,false,
L2012-11-01_sezondoz,05,L2012-11-01, sezondoz,false,
L2012-11-01_marija,06,L2012-11-01, marija,false,
L2012-11-01_opyatpar,07,L2012-11-01, opyatpar,false,
L2012-11-01_poshlyj,08,L2012-11-01, poshlyj,false,
L2012-11-01_kovcheg,09,L2012-11-01, kovcheg,false,
L2012-11-01_kuznechiki,10,L2012-11-01, kuznechiki,false,
L2012-11-01_ljubov,11,L2012-11-01, ljubov,false,
L2012-11-01_romansma,12,L2012-11-01, romansma,false,
L2012-11-01_svidanie,13,L2012-11-01, svidanie,false,
L2012-11-01_farmacev,14,L2012-11-01, farmacev,false,
L2012-11-01_balagan2,15,L2012-11-01, balagan2,false,
---
L2012-11-01_sharmans,16,L2012-11-01, sharmans,false,
L2012-11-01_puskaj,17,L2012-11-01, puskaj,false,
L2012-11-01_ryba,18,L2012-11-01, ryba,false,
L2012-11-01_eccehomo,19,L2012-11-01, eccehomo,false,
L2012-11-01_karavan,20,L2012-11-01, karavan,false,
L2012-11-01_proschan,21,L2012-11-01, proschan,false,
L2012-11-01_aneta,22,L2012-11-01, aneta,false,
L2012-11-01_voslavug,23,L2012-11-01, voslavug,false,
L2012-11-01_serenada,24,L2012-11-01, serenada,false,
L2012-11-01_dusha,25,L2012-11-01, dusha,false,
L2012-11-01_korablik,26,L2012-11-01, korablik,false,
L2012-11-01_vtornik,27,L2012-11-01, vtornik,false,
L2012-11-01_kolybeln,28,L2012-11-01, kolybeln,false,
L2012-11-01_vosxodja,29,L2012-11-01, vosxodja,false,

20.10.2012 сб – Казахстан, Астана

13.10.2012 сб – Минск, домашний концерт у И. и А. Горбач
L2012-10-13_sharmans,01,L2012-10-13, sharmans,false,
L2012-10-13_avtoparo,02,L2012-10-13, avtoparo,false,
L2012-10-13_krasnye,03,L2012-10-13, krasnye,false,
L2012-10-13_propadu,04,L2012-10-13, propadu,false,
L2012-10-13_ballada,05,L2012-10-13, ballada,false,
L2012-10-13_dopoezda,06,L2012-10-13, dopoezda,false,
L2012-10-13_vpoxodny,07,L2012-10-13, vpoxodny,false,
L2012-10-13_baltijsk,08,L2012-10-13, baltijsk,false,
L2012-10-13_ryba,09,L2012-10-13, ryba,false,
L2012-10-13_stixiopr,10,L2012-10-13, stixiopr,false,
L2012-10-13_vekaplyv,11,L2012-10-13, vekaplyv,false,
L2012-10-13_alliluja,12,L2012-10-13, alliluja,false,
L2012-10-13_desyatpe,13,L2012-10-13, desyatpe,false,
L2012-10-13_temapoleta,14,L2012-10-13, temapoleta,false,
L2012-10-13_nadvuhk,15,L2012-10-13, nadvuhk,false,
L2012-10-13_tirbayard,16,L2012-10-13, tirbayard,false,
---
L2012-10-13_nichemun,17,L2012-10-13, nichemun,false,
L2012-10-13_podzname,18,L2012-10-13, podzname,false,
L2012-10-13_chepuxa,19,L2012-10-13, chepuxa,false,
L2012-10-13_ubykagol,20,L2012-10-13, ubykagol,false,
L2012-10-13_vsetvoic,21,L2012-10-13, vsetvoic,false,
L2012-10-13_zvezdyip,22,L2012-10-13, zvezdyip,false,
L2012-10-13_kogdamen,23,L2012-10-13, kogdamen,false,
L2012-10-13_serenada,24,L2012-10-13, serenada,false,
L2012-10-13_fontanka,25,L2012-10-13, fontanka,false,
L2012-10-13_mneniche,26,L2012-10-13, mneniche,false,
L2012-10-13_pamjativ,27,L2012-10-13, pamjativ,false,
L2012-10-13_trubach,28,L2012-10-13, trubach,false,
L2012-10-13_nerazmen,29,L2012-10-13, nerazmen,false,

01.10.2012 пн – Москва, бард-клуб "Гнездо глухаря"
L2012-10-01_avtoparo,01,L2012-10-01, avtoparo,false,
L2012-10-01_ryba,02,L2012-10-01, ryba,false,
L2012-10-01_krasnye,03,L2012-10-01, krasnye,false,
L2012-10-01_propadu,04,L2012-10-01, propadu,false,
L2012-10-01_ballada,05,L2012-10-01, ballada,false,
L2012-10-01_dopoezda,06,L2012-10-01, dopoezda,false,
L2012-10-01_vpoxodny,07,L2012-10-01, vpoxodny,false,
L2012-10-01_baltijsk,08,L2012-10-01, baltijsk,false,
L2012-10-01_proschanie,09,L2012-10-01, proschanie,false,
L2012-10-01_stixiopr,10,L2012-10-01, stixiopr,false,
L2012-10-01_vekaplyv,11,L2012-10-01, vekaplyv,false,
L2012-10-01_alliluja,12,L2012-10-01, alliluja,false,
L2012-10-01_desyatpe,13,L2012-10-01, desyatpe,false,
L2012-10-01_temapoleta,14,L2012-10-01, temapoleta,false,
L2012-10-01_nadvuhk,15,L2012-10-01, nadvuhk,false,
L2012-10-01_tirbayard,16,L2012-10-01, tirbayard,false,
---
L2012-10-01_nichemun,17,L2012-10-01, nichemun,false,
L2012-10-01_vishnevo,18,L2012-10-01, vishnevo,false,
L2012-10-01_vsetvoic,19,L2012-10-01, vsetvoic,false,
L2012-10-01_zvezdyip,20,L2012-10-01, zvezdyip,false,
L2012-10-01_traviata,21,L2012-10-01, traviata,false,
L2012-10-01_kogdamen,22,L2012-10-01, kogdamen,false,
L2012-10-01_jachashu,23,L2012-10-01, jachashu,false,
L2012-10-01_pamjativ,24,L2012-10-01, pamjativ,false,
L2012-10-01_esli,25,L2012-10-01, esli,false,
L2012-10-01_nerazmen,26,L2012-10-01, nerazmen,false,

22.09.2012 сб – Днепропетровск

20.09.2012 чт – Харьков

16.09.2012 вс – Киев, "Шоколадный дом"
L2012-09-16_krasnye,01,L2012-09-16, krasnye,false,
L2012-09-16_avtoparo,02,L2012-09-16, avtoparo,false,
L2012-09-16_ryba,03,L2012-09-16, ryba,false,
L2012-09-16_proschanie,04,L2012-09-16, proschanie,false,
L2012-09-16_kakojkos,05,L2012-09-16, kakojkos,false,
L2012-09-16_kuznechiki,06,L2012-09-16, kuznechiki,false,
L2012-09-16_baltijsk,07,L2012-09-16, baltijsk,false,
L2012-09-16_volhonka,08,L2012-09-16, volhonka,false,
L2012-09-16_temapoleta,09,L2012-09-16, temapoleta,false,
L2012-09-16_stixiopr,10,L2012-09-16, stixiopr,false,
L2012-09-16_alliluja,11,L2012-09-16, alliluja,false,
L2012-09-16_vekaplyv,12,L2012-09-16, vekaplyv,false,
L2012-09-16_nichemun,13,L2012-09-16, nichemun,false,
L2012-09-16_desyatpe,14,L2012-09-16, desyatpe,false,
L2012-09-16_jachashu,15,L2012-09-16, jachashu,false,
L2012-09-16_etiglaza,16,L2012-09-16, etiglaza,false,
---
L2012-09-16_kibitka,17,L2012-09-16, kibitka,false,
L2012-09-16_chepuxa,18,L2012-09-16, chepuxa,false,
L2012-09-16_dopoezda,19,L2012-09-16, dopoezda,false,
L2012-09-16_zvezdyip,20,L2012-09-16, zvezdyip,false,
L2012-09-16_peshkom,21,L2012-09-16, peshkom,false,
L2012-09-16_vsetvoic,22,L2012-09-16, vsetvoic,false,
L2012-09-16_nadvuhk,23,L2012-09-16, nadvuhk,false,
L2012-09-16_mneniche,24,L2012-09-16, mneniche,false,
L2012-09-16_pesenkao,25,L2012-09-16, pesenkao,false,
L2012-09-16_pamjativ,26,L2012-09-16, pamjativ,false,
L2012-09-16_esli,27,L2012-09-16, esli,false,
L2012-09-16_nerazmen,28,L2012-09-16, nerazmen,false,

03.08.2012 пт – Москва, бард-клуб "Гнездо глухаря"
L2012-08-03_zhizn,01,L2012-08-03, zhizn,false,
L2012-08-03_kinemat2,02,L2012-08-03, kinemat2,false,
L2012-08-03_propadu,03,L2012-08-03, propadu,false,
L2012-08-03_nichemun,04,L2012-08-03, nichemun,false,
L2012-08-03_dendensk,05,L2012-08-03, dendensk,false,
L2012-08-03_kuznechiki,06,L2012-08-03, kuznechiki,false,
L2012-08-03_chepuxa,07,L2012-08-03, chepuxa,false,
L2012-08-03_ryba,08,L2012-08-03, ryba,false,
L2012-08-03_serenada,09,L2012-08-03, serenada,false,
L2012-08-03_alliluja,10,L2012-08-03, alliluja,false,
L2012-08-03_vekaplyv,11,L2012-08-03, vekaplyv,false,
L2012-08-03_fontanka,12,L2012-08-03, fontanka,false,
L2012-08-03_kakojkos,13,L2012-08-03, kakojkos,false,
L2012-08-03_moiraket,14,L2012-08-03, moiraket,false,
L2012-08-03_cybin,15,L2012-08-03, cybin,false,

L2012-08-03_avtoparo,16,L2012-08-03, avtoparo,false,
L2012-08-03_sharmans,17,L2012-08-03, sharmans,false,
L2012-08-03_nadvuhk,18,L2012-08-03, nadvuhk,false,
L2012-08-03_avstrali,19,L2012-08-03, avstrali,false,
L2012-08-03_vsetvoic,20,L2012-08-03, vsetvoic,false,
L2012-08-03_ballada,21,L2012-08-03, ballada,false,
L2012-08-03_baltijsk,22,L2012-08-03, baltijsk,false,
L2012-08-03_volhonka,23,L2012-08-03, volhonka,false,
L2012-08-03_podzname,24,L2012-08-03, podzname,false,
L2012-08-03_trubach,25,L2012-08-03, trubach,false,
L2012-08-03_esli,26,L2012-08-03, esli,false,
L2012-08-03_nerazmen,27,L2012-08-03, nerazmen,false,

07.07.2012 сб – Самарская обл, Мастрюковские озёра, фестиваль "Платформа-2012"
L2012-07-07_sharmans,01,L2012-07-07, sharmans,false,
L2012-07-07_krasnye,02,L2012-07-07, krasnye,false,
L2012-07-07_propadu,03,L2012-07-07, propadu,false,
L2012-07-07_zhizn,04,L2012-07-07, zhizn,false,
L2012-07-07_podzname,05,L2012-07-07, podzname,false,
L2012-07-07_kuznechiki,06,L2012-07-07, kuznechiki,false,
L2012-07-07_chepuxa,07,L2012-07-07, chepuxa,false,
L2012-07-07_dopoezda,08,L2012-07-07, dopoezda,false,
L2012-07-07_fontanka,09,L2012-07-07, fontanka,false,
L2012-07-07_vekaplyv,10,L2012-07-07, vekaplyv,false,
L2012-07-07_baltijsk,11,L2012-07-07, baltijsk,false,
L2012-07-07_alliluja,12,L2012-07-07, alliluja,false,
L2012-07-07_mneniche,13,L2012-07-07, mneniche,false,
L2012-07-07_volhonka,14,L2012-07-07, volhonka,false,
L2012-07-07_vsetvoic,15,L2012-07-07, vsetvoic,false,
L2012-07-07_pamjativ,16,L2012-07-07, pamjativ,false,
L2012-07-07_esli,17,L2012-07-07, esli,false,
L2012-07-07_nerazmen,18,L2012-07-07, nerazmen,false,

03.06.2012 вс – Москва, бард-клуб "Гнездо глухаря", дуэт (клавиши)
L2012-06-03_1992,01,L2012-06-03, 1992,false,
L2012-06-03_burja,02,L2012-06-03, burja,false,
L2012-06-03_rozhdest,03,L2012-06-03, rozhdest,false,
L2012-06-03_vbelojmg,04,L2012-06-03, vbelojmg,false,
L2012-06-03_vjuga,05,L2012-06-03, vjuga,false,
L2012-06-03_eccehomo,06,L2012-06-03, eccehomo,false,
L2012-06-03_marija,07,L2012-06-03, marija,false,
L2012-06-03_muzhajsj,08,L2012-06-03, muzhajsj,false,
L2012-06-03_descensu,09,L2012-06-03, descensu,false,
L2012-06-03_switzerl,10,L2012-06-03, switzerl,false,
L2012-06-03_vpoxodny,11,L2012-06-03, vpoxodny,false,
L2012-06-03_sentenci,12,L2012-06-03, sentenci,false,
L2012-06-03_brodjagi,13,L2012-06-03, brodjagi,false,
L2012-06-03_okean,14,L2012-06-03, okean,false,
L2012-06-03_trojka,15,L2012-06-03, trojka,false,
---
L2012-06-03_kibitka,16,L2012-06-03, kibitka,false,
L2012-06-03_kalejdos,17,L2012-06-03, kalejdos,false,
L2012-06-03_dusha,18,L2012-06-03, dusha,false,
L2012-06-03_lunnaja,19,L2012-06-03, lunnaja,false,
L2012-06-03_teplyj,20,L2012-06-03, teplyj,false,
L2012-06-03_vremjaid,21*,L2012-06-03, vremjaid,false,
L2012-06-03_rybachka,22*,L2012-06-03, rybachka,false,
L2012-06-03_sovestbl,23*,L2012-06-03, sovestbl,false,
L2012-06-03_ishlodiv,24*,L2012-06-03, ishlodiv,false,
L2012-06-03_trubach,25,L2012-06-03, trubach,false,
L2012-06-03_vtornik,26,L2012-06-03, vtornik,false,
L2012-06-03_kolybeln,27,L2012-06-03, kolybeln,false,

13.05.2012 вс – Москва, бард-клуб "Гнездо глухаря"
L2012-05-13_sharmans,01,L2012-05-13, sharmans,false,
L2012-05-13_nichemun,02,L2012-05-13, nichemun,false,
L2012-05-13_ubykagol,03,L2012-05-13, ubykagol,false,
L2012-05-13_zhizn,04,L2012-05-13, zhizn,false,
L2012-05-13_propadu,05,L2012-05-13, propadu,false,
L2012-05-13_krasnye,06,L2012-05-13, krasnye,false,
L2012-05-13_vekaplyv,07,L2012-05-13, vekaplyv,false,
L2012-05-13_kuznechiki,08,L2012-05-13, kuznechiki,false,
L2012-05-13_temapoleta,09,L2012-05-13, temapoleta,false,
L2012-05-13_chepuxa,10,L2012-05-13, chepuxa,false,
L2012-05-13_alliluja,11,L2012-05-13, alliluja,false,
L2012-05-13_baltijsk,12,L2012-05-13, baltijsk,false,
L2012-05-13_fontanka,13,L2012-05-13, fontanka,false,
L2012-05-13_inicialy,14,L2012-05-13, inicialy,false,
L2012-05-13_nadvuhk,15,L2012-05-13, nadvuhk,false,
L2012-05-13_esli,16,L2012-05-13, esli,false,
---
L2012-05-13_podzname,17,L2012-05-13, podzname,false,
L2012-05-13_serenada,18,L2012-05-13, serenada,false,
L2012-05-13_shkolat2,19,L2012-05-13, shkolat2,false,
L2012-05-13_ballada,20,L2012-05-13, ballada,false,
L2012-05-13_pamjativ,21,L2012-05-13, pamjativ,false,
L2012-05-13_mezhdupr,22,L2012-05-13, mezhdupr,false,
L2012-05-13_traviata,23,L2012-05-13, traviata,false,
L2012-05-13_vsetvoic,24,L2012-05-13, vsetvoic,false,
L2012-05-13_kogdaned,25,L2012-05-13, kogdaned,false,
L2012-05-13_rydaytru,26,L2012-05-13, rydaytru,false,
L2012-05-13_nerazmen,27,L2012-05-13, nerazmen,false,

29.04.2012 вс – Москва, арт-кафе театра "Буфф", премьера
L2012-04-29_ryba,01,L2012-04-29, ryba,false,
L2012-04-29_sharmans,02,L2012-04-29, sharmans,false,
L2012-04-29_ubykagol,03,L2012-04-29, ubykagol,false,
L2012-04-29_serenada,04,L2012-04-29, serenada,false,
L2012-04-29_etodolzh,05,L2012-04-29, etodolzh,false,
L2012-04-29_rodljuds,06,L2012-04-29, rodljuds,false,
L2012-04-29_vpoxodny,07,L2012-04-29, vpoxodny,false,
L2012-04-29_kordebal,08,L2012-04-29, kordebal,false,
L2012-04-29_dopoezda,09,L2012-04-29, dopoezda,false,
L2012-04-29_suhumi,10,L2012-04-29, suhumi,false,
L2012-04-29_alliluja,11,L2012-04-29, alliluja,false,
L2012-04-29_vrjadli,12,L2012-04-29, vrjadli,false,
L2012-04-29_sokolnik,13,L2012-04-29, sokolnik,false,
L2012-04-29_zvezdyip,14,L2012-04-29, zvezdyip,true,
L2012-04-29_etiglaza,15,L2012-04-29, etiglaza,false,
---
L2012-04-29_kovcheg,16,L2012-04-29, kovcheg,false,
L2012-04-29_podzname,17,L2012-04-29, podzname,false,
L2012-04-29_kogdamen,18,L2012-04-29, kogdamen,false,
L2012-04-29_temapoleta,19,L2012-04-29, temapoleta,false,
L2012-04-29_vekaplyv,20,L2012-04-29, vekaplyv,false,
L2012-04-29_ballada,21,L2012-04-29, ballada,false,
L2012-04-29_pamjativ,22,L2012-04-29, pamjativ,false,
L2012-04-29_nadvuhk,23,L2012-04-29, nadvuhk,false,
L2012-04-29_inicialy,24,L2012-04-29, inicialy,false,
L2012-04-29_esli,25,L2012-04-29, esli,false,
L2012-04-29_rydaytru,26,L2012-04-29, rydaytru,false,
L2012-04-29_nerazmen,27,L2012-04-29, nerazmen,false,

30.03.2012 пт – Санкт-Петербург, КЗ "У Финляндского", премьера
L2012-03-30_ryba,01,L2012-03-30, ryba,false,
L2012-03-30_sharmans,02,L2012-03-30, sharmans,false,
L2012-03-30_chepuxa,03,L2012-03-30, chepuxa,false,
L2012-03-30_gorestn2,04,L2012-03-30, gorestn2,false,
L2012-03-30_ubykagol,05,L2012-03-30, ubykagol,false,
L2012-03-30_propadu,06,L2012-03-30, propadu,false,
L2012-03-30_rodljuds,07,L2012-03-30, rodljuds,false,
L2012-03-30_vpoxodny,08,L2012-03-30, vpoxodny,false,
L2012-03-30_dopoezda,09,L2012-03-30, dopoezda,false,
L2012-03-30_kordebal,10,L2012-03-30, kordebal,false,
L2012-03-30_etodolzh,11,L2012-03-30, etodolzh,false,
L2012-03-30_suhumi,12,L2012-03-30, suhumi,false,
L2012-03-30_schastli,13,L2012-03-30, schastli,false,
L2012-03-30_nadvuhk,14,L2012-03-30, nadvuhk,true,
L2012-03-30_pamjativ,15,L2012-03-30, pamjativ,false,
L2012-03-30_vrjadli,16,L2012-03-30, vrjadli,false,
L2012-03-30_etiglaza,17,L2012-03-30, etiglaza,false,
---
L2012-03-30_kovcheg,18,L2012-03-30, kovcheg,false,
L2012-03-30_podzname,19,L2012-03-30, podzname,false,
L2012-03-30_ballada,20,L2012-03-30, ballada,false,
L2012-03-30_kogdamen,21,L2012-03-30, kogdamen,false,
L2012-03-30_vekaplyv,22,L2012-03-30, vekaplyv,false,
L2012-03-30_inicialy,23,L2012-03-30, inicialy,false,
L2012-03-30_fontanka,24,L2012-03-30, fontanka,false,
L2012-03-30_rydaytru,25,L2012-03-30, rydaytru,false,
L2012-03-30_esli,26,L2012-03-30, esli,false,
L2012-03-30_mezhdupr,27,L2012-03-30, mezhdupr,false,
L2012-03-30_trubach,28,L2012-03-30, trubach,false,
L2012-03-30_nerazmen,29,L2012-03-30, nerazmen,false,

19.03.2012 пн – Москва, бард-клуб "Гнездо глухаря", премьера
L2012-03-19_ryba,01,L2012-03-19, ryba,false,
L2012-03-19_zhizn,02,L2012-03-19, zhizn,false,
L2012-03-19_romans2,03,L2012-03-19, romans2,false,
L2012-03-19_deja,04,L2012-03-19, deja,false,
L2012-03-19_propadu,05,L2012-03-19, propadu,false,
L2012-03-19_rodljuds,06,L2012-03-19, rodljuds,false,
L2012-03-19_vpoxodny,07,L2012-03-19, vpoxodny,false,
L2012-03-19_dopoezda,08,L2012-03-19, dopoezda,false,
L2012-03-19_kordebal,09,L2012-03-19, kordebal,false,
L2012-03-19_etodolzh,10,L2012-03-19, etodolzh,false,
L2012-03-19_suhumi,11,L2012-03-19, suhumi,false,
L2012-03-19_vrjadli,12,L2012-03-19, vrjadli,false,
L2012-03-19_kogdamen,13,L2012-03-19, kogdamen,false,
L2012-03-19_ubykagol,14,L2012-03-19, ubykagol,false,
L2012-03-19_schastli,15,L2012-03-19, schastli,true,
L2012-03-19_chepuxa,16,L2012-03-19, chepuxa,false,
---
L2012-03-19_kuznechiki,17,L2012-03-19, kuznechiki,false,
L2012-03-19_kovcheg,18,L2012-03-19, kovcheg,false,
L2012-03-19_podzname,19,L2012-03-19, podzname,false,
L2012-03-19_ballada,20,L2012-03-19, ballada,false,
L2012-03-19_pamjativ,21,L2012-03-19, pamjativ,false,
L2012-03-19_vekaplyv,22,L2012-03-19, vekaplyv,false,
L2012-03-19_fontanka,23,L2012-03-19, fontanka,false,
L2012-03-19_inicialy,24,L2012-03-19, inicialy,false,
L2012-03-19_serenada,25,L2012-03-19, serenada,false,
L2012-03-19_trubach,26,L2012-03-19, trubach,false,
L2012-03-19_nerazmen,27,L2012-03-19, nerazmen,false,

19.02.2012 вс – США, Mountain View, CA, Samovar Hall, премьра
L2012-02-19_sharmans,01,L2012-02-19, sharmans,false,
L2012-02-19_chepuxa,02,L2012-02-19, chepuxa,false,
L2012-02-19_romans2,03,L2012-02-19, romans2,false,
L2012-02-19_deja,04,L2012-02-19, deja,false,
L2012-02-19_temapoleta,05,L2012-02-19, temapoleta,false,
L2012-02-19_ubykagol,06,L2012-02-19, ubykagol,false,
L2012-02-19_rodljuds,07,L2012-02-19, rodljuds,false,
L2012-02-19_vpoxodny,08,L2012-02-19, vpoxodny,false,
L2012-02-19_kordebal,09,L2012-02-19, kordebal,false,
L2012-02-19_etodolzh,10,L2012-02-19, etodolzh,false,
L2012-02-19_dopoezda,11,L2012-02-19, dopoezda,false,
L2012-02-19_suhumi,12,L2012-02-19, suhumi,false,
L2012-02-19_kogdamen,13,L2012-02-19, kogdamen,false,
L2012-02-19_vrjadli,14,L2012-02-19, vrjadli,false,
L2012-02-19_etiglaza,15,L2012-02-19, etiglaza,false,
---
L2012-02-19_kovcheg,16,L2012-02-19, kovcheg,false,
L2012-02-19_podzname,17,L2012-02-19, podzname,false,
L2012-02-19_ballada,18,L2012-02-19, ballada,false,
L2012-02-19_pamjativ,19,L2012-02-19, pamjativ,false,
L2012-02-19_kinemat2,20,L2012-02-19, kinemat2,false,
L2012-02-19_vekaplyv,21,L2012-02-19, vekaplyv,false,
L2012-02-19_fontanka,22,L2012-02-19, fontanka,false,
L2012-02-19_inicialy,23,L2012-02-19, inicialy,false,
L2012-02-19_serenada,24,L2012-02-19, serenada,false,
L2012-02-19_esli,25,L2012-02-19, esli,false,
L2012-02-19_rydaytru,26,L2012-02-19, rydaytru,true,
L2012-02-19_nerazmen,27,L2012-02-19, nerazmen,false,

05.02.2012 вс – Москва, арт-кафе театра "Буфф"
L2012-02-05_sharmans,01,L2012-02-05, sharmans,false,
L2012-02-05_avtoparo,02,L2012-02-05, avtoparo,false,
L2012-02-05_romans2,03,L2012-02-05, romans2,false,
L2012-02-05_baltijsk,04,L2012-02-05, baltijsk,false,
L2012-02-05_vpoxodny,05,L2012-02-05, vpoxodny,false,
L2012-02-05_kuznechiki,06,L2012-02-05, kuznechiki,false,
L2012-02-05_deja,07,L2012-02-05, deja,false,
L2012-02-05_desyatpe,08,L2012-02-05, desyatpe,false,
L2012-02-05_chuzhaj2,09,L2012-02-05, chuzhaj2,false,
L2012-02-05_chepuxa,10,L2012-02-05, chepuxa,false,
L2012-02-05_ryba,11,L2012-02-05, ryba,false,
L2012-02-05_rodljuds,12,L2012-02-05, rodljuds,false,
L2012-02-05_serenada,13,L2012-02-05, serenada,false,
L2012-02-05_temapoleta,14,L2012-02-05, temapoleta,false,
L2012-02-05_suhumi,15,L2012-02-05, suhumi,false,
---
L2012-02-05_zhizn,16,L2012-02-05, zhizn,false,
L2012-02-05_etodolzh,17,L2012-02-05, etodolzh,false,
L2012-02-05_volhonka,18,L2012-02-05, volhonka,false,
L2012-02-05_duet,19,L2012-02-05, duet,false,
L2012-02-05_kovcheg,20,L2012-02-05, kovcheg,false,
L2012-02-05_cirkachk,21,L2012-02-05, cirkachk,false,
L2012-02-05_mneniche,22,L2012-02-05, mneniche,false,
L2012-02-05_trubach,23,L2012-02-05, trubach,false,
L2012-02-05_esli,24,L2012-02-05, esli,false,
L2012-02-05_nerazmen,25,L2012-02-05, nerazmen,false,
L2012-02-05_pamjativ,26,L2012-02-05, pamjativ,false,

09.01.2012 пн – Москва, бард-клуб "Гнездо глухаря"
L2012-01-09_sharmans,01,L2012-01-09, sharmans,false,
L2012-01-09_odnazhdy,02,L2012-01-09, odnazhdy,false,
L2012-01-09_propadu,03,L2012-01-09, propadu,false,
L2012-01-09_tirbayard,04,L2012-01-09, tirbayard,false,
L2012-01-09_baltijsk,05,L2012-01-09, baltijsk,false,
L2012-01-09_vpoxodny,06,L2012-01-09, vpoxodny,false,
L2012-01-09_romans2,07,L2012-01-09, romans2,false,
L2012-01-09_deja,08,L2012-01-09, deja,false,
L2012-01-09_chuzhaj2,09,L2012-01-09, chuzhaj2,false,
L2012-01-09_chepuxa,10,L2012-01-09, chepuxa,false,
L2012-01-09_ryba,11,L2012-01-09, ryba,false,
L2012-01-09_peshkom,12,L2012-01-09, peshkom,false,
L2012-01-09_temapoleta,13,L2012-01-09, temapoleta,false,
L2012-01-09_dopoezda,14,L2012-01-09, dopoezda,false,
L2012-01-09_suhumi,15,L2012-01-09, suhumi,false,
L2012-01-09_etiglaza,16,L2012-01-09, etiglaza,false,
---
L2012-01-09_krasnye,17,L2012-01-09, krasnye,false,
L2012-01-09_zatemzhe,18,L2012-01-09, zatemzhe,false,
L2012-01-09_podzname,19,L2012-01-09, podzname,false,
L2012-01-09_fontanka,20,L2012-01-09, fontanka,false,
L2012-01-09_serenada,21,L2012-01-09, serenada,false,
L2012-01-09_vekaplyv,22,L2012-01-09, vekaplyv,false,
L2012-01-09_kinemat2,23,L2012-01-09, kinemat2,false,
L2012-01-09_alliluja,24,L2012-01-09, alliluja,false,
L2012-01-09_vademecu,25,L2012-01-09, vademecu,false,
L2012-01-09_trubach,26,L2012-01-09, trubach,false,
L2012-01-09_pamjativ,27,L2012-01-09, pamjativ,false,


2011 г. ▼ ▲

11.12.2011 вс – Москва, Тургеневская библиотека
L2011-12-11_zatemzhe,01,L2011-12-11, zatemzhe,false,
L2011-12-11_podzname,02,L2011-12-11, podzname,false,
L2011-12-11_fontanka,03,L2011-12-11, fontanka,false,
L2011-12-11_kinemat2,04,L2011-12-11, kinemat2,false,
L2011-12-11_peshkom,05,L2011-12-11, peshkom,false,
L2011-12-11_panorama,06,L2011-12-11, panorama,false,
L2011-12-11_etodolzh,07,L2011-12-11, etodolzh,false,
L2011-12-11_mneniche,08,L2011-12-11, mneniche,false,
L2011-12-11_krasnye,09,L2011-12-11, krasnye,false,
L2011-12-11_sharmans,10,L2011-12-11, sharmans,false,
L2011-12-11_chuzhaj2,11,L2011-12-11, chuzhaj2,false,
L2011-12-11_suhumi,12,L2011-12-11, suhumi,false,
L2011-12-11_rodljuds,13,L2011-12-11, rodljuds,false,
L2011-12-11_traviata,14,L2011-12-11, traviata,false,
L2011-12-11_inicialy,15,L2011-12-11, inicialy,false,
L2011-12-11_pamjativ,16,L2011-12-11, pamjativ,false,
L2011-12-11_inicialy,17,L2011-12-11, inicialy,false,
L2011-12-11_esli,18,L2011-12-11, esli,false,
L2011-12-11_nerazmen,19,L2011-12-11, nerazmen,false,
??. Балтийские волны
??. Гадалка и ворон
??. Песенка

26.11.2011 сб – Москва, Планетарий КЦ ВС РФ
L2011-11-26_chuzhaj2,01,L2011-11-26, chuzhaj2,false,
L2011-11-26_odnazhdy,02,L2011-11-26, odnazhdy,false,
L2011-11-26_dopoezda,03,L2011-11-26, dopoezda,false,
L2011-11-26_suhumi,04,L2011-11-26, suhumi,false,
L2011-11-26_podzname,05,L2011-11-26, podzname,false,
L2011-11-26_ubykagol,06,L2011-11-26, ubykagol,false,
L2011-11-26_baltijsk,07,L2011-11-26, baltijsk,false,
L2011-11-26_vekaplyv,08,L2011-11-26, vekaplyv,false,
L2011-11-26_fontanka,09,L2011-11-26, fontanka,false,
L2011-11-26_dendensk,10,L2011-11-26, dendensk,false,
L2011-11-26_kordebal,11,L2011-11-26, kordebal,false,
L2011-11-26_volk,12,L2011-11-26, volk,false,
L2011-11-26_peshkom,13,L2011-11-26, peshkom,false,
L2011-11-26_vsetvoic,14,L2011-11-26, vsetvoic,false,
L2011-11-26_kogdamen,15,L2011-11-26, kogdamen,false,
L2011-11-26_1991,16,L2011-11-26, 1991,false,
L2011-11-26_krasnye,17,L2011-11-26, krasnye,false,
L2011-11-26_sharmans,18,L2011-11-26, sharmans,false,
L2011-11-26_kinemat2,19,L2011-11-26, kinemat2,false,
L2011-11-26_vpoxodny,20,L2011-11-26, vpoxodny,false,
L2011-11-26_rodljuds,21,L2011-11-26, rodljuds,false,
L2011-11-26_traviata,22,L2011-11-26, traviata,false,
L2011-11-26_mneniche,23,L2011-11-26, mneniche,false,
L2011-11-26_pamjativ,24,L2011-11-26, pamjativ,false,
L2011-11-26_esli,25,L2011-11-26, esli,false,
L2011-11-26_nerazmen,26,L2011-11-26, nerazmen,false,

08.11.2011 вт – Москва, бард-клуб "Гнездо глухаря", дуэт (гитара)
L2011-11-08_navsejz1,01,L2011-11-08, navsejz1,false,
L2011-11-08_proschan,02,L2011-11-08, proschan,false,
L2011-11-08_paris,03,L2011-11-08, paris,false,
L2011-11-08_opyatpar,04,L2011-11-08, opyatpar,false,
L2011-11-08_poshlyj,05,L2011-11-08, poshlyj,false,
L2011-11-08_adleucon,06,L2011-11-08, adleucon,false,
L2011-11-08_vrjadli,07,L2011-11-08, vrjadli,false,
L2011-11-08_romans1,08,L2011-11-08, romans1,false,
L2011-11-08_karavan,09,L2011-11-08, karavan,false,
L2011-11-08_interme3,10,L2011-11-08, interme3,false,
L2011-11-08_molitva,11,L2011-11-08, molitva,false,
L2011-11-08_marija,12,L2011-11-08, marija,false,
L2011-11-08_sezondoz,13,L2011-11-08, sezondoz,false,
L2011-11-08_ljubov,14,L2011-11-08, ljubov,false,
L2011-11-08_farmacev,15,L2011-11-08, farmacev,false,
L2011-11-08_balagan2,16,L2011-11-08, balagan2,false,
---
L2011-11-08_kibitka,17,L2011-11-08, kibitka,false,
L2011-11-08_ryba,18,L2011-11-08, ryba,false,
L2011-11-08_eccehomo,19,L2011-11-08, eccehomo,false,
L2011-11-08_javnovpo,20*,L2011-11-08, javnovpo,false,
L2011-11-08_dolinanm,21*,L2011-11-08, dolinanm,false,
L2011-11-08_exdanapr,22*,L2011-11-08, exdanapr,false,
L2011-11-08_nepokorn,23*,L2011-11-08, nepokorn,false,
L2011-11-08_vsemuvre,24*,L2011-11-08, vsemuvre,false,
L2011-11-08_vtornik,25,L2011-11-08, vtornik,false,
L2011-11-08_korablik,26,L2011-11-08, korablik,false,
L2011-11-08_kolybeln,27,L2011-11-08, kolybeln,false,
L2011-11-08_vosxodja,28,L2011-11-08, vosxodja,false,

17.10.2011 пн – Москва, бард-клуб "Гнездо глухаря"

11.09.2011 вс – Одесса, ДК медработников
L2011-09-11_sharmans,01,L2011-09-11, sharmans,false,
L2011-09-11_ubykagol,02,L2011-09-11, ubykagol,false,
L2011-09-11_krasnye,03,L2011-09-11, krasnye,false,
L2011-09-11_fontanka,04,L2011-09-11, fontanka,false,
L2011-09-11_suhumi,05,L2011-09-11, suhumi,false,
L2011-09-11_cirkachk,06,L2011-09-11, cirkachk,false,
L2011-09-11_kuznechiki,07,L2011-09-11, kuznechiki,false,
L2011-09-11_stixiopr,08,L2011-09-11, stixiopr,false,
L2011-09-11_desyatpe,09,L2011-09-11, desyatpe,false,
L2011-09-11_vsetvoic,10,L2011-09-11, vsetvoic,false,
L2011-09-11_ryba,11,L2011-09-11, ryba,false,
L2011-09-11_volk,12,L2011-09-11, volk,false,
L2011-09-11_chepuxa,13,L2011-09-11, chepuxa,false,
L2011-09-11_esli,14,L2011-09-11, esli,false,
---
L2011-09-11_zhizn,15,L2011-09-11, zhizn,false,
L2011-09-11_1992,16,L2011-09-11, 1992,false,
L2011-09-11_avtoparo,17,L2011-09-11, avtoparo,false,
L2011-09-11_tirbayard,18,L2011-09-11, tirbayard,false,
L2011-09-11_dendensk,19,L2011-09-11, dendensk,false,
L2011-09-11_traviata,20,L2011-09-11, traviata,false,
L2011-09-11_kogdaned,21,L2011-09-11, kogdaned,false,
L2011-09-11_baltijsk,22,L2011-09-11, baltijsk,false,
L2011-09-11_temapoleta,23,L2011-09-11, temapoleta,false,
L2011-09-11_mneniche,24,L2011-09-11, mneniche,false,
L2011-09-11_kogdamen,26,L2011-09-11, kogdamen,false,
L2011-09-11_nerazmen,27,L2011-09-11, nerazmen,false,

09.06.2011 чт – Москва, бард-клуб "Гнездо глухаря"

03.06.2011 пт – Санкт-Петербург, КЗ "У Финляндского"
L2011-06-03_suhumi,01,L2011-06-03, suhumi,false,
L2011-06-03_propadu,02,L2011-06-03, propadu,false,
L2011-06-03_peterbur,03,L2011-06-03, peterbur,false,
L2011-06-03_1991,04,L2011-06-03, 1991,false,
L2011-06-03_volk,05,L2011-06-03, volk,false,
L2011-06-03_ubykagol,06,L2011-06-03, ubykagol,false,
L2011-06-03_nebyvaet,07,L2011-06-03, nebyvaet,false,
L2011-06-03_podzname,08,L2011-06-03, podzname,false,
L2011-06-03_fontanka,09,L2011-06-03, fontanka,false,
L2011-06-03_prenebre,10,L2011-06-03, prenebre,false,
L2011-06-03_piter,11,L2011-06-03, piter,false,
L2011-06-03_moekoro2,12,L2011-06-03, moekoro2,false,
L2011-06-03_brodjagi,13,L2011-06-03, brodjagi,false,
L2011-06-03_kadril,14,L2011-06-03, kadril,false,
L2011-06-03_zastolnaya,15,L2011-06-03, zastolnaya,false,
---
L2011-06-03_sharmans,16,L2011-06-03, sharmans,false,
L2011-06-03_istorija,17,L2011-06-03, istorija,false,
L2011-06-03_rodljuds,18,L2011-06-03, rodljuds,false,
L2011-06-03_traviata,19,L2011-06-03, traviata,false,
L2011-06-03_kogdaned,20,L2011-06-03, kogdaned,false,
L2011-06-03_ballada,21,L2011-06-03, ballada,false,
L2011-06-03_romans2,22,L2011-06-03, romans2,false,
L2011-06-03_serenada,23,L2011-06-03, serenada,false,
L2011-06-03_kogdamen,24,L2011-06-03, kogdamen,false,
L2011-06-03_kovcheg,25,L2011-06-03, kovcheg,false,

13.05.2011 пт – Киев, "Шоколадный дом"
L2011-05-13_suhumi,01,L2011-05-13, suhumi,false,
L2011-05-13_propadu,02,L2011-05-13, propadu,false,
L2011-05-13_peterbur,03,L2011-05-13, peterbur,false,
L2011-05-13_1991,04,L2011-05-13, 1991,false,
L2011-05-13_volk,05,L2011-05-13, volk,false,
L2011-05-13_ubykagol,06,L2011-05-13, ubykagol,false,
L2011-05-13_nebyvaet,07,L2011-05-13, nebyvaet,false,
L2011-05-13_podzname,08,L2011-05-13, podzname,false,
L2011-05-13_fontanka,09,L2011-05-13, fontanka,false,
L2011-05-13_prenebre,10,L2011-05-13, prenebre,false,
L2011-05-13_piter,11,L2011-05-13, piter,false,
L2011-05-13_moekoro2,12,L2011-05-13, moekoro2,false,
L2011-05-13_brodjagi,13,L2011-05-13, brodjagi,false,
L2011-05-13_kadril,14,L2011-05-13, kadril,false,
L2011-05-13_zastolnaya,15,L2011-05-13, zastolnaya,false,
L2011-05-13_sharmans,16,L2011-05-13, sharmans,false,
L2011-05-13_istorija,17,L2011-05-13, istorija,false,
L2011-05-13_kalejdos,18,L2011-05-13, kalejdos,false,
L2011-05-13_rodljuds,19,L2011-05-13, rodljuds,false,
L2011-05-13_traviata,20,L2011-05-13, traviata,false,
L2011-05-13_kogdaned,21,L2011-05-13, kogdaned,false,
L2011-05-13_ballada,22,L2011-05-13, ballada,false,
L2011-05-13_romans2,23,L2011-05-13, romans2,false,
L2011-05-13_serenada,24,L2011-05-13, serenada,false,
L2011-05-13_trubach,25,L2011-05-13, trubach,false,
L2011-05-13_kogdamen,26,L2011-05-13, kogdamen,false,
L2011-05-13_kovcheg,27,L2011-05-13, kovcheg,false,

20.03.2011 вс – США, Boston, MA

19.03.2011 сб – США, Valley Stream, NY, клуб "ZUS"
L2011-03-19_1992,01,L2011-03-19, 1992,false,
L2011-03-19_suhumi,02,L2011-03-19, suhumi,false,
L2011-03-19_propadu,03,L2011-03-19, propadu,false,
L2011-03-19_peterbur,04,L2011-03-19, peterbur,false,
L2011-03-19_romans2,05,L2011-03-19, romans2,false,
L2011-03-19_kadril,06,L2011-03-19, kadril,false,
L2011-03-19_ubykagol,07,L2011-03-19, ubykagol,false,
L2011-03-19_ballada,08,L2011-03-19, ballada,false,
L2011-03-19_brodjagi,19,L2011-03-19, brodjagi,false,
L2011-03-19_piter,10,L2011-03-19, piter,false,
L2011-03-19_traviata,11,L2011-03-19, traviata,false,
L2011-03-19_mezhdupr,12,L2011-03-19, mezhdupr,false,
L2011-03-19_pamjativ,13,L2011-03-19, pamjativ,false,
L2011-03-19_volk,14,L2011-03-19, volk,false,
L2011-03-19_zastolnaya,15,L2011-03-19, zastolnaya,false,
L2011-03-19_fontanka,16,L2011-03-19, fontanka,false,
L2011-03-19_moekoro2,17,L2011-03-19, moekoro2,false,
L2011-03-19_alliluja,18,L2011-03-19, alliluja,false,
L2011-03-19_esli,29,L2011-03-19, esli,false,
L2011-03-19_vsetvoic,20,L2011-03-19, vsetvoic,false,
L2011-03-19_kogdamen,21,L2011-03-19, kogdamen,false,
L2011-03-19_podzname,22,L2011-03-19, podzname,false,
L2011-03-19_ryba,23,L2011-03-19, ryba,false,
L2011-03-19_nerazmen,24,L2011-03-19, nerazmen,false,
L2011-03-19_trubach,25,L2011-03-19, trubach,false,

18.03.2011 пт – США, Upper Saddle River, NJ

13.03.2011 вс – США, Madison, WI

12.03.2011 сб – США, Chicago, IL

11.03.2011 пт – США, Cleveland, OH

09.03.2011 ср – США, Pittsburgh, PA

28.02.2011 пн – Москва, домашний концерт у В. Палта, 3 премьеры
L2011-02-28_suhumi,01,L2011-02-28, suhumi,false,
L2011-02-28_propadu,02,L2011-02-28, propadu,false,
L2011-02-28_peterbur,03,L2011-02-28, peterbur,false,
L2011-02-28_romans2,04,L2011-02-28, romans2,false,
L2011-02-28_serenada,05,L2011-02-28, serenada,false,
L2011-02-28_prenebre,06,L2011-02-28, prenebre,false,
L2011-02-28_kadril,07,L2011-02-28, kadril,false,
L2011-02-28_ubykagol,08,L2011-02-28, ubykagol,false,
L2011-02-28_ktosamgo,09,L2011-02-28, ktosamgo,true,
L2011-02-28_brodjagi,10,L2011-02-28, brodjagi,false,
L2011-02-28_piter,11,L2011-02-28, piter,false,
L2011-02-28_nebyvaet,12,L2011-02-28, nebyvaet,false,
L2011-02-28_vsetvoic,13,L2011-02-28, vsetvoic,false,
L2011-02-28_traviata,14,L2011-02-28, traviata,false,
L2011-02-28_mezhdupr,15,L2011-02-28, mezhdupr,true,
L2011-02-28_volk,16,L2011-02-28, volk,false,
L2011-02-28_fontanka,17,L2011-02-28, fontanka,false,
L2011-02-28_rodljuds,18,L2011-02-28, rodljuds,false,
L2011-02-28_podzname,19,L2011-02-28, podzname,false,
L2011-02-28_1991,20,L2011-02-28, 1991,false,
L2011-02-28_votpodni,21,L2011-02-28, votpodni,false,
L2011-02-28_sokolnik,22,L2011-02-28, sokolnik,false,
L2011-02-28_kogdamen,23,L2011-02-28, kogdamen,true,
L2011-02-28_nerazmen,24,L2011-02-28, nerazmen,false,

11.02.2011 пт – Санкт-Петербург, КЗ "У Финляндского", дуэт (клавиши), премьера
L2011-02-11_kibitka,01,L2011-02-11, kibitka,false,
L2011-02-11_burja,02,L2011-02-11, burja,false,
L2011-02-11_rozhdest,03,L2011-02-11, rozhdest,false,
L2011-02-11_marija,04,L2011-02-11, marija,false,
L2011-02-11_dusha,05,L2011-02-11, dusha,false,
L2011-02-11_posesche,06,L2011-02-11, posesche,false,
L2011-02-11_brodjagi,07,L2011-02-11, brodjagi,false,
L2011-02-11_baltijsk,08,L2011-02-11, baltijsk,false,
L2011-02-11_vpoxodny,09,L2011-02-11, vpoxodny,false,
L2011-02-11_teplyj,10,L2011-02-11, teplyj,false,
L2011-02-11_lunnaja,11,L2011-02-11, lunnaja,false,
L2011-02-11_descensu,12,L2011-02-11, descensu,false,
L2011-02-11_opyattor,13,L2011-02-11, opyattor,true,
L2011-02-11_muzhajsj,14,L2011-02-11, muzhajsj,false,
L2011-02-11_podzname,15,L2011-02-11, podzname,false,
L2011-02-11_trubach,16,L2011-02-11, trubach,false,
L2011-02-11_sentenci,17,L2011-02-11, sentenci,false,
---
L2011-02-11_navsejz1,18,L2011-02-11, navsejz1,false,
L2011-02-11_adleucon,19,L2011-02-11, adleucon,false,
L2011-02-11_poshlyj,20,L2011-02-11, poshlyj,false,
L2011-02-11_paris,21,L2011-02-11, paris,false,
L2011-02-11_ryba,22,L2011-02-11, ryba,false,
L2011-02-11_molitva,23,L2011-02-11, molitva,false,
L2011-02-11_sezondoz,24,L2011-02-11, sezondoz,false,
L2011-02-11_proschan,25,L2011-02-11, proschan,false,
L2011-02-11_karavan,26,L2011-02-11, karavan,false,
L2011-02-11_nenadoby,27,L2011-02-11, nenadoby,false,
L2011-02-11_serenada,28,L2011-02-11, serenada,false,
L2011-02-11_romans1,29,L2011-02-11, romans1,false,
L2011-02-11_korablik,30,L2011-02-11, korablik,false,
L2011-02-11_vtornik,31,L2011-02-11, vtornik,false,
L2011-02-11_kolybeln,32,L2011-02-11, kolybeln,false,
L2011-02-11_vosxodja,33,L2011-02-11, vosxodja,false,


2010 г. ▼ ▲

18.12.2010 сб – США, Mountain View, CA, Samovar Hall
L2010-12-18_zhizn,01,L2010-12-18, zhizn,false,
L2010-12-18_cirkachk,02,L2010-12-18, cirkachk,false,
L2010-12-18_stixiopr,03,L2010-12-18, stixiopr,false,
L2010-12-18_baltijsk,04,L2010-12-18, baltijsk,false,
L2010-12-18_krasnye,05,L2010-12-18, krasnye,false,
L2010-12-18_sokolnik,06,L2010-12-18, sokolnik,false,
L2010-12-18_chuzhaj2,07,L2010-12-18, chuzhaj2,false,
L2010-12-18_duet,08,L2010-12-18, duet,false,
L2010-12-18_dendensk,09,L2010-12-18, dendensk,false,
L2010-12-18_odnazhdy,10,L2010-12-18, odnazhdy,false,
L2010-12-18_zatemzhe,11,L2010-12-18, zatemzhe,false,
L2010-12-18_desyatpe,12,L2010-12-18, desyatpe,false,
L2010-12-18_ryba,13,L2010-12-18, ryba,false,
L2010-12-18_tirbayard,14,L2010-12-18, tirbayard,false,
L2010-12-18_avtoparo,15,L2010-12-18, avtoparo,false,
L2010-12-18_kogdaned,16,L2010-12-18, kogdaned,false,
L2010-12-18_traviata,17,L2010-12-18, traviata,false,
L2010-12-18_vsetvoic,18,L2010-12-18, vsetvoic,false,
L2010-12-18_vpoxodny,19,L2010-12-18, vpoxodny,false,
L2010-12-18_temapoleta,20,L2010-12-18, temapoleta,false,
L2010-12-18_2001,21,L2010-12-18, 2001,false,
L2010-12-18_mneniche,22,L2010-12-18, mneniche,false,
L2010-12-18_dopoezda,23,L2010-12-18, dopoezda,false,
L2010-12-18_chepuxa,24,L2010-12-18, chepuxa,false,
L2010-12-18_pamjativ,25,L2010-12-18, pamjativ,false,
L2010-12-18_esli,26,L2010-12-18, esli,false,
L2010-12-18_trubach,27,L2010-12-18, trubach,false,
L2010-12-18_nerazmen,28,L2010-12-18, nerazmen,false,
??. Балтийские волны

12.12.2010 вс – США, Ann Arbor, MI

30.11.2010 вт – США, Rochester, NY

19.10.2010 вт – Минск, кафе-клуб "Лисья нора"
L2010-10-19_1992,01,L2010-10-19, 1992,false,
L2010-10-19_zhizn,02,L2010-10-19, zhizn,false,
L2010-10-19_cirkachk,03,L2010-10-19, cirkachk,false,
L2010-10-19_stixiopr,04,L2010-10-19, stixiopr,false,
L2010-10-19_baltijsk,05,L2010-10-19, baltijsk,false,
L2010-10-19_krasnye,06,L2010-10-19, krasnye,false,
L2010-10-19_chuzhaj2,07,L2010-10-19, chuzhaj2,false,
L2010-10-19_dendensk,08,L2010-10-19, dendensk,false,
L2010-10-19_odnazhdy,09,L2010-10-19, odnazhdy,false,
L2010-10-19_ryba,10,L2010-10-19, ryba,false,
L2010-10-19_desyatpe,11,L2010-10-19, desyatpe,false,
L2010-10-19_traviata,12,L2010-10-19, traviata,false,
L2010-10-19_kogdaned,13,L2010-10-19, kogdaned,false,
---
L2010-10-19_avtoparo,14,L2010-10-19, avtoparo,false,
L2010-10-19_peshkom,15,L2010-10-19, peshkom,false,
L2010-10-19_vsetvoic,16,L2010-10-19, vsetvoic,false,
L2010-10-19_deja,17,L2010-10-19, deja,false,
L2010-10-19_sokolnik,18,L2010-10-19, sokolnik,false,
L2010-10-19_alliluja,19,L2010-10-19, alliluja,false,
L2010-10-19_vpoxodny,20,L2010-10-19, vpoxodny,false,
L2010-10-19_temapoleta,21,L2010-10-19, temapoleta,false,
L2010-10-19_2001,22,L2010-10-19, 2001,false,
L2010-10-19_mneniche,23,L2010-10-19, mneniche,false,
L2010-10-19_dopoezda,25,L2010-10-19, dopoezda,false,
L2010-10-19_chepuxa,26,L2010-10-19, chepuxa,false,
L2010-10-19_pamjativ,27,L2010-10-19, pamjativ,false,
L2010-10-19_esli,28,L2010-10-19, esli,false,
L2010-10-19_nerazmen,29,L2010-10-19, nerazmen,false,
L2010-10-19_trubach,30,L2010-10-19, trubach,false,

16.10.2010 сб – Израиль, Бат-Ям, Концертный зал "Гейхал-а-Тарбут"
L2010-10-16_1992,01,L2010-10-16, 1992,false,
L2010-10-16_zhizn,02,L2010-10-16, zhizn,false,
L2010-10-16_cirkachk,03,L2010-10-16, cirkachk,false,
L2010-10-16_stixiopr,04,L2010-10-16, stixiopr,false,
L2010-10-16_baltijsk,05,L2010-10-16, baltijsk,false,
L2010-10-16_krasnye,06,L2010-10-16, krasnye,false,
L2010-10-16_chuzhaj2,07,L2010-10-16, chuzhaj2,false,
L2010-10-16_duet,08,L2010-10-16, duet,false,
L2010-10-16_dendensk,09,L2010-10-16, dendensk,false,
L2010-10-16_odnazhdy,10,L2010-10-16, odnazhdy,false,
L2010-10-16_sokolnik,11,L2010-10-16, sokolnik,false,
L2010-10-16_vsetvoic,12,L2010-10-16, vsetvoic,false,
L2010-10-16_desyatpe,13,L2010-10-16, desyatpe,false,
L2010-10-16_traviata,14,L2010-10-16, traviata,false,
L2010-10-16_2001,15,L2010-10-16, 2001,false,
L2010-10-16_kogdaned,16,L2010-10-16, kogdaned,false,
---
L2010-10-16_avtoparo,17,L2010-10-16, avtoparo,false,
L2010-10-16_kuznechiki,18,L2010-10-16, kuznechiki,false,
L2010-10-16_propadu,19,L2010-10-16, propadu,false,
L2010-10-16_peshkom,20,L2010-10-16, peshkom,false,
L2010-10-16_alliluja,21,L2010-10-16, alliluja,false,
L2010-10-16_vpoxodny,22,L2010-10-16, vpoxodny,false,
L2010-10-16_temapoleta,23,L2010-10-16, temapoleta,false,
L2010-10-16_mneniche,24,L2010-10-16, mneniche,false,
L2010-10-16_volhonka,25,L2010-10-16, volhonka,false,
L2010-10-16_dopoezda,26,L2010-10-16, dopoezda,false,
L2010-10-16_chepuxa,27,L2010-10-16, chepuxa,false,
L2010-10-16_esli,28,L2010-10-16, esli,false,
L2010-10-16_trubach,29,L2010-10-16, trubach,false,
L2010-10-16_nerazmen,30,L2010-10-16, nerazmen,false,

14.10.2010 чт – Израиль, Хайфа, зал "Бейтену"
L2010-10-14_cirkachk,01,L2010-10-14, cirkachk,false,
L2010-10-14_vademecu,02,L2010-10-14, vademecu,false,
L2010-10-14_baltijsk,03,L2010-10-14, baltijsk,false,
L2010-10-14_krasnye,04,L2010-10-14, krasnye,false,
L2010-10-14_chuzhaj2,05,L2010-10-14, chuzhaj2,false,
L2010-10-14_duet,06,L2010-10-14, duet,false,
L2010-10-14_dendensk,07,L2010-10-14, dendensk,false,
L2010-10-14_odnazhdy,08,L2010-10-14, odnazhdy,false,
L2010-10-14_kuznechiki,09,L2010-10-14, kuznechiki,false,
L2010-10-14_propadu,10,L2010-10-14, propadu,false,
L2010-10-14_desyatpe,11,L2010-10-14, desyatpe,false,
L2010-10-14_traviata,12,L2010-10-14, traviata,false,
L2010-10-14_2001,13,L2010-10-14, 2001,false,
L2010-10-14_tirbayard,14,L2010-10-14, tirbayard,false,
---
L2010-10-14_avtoparo,15,L2010-10-14, avtoparo,false,
L2010-10-14_ryba,16,L2010-10-14, ryba,false,
L2010-10-14_vsetvoic,17,L2010-10-14, vsetvoic,false,
L2010-10-14_sokolnik,18,L2010-10-14, sokolnik,false,
L2010-10-14_proschalm,19,L2010-10-14, proschalm,false,
L2010-10-14_vpoxodny,20,L2010-10-14, vpoxodny,false,
L2010-10-14_temapoleta,21,L2010-10-14, temapoleta,false,
L2010-10-14_volhonka,22,L2010-10-14, volhonka,false,
L2010-10-14_chepuxa,23,L2010-10-14, chepuxa,false,
L2010-10-14_pamjativ,24,L2010-10-14, pamjativ,false,
L2010-10-14_esli,25,L2010-10-14, esli,false,
L2010-10-14_nerazmen,26,L2010-10-14, nerazmen,false,

13.10.2010 ср – Израиль, Иерусалим, Культурный центр, зал "Гармония"
L2010-10-13_1992,01,L2010-10-13, 1992,false,
L2010-10-13_avtoparo,02,L2010-10-13, avtoparo,false,
L2010-10-13_kuznechiki,03,L2010-10-13, kuznechiki,false,
L2010-10-13_baltijsk,04,L2010-10-13, baltijsk,false,
L2010-10-13_krasnye,05,L2010-10-13, krasnye,false,
L2010-10-13_chuzhaj2,06,L2010-10-13, chuzhaj2,false,
L2010-10-13_duet,07,L2010-10-13, duet,false,
L2010-10-13_dendensk,08,L2010-10-13, dendensk,false,
L2010-10-13_vademecu,09,L2010-10-13, vademecu,false,
L2010-10-13_cirkachk,10,L2010-10-13, cirkachk,false,
L2010-10-13_2001,11,L2010-10-13, 2001,false,
L2010-10-13_vrjadli,12,L2010-10-13, vrjadli,false,
L2010-10-13_zatemzhe,13,L2010-10-13, zatemzhe,false,
L2010-10-13_desyatpe,14,L2010-10-13, desyatpe,false,
L2010-10-13_tirbayard,15,L2010-10-13, tirbayard,false,
---
L2010-10-13_zhizn,16,L2010-10-13, zhizn,false,
L2010-10-13_ryba,17,L2010-10-13, ryba,false,
L2010-10-13_vsetvoic,18,L2010-10-13, vsetvoic,false,
L2010-10-13_sokolnik,19,L2010-10-13, sokolnik,false,
L2010-10-13_alliluja,20,L2010-10-13, alliluja,false,
L2010-10-13_vpoxodny,21,L2010-10-13, vpoxodny,false,
L2010-10-13_temapoleta,22,L2010-10-13, temapoleta,false,
L2010-10-13_mneniche,23,L2010-10-13, mneniche,false,
L2010-10-13_udachny,24,L2010-10-13, udachny,false,
L2010-10-13_dopoezda,25,L2010-10-13, dopoezda,false,
L2010-10-13_chepuxa,26,L2010-10-13, chepuxa,false,
L2010-10-13_pamjativ,27,L2010-10-13, pamjativ,false,
L2010-10-13_nerazmen,28,L2010-10-13, nerazmen,false,

18.09.2010 сб – Киев, Республиканский Дом актёра
L2010-09-18_1992,01,L2010-09-18, 1992,false,
L2010-09-18_avtoparo,02,L2010-09-18, avtoparo,false,
L2010-09-18_kuznechiki,03,L2010-09-18, kuznechiki,false,
L2010-09-18_baltijsk,04,L2010-09-18, baltijsk,false,
L2010-09-18_krasnye,05,L2010-09-18, krasnye,false,
L2010-09-18_chuzhaj2,06,L2010-09-18, chuzhaj2,false,
L2010-09-18_duet,07,L2010-09-18, duet,false,
L2010-09-18_dendensk,08,L2010-09-18, dendensk,false,
L2010-09-18_vademecu,09,L2010-09-18, vademecu,false,
L2010-09-18_cirkachk,10,L2010-09-18, cirkachk,false,
L2010-09-18_2001,11,L2010-09-18, 2001,false,
L2010-09-18_volhonka,12,L2010-09-18, volhonka,false,
L2010-09-18_zatemzhe,13,L2010-09-18, zatemzhe,false,
L2010-09-18_desyatpe,14,L2010-09-18, desyatpe,false,
L2010-09-18_tirbayard,15,L2010-09-18, tirbayard,false,
---
L2010-09-18_zhizn,16,L2010-09-18, zhizn,false,
L2010-09-18_ryba,17,L2010-09-18, ryba,false,
L2010-09-18_sokolnik,18,L2010-09-18, sokolnik,false,
L2010-09-18_vsetvoic,19,L2010-09-18, vsetvoic,false,
L2010-09-18_vpoxodny,20,L2010-09-18, vpoxodny,false,
L2010-09-18_temapoleta,21,L2010-09-18, temapoleta,false,
L2010-09-18_mneniche,22,L2010-09-18, mneniche,false,
L2010-09-18_alliluja,23,L2010-09-18, alliluja,false,
L2010-09-18_dopoezda,24,L2010-09-18, dopoezda,false,
L2010-09-18_chepuxa,25,L2010-09-18, chepuxa,false,
L2010-09-18_pamjativ,26,L2010-09-18, pamjativ,false,
L2010-09-18_esli,27,L2010-09-18, esli,false,
L2010-09-18_nerazmen,28,L2010-09-18, nerazmen,false,

30.05.2010 вс – Санкт-Петербург, КЗ "У Финляндского"

22.05.2010 сб – Москва, ЦДЖ, премьера
+ Гадалка и ворон

25.04.2010 вс – Москва, ЦДХ
L2010-04-25_1992,01,L2010-04-25, 1992,false,
L2010-04-25_avtoparo,02,L2010-04-25, avtoparo,false,
L2010-04-25_krasnye,03,L2010-04-25, krasnye,false,
L2010-04-25_chuzhaj2,04,L2010-04-25, chuzhaj2,false,
L2010-04-25_1991,05,L2010-04-25, 1991,false,
L2010-04-25_kuznechiki,06,L2010-04-25, kuznechiki,false,
L2010-04-25_deja,07,L2010-04-25, deja,false,
L2010-04-25_baltijsk,08,L2010-04-25, baltijsk,false,
L2010-04-25_dendensk,09,L2010-04-25, dendensk,false,
L2010-04-25_vpoxodny,10,L2010-04-25, vpoxodny,false,
L2010-04-25_zatemzhe,11,L2010-04-25, zatemzhe,false,
L2010-04-25_cirkachk,12,L2010-04-25, cirkachk,false,
L2010-04-25_udachny,13,L2010-04-25, udachny,false,
L2010-04-25_vrjadli,14,L2010-04-25, vrjadli,false,
L2010-04-25_tirbayard,15,L2010-04-25, tirbayard,false,
L2010-04-25_volk,16,L2010-04-25, volk,false,
L2010-04-25_zhizn,17,L2010-04-25, zhizn,false,
L2010-04-25_ryba,18,L2010-04-25, ryba,false,
L2010-04-25_volhonka,19,L2010-04-25, volhonka,false,
L2010-04-25_mneniche,20,L2010-04-25, mneniche,false,
L2010-04-25_peshkom,21,L2010-04-25, peshkom,false,
L2010-04-25_temapoleta,22,L2010-04-25, temapoleta,false,
L2010-04-25_alliluja,23,L2010-04-25, alliluja,false,
L2010-04-25_stixiopr,24,L2010-04-25, stixiopr,false,
L2010-04-25_vademecu,25,L2010-04-25, vademecu,false,
L2010-04-25_dopoezda,26,L2010-04-25, dopoezda,false,
L2010-04-25_esli,27,L2010-04-25, esli,false,
L2010-04-25_trubach,28,L2010-04-25, trubach,false,
L2010-04-25_nerazmen,29,L2010-04-25, nerazmen,false,

06.03.2010 сб – Москва, ЦДЖ, дуэт (клавиши)
L2010-03-06_sharmans,01,L2010-03-06, sharmans,false,
L2010-03-06_vbelojmg,02,L2010-03-06, vbelojmg,false,
L2010-03-06_kibitka,03,L2010-03-06, kibitka,false,
L2010-03-06_burja,04,L2010-03-06, burja,false,
L2010-03-06_vjuga,05,L2010-03-06, vjuga,false,
L2010-03-06_rozhdest,06,L2010-03-06, rozhdest,false,
L2010-03-06_marija,07,L2010-03-06, marija,false,
L2010-03-06_dusha,08,L2010-03-06, dusha,false,
L2010-03-06_posesche,09,L2010-03-06, posesche,false,
L2010-03-06_voslavug,10,L2010-03-06, voslavug,false,
L2010-03-06_kuznechiki,11,L2010-03-06, kuznechiki,false,
L2010-03-06_alliluja,12,L2010-03-06, alliluja,false,
L2010-03-06_brodjagi,13,L2010-03-06, brodjagi,false,
L2010-03-06_baltijsk,14,L2010-03-06, baltijsk,false,
L2010-03-06_teplyj,15,L2010-03-06, teplyj,false,
L2010-03-06_proscha2,16,L2010-03-06, proscha2,false,
L2010-03-06_lunnaja,17,L2010-03-06, lunnaja,false,
L2010-03-06_vpoxodny,18,L2010-03-06, vpoxodny,false,
L2010-03-06_descensu,19,L2010-03-06, descensu,false,
L2010-03-06_proscha1,20,L2010-03-06, proscha1,false,
L2010-03-06_pochtich,21,L2010-03-06, pochtich,false,
L2010-03-06_gonistos,22,L2010-03-06, gonistos,false,
L2010-03-06_muzhajsj,23,L2010-03-06, muzhajsj,false,
L2010-03-06_podzname,24,L2010-03-06, podzname,false,
L2010-03-06_trubach,25,L2010-03-06, trubach,false,
L2010-03-06_sentenci,26,L2010-03-06, sentenci,false,
L2010-03-06_kolybeln,27,L2010-03-06, kolybeln,false,

28.02.2010 вс – Москва, Культурный центр ДОМ
L2010-02-28_1992,01,L2010-02-28, 1992,false,
L2010-02-28_chuzhaj2,02,L2010-02-28, chuzhaj2,false,
L2010-02-28_zhizn,03,L2010-02-28, zhizn,false,
L2010-02-28_ryba,04,L2010-02-28, ryba,false,
L2010-02-28_dopoezda,05,L2010-02-28, dopoezda,false,
L2010-02-28_cirkachk,06,L2010-02-28, cirkachk,false,
L2010-02-28_peshkom,07,L2010-02-28, peshkom,false,
L2010-02-28_1991,08,L2010-02-28, 1991,false,
L2010-02-28_krasnye,09,L2010-02-28, krasnye,false,
L2010-02-28_dendensk,10,L2010-02-28, dendensk,false,
L2010-02-28_volhonka,11,L2010-02-28, volhonka,false,
L2010-02-28_zatemzhe,12,L2010-02-28, zatemzhe,false,
L2010-02-28_deja,13,L2010-02-28, deja,false,
L2010-02-28_volk,14,L2010-02-28, volk,false,
L2010-02-28_stixiopr,15,L2010-02-28, stixiopr,false,
L2010-02-28_temapoleta,16,L2010-02-28, temapoleta,false,
---
L2010-02-28_sharmans,17,L2010-02-28, sharmans,false,
L2010-02-28_desyatpe,18,L2010-02-28, desyatpe,false,
L2010-02-28_mneniche,19,L2010-02-28, mneniche,false,
L2010-02-28_tirbayard,20,L2010-02-28, tirbayard,false,
L2010-02-28_chepuxa,21,L2010-02-28, chepuxa,false,
L2010-02-28_esli,22,L2010-02-28, esli,false,
L2010-02-28_pamjativ,23,L2010-02-28, pamjativ,false,
L2010-02-28_alliluja,24,L2010-02-28, alliluja,false,
L2010-02-28_trubach,25,L2010-02-28, trubach,false,
L2010-02-28_nerazmen,26,L2010-02-28, nerazmen,false,

30.01.2010 сб – Москва, ЦДЖ, дуэт (гитара)
L2010-01-30_kovcheg,01,L2010-01-30, kovcheg,false,
L2010-01-30_avtoparo,02,L2010-01-30, avtoparo,false,
L2010-01-30_kuznechiki,03,L2010-01-30, kuznechiki,false,
L2010-01-30_adleucon,04,L2010-01-30, adleucon,false,
L2010-01-30_navsejz1,05,L2010-01-30, navsejz1,false,
L2010-01-30_proschan,06,L2010-01-30, proschan,false,
L2010-01-30_kibitka,07,L2010-01-30, kibitka,false,
L2010-01-30_eccehomo,08,L2010-01-30, eccehomo,false,
L2010-01-30_kalejdos,09,L2010-01-30, kalejdos,false,
L2010-01-30_paris,10,L2010-01-30, paris,false,
L2010-01-30_ryba,11,L2010-01-30, ryba,false,
L2010-01-30_puskaj,12,L2010-01-30, puskaj,false,
L2010-01-30_nenadoby,13,L2010-01-30, nenadoby,false,
L2010-01-30_korablik,14,L2010-01-30, korablik,false,
L2010-01-30_svidanie,15,L2010-01-30, svidanie,false,
L2010-01-30_romansma,16,L2010-01-30, romansma,false,
L2010-01-30_ljubov,17,L2010-01-30, ljubov,false,
L2010-01-30_farmacev,18,L2010-01-30, farmacev,false,
---
L2010-01-30_1992,19,L2010-01-30, 1992,false,
L2010-01-30_molitva,20,L2010-01-30, molitva,false,
L2010-01-30_desyatpe,21,L2010-01-30, desyatpe,false,
L2010-01-30_sezondoz,22,L2010-01-30, sezondoz,false,
L2010-01-30_serenada,23,L2010-01-30, serenada,false,
L2010-01-30_romans1,24,L2010-01-30, romans1,false,
L2010-01-30_proscha1,25,L2010-01-30, proscha1,false,
L2010-01-30_poshlyj,26,L2010-01-30, poshlyj,false,
L2010-01-30_aneta,27,L2010-01-30, aneta,false,
L2010-01-30_vpoxodny,28,L2010-01-30, vpoxodny,false,
L2010-01-30_karavan,29,L2010-01-30, karavan,false,
L2010-01-30_interme3,30,L2010-01-30, interme3,false,
L2010-01-30_dusha,31,L2010-01-30, dusha,false,
L2010-01-30_kolybeln,32,L2010-01-30, kolybeln,false,
L2010-01-30_vtornik,33,L2010-01-30, vtornik,false,
L2010-01-30_vosxodja,34,L2010-01-30, vosxodja,false,


2009 г. ▼ ▲

18.12.2009 пт – Москва, Политехнический музей
L2009-12-18_1992,01,L2009-12-18, 1992,false,
L2009-12-18_avtoparo,02,L2009-12-18, avtoparo,false,
L2009-12-18_kuznechiki,03,L2009-12-18, kuznechiki,false,
L2009-12-18_2001,04,L2009-12-18, 2001,false,
L2009-12-18_krasnye,05,L2009-12-18, krasnye,false,
L2009-12-18_odnazhdy,06,L2009-12-18, odnazhdy,false,
L2009-12-18_sokolnik,07,L2009-12-18, sokolnik,false,
L2009-12-18_zatemzhe,08,L2009-12-18, zatemzhe,false,
L2009-12-18_cirkachk,09,L2009-12-18, cirkachk,false,
L2009-12-18_zhizn,10,L2009-12-18, zhizn,false,
L2009-12-18_dopoezda,11,L2009-12-18, dopoezda,false,
L2009-12-18_esli,12,L2009-12-18, esli,false,
L2009-12-18_baltijsk,13,L2009-12-18, baltijsk,false,
L2009-12-18_peterbur,14,L2009-12-18, peterbur,false,
L2009-12-18_propadu,15,L2009-12-18, propadu,false,
L2009-12-18_desyatpe,16,L2009-12-18, desyatpe,false,
---
L2009-12-18_chuzhaj2,17,L2009-12-18, chuzhaj2,false,
L2009-12-18_chepuxa,18,L2009-12-18, chepuxa,false,
L2009-12-18_ryba,19,L2009-12-18, ryba,false,
L2009-12-18_gonistos,20,L2009-12-18, gonistos,false,
L2009-12-18_deja,21,L2009-12-18, deja,false,
L2009-12-18_dendensk,22,L2009-12-18, dendensk,false,
L2009-12-18_proschalm,23,L2009-12-18, proschalm,false,
L2009-12-18_tirbayard,24,L2009-12-18, tirbayard,false,
L2009-12-18_mneniche,25,L2009-12-18, mneniche,false,
L2009-12-18_vademecu,26,L2009-12-18, vademecu,false,
L2009-12-18_stixiopr,27,L2009-12-18, stixiopr,false,
L2009-12-18_alliluja,28,L2009-12-18, alliluja,false,
L2009-12-18_trubach,29,L2009-12-18, trubach,false,
L2009-12-18_nerazmen,30,L2009-12-18, nerazmen,false,

21.11.2009 сб – США, North Brunswick, NJ

14.11.2009 сб – США, Los Angeles, CA, Parc Tarzana

08.11.2009 вс – США, Fair Lawn, NJ
L2009-11-08_1992,01,L2009-11-08, 1992,false,
L2009-11-08_krasnye,02,L2009-11-08, krasnye,false,
L2009-11-08_kuznechiki,03,L2009-11-08, kuznechiki,false,
L2009-11-08_avtoparo,04,L2009-11-08, avtoparo,false,
L2009-11-08_chuzhaj2,05,L2009-11-08, chuzhaj2,false,
L2009-11-08_zhizn,06,L2009-11-08, zhizn,false,
L2009-11-08_cirkachk,07,L2009-11-08, cirkachk,false,
L2009-11-08_2001,08,L2009-11-08, 2001,false,
L2009-11-08_esli,09,L2009-11-08, esli,false,
L2009-11-08_dendensk,10,L2009-11-08, dendensk,false,
L2009-11-08_neumeesh,11,L2009-11-08, neumeesh,false,
L2009-11-08_sokolnik,12,L2009-11-08, sokolnik,false,
L2009-11-08_baltijsk,13,L2009-11-08, baltijsk,false,
L2009-11-08_peterbur,14,L2009-11-08, peterbur,false,
L2009-11-08_proschalm,15,L2009-11-08, proschalm,false,
---
L2009-11-08_propadu,16,L2009-11-08, propadu,false,
L2009-11-08_vishnevo,17,L2009-11-08, vishnevo,false,
L2009-11-08_avstrali,18,L2009-11-08, avstrali,false,
L2009-11-08_ryba,19,L2009-11-08, ryba,false,
L2009-11-08_desyatpe,20,L2009-11-08, desyatpe,false,
L2009-11-08_stixiopr,21,L2009-11-08, stixiopr,false,
L2009-11-08_temapoleta,22,L2009-11-08, temapoleta,false,
L2009-11-08_tirbayard,23,L2009-11-08, tirbayard,false,
L2009-11-08_gonistos,24,L2009-11-08, gonistos,false,
L2009-11-08_vademecu,25,L2009-11-08, vademecu,false,
L2009-11-08_alliluja,26,L2009-11-08, alliluja,false,
L2009-11-08_trubach,27,L2009-11-08, trubach,false,

07.11.2009 сб – США, Boston, MA

05.11.2009 чт – США, Washington, DC, домашний концерт

01.11.2009 вс – США, Brooklyn, NY
L2009-11-01_1992,01,L2009-11-01, 1992,false,
L2009-11-01_krasnye,02,L2009-11-01, krasnye,false,
L2009-11-01_kuznechiki,03,L2009-11-01, kuznechiki,false,
L2009-11-01_2001,04,L2009-11-01, 2001,false,
L2009-11-01_dendensk,05,L2009-11-01, dendensk,false,
L2009-11-01_odnazhdy,06,L2009-11-01, odnazhdy,false,
L2009-11-01_sokolnik,07,L2009-11-01, sokolnik,false,
L2009-11-01_zhizn,08,L2009-11-01, zhizn,false,
L2009-11-01_cirkachk,09,L2009-11-01, cirkachk,false,
L2009-11-01_dopoezda,10,L2009-11-01, dopoezda,false,
L2009-11-01_peshkom,11,L2009-11-01, peshkom,false,
L2009-11-01_esli,12,L2009-11-01, esli,false,
L2009-11-01_neumeesh,13,L2009-11-01, neumeesh,false,
L2009-11-01_gonistos,14,L2009-11-01, gonistos,false,
L2009-11-01_alliluja,15,L2009-11-01, alliluja,false,
---
L2009-11-01_avtoparo,16,L2009-11-01, avtoparo,false,
L2009-11-01_udachny,17,L2009-11-01, udachny,false,
L2009-11-01_desyatpe,18,L2009-11-01, desyatpe,false,
L2009-11-01_temapoleta,19,L2009-11-01, temapoleta,false,
L2009-11-01_peterbur,20,L2009-11-01, peterbur,false,
L2009-11-01_baltijsk,21,L2009-11-01, baltijsk,false,
L2009-11-01_chuzhaj2,22,L2009-11-01, chuzhaj2,false,
L2009-11-01_proschalm,23,L2009-11-01, proschalm,false,
L2009-11-01_kogdaned,24,L2009-11-01, kogdaned,false,

18.10.2009 вс – Москва, ЦДЖ, премьера
L2009-10-18_1992,01,L2009-10-18, 1992,false,
L2009-10-18_krasnye,02,L2009-10-18, krasnye,false,
L2009-10-18_kuznechiki,03,L2009-10-18, kuznechiki,false,
L2009-10-18_zhizn,04,L2009-10-18, zhizn,false,
L2009-10-18_dendensk,05,L2009-10-18, dendensk,false,
L2009-10-18_odnazhdy,06,L2009-10-18, odnazhdy,false,
L2009-10-18_cirkachk,07,L2009-10-18, cirkachk,false,
L2009-10-18_2001,08,L2009-10-18, 2001,false,
L2009-10-18_dopoezda,09,L2009-10-18, dopoezda,false,
L2009-10-18_peshkom,10,L2009-10-18, peshkom,false,
L2009-10-18_esli,11,L2009-10-18, esli,false,
L2009-10-18_neumeesh,12,L2009-10-18, neumeesh,false,
L2009-10-18_baltijsk,13,L2009-10-18, baltijsk,false,
L2009-10-18_peterbur,14,L2009-10-18, peterbur,false,
---
L2009-10-18_propadu,15,L2009-10-18, propadu,false,
L2009-10-18_deja,16,L2009-10-18, deja,false,
L2009-10-18_temapoleta,17,L2009-10-18, temapoleta,false,
L2009-10-18_chepuxa,18,L2009-10-18, chepuxa,false,
L2009-10-18_volk,19,L2009-10-18, volk,false,
L2009-10-18_tirbayard,20,L2009-10-18, tirbayard,false,
L2009-10-18_mneniche,21,L2009-10-18, mneniche,false,
L2009-10-18_kogdaned,22,L2009-10-18, kogdaned,false,
L2009-10-18_alliluja,23,L2009-10-18, alliluja,false,
L2009-10-18_ryba,24,L2009-10-18, ryba,false,
L2009-10-18_vademecu,25,L2009-10-18, vademecu,false,
L2009-10-18_sokolnik,26,L2009-10-18, sokolnik,false,
L2009-10-18_proschalm,27,L2009-10-18, proschalm,true,

21.06.2009 вс – Москва, ЦДЖ, 2 премьеры
L2009-06-21_krasnye,01,L2009-06-21, krasnye,false,
L2009-06-21_panorama,02,L2009-06-21, panorama,false,
L2009-06-21_dopoezda,03,L2009-06-21, dopoezda,false,
L2009-06-21_kogdaned,04,L2009-06-21, kogdaned,false,
L2009-06-21_zatemzhe,05,L2009-06-21, zatemzhe,false,
L2009-06-21_vrjadli,06,L2009-06-21, vrjadli,false,
L2009-06-21_alliluja,07,L2009-06-21, alliluja,false,
L2009-06-21_ryba,08,L2009-06-21, ryba,false,
L2009-06-21_volk,09,L2009-06-21, volk,false,
L2009-06-21_bystrov,10,L2009-06-21, bystrov,false,
L2009-06-21_bystrov2,11,L2009-06-21, bystrov2,true,
L2009-06-21_desyatpe,12,L2009-06-21, desyatpe,false,
L2009-06-21_gonistos,13,L2009-06-21, gonistos,false,
L2009-06-21_tirbayard,14,L2009-06-21, tirbayard,false,
L2009-06-21_proscha4,15,L2009-06-21, proscha4,false,
L2009-06-21_udachny,16,L2009-06-21, udachny,false,
L2009-06-21_peshkom,17,L2009-06-21, peshkom,false,
L2009-06-21_bezvyxod,18,L2009-06-21, bezvyxod,false,
L2009-06-21_traviata,19,L2009-06-21, traviata,false,
L2009-06-21_esli,20,L2009-06-21, esli,false,
L2009-06-21_moiraket,21,L2009-06-21, moiraket,false,
L2009-06-21_chepuxa,22,L2009-06-21, chepuxa,false,
L2009-06-21_sokolnik,23,L2009-06-21, sokolnik,true,
L2009-06-21_pamjativ,24,L2009-06-21, pamjativ,false,
L2009-06-21_nerazmen,25,L2009-06-21, nerazmen,false,

29.05.2009 пт – Санкт-Петербург, КЗ "У Финляндского", дуэт (клавиши)
L2009-05-29_sharmans,01,L2009-05-29, sharmans,false,
L2009-05-29_vbelojmg,02,L2009-05-29, vbelojmg,false,
L2009-05-29_trojka,03,L2009-05-29, trojka,false,
L2009-05-29_rozhdest,04,L2009-05-29, rozhdest,false,
L2009-05-29_marija,05,L2009-05-29, marija,false,
L2009-05-29_brodjagi,06,L2009-05-29, brodjagi,false,
L2009-05-29_descensu,07,L2009-05-29, descensu,false,
L2009-05-29_trubach,08,L2009-05-29, trubach,false,
L2009-05-29_podzname,09,L2009-05-29, podzname,false,
L2009-05-29_pochtich,10,L2009-05-29, pochtich,false,
L2009-05-29_lunnaja,11,L2009-05-29, lunnaja,false,
L2009-05-29_vpoxodny,12,L2009-05-29, vpoxodny,false,
L2009-05-29_teplyj,13,L2009-05-29, teplyj,false,
L2009-05-29_baltijsk,14,L2009-05-29, baltijsk,false,
L2009-05-29_alliluja,15,L2009-05-29, alliluja,false,
L2009-05-29_okean,16,L2009-05-29, okean,false,
L2009-05-29_sentenci,17,L2009-05-29, sentenci,false,
---
L2009-05-29_kibitka,18,L2009-05-29, kibitka,false,
L2009-05-29_burja,19,L2009-05-29, burja,false,
L2009-05-29_voslavug,20,L2009-05-29, voslavug,false,
L2009-05-29_posesche,21,L2009-05-29, posesche,false,
L2009-05-29_muzhajsj,22,L2009-05-29, muzhajsj,false,
L2009-05-29_dusha,23,L2009-05-29, dusha,false,
L2009-05-29_kalejdos,24,L2009-05-29, kalejdos,false,
L2009-05-29_proscha2,25,L2009-05-29, proscha2,false,
L2009-05-29_gonistos,26,L2009-05-29, gonistos,false,
L2009-05-29_proscha1,27,L2009-05-29, proscha1,false,
L2009-05-29_vtornik,28,L2009-05-29, vtornik,false,
L2009-05-29_kolybeln,29,L2009-05-29, kolybeln,false,

16.05.2009 сб – Москва, ЦДЖ, дуэт (гитара), "Песни 21-го века"
L2009-05-16_zhizn,01,L2009-05-16, zhizn,false,
L2009-05-16_kuznechiki,02,L2009-05-16, kuznechiki,false,
L2009-05-16_mneniche,03,L2009-05-16, mneniche,false,
L2009-05-16_deja,04,L2009-05-16, deja,false,
L2009-05-16_temapoleta,05,L2009-05-16, temapoleta,false,
L2009-05-16_traviata,06,L2009-05-16, traviata,false,
L2009-05-16_proschanie,07,L2009-05-16, proschanie,false,
L2009-05-16_udachny,08,L2009-05-16, udachny,false,
L2009-05-16_opyatpar,09,L2009-05-16, opyatpar,false,
L2009-05-16_suhumi,10,L2009-05-16, suhumi,false,
L2009-05-16_natrinad,11,L2009-05-16, natrinad,false,
L2009-05-16_zastolnaya,12,L2009-05-16, zastolnaya,false,
L2009-05-16_nenadoby,13,L2009-05-16, nenadoby,false,
L2009-05-16_nebyvaet,14,L2009-05-16, nebyvaet,false,
L2009-05-16_dopoezda,15,L2009-05-16, dopoezda,false,
L2009-05-16_tirbayard,16,L2009-05-16, tirbayard,false,
L2009-05-16_volhonka,17,L2009-05-16, volhonka,false,
L2009-05-16_serenada,18,L2009-05-16, serenada,false,
L2009-05-16_esli,19,L2009-05-16, esli,false,
L2009-05-16_desyatpe,20,L2009-05-16, desyatpe,false,
L2009-05-16_vtornik,21,L2009-05-16, vtornik,false,
L2009-05-16_vsemuvre,22*,L2009-05-16, vsemuvre ,false,
L2009-05-16_nebudemx,23*,L2009-05-16, nebudemx,false,

11.04.2009 сб – Москва, ЦДЖ, "Песни 90-х"
L2009-04-11_avtoparo,01,L2009-04-11, avtoparo,false,
L2009-04-11_krasnye,02,L2009-04-11, krasnye,false,
L2009-04-11_chuzhaj2,03,L2009-04-11, chuzhaj2,false,
L2009-04-11_zhizn,04,L2009-04-11, zhizn,false,
L2009-04-11_ryba,05,L2009-04-11, ryba,false,
L2009-04-11_rodljuds,06,L2009-04-11, rodljuds,false,
L2009-04-11_etodolzh,07,L2009-04-11, etodolzh,false,
L2009-04-11_propadu,08,L2009-04-11, propadu,false,
L2009-04-11_peshkom,09,L2009-04-11, peshkom,false,
L2009-04-11_cirkachk,10,L2009-04-11, cirkachk,false,
L2009-04-11_vrjadli,11,L2009-04-11, vrjadli,false,
L2009-04-11_etiglaza,12,L2009-04-11, etiglaza,false,
L2009-04-11_1992,13,L2009-04-11, 1992,false,
L2009-04-11_inicialy,14,L2009-04-11, inicialy,false,
L2009-04-11_deja,15,L2009-04-11, deja,false,
---
L2009-04-11_chepuxa,16,L2009-04-11, chepuxa,false,
L2009-04-11_volk,17,L2009-04-11, volk,false,
L2009-04-11_1991,18,L2009-04-11, 1991,false,
L2009-04-11_duet,19,L2009-04-11, duet,false,
L2009-04-11_vademecu,20,L2009-04-11, vademecu,false,
L2009-04-11_volhonka,21,L2009-04-11, volhonka,false,
L2009-04-11_pamjativ,22,L2009-04-11, pamjativ,false,
L2009-04-11_2001,23,L2009-04-11, 2001,false,
L2009-04-11_nerazmen,24,L2009-04-11, nerazmen,false,

14.03.2009 сб – Москва, ЦДЖ, дуэт (клавиши), "Песни 80-х"
L2009-03-14_sharmans,01,L2009-03-14, sharmans,false,
L2009-03-14_pustyjeb,02,L2009-03-14, pustyjeb,false,
L2009-03-14_romans2,03,L2009-03-14, romans2,false,
L2009-03-14_dusha,04,L2009-03-14, dusha,false,
L2009-03-14_burja,05,L2009-03-14, burja,false,
L2009-03-14_voslavug,06,L2009-03-14, voslavug,false,
L2009-03-14_rusalka,07,L2009-03-14, rusalka,false,
L2009-03-14_descensu,08,L2009-03-14, descensu,false,
L2009-03-14_vishnevo,09,L2009-03-14, vishnevo,false,
L2009-03-14_stixiopr,10,L2009-03-14, stixiopr,false,
L2009-03-14_marija,11,L2009-03-14, marija,false,
L2009-03-14_nichemun,12,L2009-03-14, nichemun,false,
L2009-03-14_ispokojn,13,L2009-03-14, ispokojn,false,
L2009-03-14_podzname,14,L2009-03-14, podzname,false,
L2009-03-14_trubach,15,L2009-03-14, trubach,false,
L2009-03-14_proscha1,16,L2009-03-14, proscha1,false,
---
L2009-03-14_kibitka,17,L2009-03-14, kibitka,false,
L2009-03-14_muzhajsj,18,L2009-03-14, muzhajsj,false,
L2009-03-14_unasopja,19,L2009-03-14, unasopja,false,
L2009-03-14_vekaplyv,20,L2009-03-14, vekaplyv,false,
L2009-03-14_eccehomo,21,L2009-03-14, eccehomo,false,
L2009-03-14_gonistos,22,L2009-03-14, gonistos,false,
L2009-03-14_vpoxodny,23,L2009-03-14, vpoxodny,false,
L2009-03-14_teplyj,24,L2009-03-14, teplyj,false,
L2009-03-14_baltijsk,25,L2009-03-14, baltijsk,false,
L2009-03-14_alliluja,26,L2009-03-14, alliluja,false,
L2009-03-14_proscha2,27,L2009-03-14, proscha2,false,
L2009-03-14_sentenci,28,L2009-03-14, sentenci,false,
L2009-03-14_kolybeln,29,L2009-03-14, kolybeln,false,

22.02.2009 вс – Москва, ЦДЖ, дуэт (гитара, клавиши), "Песни 80-х"
L2009-02-22_kovcheg,01,L2009-02-22, kovcheg,false,
L2009-02-22_navsejz1,02,L2009-02-22, navsejz1,false,
L2009-02-22_adleucon,03,L2009-02-22, adleucon,false,
L2009-02-22_proschan,04,L2009-02-22, proschan,false,
L2009-02-22_itakdruz,05,L2009-02-22, itakdruz,false,
L2009-02-22_poshlyj,06,L2009-02-22, poshlyj,false,
L2009-02-22_sezondoz,07,L2009-02-22, sezondoz,false,
L2009-02-22_romansma,08,L2009-02-22, romansma,false,
L2009-02-22_romans1,09,L2009-02-22, romans1,false,
L2009-02-22_zatemzhe,10,L2009-02-22, zatemzhe,false,
L2009-02-22_votpodni,11,L2009-02-22, votpodni,false,
L2009-02-22_jachashu,12,L2009-02-22, jachashu,false,
L2009-02-22_kupljubi,13,L2009-02-22, kupljubi,false,
L2009-02-22_korablik,14,L2009-02-22, korablik,false,
L2009-02-22_navescha,15,L2009-02-22, navescha,false,
L2009-02-22_vosxodja,16,L2009-02-22, vosxodja,false,
---
L2009-02-22_kibitka,17,L2009-02-22, kibitka,false,
L2009-02-22_teplyj,18,L2009-02-22, teplyj,false,
L2009-02-22_vpoxodny,19,L2009-02-22, vpoxodny,false,
L2009-02-22_dusha,20,L2009-02-22, dusha,false,
L2009-02-22_marija,21,L2009-02-22, marija,false,
L2009-02-22_trojka,22,L2009-02-22, trojka,false,
L2009-02-22_voslavug,23,L2009-02-22, voslavug,false,
L2009-02-22_alliluja,24,L2009-02-22, alliluja,false,
L2009-02-22_vekaplyv,25,L2009-02-22, vekaplyv,false,
L2009-02-22_proscha2,26,L2009-02-22, proscha2,false,
L2009-02-22_proscha1,27,L2009-02-22, proscha1,false,
L2009-02-22_sentenci,28,L2009-02-22, sentenci,false,
L2009-02-22_kolybeln,29,L2009-02-22, kolybeln,false,


2008 г. ▼ ▲

26.12.2008 пт – Москва, ЦДЖ, 2 премьеры
L2008-12-26_avtoparo,01,L2008-12-26, avtoparo,false,
L2008-12-26_chuzhaj2,02,L2008-12-26, chuzhaj2,false,
L2008-12-26_kogdaned,03,L2008-12-26, kogdaned,false,
L2008-12-26_ubykagol,04,L2008-12-26, ubykagol,false,
L2008-12-26_zhizn,05,L2008-12-26, zhizn,false,
L2008-12-26_kuznechiki,06,L2008-12-26, kuznechiki,false,
L2008-12-26_stixiopr,07,L2008-12-26, stixiopr,false,
L2008-12-26_zatemzhe,08,L2008-12-26, zatemzhe,false,
L2008-12-26_vademecu,09,L2008-12-26, vademecu,false,
L2008-12-26_volhonka,10,L2008-12-26, volhonka,false,
L2008-12-26_pamjativ,11,L2008-12-26, pamjativ,false,
L2008-12-26_temapoleta,12,L2008-12-26, temapoleta,false,
L2008-12-26_etiglaza,13,L2008-12-26, etiglaza,false,
L2008-12-26_gonistos,14,L2008-12-26, gonistos,true,
L2008-12-26_tirbayard,15,L2008-12-26, tirbayard,false,
L2008-12-26_menuet,16,L2008-12-26, menuet,false,
L2008-12-26_piter,17,L2008-12-26, piter,false,
L2008-12-26_zastolnaya,18,L2008-12-26, zastolnaya,false,
L2008-12-26_chepuxa,19,L2008-12-26, chepuxa,false,
L2008-12-26_vrjadli,20,L2008-12-26, vrjadli,false,
L2008-12-26_alliluja,21,L2008-12-26, alliluja,false,
L2008-12-26_dopoezda,22,L2008-12-26, dopoezda,false,
L2008-12-26_suhumi,23,L2008-12-26, suhumi,false,
L2008-12-26_deja,24,L2008-12-26, deja,false,
L2008-12-26_2001,25,L2008-12-26, 2001,true,
L2008-12-26_proscha4,26,L2008-12-26, proscha4,false,
L2008-12-26_nerazmen,27,L2008-12-26, nerazmen,false,

08.11.2008 сб – Москва, ЦДЖ, дуэт (клавиши)
L2008-11-08_1992,01,L2008-11-08, 1992,false,
L2008-11-08_kuznechiki,02,L2008-11-08, kuznechiki,false,
L2008-11-08_trojka,03,L2008-11-08, trojka,false,
L2008-11-08_rozhdest,04,L2008-11-08, rozhdest,false,
L2008-11-08_marija,05,L2008-11-08, marija,false,
L2008-11-08_dusha,06,L2008-11-08, dusha,false,
L2008-11-08_vbelojmg,07,L2008-11-08, vbelojmg,false,
L2008-11-08_baltijsk,08,L2008-11-08, baltijsk,false,
L2008-11-08_vpoxodny,09,L2008-11-08, vpoxodny,false,
L2008-11-08_teplyj,10,L2008-11-08, teplyj,false,
L2008-11-08_lunnaja,11,L2008-11-08, lunnaja,false,
L2008-11-08_fridrih,12,L2008-11-08, fridrih,false,
L2008-11-08_pochtich,13,L2008-11-08, pochtich,false,
L2008-11-08_kalejdos,14,L2008-11-08, kalejdos,false,
L2008-11-08_proscha2,15,L2008-11-08, proscha2,false,
---
L2008-11-08_kibitka,16,L2008-11-08, kibitka,false,
L2008-11-08_burja,17,L2008-11-08, burja,false,
L2008-11-08_shkolat1,18,L2008-11-08, shkolat1,false,
L2008-11-08_brodjagi,19,L2008-11-08, brodjagi,false,
L2008-11-08_drugajaz,20,L2008-11-08, drugajaz,false,
L2008-11-08_voslavug,21,L2008-11-08, voslavug,false,
L2008-11-08_posesche,22,L2008-11-08, posesche,false,
L2008-11-08_sentenci,23,L2008-11-08, sentenci,false,
L2008-11-08_okean,24,L2008-11-08, okean,false,
L2008-11-08_vekaplyv,25,L2008-11-08, vekaplyv,false,
L2008-11-08_vtornik,26,L2008-11-08, vtornik,false,
L2008-11-08_proscha1,27,L2008-11-08, proscha1,false,

25.10.2008 сб – Москва, ЦДЖ, дуэт (клавиши), премьера
L2008-10-25_sharmans,01,L2008-10-25, sharmans,false,
L2008-10-25_proscha1,02,L2008-10-25, proscha1,false,
L2008-10-25_burja,03,L2008-10-25, burja,false,
L2008-10-25_voslavug,04,L2008-10-25, voslavug,false,
L2008-10-25_vjuga,05,L2008-10-25, vjuga,false,
L2008-10-25_baltijsk,06,L2008-10-25, baltijsk,false,
L2008-10-25_kuznechiki,07,L2008-10-25, kuznechiki,false,
L2008-10-25_trojka,08,L2008-10-25, trojka,false,
L2008-10-25_chinatow,09,L2008-10-25, chinatow,false,
L2008-10-25_brodjagi,10,L2008-10-25, brodjagi,false,
L2008-10-25_lunnaja,11,L2008-10-25, lunnaja,false,
L2008-10-25_cybin,12,L2008-10-25, cybin,false,
L2008-10-25_okean,13,L2008-10-25, okean,false,
---
L2008-10-25_vtornik,14,L2008-10-25, vtornik,false,
L2008-10-25_pochtich,15,L2008-10-25, pochtich,false,
L2008-10-25_vbelojmg,16,L2008-10-25, vbelojmg,false,
L2008-10-25_posesche,17,L2008-10-25, posesche,false,
L2008-10-25_vpoxodny,18,L2008-10-25, vpoxodny,false,
L2008-10-25_teplyj,19,L2008-10-25, teplyj,false,
L2008-10-25_rozhdest,20,L2008-10-25, rozhdest,false,
L2008-10-25_proscha4,21,L2008-10-25, proscha4,false,
L2008-10-25_fridrih,22,L2008-10-25, fridrih,false,
L2008-10-25_interme2,23,L2008-10-25, interme2,true,
L2008-10-25_kolybeln,24,L2008-10-25, kolybeln,false,

28.09.2008 вс – Москва, ЦДЖ
L2008-09-28_1992,01,L2008-09-28, 1992,false,
L2008-09-28_krasnye,02,L2008-09-28, krasnye,false,
L2008-09-28_sharmans,03,L2008-09-28, sharmans,false,
L2008-09-28_deja,04,L2008-09-28, deja,false,
L2008-09-28_dopoezda,05,L2008-09-28, dopoezda,false,
L2008-09-28_esli,06,L2008-09-28, esli,false,
L2008-09-28_temapoleta,07,L2008-09-28, temapoleta,false,
L2008-09-28_udachny,08,L2008-09-28, udachny,false,
L2008-09-28_ryba,09,L2008-09-28, ryba,false,
L2008-09-28_odnazhdy,10,L2008-09-28, odnazhdy,false,
L2008-09-28_dendensk,11,L2008-09-28, dendensk,false,
L2008-09-28_volhonka,12,L2008-09-28, volhonka,false,
L2008-09-28_zatemzhe,13,L2008-09-28, zatemzhe,false,
L2008-09-28_cirkachk,14,L2008-09-28, cirkachk,false,
L2008-09-28_tirbayard,15,L2008-09-28, tirbayard,false,
L2008-09-28_volk,16,L2008-09-28, volk,false,
L2008-09-28_alliluja,17,L2008-09-28, alliluja,false,
L2008-09-28_mneniche,18,L2008-09-28, mneniche,false,
L2008-09-28_ispokojn,19,L2008-09-28, ispokojn,false,
L2008-09-28_proschanie,20,L2008-09-28, proschanie,false,
L2008-09-28_baltijsk,21,L2008-09-28, baltijsk,false,
L2008-09-28_vpoxodny,22,L2008-09-28, vpoxodny,false,
L2008-09-28_chuzhaj2,23,L2008-09-28, chuzhaj2,false,
L2008-09-28_romansma,24,L2008-09-28, romansma,false,
L2008-09-28_desyatpe,25,L2008-09-28, desyatpe,false,
L2008-09-28_pamjativ,26,L2008-09-28, pamjativ,false,
L2008-09-28_nerazmen,27,L2008-09-28, nerazmen,false,

19.09.2008 пт – США, Cleveland, OH

14.09.2008 вс – США, Brooklyn, NY
L2008-09-14_1992,01,L2008-09-14, 1992,false,
L2008-09-14_krasnye,02,L2008-09-14, krasnye,false,
L2008-09-14_sharmans,03,L2008-09-14, sharmans,false,
L2008-09-14_deja,04,L2008-09-14, deja,false,
L2008-09-14_dopoezda,05,L2008-09-14, dopoezda,false,
L2008-09-14_esli,06,L2008-09-14, esli,false,
L2008-09-14_temapoleta,07,L2008-09-14, temapoleta,false,
L2008-09-14_udachny,08,L2008-09-14, udachny,false,
L2008-09-14_odnazhdy,09,L2008-09-14, odnazhdy,false,
L2008-09-14_volhonka,10,L2008-09-14, volhonka,false,
L2008-09-14_zatemzhe,11,L2008-09-14, zatemzhe,false,
L2008-09-14_cirkachk,12,L2008-09-14, cirkachk,false,
L2008-09-14_vremjaid,13*,L2008-09-14, vremjaid,false,
L2008-09-14_tirbayard,14,L2008-09-14, tirbayard,false,
L2008-09-14_volk,15,L2008-09-14, volk,false,
L2008-09-14_alliluja,16,L2008-09-14, alliluja,false,
L2008-09-14_mneniche,17,L2008-09-14, mneniche,false,
L2008-09-14_ispokojn,18,L2008-09-14, ispokojn,false,
L2008-09-14_proschanie,19,L2008-09-14, proschanie,false,
L2008-09-14_vrjadli,20,L2008-09-14, vrjadli,false,
L2008-09-14_vpoxodny,21,L2008-09-14, vpoxodny,false,
L2008-09-14_baltijsk,22,L2008-09-14, baltijsk,false,
L2008-09-14_desyatpe,23,L2008-09-14, desyatpe,false,
L2008-09-14_proscha4,24,L2008-09-14, proscha4,false,
L2008-09-14_vademecu,25,L2008-09-14, vademecu,false,
L2008-09-14_ryba,26,L2008-09-14, ryba,false,
L2008-09-14_nerazmen,27,L2008-09-14, nerazmen,false,

15.06.2008 вс – Москва, ЦДЖ, дуэт ()
L2008-06-15_1992,01,L2008-06-15, 1992,false,
L2008-06-15_kuznechiki,02,L2008-06-15, kuznechiki,false,
L2008-06-15_dopoezda,03,L2008-06-15, dopoezda,false,
L2008-06-15_navsejz1,04,L2008-06-15, navsejz1,false,
L2008-06-15_marija,05,L2008-06-15, marija,false,
L2008-06-15_teplyj,06,L2008-06-15, teplyj,false,
L2008-06-15_eccehomo,07,L2008-06-15, eccehomo,false,
L2008-06-15_ryba,08,L2008-06-15, ryba,false,
L2008-06-15_proschanie,09,L2008-06-15, proschanie,false,
L2008-06-15_voslavug,10,L2008-06-15, voslavug,false,
L2008-06-15_serenada,11,L2008-06-15, serenada,false,
L2008-06-15_desyatpe,12,L2008-06-15, desyatpe,false,
L2008-06-15_temapoleta,13,L2008-06-15, temapoleta,false,
L2008-06-15_okean,14,L2008-06-15, okean,false,
L2008-06-15_tirbayard,15,L2008-06-15, tirbayard,false,
L2008-06-15_sharmans,16,L2008-06-15, sharmans,false,
L2008-06-15_proscha4,17,L2008-06-15, proscha4,false,
L2008-06-15_korablik,18,L2008-06-15, korablik,false,
L2008-06-15_romans1,19,L2008-06-15, romans1,false,
L2008-06-15_kibitka,20,L2008-06-15, kibitka,false,
L2008-06-15_proschan,21,L2008-06-15, proschan,false,
L2008-06-15_sezondoz,22,L2008-06-15, sezondoz,false,
L2008-06-15_natrinad,23,L2008-06-15, natrinad,false,
L2008-06-15_nenadoby,24,L2008-06-15, nenadoby,false,
L2008-06-15_vtornik,25,L2008-06-15, vtornik,false,
L2008-06-15_vosxodja,26,L2008-06-15, vosxodja,false,

13.06.2008 пт – Москва, ЦДЖ
L2008-06-13_nerazmen,01,L2008-06-13, nerazmen,false,
L2008-06-13_odnazhdy,02,L2008-06-13, odnazhdy,false,
L2008-06-13_dendensk,03,L2008-06-13, dendensk,false,
L2008-06-13_krasnye,04,L2008-06-13, krasnye,false,
L2008-06-13_1991,05,L2008-06-13, 1991,false,
L2008-06-13_volhonka,06,L2008-06-13, volhonka,false,
L2008-06-13_zatemzhe,07,L2008-06-13, zatemzhe,false,
L2008-06-13_baltijsk,08,L2008-06-13, baltijsk,false,
L2008-06-13_vpoxodny,09,L2008-06-13, vpoxodny,false,
L2008-06-13_vrjadli,10,L2008-06-13, vrjadli,false,
L2008-06-13_inicialy,11,L2008-06-13, inicialy,false,
L2008-06-13_esli,12,L2008-06-13, esli,false,
L2008-06-13_traviata,13,L2008-06-13, traviata,false,
L2008-06-13_suhumi,14,L2008-06-13, suhumi,false,
L2008-06-13_alliluja,15,L2008-06-13, alliluja,false,
L2008-06-13_avstrali,16,L2008-06-13, avstrali,false,
L2008-06-13_peshkom,17,L2008-06-13, peshkom,false,
L2008-06-13_nebyvaet,18,L2008-06-13, nebyvaet,false,
L2008-06-13_kogdaned,19,L2008-06-13, kogdaned,false,
L2008-06-13_pamjativ,20,L2008-06-13, pamjativ,false,
L2008-06-13_deja,21,L2008-06-13, deja,false,
L2008-06-13_mneniche,22,L2008-06-13, mneniche,false,
L2008-06-13_vademecu,23,L2008-06-13, vademecu,false,
L2008-06-13_neumeesh,24,L2008-06-13, neumeesh,false,
L2008-06-13_chepuxa,25,L2008-06-13, chepuxa,false,

04.06.2008 ср – Санкт-Петербург, Театр эстрады имени А. Райкина
L2008-06-04_sharmans,01,L2008-06-04, sharmans,false,
L2008-06-04_zhizn,02,L2008-06-04, zhizn,false,
L2008-06-04_dopoezda,03,L2008-06-04, dopoezda,false,
L2008-06-04_suhumi,04,L2008-06-04, suhumi,false,
L2008-06-04_pamjativ,05,L2008-06-04, pamjativ,false,
L2008-06-04_nebyvaet,06,L2008-06-04, nebyvaet,false,
L2008-06-04_serenada,07,L2008-06-04, serenada,false,
L2008-06-04_deja,08,L2008-06-04, deja,false,
L2008-06-04_mneniche,09,L2008-06-04, mneniche,false,
L2008-06-04_udachny,10,L2008-06-04, udachny,false,
L2008-06-04_proschanie,11,L2008-06-04, proschanie,false,
L2008-06-04_volhonka,12,L2008-06-04, volhonka,false,
L2008-06-04_temapoleta,13,L2008-06-04, temapoleta,false,
L2008-06-04_kogdaned,14,L2008-06-04, kogdaned,false,
L2008-06-04_proscha4,15,L2008-06-04, proscha4,false,
---
L2008-06-04_1992,16,L2008-06-04, 1992,false,
L2008-06-04_tirbayard,17,L2008-06-04, tirbayard,false,
L2008-06-04_cirkachk,18,L2008-06-04, cirkachk,false,
L2008-06-04_esli,19,L2008-06-04, esli,false,
L2008-06-04_vrjadli,20,L2008-06-04, vrjadli,false,
L2008-06-04_traviata,21,L2008-06-04, traviata,false,
L2008-06-04_baltijsk,22,L2008-06-04, baltijsk,false,
L2008-06-04_desyatpe,23,L2008-06-04, desyatpe,false,
L2008-06-04_vademecu,24,L2008-06-04, vademecu,false,
L2008-06-04_neumeesh,25,L2008-06-04, neumeesh,false,
L2008-06-04_nerazmen,26,L2008-06-04, nerazmen,false,

17.05.2008 сб – Москва, ЦДЖ, "Песни 21-го века", премьера
L2008-05-17_zhizn,01,L2008-05-17, zhizn,false,
L2008-05-17_kuznechiki,02,L2008-05-17, kuznechiki,false,
L2008-05-17_mneniche,03,L2008-05-17, mneniche,false,
L2008-05-17_tirbayard,04,L2008-05-17, tirbayard,false,
L2008-05-17_proscha4,05,L2008-05-17, proscha4,false,
L2008-05-17_temapoleta,06,L2008-05-17, temapoleta,false,
L2008-05-17_kogdaned,07,L2008-05-17, kogdaned,false,
L2008-05-17_nebyvaet,08,L2008-05-17, nebyvaet,false,
L2008-05-17_bystrov,09,L2008-05-17, bystrov,false,
L2008-05-17_esli,10,L2008-05-17, esli,false,
L2008-05-17_traviata,11,L2008-05-17, traviata,false,
L2008-05-17_pochtich,12,L2008-05-17, pochtich,false,
L2008-05-17_proschanie,13,L2008-05-17, proschanie,false,
L2008-05-17_piter,14,L2008-05-17, piter,false,
L2008-05-17_zastolnaya,15,L2008-05-17, zastolnaya,false,
L2008-05-17_volhonka,16,L2008-05-17, volhonka,false,
L2008-05-17_serenada,17,L2008-05-17, serenada,false,
L2008-05-17_udachny,18,L2008-05-17, udachny,false,
L2008-05-17_dopoezda,19,L2008-05-17, dopoezda,false,
L2008-05-17_suhumi,20,L2008-05-17, suhumi,false,
L2008-05-17_deja,21,L2008-05-17, deja,false,
L2008-05-17_desyatpe,22,L2008-05-17, desyatpe,false,
L2008-05-17_neumeesh,23,L2008-05-17, neumeesh,true,
L2008-05-17_nerazmen,24,L2008-05-17, nerazmen,false,

15.04.2008 вт – Москва, ЦДЖ, "Чтобы помнили", памяти Любы Захарченко
L2008-05-17_lampochk,01*,L2008-05-17, lampochk,false,

05.04.2008 сб – Москва, ЦДЖ, "Песни 90-х"
L2008-04-05_sharmans,01,L2008-04-05, sharmans,false,
L2008-04-05_peshkom,02,L2008-04-05, peshkom,false,
L2008-04-05_ryba,03,L2008-04-05, ryba,false,
L2008-04-05_inicialy,04,L2008-04-05, inicialy,false,
L2008-04-05_volk,05,L2008-04-05, volk,false,
L2008-04-05_panorama,06,L2008-04-05, panorama,false,
L2008-04-05_cirkachk,07,L2008-04-05, cirkachk,false,
L2008-04-05_stixiopr,08,L2008-04-05, stixiopr,false,
L2008-04-05_vrjadli,09,L2008-04-05, vrjadli,false,
L2008-04-05_peterbur,10,L2008-04-05, peterbur,false,
L2008-04-05_baltijsk,11,L2008-04-05, baltijsk,false,
L2008-04-05_1995,12,L2008-04-05, 1995,false,
L2008-04-05_prenebre,13,L2008-04-05, prenebre,false,
L2008-04-05_vademecu,14,L2008-04-05, vademecu,false,
L2008-04-05_pamjativ,15,L2008-04-05, pamjativ,false,
L2008-04-05_1992,16,L2008-04-05, 1992,false,
L2008-04-05_rodljuds,17,L2008-04-05, rodljuds,false,
L2008-04-05_krasnye,18,L2008-04-05, krasnye,false,
L2008-04-05_dendensk,19,L2008-04-05, dendensk,false,
L2008-04-05_rozhdest,20,L2008-04-05, rozhdest,false,
L2008-04-05_zvezdoch,21,L2008-04-05, zvezdoch,false,
L2008-04-05_moiraket,22,L2008-04-05, moiraket,false,
L2008-04-05_propadu,23,L2008-04-05, propadu,false,
L2008-04-05_chuzhaj2,24,L2008-04-05, chuzhaj2,false,
L2008-04-05_chepuxa,25,L2008-04-05, chepuxa,false,
L2008-04-05_nerazmen,26,L2008-04-05, nerazmen,false,

16.03.2008 вс – Москва, ЦДЖ, дуэт (), "Песни 80-х"
L2008-03-16_kibitka,01,L2008-03-16, kibitka,false,
L2008-03-16_adleucon,02,L2008-03-16, adleucon,false,
L2008-03-16_voslavug,03,L2008-03-16, voslavug,false,
L2008-03-16_marija,04,L2008-03-16, marija,false,
L2008-03-16_sezondoz,05,L2008-03-16, sezondoz,false,
L2008-03-16_molitva,06,L2008-03-16, molitva,false,
L2008-03-16_zatemzhe,07,L2008-03-16, zatemzhe,false,
L2008-03-16_alliluja,08,L2008-03-16, alliluja,false,
L2008-03-16_zaliv,09,L2008-03-16, zaliv,false,
L2008-03-16_poshlyj,10,L2008-03-16, poshlyj,false,
L2008-03-16_vpoxodny,11,L2008-03-16, vpoxodny,false,
L2008-03-16_itakdruz,12,L2008-03-16, itakdruz,false,
L2008-03-16_votpodni,13,L2008-03-16, votpodni,false,
L2008-03-16_ljudisux,14,L2008-03-16, ljudisux,false,
L2008-03-16_romans1,15,L2008-03-16, romans1,false,
L2008-03-16_kovcheg,16,L2008-03-16, kovcheg,false,
---
L2008-03-16_navsejz1,17,L2008-03-16, navsejz1,false,
L2008-03-16_kolybeln,18,L2008-03-16, kolybeln,false,
L2008-03-16_teplyj,19,L2008-03-16, teplyj,false,
L2008-03-16_vozvrasc,20,L2008-03-16, vozvrasc,false,
L2008-03-16_korablik,21,L2008-03-16, korablik,false,
L2008-03-16_navescha,22,L2008-03-16, navescha,false,
L2008-03-16_mezhetim,23,L2008-03-16, mezhetim,false,
L2008-03-16_ispokojn,24,L2008-03-16, ispokojn,false,
L2008-03-16_kogdaby,25,L2008-03-16, (М. Стародубцев) kogdaby,false,
L2008-03-16_proscha1,26,L2008-03-16, proscha1,false,
L2008-03-16_proschan,27,L2008-03-16, proschan,false,
L2008-03-16_akoektop,28,L2008-03-16, akoektop,false,
L2008-03-16_balagan2,29,L2008-03-16, balagan2,false,
L2008-03-16_vosxodja,30,L2008-03-16, vosxodja,false,

29.02.2008 пт – Москва, ЦДЖ, дуэт ()
L2008-02-29_menuet,01,L2008-02-29, menuet,false,
L2008-02-29_ljubov,02,L2008-02-29, ljubov,false,
L2008-02-29_farmacev,03,L2008-02-29, farmacev,false,
L2008-02-29_vbelojmg,04,L2008-02-29, vbelojmg,false,
L2008-02-29_ryba,05,L2008-02-29, ryba,false,
L2008-02-29_burja,06,L2008-02-29, burja,false,
L2008-02-29_karavan,07,L2008-02-29, karavan,false,
L2008-02-29_eccehomo,08,L2008-02-29, eccehomo,false,
L2008-02-29_kuznechiki,09,L2008-02-29, kuznechiki,false,
L2008-02-29_volk,10,L2008-02-29, volk,false,
L2008-02-29_cirkachk,11,L2008-02-29, cirkachk,false,
L2008-02-29_etoja,12,L2008-02-29, etoja,false,
L2008-02-29_vrjadli,13,L2008-02-29, vrjadli,false,
L2008-02-29_puskaj,14,L2008-02-29, puskaj,false,
---
L2008-02-29_1992,15,L2008-02-29, 1992,false,
L2008-02-29_ubykagol,16,L2008-02-29, ubykagol,false,
L2008-02-29_rusalka,17,L2008-02-29, rusalka,false,
L2008-02-29_aneta,18,L2008-02-29, aneta,false,
L2008-02-29_vjuga,19,L2008-02-29, vjuga,false,
L2008-02-29_jachashu,20,L2008-02-29, jachashu,false,
L2008-02-29_slezazol,21,L2008-02-29, slezazol,false,
L2008-02-29_paris,22,L2008-02-29, paris,false,
L2008-02-29_konecned,23,L2008-02-29, konecned,false,
L2008-02-29_okean,24,L2008-02-29, okean,false,
L2008-02-29_nenadoby,25,L2008-02-29, nenadoby,false,
L2008-02-29_vtornik,26,L2008-02-29, vtornik,false,

09.02.2008 сб – США, San Diego, CA

08.02.2008 пт – США, Cupertino, CA, De Anza College
L2008-02-08_sharmans,01,L2008-02-08, sharmans,false,
L2008-02-08_mneniche,02,L2008-02-08, mneniche,false,
L2008-02-08_kordebal,03,L2008-02-08, kordebal,false,
L2008-02-08_deja,04,L2008-02-08, deja,false,
L2008-02-08_temapoleta,05,L2008-02-08, temapoleta,false,
L2008-02-08_esli,06,L2008-02-08, esli,false,
L2008-02-08_volk,07,L2008-02-08, volk,false,
L2008-02-08_kogdaned,08,L2008-02-08, kogdaned,false,
L2008-02-08_vpoxodny,09,L2008-02-08, vpoxodny,false,
L2008-02-08_cirkachk,10,L2008-02-08, cirkachk,false,
L2008-02-08_etiglaza,11,L2008-02-08, etiglaza,false,
L2008-02-08_pamjativ,12,L2008-02-08, pamjativ,false,
L2008-02-08_alliluja,13,L2008-02-08, alliluja,false,
L2008-02-08_tirbayard,14,L2008-02-08, tirbayard,false,
---
L2008-02-08_1992,15,L2008-02-08, 1992,false,
L2008-02-08_krasnye,16,L2008-02-08, krasnye,false,
L2008-02-08_odnazhdy,17,L2008-02-08, odnazhdy,false,
L2008-02-08_dendensk,18,L2008-02-08, dendensk,false,
L2008-02-08_1991,19,L2008-02-08, 1991,false,
L2008-02-08_volhonka,20,L2008-02-08, volhonka,false,
L2008-02-08_baltijsk,21,L2008-02-08, baltijsk,false,
L2008-02-08_desyatpe,22,L2008-02-08, desyatpe,false,
L2008-02-08_dopoezda,23,L2008-02-08, dopoezda,false,
L2008-02-08_suhumi,24,L2008-02-08, suhumi,false,
L2008-02-08_cybin,25,L2008-02-08, cybin,false,
L2008-02-08_proscha4,26,L2008-02-08, proscha4,false,
L2008-02-08_nerazmen,28,L2008-02-08, nerazmen,false,

06.02.2008 ср – США, Boston, MA

26.01.2008 сб – США, Morristown, NJ, домашний концерт у Г. Фельдмана
L2008-01-26_sharmans,01,L2008-01-26, sharmans,false,
L2008-01-26_kuznechiki,02,L2008-01-26, kuznechiki,false,
L2008-01-26_deja,03,L2008-01-26, deja,false,
L2008-01-26_mneniche,04,L2008-01-26, mneniche,false,
L2008-01-26_itakdruz,05,L2008-01-26, itakdruz,false,
L2008-01-26_vpoxodny,06,L2008-01-26, vpoxodny,false,
L2008-01-26_temapoleta,07,L2008-01-26, temapoleta,false,
L2008-01-26_esli,08,L2008-01-26, esli,false,
L2008-01-26_pamjativ,09,L2008-01-26, pamjativ,false,
L2008-01-26_alliluja,10,L2008-01-26, alliluja,false,
L2008-01-26_volk,11,L2008-01-26, volk,false,
L2008-01-26_kogdaned,12,L2008-01-26, kogdaned,false,
L2008-01-26_etiglaza,13,L2008-01-26, etiglaza,false,
L2008-01-26_proschanie,14,L2008-01-26, proschanie,false,
L2008-01-26_moekoro2,15,L2008-01-26, moekoro2,false,
L2008-01-26_zastolnaya,16,L2008-01-26, zastolnaya,false,
---
L2008-01-26_1992,17,L2008-01-26, 1992,false,
L2008-01-26_1991,18,L2008-01-26, 1991,false,
L2008-01-26_krasnye,19,L2008-01-26, krasnye,false,
L2008-01-26_odnazhdy,20,L2008-01-26, odnazhdy,false,
L2008-01-26_dendensk,21,L2008-01-26, dendensk,false,
L2008-01-26_bystrov,22,L2008-01-26, bystrov,false,
L2008-01-26_proscha4,23,L2008-01-26, proscha4,false,
L2008-01-26_tirbayard,24,L2008-01-26, tirbayard,false,
L2008-01-26_1995,25,L2008-01-26, 1995,false,
L2008-01-26_volhonka,26,L2008-01-26, volhonka,false,
L2008-01-26_dopoezda,27,L2008-01-26, dopoezda,false,
L2008-01-26_chepuxa,28,L2008-01-26, chepuxa,false,
L2008-01-26_nerazmen,29,L2008-01-26, nerazmen,false,

20.01.2008 вс – Москва, ЦДЖ
L2008-01-20_nerazmen,01,L2008-01-20, nerazmen,false,
L2008-01-20_nichemun,02,L2008-01-20, nichemun,false,
L2008-01-20_sharmans,03,L2008-01-20, sharmans,false,
L2008-01-20_etiglaza,04,L2008-01-20, etiglaza,false,
L2008-01-20_vpoxodny,05,L2008-01-20, vpoxodny,false,
L2008-01-20_temapoleta,06,L2008-01-20, temapoleta,false,
L2008-01-20_esli,07,L2008-01-20, esli,false,
L2008-01-20_pamjativ,08,L2008-01-20, pamjativ,false,
L2008-01-20_alliluja,09,L2008-01-20, alliluja,false,
L2008-01-20_volk,10,L2008-01-20, volk,false,
L2008-01-20_kogdaned,11,L2008-01-20, kogdaned,false,
L2008-01-20_proscha4,12,L2008-01-20, proscha4,false,
L2008-01-20_vishnevo,13,L2008-01-20, vishnevo,false,
L2008-01-20_zastolnaya,14,L2008-01-20, zastolnaya,false,
---
L2008-01-20_1991,15,L2008-01-20, 1991,false,
L2008-01-20_krasnye,16,L2008-01-20, krasnye,false,
L2008-01-20_odnazhdy,17,L2008-01-20, odnazhdy,false,
L2008-01-20_dendensk,18,L2008-01-20, dendensk,false,
L2008-01-20_bystrov,19,L2008-01-20, bystrov,false,
L2008-01-20_zvezdoch,20,L2008-01-20, zvezdoch,false,
L2008-01-20_volhonka,21,L2008-01-20, volhonka,false,
L2008-01-20_suhumi,22,L2008-01-20, suhumi,false,
L2008-01-20_dopoezda,23,L2008-01-20, dopoezda,false,


2007 г. ▼ ▲

08.12.2007 сб – Москва, Филипповская школа
L2007-12-08_sharmans,01,L2007-12-08, sharmans,false,
L2007-12-08_krasnye,02,L2007-12-08, krasnye,false,
L2007-12-08_volk,03,L2007-12-08, volk,false,
L2007-12-08_mneniche,04,L2007-12-08, mneniche,false,
L2007-12-08_pamjativ,05,L2007-12-08, pamjativ,false,
L2007-12-08_voslavug,06,L2007-12-08, voslavug,false,
L2007-12-08_tirbayard,07,L2007-12-08, tirbayard,false,
L2007-12-08_nerazmen,08,L2007-12-08, nerazmen,false,
L2007-12-08_vpoxodny,09,L2007-12-08, vpoxodny,false,
L2007-12-08_etodolzh,10,L2007-12-08, etodolzh,false,
L2007-12-08_cirkachk,11,L2007-12-08, cirkachk,false,
L2007-12-08_volhonka,12,L2007-12-08, volhonka,false,
L2007-12-08_temapoleta,13,L2007-12-08, temapoleta,false,
L2007-12-08_alliluja,14,L2007-12-08, alliluja,false,
L2007-12-08_desyatpe,15,L2007-12-08, desyatpe,false,
L2007-12-08_baltijsk,16,L2007-12-08, baltijsk,false,
L2007-12-08_etiglaza,17,L2007-12-08, etiglaza,false,
L2007-12-08_avstrali,18,L2007-12-08, avstrali,false,
L2007-12-08_kordebal,19,L2007-12-08, kordebal,false,
L2007-12-08_esli,20,L2007-12-08, esli,false,
L2007-12-08_traviata,21,L2007-12-08, traviata,false,
L2007-12-08_kogdaned,22,L2007-12-08, kogdaned,false,
L2007-12-08_1995,23,L2007-12-08, 1995,false,
L2007-12-08_proscha4,24,L2007-12-08, proscha4,false,
L2007-12-08_nichemun,25,L2007-12-08, nichemun,false,

01.12.2007 сб – Москва, ЦДЖ
L2007-12-01_nichemun,01,L2007-12-01, nichemun,false,
L2007-12-01_mneniche,02,L2007-12-01, mneniche,false,
L2007-12-01_krasnye,03,L2007-12-01, krasnye,false,
L2007-12-01_esli,04,L2007-12-01, esli,false,
L2007-12-01_vpoxodny,05,L2007-12-01, vpoxodny,false,
L2007-12-01_temapoleta,06,L2007-12-01, temapoleta,false,
L2007-12-01_moekoro2,07,L2007-12-01, moekoro2,false,
L2007-12-01_deja,08,L2007-12-01, deja,false,
L2007-12-01_brodjagi,09,L2007-12-01, brodjagi,false,
L2007-12-01_baltijsk,10,L2007-12-01, baltijsk,false,
L2007-12-01_itakdruz,11,L2007-12-01, itakdruz,false,
L2007-12-01_proschanie,12,L2007-12-01, proschanie,false,
L2007-12-01_desyatpe,13,L2007-12-01, desyatpe,false,
L2007-12-01_zastolnaya,14,L2007-12-01, zastolnaya,false,
L2007-12-01_sentenci,15,L2007-12-01, sentenci,false,
L2007-12-01_volk,16,L2007-12-01, volk,false,
L2007-12-01_tirbayard,17,L2007-12-01, tirbayard,false,
L2007-12-01_kogdaned,18,L2007-12-01, kogdaned,false,
L2007-12-01_pamjativ,19,L2007-12-01, pamjativ,false,
L2007-12-01_udachny,20,L2007-12-01, udachny,false,
L2007-12-01_podzname,21,L2007-12-01, podzname,false,
L2007-12-01_alliluja,22,L2007-12-01, alliluja,false,
L2007-12-01_dopoezda,23,L2007-12-01, dopoezda,false,
L2007-12-01_cybin,24,L2007-12-01, cybin,false,
L2007-12-01_volhonka,25,L2007-12-01, volhonka,false,
L2007-12-01_nerazmen,26,L2007-12-01, nerazmen,false,

27.10.2007 сб – Москва, ЦДЖ, второй акт дуэт (гитара), 4 премьеры
L2007-10-27_1992,01,L2007-10-27, 1992,false,
L2007-10-27_zhizn,02,L2007-10-27, zhizn,false,
L2007-10-27_1991,03,L2007-10-27, 1991,false,
L2007-10-27_krasnye,04,L2007-10-27, krasnye,false,
L2007-10-27_propadu,05,L2007-10-27, propadu,false,
L2007-10-27_volhonka,06,L2007-10-27, volhonka,false,
L2007-10-27_stixiopr,07,L2007-10-27, stixiopr,false,
L2007-10-27_alliluja,08,L2007-10-27, alliluja,false,
L2007-10-27_suhumi,09,L2007-10-27, suhumi,false,
L2007-10-27_volk,10,L2007-10-27, volk,false,
L2007-10-27_inicialy,11,L2007-10-27, inicialy,false,
L2007-10-27_chepuxa,12,L2007-10-27, chepuxa,false,
L2007-10-27_bezvyxod,13,L2007-10-27, bezvyxod,true,
L2007-10-27_desyatpe,14,L2007-10-27, desyatpe,true,
L2007-10-27_nerazmen,15,L2007-10-27, nerazmen,false,
---
L2007-10-27_sharmans,16,L2007-10-27, sharmans,false,
L2007-10-27_kovcheg,17,L2007-10-27, kovcheg,false,
L2007-10-27_navsejz1,18,L2007-10-27, navsejz1,false,
L2007-10-27_romans1,19,L2007-10-27, romans1,false,
L2007-10-27_aneta,20,L2007-10-27, aneta,false,
L2007-10-27_marija,21,L2007-10-27, marija,false,
L2007-10-27_vjuga,22,L2007-10-27, vjuga,false,
L2007-10-27_adleucon,23,L2007-10-27, adleucon,false,
L2007-10-27_voslavug,24,L2007-10-27, voslavug,false,
L2007-10-27_paris,25,L2007-10-27, paris,false,
L2007-10-27_kibitka,26,L2007-10-27, kibitka,false,
L2007-10-27_proscha4,27,L2007-10-27, proscha4,false,
L2007-10-27_nenadoby,28,L2007-10-27, nenadoby,true,
L2007-10-27_natrinad,29,L2007-10-27, natrinad,true,
L2007-10-27_vosxodja,30,L2007-10-27, vosxodja,false,

23.09.2007 вс – Москва, ЦДЖ
L2007-09-23_podzname,01,L2007-09-23, podzname,false,
L2007-09-23_nerazmen,02,L2007-09-23, nerazmen,false,
L2007-09-23_moekoro2,03,L2007-09-23, moekoro2,false,
L2007-09-23_menuet,04,L2007-09-23, menuet,false,
L2007-09-23_zastolnaya,05,L2007-09-23, zastolnaya,false,
L2007-09-23_inicialy,06,L2007-09-23, inicialy,false,
L2007-09-23_kuznechiki,07,L2007-09-23, kuznechiki,false,
L2007-09-23_kinemat2,08,L2007-09-23, kinemat2,false,
L2007-09-23_dopoezda,09,L2007-09-23, dopoezda,false,
L2007-09-23_itakdruz,10,L2007-09-23, itakdruz,false,
L2007-09-23_cirkachk,11,L2007-09-23, cirkachk,false,
L2007-09-23_rodljuds,12,L2007-09-23, rodljuds,false,
L2007-09-23_proscha4,13,L2007-09-23, proscha4,false,
L2007-09-23_alliluja,14,L2007-09-23, alliluja,false,
L2007-09-23_volk,15,L2007-09-23, volk,false,
L2007-09-23_etiglaza,16,L2007-09-23, etiglaza,false,
L2007-09-23_1991,17,L2007-09-23, 1991,false,
L2007-09-23_1992,18,L2007-09-23, 1992,false,
L2007-09-23_vpoxodny,19,L2007-09-23, vpoxodny,false,
L2007-09-23_esli,20,L2007-09-23, esli,false,
L2007-09-23_chepuxa,21,L2007-09-23, chepuxa,false,
L2007-09-23_temapoleta,22,L2007-09-23, temapoleta,false,
L2007-09-23_volhonka,23,L2007-09-23, volhonka,false,
L2007-09-23_baltijsk,24,L2007-09-23, baltijsk,false,
L2007-09-23_deja,25,L2007-09-23, deja,false,
L2007-09-23_kogdaned,26,L2007-09-23, kogdaned,false,
L2007-09-23_trubach,27,L2007-09-23, trubach,false,

06.07.2007 пт – Москва, домашний концерт у Кушлянской
L2007-07-06_1992,01,L2007-07-06, 1992,false,
L2007-07-06_zastolnaya,02,L2007-07-06, zastolnaya,false,
L2007-07-06_farewell,03,L2007-07-06, farewell,false,
L2007-07-06_brodjagi,04,L2007-07-06, brodjagi,false,
L2007-07-06_zhizn,05,L2007-07-06, zhizn,false,
L2007-07-06_nerazmen,06,L2007-07-06, nerazmen,false,
L2007-07-06_inicialy,07,L2007-07-06, inicialy,false,
L2007-07-06_akoektop,08,L2007-07-06, akoektop,false,
L2007-07-06_proschanie,09,L2007-07-06, proschanie,false,
L2007-07-06_etodolzh,10,L2007-07-06, etodolzh,false,
L2007-07-06_kinemat2,11,L2007-07-06, kinemat2,false,
L2007-07-06_cirkachk,12,L2007-07-06, cirkachk,false,
L2007-07-06_chepuxa,13,L2007-07-06, chepuxa,false,
L2007-07-06_esli,14,L2007-07-06, esli,false,
L2007-07-06_shkolat2,15,L2007-07-06, shkolat2,false,
L2007-07-06_proscha4,16,L2007-07-06, proscha4,false,
L2007-07-06_deja,17,L2007-07-06, deja,false,
L2007-07-06_mneniche,18,L2007-07-06, mneniche,false,
L2007-07-06_vrjadli,19,L2007-07-06, vrjadli,false,
L2007-07-06_pochtich,20,L2007-07-06, pochtich,false,
L2007-07-06_udachny,21,L2007-07-06, udachny,false,
L2007-07-06_kogdaned,22,L2007-07-06, kogdaned,false,
L2007-07-06_tirbayard,23,L2007-07-06, tirbayard,false,
L2007-07-06_etiglaza,24,L2007-07-06, etiglaza,false,
L2007-07-06_peterbur,25,L2007-07-06, peterbur,false,

26.05.2007 сб – Москва, ЦДЖ, второй акт дуэт (гитара)
L2007-05-26_dendensk,01,L2007-05-26, dendensk,false,
L2007-05-26_1992,02,L2007-05-26, 1992,false,
L2007-05-26_kordebal,03,L2007-05-26, kordebal,false,
L2007-05-26_nerazmen,04,L2007-05-26, nerazmen,false,
L2007-05-26_traviata,05,L2007-05-26, traviata,false,
L2007-05-26_dopoezda,06,L2007-05-26, dopoezda,false,
L2007-05-26_pamjativ,07,L2007-05-26, pamjativ,false,
L2007-05-26_volk,08,L2007-05-26, volk,false,
L2007-05-26_podzname,09,L2007-05-26, podzname,false,
L2007-05-26_alliluja,10,L2007-05-26, alliluja,false,
L2007-05-26_chuzhaj2,11,L2007-05-26, chuzhaj2,false,
L2007-05-26_farewell,12,L2007-05-26, farewell,false,
L2007-05-26_trubach,13,L2007-05-26, trubach,false,
L2007-05-26_propadu,14,L2007-05-26, propadu,false,
L2007-05-26_akoektop,15,L2007-05-26, akoektop,false,
---
L2007-05-26_sharmans,16,L2007-05-26, sharmans,false,
L2007-05-26_kuznechiki,17,L2007-05-26, kuznechiki,false,
L2007-05-26_adleucon,18,L2007-05-26, adleucon,false,
L2007-05-26_navsejz1,19,L2007-05-26, navsejz1,false,
L2007-05-26_aneta,20,L2007-05-26, aneta,false,
L2007-05-26_lunnaja,21,L2007-05-26, lunnaja,false,
L2007-05-26_bereg,22,L2007-05-26, bereg,false,
L2007-05-26_navescha,23,L2007-05-26, navescha,false,
L2007-05-26_proscha1,24,L2007-05-26, proscha1,false,
L2007-05-26_romans1,25,L2007-05-26, romans1,false,
L2007-05-26_eccehomo,26,L2007-05-26, eccehomo,false,
L2007-05-26_proscha4,27,L2007-05-26, proscha4,false,
L2007-05-26_vtornik,28,L2007-05-26, vtornik,false,
L2007-05-26_vosxodja,29,L2007-05-26, vosxodja,false,

13.04.2007 пт – Москва, ЦДЖ
L2007-04-13_podzname,01,L2007-04-13, podzname,false,
L2007-04-13_istorija,02,L2007-04-13, istorija,false,
L2007-04-13_nerazmen,03,L2007-04-13, nerazmen,false,
L2007-04-13_cirkachk,04,L2007-04-13, cirkachk,false,
L2007-04-13_bystrov,05,L2007-04-13, bystrov,false,
L2007-04-13_mneniche,06,L2007-04-13, mneniche,false,
L2007-04-13_alliluja,07,L2007-04-13, alliluja,false,
L2007-04-13_1992,08,L2007-04-13, 1992,false,
L2007-04-13_deja,09,L2007-04-13, deja,false,
L2007-04-13_dendensk,10,L2007-04-13, dendensk,false,
L2007-04-13_volhonka,11,L2007-04-13, volhonka,false,
L2007-04-13_volk,12,L2007-04-13, volk,false,
L2007-04-13_krasnye,13,L2007-04-13, krasnye,false,
L2007-04-13_propadu,14,L2007-04-13, propadu,false,
L2007-04-13_moiraket,15,L2007-04-13, moiraket,false,
L2007-04-13_proscha4,16,L2007-04-13, proscha4,false,
L2007-04-13_peshkom,17,L2007-04-13, peshkom,false,
L2007-04-13_duet,18,L2007-04-13, duet,false,
L2007-04-13_1991,19,L2007-04-13, 1991,false,
L2007-04-13_inicialy,20,L2007-04-13, inicialy,false,
L2007-04-13_zhizn,21,L2007-04-13, zhizn,false,
L2007-04-13_esli,22,L2007-04-13, esli,false,
L2007-04-13_chepuxa,23,L2007-04-13, chepuxa,false,
L2007-04-13_voslavug,24,L2007-04-13, voslavug,false,
L2007-04-13_udachny,25,L2007-04-13, udachny,false,
L2007-04-13_dopoezda,26,L2007-04-13, dopoezda,false,
L2007-04-13_suhumi,27,L2007-04-13, suhumi,false,
L2007-04-13_trubach,28,L2007-04-13, trubach,false,

25.03.2007 вс – Москва, ЦДЖ, дуэт (гитара), "Песни 21-го века"
L2007-03-25_kibitka,01,L2007-03-25, kibitka,false,
L2007-03-25_kovcheg,02,L2007-03-25, kovcheg,false,
L2007-03-25_ubykagol,03,L2007-03-25, ubykagol,false,
L2007-03-25_temapoleta,04,L2007-03-25, temapoleta,false,
L2007-03-25_romansma,05,L2007-03-25, romansma,false,
L2007-03-25_svidanie,06,L2007-03-25, svidanie,false,
L2007-03-25_jachashu,07,L2007-03-25, jachashu,false,
L2007-03-25_vbelojmg,08,L2007-03-25, vbelojmg,false,
L2007-03-25_vjuga,09,L2007-03-25, vjuga,false,
L2007-03-25_serenada,10,L2007-03-25, serenada,false,
L2007-03-25_dusha,11,L2007-03-25, dusha,false,
L2007-03-25_poshlyj,12,L2007-03-25, poshlyj,false,
L2007-03-25_ryba,13,L2007-03-25, ryba,false,
L2007-03-25_marija,14,L2007-03-25, marija,false,
L2007-03-25_paris,15,L2007-03-25, paris,false,
L2007-03-25_proschanie,16,L2007-03-25, proschanie,false,
L2007-03-25_aneta,17,L2007-03-25, aneta,false,
L2007-03-25_opyatpar,18,L2007-03-25, opyatpar,false,
L2007-03-25_etoja,19,L2007-03-25, etoja,false,
L2007-03-25_vrjadli,20,L2007-03-25, vrjadli,false,
L2007-03-25_interme3,21,L2007-03-25, interme3,false,
L2007-03-25_puskaj,22,L2007-03-25, puskaj,false,
L2007-03-25_sezondoz,23,L2007-03-25, sezondoz,false,
L2007-03-25_tirbayard,24,L2007-03-25, tirbayard,false,
L2007-03-25_korablik,25,L2007-03-25, korablik,false,
L2007-03-25_farmacev,26,L2007-03-25, farmacev,false,

02.03.2007 пт – Санкт-Петербург, Театр эстрады имени А. Райкина
L2007-03-02_sharmans,01,L2007-03-02, sharmans,false,
L2007-03-02_ballada,02,L2007-03-02, ballada,false,
L2007-03-02_inicialy,03,L2007-03-02, inicialy,false,
L2007-03-02_chepuxa,04,L2007-03-02, chepuxa,false,
L2007-03-02_mneniche,05,L2007-03-02, mneniche,false,
L2007-03-02_cirkachk,06,L2007-03-02, cirkachk,false,
L2007-03-02_volk,07,L2007-03-02, volk,false,
L2007-03-02_balagan1,08,L2007-03-02, balagan1,false,
L2007-03-02_odnazhdy,09,L2007-03-02, odnazhdy,false,
L2007-03-02_bystrov,10,L2007-03-02, bystrov,false,
L2007-03-02_volhonka,11,L2007-03-02, volhonka,false,
L2007-03-02_vpoxodny,12,L2007-03-02, vpoxodny,false,
L2007-03-02_esli,13,L2007-03-02, esli,false,
L2007-03-02_kogdaned,14,L2007-03-02, kogdaned,false,
L2007-03-02_pochtich,15,L2007-03-02, pochtich,false,
L2007-03-02_podzname,16,L2007-03-02, podzname,false,
L2007-03-02_alliluja,17,L2007-03-02, alliluja,false,
L2007-03-02_molitva,18,L2007-03-02, molitva,false,
L2007-03-02_sentenci,19,L2007-03-02, sentenci,false,
L2007-03-02_menuet,20,L2007-03-02, menuet,false,
L2007-03-02_etoneja,21,L2007-03-02, etoneja,false,
L2007-03-02_1992,22,L2007-03-02, 1992,false,
L2007-03-02_1995,23,L2007-03-02, 1995,false,
L2007-03-02_zastolnaya,24,L2007-03-02, zastolnaya,false,
L2007-03-02_udachny,25,L2007-03-02, udachny,false,
L2007-03-02_traviata,26,L2007-03-02, traviata,false,
L2007-03-02_dopoezda,27,L2007-03-02, dopoezda,false,
L2007-03-02_nerazmen,28,L2007-03-02, nerazmen,false,
L2007-03-02_tirbayard,29,L2007-03-02, tirbayard,false,
L2007-03-02_proschanie,30,L2007-03-02, proschanie,false,

25.02.2007 вс – Москва, ЦДЖ, второй акт дуэт (гитара)
L2007-02-25_odnazhdy,01,L2007-02-25, odnazhdy,false,
L2007-02-25_mneniche,02,L2007-02-25, mneniche,false,
L2007-02-25_1990,03,L2007-02-25, 1990,false,
L2007-02-25_kupljubi,04,L2007-02-25, kupljubi,false,
L2007-02-25_1992,05,L2007-02-25, 1992,false,
L2007-02-25_bystrov,06,L2007-02-25, bystrov,false,
L2007-02-25_alliluja,07,L2007-02-25, alliluja,false,
L2007-02-25_inicialy,08,L2007-02-25, inicialy,false,
L2007-02-25_rozhdest,09,L2007-02-25, rozhdest,false,
L2007-02-25_shkolat2,10,L2007-02-25, shkolat2,false,
L2007-02-25_volk,11,L2007-02-25, volk,false,
L2007-02-25_esli,12,L2007-02-25, esli,false,
L2007-02-25_dopoezda,13,L2007-02-25, dopoezda,false,
L2007-02-25_udachny,14,L2007-02-25, udachny,false,
---
L2007-02-25_sharmans,15,L2007-02-25, sharmans,false,
L2007-02-25_burja,16,L2007-02-25, burja,false,
L2007-02-25_proschanie,17,L2007-02-25, proschanie,false,
L2007-02-25_eccehomo,18,L2007-02-25, eccehomo,false,
L2007-02-25_ljubov,19,L2007-02-25, ljubov,false,
L2007-02-25_okean,20,L2007-02-25, okean,false,
L2007-02-25_navescha,21,L2007-02-25, navescha,false,
L2007-02-25_dusha,22,L2007-02-25, dusha,false,
L2007-02-25_karavan,23,L2007-02-25, karavan,false,
L2007-02-25_adleucon,24,L2007-02-25, adleucon,false,
L2007-02-25_vtornik,25,L2007-02-25, vtornik,false,
L2007-02-25_tirbayard,26,L2007-02-25, tirbayard,false,
L2007-02-25_vosxodja,27,L2007-02-25, vosxodja,false,

26.01.2007 пт – Москва, ЦДЖ
L2007-01-26_nichemun,01,L2007-01-26, nichemun,false,
L2007-01-26_menuet,02,L2007-01-26, menuet,false,
L2007-01-26_deja,03,L2007-01-26, deja,false,
L2007-01-26_brodjagi,04,L2007-01-26, brodjagi,false,
L2007-01-26_kadril,05,L2007-01-26, kadril,false,
L2007-01-26_cirkachk,06,L2007-01-26, cirkachk,false,
L2007-01-26_stixiopr,07,L2007-01-26, stixiopr,false,
L2007-01-26_voslavug,08,L2007-01-26, voslavug,false,
L2007-01-26_nerazmen,09,L2007-01-26, nerazmen,false,
L2007-01-26_alliluja,10,L2007-01-26, alliluja,false,
L2007-01-26_proschanie,11,L2007-01-26, proschanie,false,
L2007-01-26_volhonka,12,L2007-01-26, volhonka,false,
L2007-01-26_ispokojn,13,L2007-01-26, ispokojn,false,
L2007-01-26_1991,14,L2007-01-26, 1991,false,
L2007-01-26_odnazhdy,15,L2007-01-26, odnazhdy,false,
L2007-01-26_1992,16,L2007-01-26, 1992,false,
---
L2007-01-26_sharmans,17,L2007-01-26, sharmans,false,
L2007-01-26_zvezdoch,18,L2007-01-26, zvezdoch,false,
L2007-01-26_istorija,19,L2007-01-26, istorija,false,
L2007-01-26_prenebre,20,L2007-01-26, prenebre,false,
L2007-01-26_propadu,21,L2007-01-26, propadu,false,
L2007-01-26_1995,22,L2007-01-26, 1995,false,
L2007-01-26_traviata,23,L2007-01-26, traviata,false,
L2007-01-26_zatemzhe,24,L2007-01-26, zatemzhe,false,
L2007-01-26_etodolzh,25,L2007-01-26, etodolzh,false,
L2007-01-26_vpoxodny,26,L2007-01-26, vpoxodny,false,
L2007-01-26_sustavy,27,L2007-01-26, sustavy,false,
L2007-01-26_vishnevo,28,L2007-01-26, vishnevo,false,

15.01.2007 пн – Минск, ДК Ветеранов
L2007-01-15_menuet,01,L2007-01-15, menuet,false,
L2007-01-15_zastolnaya,02,L2007-01-15, zastolnaya,false,
L2007-01-15_moekoro2,03,L2007-01-15, moekoro2,false,
L2007-01-15_1991,04,L2007-01-15, 1991,false,
L2007-01-15_rodljuds,05,L2007-01-15, rodljuds,false,
L2007-01-15_pochtich,06,L2007-01-15, pochtich,false,
L2007-01-15_kogdaned,07,L2007-01-15, kogdaned,false,
L2007-01-15_traviata,08,L2007-01-15, traviata,false,
L2007-01-15_propadu,09,L2007-01-15, propadu,false,
L2007-01-15_alliluja,10,L2007-01-15, alliluja,false,
L2007-01-15_dopoezda,11,L2007-01-15, dopoezda,false,
L2007-01-15_volhonka,12,L2007-01-15, volhonka,false,
L2007-01-15_etiglaza,13,L2007-01-15, etiglaza,false,
L2007-01-15_nerazmen,14,L2007-01-15, nerazmen,false,
L2007-01-15_proschanie,15,L2007-01-15, proschanie,false,
L2007-01-15_sentenci,16,L2007-01-15, sentenci,false,
---
L2007-01-15_sharmans,17,L2007-01-15, sharmans,false,
L2007-01-15_peshkom,18,L2007-01-15, peshkom,false,
L2007-01-15_voslavug,19,L2007-01-15, voslavug,false,
L2007-01-15_ochemtok,20*,L2007-01-15, ochemtok,false,
L2007-01-15_krasnye,21,L2007-01-15, krasnye,false,
L2007-01-15_mneniche,22,L2007-01-15, mneniche,false,
L2007-01-15_chepuxa,23,L2007-01-15, chepuxa,false,
L2007-01-15_vpoxodny,24,L2007-01-15, vpoxodny,false,
L2007-01-15_esli,25,L2007-01-15, esli,false,
L2007-01-15_ballada,26,L2007-01-15, ballada,false,
L2007-01-15_tirbayard,27,L2007-01-15, tirbayard,false,


2006 г. ▼ ▲

08.12.2006 пт – Москва, ЦДЖ, 2 премьеры
L2006-12-08_menuet,01,L2006-12-08, menuet,false,
L2006-12-08_zastolnaya,02,L2006-12-08, zastolnaya,false,
L2006-12-08_moekoro2,03,L2006-12-08, moekoro2,false,
L2006-12-08_itakdruz,04,L2006-12-08, itakdruz,false,
L2006-12-08_1991,05,L2006-12-08, 1991,false,
L2006-12-08_rodljuds,06,L2006-12-08, rodljuds,false,
L2006-12-08_pochtich,07,L2006-12-08, pochtich,false,
L2006-12-08_sentenci,08,L2006-12-08, sentenci,false,
L2006-12-08_propadu,09,L2006-12-08, propadu,false,
L2006-12-08_alliluja,10,L2006-12-08, alliluja,false,
L2006-12-08_voslavug,11,L2006-12-08, voslavug,false,
L2006-12-08_dopoezda,12,L2006-12-08, dopoezda,false,
L2006-12-08_volhonka,13,L2006-12-08, volhonka,false,
L2006-12-08_etiglaza,14,L2006-12-08, etiglaza,false,
L2006-12-08_proschanie,15,L2006-12-08, proschanie,true,
L2006-12-08_peshkom,16,L2006-12-08, peshkom,false,
L2006-12-08_chtotaok,17*,L2006-12-08, chtotaok,false,
L2006-12-08_korablik,18,L2006-12-08, korablik,false,
L2006-12-08_duet,19,L2006-12-08, duet,false,
L2006-12-08_mneniche,20,L2006-12-08, mneniche,false,
L2006-12-08_chepuxa,21,L2006-12-08, chepuxa,false,
L2006-12-08_vpoxodny,22,L2006-12-08, vpoxodny,false,
L2006-12-08_esli,23,L2006-12-08, esli,false,
L2006-12-08_panorama,24,L2006-12-08, panorama,false,
L2006-12-08_volk,25,L2006-12-08, volk,false,
L2006-12-08_ballada,26,L2006-12-08, ballada,false,
L2006-12-08_tirbayard,27,L2006-12-08, tirbayard,true,
L2006-12-08_trubach,28,L2006-12-08, trubach,false,

02.12.2006 сб – Москва, МГУ, клуб "Казематы"

18.11.2006 сб – Москва, ЦДЖ, дуэт (гитара)
L2006-11-18_sharmans,01,L2006-11-18, sharmans,false,
L2006-11-18_kovcheg,02,L2006-11-18, kovcheg,false,
L2006-11-18_ryba,03,L2006-11-18, ryba,false,
L2006-11-18_descensu,04,L2006-11-18, descensu,false,
L2006-11-18_menuet,05,L2006-11-18, menuet,false,
L2006-11-18_romansma,06,L2006-11-18, romansma,false,
L2006-11-18_ljubov,07,L2006-11-18, ljubov,false,
L2006-11-18_farmacev,08,L2006-11-18, farmacev,false,
L2006-11-18_korablik,09,L2006-11-18, korablik,false,
L2006-11-18_jachashu,10,L2006-11-18, jachashu,false,
L2006-11-18_kuznechiki,11,L2006-11-18, kuznechiki,false,
L2006-11-18_1992,12,L2006-11-18, 1992,false,
---
L2006-11-18_kibitka,13,L2006-11-18, kibitka,false,
14-
L2006-11-18_marija,15,L2006-11-18, marija,false,
L2006-11-18_dolinanm,16*,L2006-11-18, (М. Стародубцев) dolinanm,false,
L2006-11-18_temapoleta,17,L2006-11-18, temapoleta,false,
L2006-11-18_vtornik,18,L2006-11-18, vtornik,false,
L2006-11-18_dopoezda,19,L2006-11-18, dopoezda,false,

28.10.2006 сб – США, Gaithersburg, MD

27.10.2006 пт – США, Philadelphia, PA
L2006-10-27_deja,01,L2006-10-27, deja,false,
L2006-10-27_nerazmen,02,L2006-10-27, nerazmen,false,
L2006-10-27_dendensk,03,L2006-10-27, dendensk,false,
L2006-10-27_alliluja,04,L2006-10-27, alliluja,false,
L2006-10-27_sharmans,05,L2006-10-27, sharmans,false,
L2006-10-27_menuet,06,L2006-10-27, menuet,false,
L2006-10-27_rodljuds,07,L2006-10-27, rodljuds,false,
L2006-10-27_volhonka,08,L2006-10-27, volhonka,false,
L2006-10-27_suhumi,09,L2006-10-27, suhumi,false,
L2006-10-27_mneniche,10,L2006-10-27, mneniche,false,
L2006-10-27_piter,11,L2006-10-27, piter,false,
L2006-10-27_dopoezda,12,L2006-10-27, dopoezda,false,
L2006-10-27_proscha4,13,L2006-10-27, proscha4,false,
L2006-10-27_kogdaned,14,L2006-10-27, kogdaned,false,
L2006-10-27_itakdruz,15,L2006-10-27, itakdruz,false,
L2006-10-27_panorama,16,L2006-10-27, panorama,false,
L2006-10-27_etiglaza,17,L2006-10-27, etiglaza,false,
L2006-10-27_etodolzh,18,L2006-10-27, etodolzh,false,
L2006-10-27_brodjagi,19,L2006-10-27, brodjagi,false,
L2006-10-27_sentenci,20,L2006-10-27, sentenci,false,
L2006-10-27_zavescha,21,L2006-10-27, zavescha,false,
L2006-10-27_pochtich,22,L2006-10-27, pochtich,false,
L2006-10-27_cybin,23,L2006-10-27, cybin,false,
L2006-10-27_1991,24,L2006-10-27, 1991,false,
L2006-10-27_1990,25,L2006-10-27, 1990,false,

22.10.2006 вс – США, Brooklyn, NY
L2006-10-22_nerazmen,01,L2006-10-22, nerazmen,false,
L2006-10-22_krasnye,02,L2006-10-22, krasnye,false,
L2006-10-22_sharmans,03,L2006-10-22, sharmans,false,
L2006-10-22_deja,04,L2006-10-22, deja,false,
L2006-10-22_dendensk,05,L2006-10-22, dendensk,false,
L2006-10-22_volhonka,06,L2006-10-22, volhonka,false,
L2006-10-22_suhumi,07,L2006-10-22, suhumi,false,
L2006-10-22_cirkachk,08,L2006-10-22, cirkachk,false,
L2006-10-22_moekoro3,09,L2006-10-22, moekoro3,false,
L2006-10-22_pochtich,10,L2006-10-22, pochtich,false,
L2006-10-22_menuet,11,L2006-10-22, menuet,false,
L2006-10-22_zavescha,12,L2006-10-22, zavescha,false,
L2006-10-22_alliluja,13,L2006-10-22, alliluja,false,
L2006-10-22_mneniche,14,L2006-10-22, mneniche,false,
L2006-10-22_kuznechiki,15,L2006-10-22, kuznechiki,false,
L2006-10-22_dopoezda,16,L2006-10-22, dopoezda,false,
---
L2006-10-22_zhizn,17,L2006-10-22, zhizn,false,
L2006-10-22_rodljuds,18,L2006-10-22, rodljuds,false,
L2006-10-22_popdorog,19*,L2006-10-22, popdorog,false,
L2006-10-22_etiglaza,20,L2006-10-22, etiglaza,false,
L2006-10-22_1992,21,L2006-10-22, 1992,false,
L2006-10-22_odnazhdy,22,L2006-10-22, odnazhdy,false,
L2006-10-22_proscha4,23,L2006-10-22, proscha4,false,
L2006-10-22_itakdruz,24,L2006-10-22, itakdruz,false,
L2006-10-22_kogdaned,25,L2006-10-22, kogdaned,false,
L2006-10-22_sentenci,26,L2006-10-22, sentenci,false,

21.10.2006 сб – США, Fair Lawn, NJ
L2006-10-21_nerazmen,01,L2006-10-21, nerazmen,false,
L2006-10-21_krasnye,02,L2006-10-21, krasnye,false,
L2006-10-21_sharmans,03,L2006-10-21, sharmans,false,
L2006-10-21_deja,04,L2006-10-21, deja,false,
L2006-10-21_dendensk,05,L2006-10-21, dendensk,false,
L2006-10-21_etodolzh,06,L2006-10-21, etodolzh,false,
L2006-10-21_cirkachk,07,L2006-10-21, cirkachk,false,
L2006-10-21_temapoleta,08,L2006-10-21, temapoleta,false,
L2006-10-21_zastolnaya,09,L2006-10-21, zastolnaya,false,
L2006-10-21_moekoro2,10,L2006-10-21, moekoro2,false,
L2006-10-21_menuet,11,L2006-10-21, menuet,false,
L2006-10-21_pochtich,12,L2006-10-21, pochtich,false,
L2006-10-21_brodjagi,13,L2006-10-21, brodjagi,false,
L2006-10-21_zavescha,14,L2006-10-21, zavescha,false,
L2006-10-21_alliluja,15,L2006-10-21, alliluja,false,
L2006-10-21_mneniche,16,L2006-10-21, mneniche,false,
L2006-10-21_dopoezda,17,L2006-10-21, dopoezda,false,
---
L2006-10-21_odnazhdy,18,L2006-10-21, odnazhdy,false,
L2006-10-21_volk,19,L2006-10-21, volk,false,
L2006-10-21_ballada,20,L2006-10-21, ballada,false,
L2006-10-21_rodljuds,21,L2006-10-21, rodljuds,false,
L2006-10-21_1991,22,L2006-10-21, 1991,false,
L2006-10-21_cybin,23,L2006-10-21, cybin,false,
L2006-10-21_1992,24,L2006-10-21, 1992,false,
L2006-10-21_proscha4,25,L2006-10-21, proscha4,false,
L2006-10-21_itakdruz,26,L2006-10-21, itakdruz,false,
L2006-10-21_kogdaned,27,L2006-10-21, kogdaned,false,
L2006-10-21_sentenci,28,L2006-10-21, sentenci,false,

13.10.2006 пт – Москва, ЦДЖ, "Песни 21-го века"
L2006-10-13_nerazmen,01,L2006-10-13, nerazmen,false,
L2006-10-13_krasnye,02,L2006-10-13, krasnye,false,
L2006-10-13_sharmans,03,L2006-10-13, sharmans,false,
L2006-10-13_deja,04,L2006-10-13, deja,false,
L2006-10-13_dendensk,05,L2006-10-13, dendensk,false,
L2006-10-13_etodolzh,06,L2006-10-13, etodolzh,false,
L2006-10-13_temapoleta,07,L2006-10-13, temapoleta,false,
L2006-10-13_1991,08,L2006-10-13, 1991,false,
L2006-10-13_zastolnaya,09,L2006-10-13, zastolnaya,false,
L2006-10-13_moekoro2,10,L2006-10-13, moekoro2,false,
L2006-10-13_menuet,11,L2006-10-13, menuet,false,
L2006-10-13_brodjagi,12,L2006-10-13, brodjagi,false,
L2006-10-13_zavescha,13,L2006-10-13, zavescha,false,
L2006-10-13_alliluja,14,L2006-10-13, alliluja,false,
L2006-10-13_dopoezda,15,L2006-10-13, dopoezda,false,
L2006-10-13_kogdajab,16,L2006-10-13, kogdajab,false,
L2006-10-13_mneniche,17,L2006-10-13, mneniche,false,
L2006-10-13_volk,18,L2006-10-13, volk,false,
L2006-10-13_ballada,19,L2006-10-13, ballada,false,
L2006-10-13_rodljuds,20,L2006-10-13, rodljuds,false,
L2006-10-13_proscha4,21,L2006-10-13, proscha4,false,
L2006-10-13_duet,22,L2006-10-13, duet,false,
L2006-10-13_panorama,23,L2006-10-13, panorama,false,
L2006-10-13_1992,24,L2006-10-13, 1992,false,
L2006-10-13_peshkom,25,L2006-10-13, peshkom,false,
L2006-10-13_sentenci,26,L2006-10-13, sentenci,false,

29.09.2006 пт – Москва, ЦДЖ
L2006-09-29_zhizn,01,L2006-09-29, zhizn,false,
L2006-09-29_inicialy,02,L2006-09-29, inicialy,false,
L2006-09-29_krasnye,03,L2006-09-29, krasnye,false,
L2006-09-29_dendensk,04,L2006-09-29, dendensk,false,
L2006-09-29_volhonka,05,L2006-09-29, volhonka,false,
L2006-09-29_etodolzh,06,L2006-09-29, etodolzh,false,
L2006-09-29_cirkachk,07,L2006-09-29, cirkachk,false,
L2006-09-29_moekoro3,08,L2006-09-29, moekoro3,false,
L2006-09-29_suhumi,09,L2006-09-29, suhumi,false,
L2006-09-29_volk,10,L2006-09-29, volk,false,
L2006-09-29_1991,11,L2006-09-29, 1991,false,
L2006-09-29_nerazmen,12,L2006-09-29, nerazmen,false,
L2006-09-29_mneniche,13,L2006-09-29, mneniche,false,
L2006-09-29_odnazhdy,14,L2006-09-29, odnazhdy,false,
L2006-09-29_dopoezda,15,L2006-09-29, dopoezda,false,
---
L2006-09-29_sharmans,16,L2006-09-29, sharmans,false,
L2006-09-29_kovcheg,17,L2006-09-29, kovcheg,false,
L2006-09-29_kuznechiki,18,L2006-09-29, kuznechiki,false,
L2006-09-29_molitva,19,L2006-09-29, molitva,false,
L2006-09-29_navsejz1,20,L2006-09-29, navsejz1,false,
L2006-09-29_marija,21,L2006-09-29, marija,false,
L2006-09-29_etoja,22,L2006-09-29, etoja,false,
L2006-09-29_okean,23,L2006-09-29, okean,false,
L2006-09-29_ryba,24,L2006-09-29, ryba,false,
L2006-09-29_adleucon,25,L2006-09-29, adleucon,false,
L2006-09-29_cybin,26,L2006-09-29, cybin,false,
L2006-09-29_sudnadsu,27*,L2006-09-29, sudnadsu,false,
L2006-09-29_proscha4,28,L2006-09-29, proscha4,false,
L2006-09-29_kogdaned,29,L2006-09-29, kogdaned,false,
L2006-09-29_vtornik,30,L2006-09-29, vtornik,false,
L2006-09-29_chtobyat,31,L2006-09-29, chtobyat,false,
L2006-09-29_vosxodja,32,L2006-09-29, vosxodja,false,

08.07.2006 сб – Москва, домашний концерт у Ю. Шапиро
L2006-07-08_istorija,01,L2006-07-08, istorija,false,
L2006-07-08_kinemat2,02,L2006-07-08, kinemat2,false,
L2006-07-08_esli,03,L2006-07-08, esli,false,
L2006-07-08_dopoezda,04,L2006-07-08, dopoezda,false,
L2006-07-08_itakdruz,05,L2006-07-08, itakdruz,false,
L2006-07-08_volhonka,06,L2006-07-08, volhonka,false,
L2006-07-08_cirkachk,07,L2006-07-08, cirkachk,false,
L2006-07-08_proscha4,08,L2006-07-08, proscha4,false,
L2006-07-08_etodolzh,09,L2006-07-08, etodolzh,false,
L2006-07-08_zastolnaya,10,L2006-07-08, zastolnaya,false,
L2006-07-08_piter,11,L2006-07-08, piter,false,
L2006-07-08_pochtich,12,L2006-07-08, pochtich,false,
L2006-07-08_1991,13,L2006-07-08, 1991,false,
L2006-07-08_inicialy,14,L2006-07-08, inicialy,false,
L2006-07-08_peshkom,15,L2006-07-08, peshkom,false,
L2006-07-08_rodljuds,16,L2006-07-08, rodljuds,false,
L2006-07-08_volk,17,L2006-07-08, volk,false,
L2006-07-08_cybin,18,L2006-07-08, cybin,false,
L2006-07-08_adleucon,19,L2006-07-08, adleucon,false,
L2006-07-08_kogdaned,20,L2006-07-08, kogdaned,false,
L2006-07-08_chepuxa,21,L2006-07-08, chepuxa,false,
L2006-07-08_sentenci,22,L2006-07-08, sentenci,false,

23.06.2006 пт – Москва, ЦДЖ, второй акт дуэт (гитара), 3 премьеры
L2006-06-23_krasnye,01,L2006-06-23, krasnye,false,
L2006-06-23_nerazmen,02,L2006-06-23, nerazmen,false,
L2006-06-23_moekoro3,03,L2006-06-23, moekoro3,false,
L2006-06-23_mneniche,04,L2006-06-23, mneniche,false,
L2006-06-23_1991,05,L2006-06-23, 1991,false,
L2006-06-23_volhonka,06,L2006-06-23, volhonka,false,
L2006-06-23_odnazhdy,07,L2006-06-23, odnazhdy,false,
L2006-06-23_inicialy,08,L2006-06-23, inicialy,false,
L2006-06-23_volk,09,L2006-06-23, volk,false,
L2006-06-23_itakdruz,10,L2006-06-23, itakdruz,false,
L2006-06-23_moekoro2,11,L2006-06-23, moekoro2,false,
L2006-06-23_dopoezda,12,L2006-06-23, dopoezda,false,
L2006-06-23_pochtich,13,L2006-06-23, pochtich,true,
L2006-06-23_chtozane,14,L2006-06-23, chtozane,false,
L2006-06-23_piter,15,L2006-06-23, piter,false,
---
L2006-06-23_kibitka,16,L2006-06-23, kibitka,false,
L2006-06-23_burja,17,L2006-06-23, burja,false,
L2006-06-23_vbelojmg,18,L2006-06-23, vbelojmg,false,
L2006-06-23_korablik,19,L2006-06-23, korablik,false,
L2006-06-23_eccehomo,20,L2006-06-23, eccehomo,false,
L2006-06-23_karavan,21,L2006-06-23, karavan,false,
L2006-06-23_adleucon,22,L2006-06-23, adleucon,false,
L2006-06-23_vrjadli,23,L2006-06-23, vrjadli,false,
L2006-06-23_kogdaned,24,L2006-06-23, kogdaned,false,
L2006-06-23_proscha1,25,L2006-06-23, proscha1,false,
L2006-06-23_chtobyat,26,L2006-06-23, chtobyat,true,
L2006-06-23_kolybeln,27,L2006-06-23, kolybeln,false,
L2006-06-23_cybin,28,L2006-06-23, cybin,true,
L2006-06-23_vosxodja,29,L2006-06-23, vosxodja,false,

05.06.2006 пн – Санкт-Петербург, Театр эстрады имени А. Райкина

19.05.2006 пт – Москва, ЦДЖ
L2006-05-19_moekoro3,01,L2006-05-19, moekoro3,false,
L2006-05-19_1991,02,L2006-05-19, 1991,false,
L2006-05-19_nerazmen,03,L2006-05-19, nerazmen,false,
L2006-05-19_ryba,04,L2006-05-19, ryba,false,
L2006-05-19_krasnye,05,L2006-05-19, krasnye,false,
L2006-05-19_kuznechiki,06,L2006-05-19, kuznechiki,false,
L2006-05-19_itakdruz,07,L2006-05-19, itakdruz,false,
L2006-05-19_pamjativ,08,L2006-05-19, pamjativ,false,
L2006-05-19_volk,09,L2006-05-19, volk,false,
L2006-05-19_suhumi,10,L2006-05-19, suhumi,false,
L2006-05-19_odnazhdy,11,L2006-05-19, odnazhdy,false,
L2006-05-19_temapoleta,12,L2006-05-19, temapoleta,false,
L2006-05-19_zastolnaya,13,L2006-05-19, zastolnaya,false,
L2006-05-19_moekoro2,14,L2006-05-19, moekoro2,false,
L2006-05-19_chtozane,15,L2006-05-19, chtozane,false,
L2006-05-19_piter,16,L2006-05-19, piter,false,
---
L2006-05-19_kordebal,17,L2006-05-19, kordebal,false,
L2006-05-19_volhonka,18,L2006-05-19, volhonka,false,
L2006-05-19_bystrov,19,L2006-05-19, bystrov,false,
L2006-05-19_proscha4,20,L2006-05-19, proscha4,false,
L2006-05-19_dopoezda,21,L2006-05-19, dopoezda,false,
L2006-05-19_etiglaza,22,L2006-05-19, etiglaza,false,
L2006-05-19_kogdaned,23,L2006-05-19, kogdaned,false,
L2006-05-19_mneniche,24,L2006-05-19, mneniche,false,
L2006-05-19_inicialy,25,L2006-05-19, inicialy,false,
L2006-05-19_deja,26,L2006-05-19, deja,false,

06.05.2006 сб – Киев, Центральный Дом офицеров

14.04.2006 пт – Москва, ЦДЖ
L2006-04-14_sharmans,01,L2006-04-14, sharmans,false,
L2006-04-14_zhizn,02,L2006-04-14, zhizn,false,
L2006-04-14_paris,03,L2006-04-14, paris,false,
L2006-04-14_kupljubi,04,L2006-04-14, kupljubi,false,
L2006-04-14_duet,05,L2006-04-14, duet,false,
L2006-04-14_deja,06,L2006-04-14, deja,false,
L2006-04-14_pamjativ,07,L2006-04-14, pamjativ,false,
L2006-04-14_cirkachk,08,L2006-04-14, cirkachk,false,
L2006-04-14_suhumi,09,L2006-04-14, suhumi,false,
L2006-04-14_peterbur,10,L2006-04-14, peterbur,false,
L2006-04-14_volhonka,11,L2006-04-14, volhonka,false,
L2006-04-14_rozhdest,12,L2006-04-14, rozhdest,false,
L2006-04-14_volk,13,L2006-04-14, volk,false,
L2006-04-14_1991,14,L2006-04-14, 1991,false,
L2006-04-14_odnazhdy,15,L2006-04-14, odnazhdy,false,
L2006-04-14_1990,16,L2006-04-14, 1990,false,
L2006-04-14_krasnye,17,L2006-04-14, krasnye,false,
L2006-04-14_dendensk,18,L2006-04-14, dendensk,false,
L2006-04-14_kinemat2,19,L2006-04-14, kinemat2,false,
L2006-04-14_rodljuds,20,L2006-04-14, rodljuds,false,
L2006-04-14_chepuxa,21,L2006-04-14, chepuxa,false,
L2006-04-14_vademecu,22,L2006-04-14, vademecu,false,
L2006-04-14_mneniche,23,L2006-04-14, mneniche,false,
L2006-04-14_avstrali,24,L2006-04-14, avstrali,false,
L2006-04-14_dopoezda,25,L2006-04-14, dopoezda,false,

31.03.2006 пт – Москва, ЦДЖ, дуэт ()
L2006-03-31_kibitka,01,L2006-03-31, kibitka,false,
L2006-03-31_burja,02,L2006-03-31, burja,false,
L2006-03-31_sezondoz,03,L2006-03-31, sezondoz,false,
L2006-03-31_kuznechiki,04,L2006-03-31, kuznechiki,false,
L2006-03-31_adleucon,05,L2006-03-31, adleucon,false,
L2006-03-31_voslavug,06,L2006-03-31, voslavug,false,
L2006-03-31_eccehomo,07,L2006-03-31, eccehomo,false,
L2006-03-31_zaliv,08,L2006-03-31, zaliv,false,
L2006-03-31_vozvrasc,09,L2006-03-31, vozvrasc,false,
L2006-03-31_serenada,10,L2006-03-31, serenada,false,
L2006-03-31_proschan,11,L2006-03-31, proschan,false,
L2006-03-31_proscha1,12,L2006-03-31, proscha1,false,
L2006-03-31_farmacev,13,L2006-03-31, farmacev,false,
L2006-03-31_romansma,14,L2006-03-31, romansma,false,
L2006-03-31_proscha4,15,L2006-03-31, proscha4,false,
L2006-03-31_kovcheg,16,L2006-03-31, kovcheg,false,
L2006-03-31_ryba,17,L2006-03-31, ryba,false,
L2006-03-31_vbelojmg,18,L2006-03-31, vbelojmg,false,
L2006-03-31_marija,19,L2006-03-31, marija,false,
L2006-03-31_navsejz1,20,L2006-03-31, navsejz1,false,
L2006-03-31_okean,21,L2006-03-31, okean,false,
L2006-03-31_vtornik,22,L2006-03-31, vtornik,false,
L2006-03-31_kogdaned,23,L2006-03-31, kogdaned,false,
L2006-03-31_kolybeln,24,L2006-03-31, kolybeln,false,
L2006-03-31_vosxodja,25,L2006-03-31, vosxodja,false,

12.03.2006 вс – США, Los Angeles, CA

11.03.2006 сб – США, Irvine, CA, домашний концерт у А. Кискачи
L2006-03-11_sharmans,01,L2006-03-11, sharmans,false,
L2006-03-11_nerazmen,02,L2006-03-11, nerazmen,false,
L2006-03-11_moekoro3,03,L2006-03-11, moekoro3,false,
L2006-03-11_itakdruz,04,L2006-03-11, itakdruz,false,
L2006-03-11_mneniche,05,L2006-03-11, mneniche,false,
L2006-03-11_kuznechiki,06,L2006-03-11, kuznechiki,false,
L2006-03-11_piter,07,L2006-03-11, piter,false,
L2006-03-11_pamjativ,08,L2006-03-11, pamjativ,false,
L2006-03-11_nichemun,09,L2006-03-11, nichemun,false,
L2006-03-11_podzname,10,L2006-03-11, podzname,false,
L2006-03-11_suhumi,11,L2006-03-11, suhumi,false,
L2006-03-11_kinometr,12,L2006-03-11, kinometr,false,
L2006-03-11_kovcheg,13,L2006-03-11, kovcheg,false,
---
L2006-03-11_krasnye,14,L2006-03-11, krasnye,false,
L2006-03-11_dendensk,15,L2006-03-11, dendensk,false,
L2006-03-11_volhonka,16,L2006-03-11, volhonka,false,
L2006-03-11_ryba,17,L2006-03-11, ryba,false,
L2006-03-11_inicialy,18,L2006-03-11, inicialy,false,
L2006-03-11_volk,19,L2006-03-11, volk,false,
L2006-03-11_etiglaza,20,L2006-03-11, etiglaza,false,
L2006-03-11_kogdaned,21,L2006-03-11, kogdaned,false,
L2006-03-11_alliluja,22,L2006-03-11, alliluja,false,
L2006-03-11_dopoezda,23,L2006-03-11, dopoezda,false,
L2006-03-11_proscha4,24,L2006-03-11, proscha4,false,
L2006-03-11_trubach,25,L2006-03-11, trubach,false,

04.03.2006 сб – США, Palo Alto, CA

24.02.2006 пт – Москва, ЦДЖ, дуэт (), презентация mneniche
L2006-02-24_sharmans,01,L2006-02-24, sharmans,false,
L2006-02-24_kovcheg,02,L2006-02-24, kovcheg,false,
L2006-02-24_kuznechiki,03,L2006-02-24, kuznechiki,false,
L2006-02-24_adleucon,04,L2006-02-24, adleucon,false,
L2006-02-24_vtornik,05,L2006-02-24, vtornik,false,
L2006-02-24_marija,06,L2006-02-24, marija,false,
L2006-02-24_etoja,07,L2006-02-24, etoja,false,
L2006-02-24_poshlyj,08,L2006-02-24, poshlyj,false,
L2006-02-24_proscha1,09,L2006-02-24, proscha1,false,
L2006-02-24_eccehomo,10,L2006-02-24, eccehomo,false,
L2006-02-24_okean,11,L2006-02-24, okean,false,
L2006-02-24_svidanie,12,L2006-02-24, svidanie,false,
L2006-02-24_menuet,13,L2006-02-24, menuet,false,
L2006-02-24_ljubov,14,L2006-02-24, ljubov,false,
L2006-02-24_farmacev,15,L2006-02-24, farmacev,false,
L2006-02-24_voslavug,16,L2006-02-24, voslavug,false,
L2006-02-24_vjuga,17,L2006-02-24, vjuga,false,
L2006-02-24_puskaj,18,L2006-02-24, puskaj,false,
L2006-02-24_popdorog,19*,L2006-02-24, popdorog,false,
L2006-02-24_opyatpar,20,L2006-02-24, opyatpar,false,
L2006-02-24_korablik,21,L2006-02-24, korablik,false,
L2006-02-24_kogdaned,22,L2006-02-24, kogdaned,false,
L2006-02-24_proscha4,23,L2006-02-24, proscha4,false,
L2006-02-24_vosxodja,24,L2006-02-24, vosxodja,false,
L2006-02-24_kolybeln,25,L2006-02-24, kolybeln,false,

15.01.2006 вс – Москва, ЦДЖ
L2006-01-15_itakdruz,01,L2006-01-15, itakdruz,false,
L2006-01-15_ryba,02,L2006-01-15, ryba,false,
L2006-01-15_peshkom,03,L2006-01-15, peshkom,false,
L2006-01-15_moekoro3,04,L2006-01-15, moekoro3,false,
L2006-01-15_brodjagi,05,L2006-01-15, brodjagi,false,
L2006-01-15_uchitel,06,L2006-01-15, uchitel,false,
L2006-01-15_etiglaza,07,L2006-01-15, etiglaza,false,
L2006-01-15_1992,08,L2006-01-15, 1992,false,
L2006-01-15_volhonka,09,L2006-01-15, volhonka,false,
L2006-01-15_dendensk,10,L2006-01-15, dendensk,false,
L2006-01-15_krasnye,11,L2006-01-15, krasnye,false,
L2006-01-15_descensu,12,L2006-01-15, descensu,false,
L2006-01-15_chtozane,13,L2006-01-15, chtozane,false,
L2006-01-15_piter,14,L2006-01-15, piter,false,
L2006-01-15_pustyjeb,15,L2006-01-15, pustyjeb,false,
L2006-01-15_japodari,16,L2006-01-15, japodari,false,
L2006-01-15_1991,17,L2006-01-15, 1991,false,
L2006-01-15_esli,18,L2006-01-15, esli,false,
L2006-01-15_kinometr,19,L2006-01-15, kinometr,false,
L2006-01-15_suhumi,20,L2006-01-15, suhumi,false,
L2006-01-15_temapoleta,21,L2006-01-15, temapoleta,false,
L2006-01-15_chibis,22,L2006-01-15, chibis,false,
L2006-01-15_votpodni,23,L2006-01-15, votpodni,false,
L2006-01-15_alliluja,24,L2006-01-15, alliluja,false,
L2006-01-15_dopoezda,25,L2006-01-15, dopoezda,false,
L2006-01-15_chepuxa,26,L2006-01-15, chepuxa,false,


2005 г. ▼ ▲

26.12.2005 пн – Москва, ЦДЛ
L2005-12-26_nerazmen,01,L2005-12-26, nerazmen,false,
L2005-12-26_deja,02,L2005-12-26, deja,false,
L2005-12-26_kuznechiki,03,L2005-12-26, kuznechiki,false,
L2005-12-26_inicialy,04,L2005-12-26, inicialy,false,
L2005-12-26_volk,05,L2005-12-26, volk,false,
L2005-12-26_chibis,06,L2005-12-26, chibis,false,
L2005-12-26_proscha4,07,L2005-12-26, proscha4,false,
L2005-12-26_piter,08,L2005-12-26, piter,false,
L2005-12-26_chtozane,09,L2005-12-26, chtozane,false,
L2005-12-26_kogdaned,10,L2005-12-26, kogdaned,false,
L2005-12-26_dopoezda,11,L2005-12-26, dopoezda,false,

10.12.2005 сб – Москва, ЦДЖ

10.11.2005 чт – Москва, ЦДЛ, концерт Лидии Чебоксаровой, второй акт

22.10.2005 сб – Москва, ЦДРИ, премьера
+ Фридрих идёт

20.10.2005 чт – Минск, ДК Ветеранов, 2 премьеры, текст
L2005-10-20_zhizn,01,L2005-10-20, zhizn,false,
L2005-10-20_nerazmen,02,L2005-10-20, nerazmen,false,
L2005-10-20_moekoro2,03,L2005-10-20, moekoro2,false,
L2005-10-20_rodljuds,04,L2005-10-20, rodljuds,false,
L2005-10-20_jachashu,05,L2005-10-20, jachashu,false,
L2005-10-20_podzname,06,L2005-10-20, podzname,false,
L2005-10-20_uchitel,07,L2005-10-20, uchitel,false,
L2005-10-20_dendensk,08,L2005-10-20, dendensk,false,
L2005-10-20_sharmans,09,L2005-10-20, sharmans,false,
L2005-10-20_piter,10,L2005-10-20, piter,false,
L2005-10-20_pamjativ,11,L2005-10-20, pamjativ,false,
L2005-10-20_deja,12,L2005-10-20, deja,false,
L2005-10-20_mneniche,13,L2005-10-20, mneniche,false,
L2005-10-20_kuznechiki,14,L2005-10-20, kuznechiki,false,
L2005-10-20_inicialy,15,L2005-10-20, inicialy,false,
L2005-10-20_proscha4,16,L2005-10-20, proscha4,false,
---
L2005-10-20_kovcheg,17,L2005-10-20, kovcheg,false,
L2005-10-20_suhumi,18,L2005-10-20, suhumi,false,
L2005-10-20_chibis,19,L2005-10-20, chibis,false,
L2005-10-20_temapoleta,20,L2005-10-20, temapoleta,false,
L2005-10-20_eastcoast,21,L2005-10-20, eastcoast,true,
L2005-10-20_opyatpar,22,L2005-10-20, opyatpar,false,
L2005-10-20_chinatow,23,L2005-10-20, chinatow,false,
L2005-10-20_alliluja,24,L2005-10-20, alliluja,false,
L2005-10-20_kinometr,25,L2005-10-20, kinometr,false,
L2005-10-20_chtozane,26,L2005-10-20, chtozane,false,(обновлённый текст)
L2005-10-20_kogdaned,27,L2005-10-20, kogdaned,true,
L2005-10-20_dopoezda,28,L2005-10-20, dopoezda,false,

29.05.2005 вс – Москва, бард-клуб "Гнездо глухаря"

22.05.2005 вс – США, Brooklyn, NY

20.05.2005 пт – США, Philadelphia, PA

30.04.2005 сб – Москва, ЦДРИ (каминный зал)
L2005-04-30_zhizn,01,L2005-04-30, zhizn,false,
L2005-04-30_nerazmen,02,L2005-04-30, nerazmen,false,
L2005-04-30_ryba,03,L2005-04-30, ryba,false,
L2005-04-30_descensu,04,L2005-04-30, descensu,false,
L2005-04-30_brodjagi,05,L2005-04-30, brodjagi,false,
L2005-04-30_stixiopr,06,L2005-04-30, stixiopr,false,
L2005-04-30_volk,07,L2005-04-30, volk,false,
L2005-04-30_podzname,08,L2005-04-30, podzname,false,
L2005-04-30_vishnevo,09,L2005-04-30, vishnevo,false,
L2005-04-30_mneniche,10,L2005-04-30, mneniche,false,
L2005-04-30_sharmans,11,L2005-04-30, sharmans,false,
L2005-04-30_pamjativ,12,L2005-04-30, pamjativ,false,
L2005-04-30_opyatpar,13,L2005-04-30, opyatpar,false,
---
L2005-04-30_kovcheg,14,L2005-04-30, kovcheg,false,
L2005-04-30_votpodni,15,L2005-04-30, votpodni,false,
L2005-04-30_sentenci,16,L2005-04-30, sentenci,false,
L2005-04-30_kuznechiki,17,L2005-04-30, kuznechiki,false,
L2005-04-30_suhumi,18,L2005-04-30, suhumi,false,
L2005-04-30_alliluja,19,L2005-04-30, alliluja,false,
L2005-04-30_vpoxodny,20,L2005-04-30, vpoxodny,false,
L2005-04-30_temapoleta,21,L2005-04-30, temapoleta,false,
L2005-04-30_trubach,22,L2005-04-30, trubach,false,
L2005-04-30_dopoezda,23,L2005-04-30, dopoezda,false,
L2005-04-30_krasnye,24,L2005-04-30, krasnye,false,
L2005-04-30_proscha4,25,L2005-04-30, proscha4,false,
L2005-04-30_chepuxa,26,L2005-04-30, chepuxa,false,

12.04.2005 вт – Москва, бард-клуб "Шале"
L2005-04-12_1992,01,L2005-04-12, 1992,false,
L2005-04-12_dendensk,02,L2005-04-12, dendensk,false,
L2005-04-12_nerazmen,03,L2005-04-12, nerazmen,false,
L2005-04-12_deja,04,L2005-04-12, deja,false,
L2005-04-12_voslavug,05,L2005-04-12, voslavug,false,
L2005-04-12_volk,06,L2005-04-12, volk,false,
L2005-04-12_vishnevo,07,L2005-04-12, vishnevo,false,
L2005-04-12_prenebre,08,L2005-04-12, prenebre,false,
L2005-04-12_menuet,09,L2005-04-12, menuet,false,
L2005-04-12_dopoezda,10,L2005-04-12, dopoezda,false,
L2005-04-12_temapoleta,11,L2005-04-12, temapoleta,false,
L2005-04-12_jachashu,12,L2005-04-12, jachashu,false,
L2005-04-12_ryba,13,L2005-04-12, ryba,false,
L2005-04-12_kovcheg,14,L2005-04-12, kovcheg,false,
---
L2005-04-12_nichemun,15,L2005-04-12, nichemun,false,
L2005-04-12_opyatpar,16,L2005-04-12, opyatpar,false,
L2005-04-12_proscha4,17,L2005-04-12, proscha4,false,
L2005-04-12_trubach,18,L2005-04-12, trubach,false,
L2005-04-12_vpoxodny,19,L2005-04-12, vpoxodny,false,
L2005-04-12_propadu,20,L2005-04-12, propadu,false,
L2005-04-12_sharmans,21,L2005-04-12, sharmans,false,
L2005-04-12_kuznechiki,22,L2005-04-12, kuznechiki,false,
L2005-04-12_chepuxa,23,L2005-04-12, chepuxa,false,

23.03.2005 ср – Москва, рест. "Золотой дракон", клуб "Бард-ретро", юб. Медведенко

19.03.2005 сб – Санкт-Петербург, КЗ "У Финляндского"
L2005-03-19_moekoro3,01,L2005-03-19, moekoro3,false,
L2005-03-19_nerazmen,02,L2005-03-19, nerazmen,false,
L2005-03-19_peshkom,03,L2005-03-19, peshkom,false,
L2005-03-19_volk,04,L2005-03-19, volk,false,
L2005-03-19_kuznechiki,05,L2005-03-19, kuznechiki,false,
L2005-03-19_inicialy,06,L2005-03-19, inicialy,false,
L2005-03-19_nebyvaet,07,L2005-03-19, nebyvaet,false,
L2005-03-19_vishnevo,08,L2005-03-19, vishnevo,false,
L2005-03-19_alliluja,09,L2005-03-19, alliluja,false,
L2005-03-19_trubach,10,L2005-03-19, trubach,false,
L2005-03-19_voslavug,11,L2005-03-19, voslavug,false,
L2005-03-19_1995,12,L2005-03-19, 1995,false,
L2005-03-19_rozhdest,13,L2005-03-19, rozhdest,false,
L2005-03-19_moiraket,14,L2005-03-19, moiraket,false,
L2005-03-19_deja,15,L2005-03-19, deja,false,
---
L2005-03-19_nichemun,16,L2005-03-19, nichemun,false,
L2005-03-19_japodari,17,L2005-03-19, japodari,false,
L2005-03-19_1991,18,L2005-03-19, 1991,false,
L2005-03-19_mneniche,19,L2005-03-19, mneniche,false,
L2005-03-19_uchitel,20,L2005-03-19, uchitel,false,
L2005-03-19_dendensk,21,L2005-03-19, dendensk,false,
L2005-03-19_kinometr,22,L2005-03-19, kinometr,false,
L2005-03-19_pamjativ,23,L2005-03-19, pamjativ,false,
L2005-03-19_piter,24,L2005-03-19, piter,false,
L2005-03-19_proscha4,25,L2005-03-19, proscha4,false,
L2005-03-19_dopoezda,26,L2005-03-19, dopoezda,false,
L2005-03-19_chepuxa,27,L2005-03-19, chepuxa,false,

06.03.2005 вс – Москва, домашний концерт у Ю. Шапиро
L2005-03-06_traviata,01,L2005-03-06, traviata,false,
L2005-03-06_ryba,02,L2005-03-06, ryba,false,
L2005-03-06_japodari,03,L2005-03-06, japodari,false,
L2005-03-06_nebyvaet,04,L2005-03-06, nebyvaet,false,
L2005-03-06_nichemun,05,L2005-03-06, nichemun,false,
L2005-03-06_uchitel,06,L2005-03-06, uchitel,false,
L2005-03-06_rozhdest,07,L2005-03-06, rozhdest,false,
L2005-03-06_kogoljub,08,L2005-03-06, kogoljub,false,
L2005-03-06_aneta,09,L2005-03-06, aneta,false,
L2005-03-06_1995,10,L2005-03-06, 1995,false,
L2005-03-06_chtozane,11,L2005-03-06, chtozane,false,
L2005-03-06_kinometr,12,L2005-03-06, kinometr,false,
L2005-03-06_1991,13,L2005-03-06, 1991,false,
L2005-03-06_etiglaza,14,L2005-03-06, etiglaza,false,
---
L2005-03-06_voslavug,15,L2005-03-06, voslavug,false,
L2005-03-06_orodine,16,L2005-03-06, orodine,false,
L2005-03-06_baltijsk,17,L2005-03-06, baltijsk,false,
L2005-03-06_moiraket,18,L2005-03-06, moiraket,false,
L2005-03-06_opyatpar,19,L2005-03-06, opyatpar,false,
L2005-03-06_piter,20,L2005-03-06, piter,false,
L2005-03-06_trubach,21,L2005-03-06, trubach,false,
L2005-03-06_alliluja,22,L2005-03-06, alliluja,false,
L2005-03-06_dopoezda,23,L2005-03-06, dopoezda,false,
L2005-03-06_chepuxa,24,L2005-03-06, chepuxa,false,

05.02.2005 сб – Москва, бард-клуб "Гнездо глухаря"
L2005-02-05_sharmans,01,L2005-02-05, sharmans,false,
L2005-02-05_kovcheg,02,L2005-02-05, kovcheg,false,
L2005-02-05_descensu,03,L2005-02-05, descensu,false,
L2005-02-05_votpodni,04,L2005-02-05, votpodni,false,
L2005-02-05_1991,05,L2005-02-05, 1991,false,
L2005-02-05_1995,06,L2005-02-05, 1995,false,
L2005-02-05_voslavug,07,L2005-02-05, voslavug,false,
L2005-02-05_mneniche,08,L2005-02-05, mneniche,false,
L2005-02-05_esli,09,L2005-02-05, esli,false,
L2005-02-05_jachashu,10,L2005-02-05, jachashu,false,
L2005-02-05_moekoro3,11,L2005-02-05, moekoro3,false,
L2005-02-05_moekoro2,12,L2005-02-05, moekoro2,false,
L2005-02-05_chtozane,13,L2005-02-05, chtozane,false,
L2005-02-05_piter,14,L2005-02-05, piter,false,
L2005-02-05_dendensk,15,L2005-02-05, dendensk,false,
L2005-02-05_volhonka,16,L2005-02-05, volhonka,false,
---
L2005-02-05_vishnevo,17,L2005-02-05, vishnevo,false,
L2005-02-05_propadu,18,L2005-02-05, propadu,false,
L2005-02-05_stixiopr,19,L2005-02-05, stixiopr,false,
L2005-02-05_volk,20,L2005-02-05, volk,false,
L2005-02-05_ryba,21,L2005-02-05, ryba,false,
L2005-02-05_nerazmen,22,L2005-02-05, nerazmen,false,
L2005-02-05_deja,23,L2005-02-05, deja,false,
L2005-02-05_brodjagi,24,L2005-02-05, brodjagi,false,
L2005-02-05_dopoezda,25,L2005-02-05, dopoezda,false,
L2005-02-05_kuznechiki,26,L2005-02-05, kuznechiki,false,
L2005-02-05_proscha4,27,L2005-02-05, proscha4,false,
L2005-02-05_trubach,28,L2005-02-05, trubach,false,
L2005-02-05_chepuxa,29,L2005-02-05, chepuxa,false,


2004 г. ▼ ▲

22.12.2004 ср – Москва, ДК МГУ (большой зал), "Опять Париж"
L2004-12-22_zhizn,01,L2004-12-22, zhizn,false,
L2004-12-22_sharmans,02,L2004-12-22, sharmans,false,
L2004-12-22_stixiopr,03,L2004-12-22, stixiopr,false,
L2004-12-22_volk,04,L2004-12-22, volk,false,
L2004-12-22_ryba,05,L2004-12-22, ryba,false,
L2004-12-22_chtozane,06,L2004-12-22, chtozane,false,
L2004-12-22_volhonka,07,L2004-12-22, volhonka,false,
L2004-12-22_kuznechiki,08,L2004-12-22, kuznechiki,false,
L2004-12-22_esli,09,L2004-12-22, esli,false,
L2004-12-22_dopoezda,10,L2004-12-22, dopoezda,false,
L2004-12-22_trubach,11,L2004-12-22, trubach,false,
L2004-12-22_nerazmen,12,L2004-12-22, nerazmen,false,
L2004-12-22_jachashu,13,L2004-12-22, jachashu,false,
L2004-12-22_temapoleta,14,L2004-12-22, temapoleta,false,
L2004-12-22_dendensk,15,L2004-12-22, dendensk,false,
L2004-12-22_suhumi,16,L2004-12-22, suhumi,false,
L2004-12-22_krasnye,17,L2004-12-22, krasnye,false,
L2004-12-22_mneniche,18,L2004-12-22, mneniche,false,
L2004-12-22_vpoxodny,19,L2004-12-22, vpoxodny,false,
L2004-12-22_proscha4,20,L2004-12-22, proscha4,false,
L2004-12-22_sentenci,21,L2004-12-22, sentenci,false,

26.11.2004 пт – Москва, Политех, второй акт дуэт (гитара), 4 премьеры
L2004-11-26_zhizn,01,L2004-11-26, zhizn,false,
L2004-11-26_moekoro2,02,L2004-11-26, moekoro2,false,
L2004-11-26_moekoro3,03,L2004-11-26, moekoro3,false,
L2004-11-26_volk,04,L2004-11-26, volk,false,
L2004-11-26_stixiopr,05,L2004-11-26, stixiopr,false,
L2004-11-26_pamjativ,06,L2004-11-26, pamjativ,false,
L2004-11-26_piter,07,L2004-11-26, piter,true,
L2004-11-26_vpoxodny,08,L2004-11-26, vpoxodny,false,
L2004-11-26_trubach,09,L2004-11-26, trubach,false,
L2004-11-26_temapoleta,10,L2004-11-26, temapoleta,false,
L2004-11-26_uchitel,11,L2004-11-26, uchitel,true,
L2004-11-26_nerazmen,12,L2004-11-26, nerazmen,false,
L2004-11-26_mneniche,13,L2004-11-26, mneniche,false,
L2004-11-26_chtozane,14,L2004-11-26, chtozane,true,
L2004-11-26_sentenci,15,L2004-11-26, sentenci,false,
---
L2004-11-26_netridca,16*,L2004-11-26, netridca,false,
L2004-11-26_ishlodiv,17*,L2004-11-26, ishlodiv,false,
L2004-11-26_bereg,18,L2004-11-26, bereg,false,
L2004-11-26_kuznechiki,19,L2004-11-26, kuznechiki,false,
L2004-11-26_romansma,20,L2004-11-26, romansma,false,
L2004-11-26_vtornik,21,L2004-11-26, vtornik,false,
L2004-11-26_ryba,22,L2004-11-26, ryba,false,
L2004-11-26_proscha4,23,L2004-11-26, proscha4,false,
L2004-11-26_dopoezda,24,L2004-11-26, dopoezda,true,
L2004-11-26_opyatpar,25,L2004-11-26, opyatpar,false,
L2004-11-26_kovcheg,26,L2004-11-26, kovcheg,false,

08.11.2004 пн – Жуковский, Дом учёных, ЦАГИ

06.11.2004 сб – Казань, КДК имени В.И. Ленина, фестиваль "Зиланткон"
L2004-11-06_zhizn,01,L2004-11-06, zhizn,false,
L2004-11-06_sharmans,02,L2004-11-06, sharmans,false,
L2004-11-06_kovcheg,03,L2004-11-06, kovcheg,false,
L2004-11-06_rodljuds,04,L2004-11-06, rodljuds,false,
L2004-11-06_temapoleta,05,L2004-11-06, temapoleta,false,
L2004-11-06_zavescha,06,L2004-11-06, zavescha,false,
L2004-11-06_volhonka,07,L2004-11-06, volhonka,false,
L2004-11-06_moekoro2,08,L2004-11-06, moekoro2,false,
L2004-11-06_pamjativ,09,L2004-11-06, pamjativ,false,
L2004-11-06_vpoxodny,10,L2004-11-06, vpoxodny,false,
L2004-11-06_mneniche,11,L2004-11-06, mneniche,false,
L2004-11-06_podzname,12,L2004-11-06, podzname,false,
L2004-11-06_stixiopr,13,L2004-11-06, stixiopr,false,
L2004-11-06_volk,14,L2004-11-06, volk,false,
L2004-11-06_trubach,15,L2004-11-06, trubach,false,
L2004-11-06_alliluja,16,L2004-11-06, alliluja,false,
L2004-11-06_esli,17,L2004-11-06, esli,false,
L2004-11-06_opyatpar,18,L2004-11-06, opyatpar,false,
L2004-11-06_proscha4,19,L2004-11-06, proscha4,false,
L2004-11-06_vishnevo,20,L2004-11-06, vishnevo,false,

22.09.2004 ср – Москва, бард-клуб "Шале"
L2004-09-22_zhizn,01,L2004-09-22, zhizn,false,
L2004-09-22_sharmans,02,L2004-09-22, sharmans,false,
L2004-09-22_kovcheg,03,L2004-09-22, kovcheg,false,
L2004-09-22_rodljuds,04,L2004-09-22, rodljuds,false,
L2004-09-22_temapoleta,05,L2004-09-22, temapoleta,false,
L2004-09-22_moekoro2,06,L2004-09-22, moekoro2,false,
L2004-09-22_trubach,07,L2004-09-22, trubach,false,
L2004-09-22_pamjativ,08,L2004-09-22, pamjativ,false,
L2004-09-22_mneniche,09,L2004-09-22, mneniche,false,
L2004-09-22_kuznechiki,10,L2004-09-22, kuznechiki,false,
L2004-09-22_alliluja,11,L2004-09-22, alliluja,false,
L2004-09-22_proscha4,12,L2004-09-22, proscha4,false,
L2004-09-22_chibis,13,L2004-09-22, chibis,false,
L2004-09-22_propadu,14,L2004-09-22, propadu,false,
L2004-09-22_podzname,15,L2004-09-22, podzname,false,
L2004-09-22_dendensk,16,L2004-09-22, dendensk,false,
L2004-09-22_jachashu,17,L2004-09-22, jachashu,false,
L2004-09-22_esli,18,L2004-09-22, esli,false,
L2004-09-22_stixiopr,19,L2004-09-22, stixiopr,false,
L2004-09-22_ryba,20,L2004-09-22, ryba,false,
L2004-09-22_volk,21,L2004-09-22, volk,false,
L2004-09-22_nerazmen,22,L2004-09-22, nerazmen,false,
L2004-09-22_sentenci,23,L2004-09-22, sentenci,false,

21.05.2004 пт – Санкт-Петербург, КЗ "У Финляндского"
L2004-05-21_zhizn,01,L2004-05-21, zhizn,false,
L2004-05-21_sharmans,02,L2004-05-21, sharmans,false,
L2004-05-21_kovcheg,03,L2004-05-21, kovcheg,false,
L2004-05-21_rodljuds,04,L2004-05-21, rodljuds,false,
L2004-05-21_trubach,05,L2004-05-21, trubach,false,
L2004-05-21_temapoleta,06,L2004-05-21, temapoleta,false,
L2004-05-21_moekoro2,07,L2004-05-21, moekoro2,false,
L2004-05-21_vishnevo,08,L2004-05-21, vishnevo,false,
L2004-05-21_mneniche,09,L2004-05-21, mneniche,false,
L2004-05-21_pamjativ,10,L2004-05-21, pamjativ,false,
L2004-05-21_volk,11,L2004-05-21, volk,false,
L2004-05-21_kuznechiki,12,L2004-05-21, kuznechiki,false,
L2004-05-21_nerazmen,13,L2004-05-21, nerazmen,false,
L2004-05-21_proscha4,14,L2004-05-21, proscha4,false,
L2004-05-21_alliluja,15,L2004-05-21, alliluja,false,
---
L2004-05-21_jachashu,16,L2004-05-21, jachashu,false,
L2004-05-21_krasnye,17,L2004-05-21, krasnye,false,
L2004-05-21_dendensk,18,L2004-05-21, dendensk,false,
L2004-05-21_kinometr,19,L2004-05-21, kinometr,false,
L2004-05-21_stixiopr,20,L2004-05-21, stixiopr,false,
L2004-05-21_ryba,21,L2004-05-21, ryba,false,
L2004-05-21_vpoxodny,22,L2004-05-21, vpoxodny,false,
L2004-05-21_opyatpar,23,L2004-05-21, opyatpar,false,
L2004-05-21_sentenci,24,L2004-05-21, sentenci,false,

06.05.2004 чт – Киев, Дом Учителя
L2004-05-06_alliluja,01,L2004-05-06, alliluja,false,
L2004-05-06_vishnevo,02,L2004-05-06, vishnevo,false,
L2004-05-06_pamjativ,03,L2004-05-06, pamjativ,false,
L2004-05-06_temapoleta,04,L2004-05-06, temapoleta,false,
L2004-05-06_kuznechiki,05,L2004-05-06, kuznechiki,false,
L2004-05-06_zhizn,06,L2004-05-06, zhizn,false,
L2004-05-06_sharmans,07,L2004-05-06, sharmans,false,
L2004-05-06_mneniche,08,L2004-05-06, mneniche,false,
L2004-05-06_inicialy,09,L2004-05-06, inicialy,false,
L2004-05-06_proscha4,10,L2004-05-06, proscha4,false,
---
L2004-05-06_jachashu,11,L2004-05-06, jachashu,false,
L2004-05-06_krasnye,12,L2004-05-06, krasnye,false,
L2004-05-06_dendensk,13,L2004-05-06, dendensk,false,
L2004-05-06_volhonka,14,L2004-05-06, volhonka,false,
L2004-05-06_stixiopr,15,L2004-05-06, stixiopr,false,
L2004-05-06_ryba,16,L2004-05-06, ryba,false,
L2004-05-06_bystrov,17,L2004-05-06, bystrov,false,
L2004-05-06_kinometr,18,L2004-05-06, kinometr,false,
L2004-05-06_podzname,19,L2004-05-06, podzname,false,
L2004-05-06_opyatpar,20,L2004-05-06, opyatpar,false,
L2004-05-06_sentenci,21,L2004-05-06, sentenci,false,

22.04.2004 чт – Москва, Политехнический музей, дуэт (гитара), 3 премьеры
L2004-04-22_sharmans,01,L2004-04-22, sharmans,false,
L2004-04-22_kovcheg,02,L2004-04-22, kovcheg,false,
L2004-04-22_menuet,03,L2004-04-22, menuet,false,
L2004-04-22_farmacev,04,L2004-04-22, farmacev,false,
L2004-04-22_ljubov,05,L2004-04-22, ljubov,false,
L2004-04-22_kibitka,06,L2004-04-22, kibitka,false,
L2004-04-22_adleucon,07,L2004-04-22, adleucon,false,
L2004-04-22_marija,08,L2004-04-22, marija,false,
L2004-04-22_molitva,09,L2004-04-22, molitva,false,
L2004-04-22_ryba,10,L2004-04-22, ryba,false,
L2004-04-22_kalejdos,11,L2004-04-22, kalejdos,false,
L2004-04-22_navsejz1,12,L2004-04-22, navsejz1,false,
L2004-04-22_serenada,13,L2004-04-22, serenada,false,
L2004-04-22_kuznechiki,14,L2004-04-22, kuznechiki,false,
L2004-04-22_eccehomo,15,L2004-04-22, eccehomo,false,
L2004-04-22_proscha4,16,L2004-04-22, proscha4,true,
---
L2004-04-22_jachashu,17,L2004-04-22, jachashu,false,
L2004-04-22_vtornik,18,L2004-04-22, vtornik,false,
L2004-04-22_korablik,19,L2004-04-22, korablik,false,
L2004-04-22_etoja,20,L2004-04-22, etoja,false,
L2004-04-22_voslavug,21,L2004-04-22, voslavug,false,
L2004-04-22_sezondoz,22,L2004-04-22, sezondoz,false,
L2004-04-22_okean,23,L2004-04-22, okean,false,
L2004-04-22_kinometr,24,L2004-04-22, kinometr,true,
L2004-04-22_opyatpar,25,L2004-04-22, opyatpar,true,
L2004-04-22_vosxodja,26,L2004-04-22, vosxodja,false,
L2004-04-22_kolybeln,27,L2004-04-22, kolybeln,false,

18.04.2004 вс – Москва, домашний концерт у В. Палта, дуэт (гитара)

17.04.2004 сб – Москва, домашний концерт у Ю. Шапиро
L2004-04-17_kordebal,01,L2004-04-17, kordebal,false,
L2004-04-17_sentenci,02,L2004-04-17, sentenci,false,
L2004-04-17_istorija,03,L2004-04-17, istorija,false,
L2004-04-17_moekoro2,04,L2004-04-17, moekoro2,false,
L2004-04-17_temapoleta,05,L2004-04-17, temapoleta,false,
L2004-04-17_zavescha,06,L2004-04-17, zavescha,false,
L2004-04-17_podzname,07,L2004-04-17, podzname,false,
L2004-04-17_udachny,08,L2004-04-17, udachny,false,
L2004-04-17_rodljuds,09,L2004-04-17, rodljuds,false,
L2004-04-17_mneniche,10,L2004-04-17, mneniche,false,
L2004-04-17_vishnevo,11,L2004-04-17, vishnevo,false,
L2004-04-17_trubach,12,L2004-04-17, trubach,false,
L2004-04-17_volk,13,L2004-04-17, volk,false,
L2004-04-17_propadu,14,L2004-04-17, propadu,false,
L2004-04-17_panorama,15,L2004-04-17, panorama,false,
L2004-04-17_deja,16,L2004-04-17, deja,false,
L2004-04-17_chibis,17,L2004-04-17, chibis,false,
L2004-04-17_alliluja,18,L2004-04-17, alliluja,false,
L2004-04-17_volhonka,19,L2004-04-17, volhonka,false,
L2004-04-17_esli,20,L2004-04-17, esli,false,
L2004-04-17_moekoro3,21,L2004-04-17, moekoro3,false,
L2004-04-17_inicialy,22,L2004-04-17, inicialy,false,
L2004-04-17_avstrali,23,L2004-04-17, avstrali,false,
L2004-04-17_proscha4,24,L2004-04-17, proscha4,false,

12.02.2004 чт – Москва, ЦАП, премьера
L2004-02-12_sharmans,01,L2004-02-12, sharmans,false,
L2004-02-12_zhizn,02,L2004-02-12, zhizn,false,
L2004-02-12_nerazmen,03,L2004-02-12, nerazmen,false,
L2004-02-12_kovcheg,04,L2004-02-12, kovcheg,false,
L2004-02-12_kuznechiki,05,L2004-02-12, kuznechiki,false,
L2004-02-12_stixiopr,06,L2004-02-12, stixiopr,false,
L2004-02-12_alliluja,07,L2004-02-12, alliluja,false,
L2004-02-12_serenada,08,L2004-02-12, serenada,false,
L2004-02-12_krasnye,09,L2004-02-12, krasnye,false,
L2004-02-12_dendensk,10,L2004-02-12, dendensk,false,
L2004-02-12_volhonka,11,L2004-02-12, volhonka,false,
L2004-02-12_pamjativ,12,L2004-02-12, pamjativ,false,
L2004-02-12_volk,13,L2004-02-12, volk,false,
L2004-02-12_bystrov,14,L2004-02-12, bystrov,false,
L2004-02-12_mneniche,15,L2004-02-12, mneniche,false,
L2004-02-12_trubach,16,L2004-02-12, trubach,false,
L2004-02-12_rodljuds,17,L2004-02-12, rodljuds,false,
L2004-02-12_zavescha,18,L2004-02-12, zavescha,false,
L2004-02-12_suhumi,19,L2004-02-12, suhumi,false,
L2004-02-12_esli,20,L2004-02-12, esli,false,
L2004-02-12_podzname,22,L2004-02-12, podzname,false,
L2004-02-12_temapoleta,22,L2004-02-12, temapoleta,false,
L2004-02-12_vpoxodny,23,L2004-02-12, vpoxodny,false,
L2004-02-12_vishnevo,24,L2004-02-12, vishnevo,false,
L2004-02-12_chibis,25,L2004-02-12, chibis,true,
L2004-02-12_zastolnaya,26,L2004-02-12, zastolnaya,false,

29.01.2004 чт – Израиль, Тель-Авив, зал "Бейт Овед"
L2004-01-29_zhizn,01,L2004-01-29, zhizn,false,
L2004-01-29_nerazmen,02,L2004-01-29, nerazmen,false,
L2004-01-29_votpodni,03,L2004-01-29, votpodni,false,
L2004-01-29_kovcheg,04,L2004-01-29, kovcheg,false,
L2004-01-29_kuznechiki,05,L2004-01-29, kuznechiki,false,
L2004-01-29_dendensk,06,L2004-01-29, dendensk,false,
L2004-01-29_volhonka,07,L2004-01-29, volhonka,false,
L2004-01-29_pamjativ,08,L2004-01-29, pamjativ,false,
L2004-01-29_bystrov,09,L2004-01-29, bystrov,false,
L2004-01-29_temapoleta,10,L2004-01-29, temapoleta,false,
L2004-01-29_stixiopr,11,L2004-01-29, stixiopr,false,
---
L2004-01-29_sharmans,12,L2004-01-29, sharmans,false,
L2004-01-29_podzname,13,L2004-01-29, podzname,false,
L2004-01-29_rodljuds,14,L2004-01-29, rodljuds,false,
L2004-01-29_suhumi,15,L2004-01-29, suhumi,false,
L2004-01-29_zavescha,16,L2004-01-29, zavescha,false,
L2004-01-29_serenada,17,L2004-01-29, serenada,false,
L2004-01-29_esli,18,L2004-01-29, esli,false,
L2004-01-29_mneniche,19,L2004-01-29, mneniche,false,
L2004-01-29_zastolnaya,20,L2004-01-29, zastolnaya,false,
L2004-01-29_avstrali,21,L2004-01-29, avstrali,false,
L2004-01-29_sentenci,22,L2004-01-29, sentenci,false,

28.01.2004 ср – Израиль, Нес-Циона, домашний концерт
L2004-01-28_dendensk,01,L2004-01-28, dendensk,false,
L2004-01-28_pamjativ,02,L2004-01-28, pamjativ,false,
L2004-01-28_bereg,03,L2004-01-28, bereg,false,
L2004-01-28_bystrov,04,L2004-01-28, bystrov,false,
L2004-01-28_sharmans,05,L2004-01-28, sharmans,false,
L2004-01-28_temapoleta,06,L2004-01-28, temapoleta,false,
L2004-01-28_ryba,07,L2004-01-28, ryba,false,
L2004-01-28_stixiopr,08,L2004-01-28, stixiopr,false,
L2004-01-28_podzname,09,L2004-01-28, podzname,false,
L2004-01-28_rodljuds,10,L2004-01-28, rodljuds,false,
L2004-01-28_suhumi,11,L2004-01-28, suhumi,false,
L2004-01-28_zavescha,12,L2004-01-28, zavescha,false,
L2004-01-28_unknown,13,L2004-01-28, unknown,false,
L2004-01-28_nerazmen,14,L2004-01-28, nerazmen,false,

24.01.2004 сб – Израиль, Хайфа, Культурный центр "Beit Aba Khushi"

22.01.2004 чт – Израиль, Иерусалим
L2004-01-22_zhizn,01,L2004-01-22, zhizn,false,
L2004-01-22_nerazmen,02,L2004-01-22, nerazmen,false,
L2004-01-22_votpodni,03,L2004-01-22, votpodni,false,
L2004-01-22_krasnye,04,L2004-01-22, krasnye,false,
L2004-01-22_dendensk,05,L2004-01-22, dendensk,false,
L2004-01-22_volhonka,06,L2004-01-22, volhonka,false,
L2004-01-22_odnazhdy,07,L2004-01-22, odnazhdy,false,
L2004-01-22_serenada,08,L2004-01-22, serenada,false,
L2004-01-22_kuznechiki,09,L2004-01-22, kuznechiki,false,
L2004-01-22_sharmans,10,L2004-01-22, sharmans,false,
L2004-01-22_kupljubi,11,L2004-01-22, kupljubi,false,
L2004-01-22_bystrov,12,L2004-01-22, bystrov,false,
L2004-01-22_volk,13,L2004-01-22, volk,false,
L2004-01-22_alliluja,14,L2004-01-22, alliluja,false,
---
L2004-01-22_rodljuds,15,L2004-01-22, rodljuds,false,
L2004-01-22_temapoleta,16,L2004-01-22, temapoleta,false,
L2004-01-22_stixiopr,17,L2004-01-22, stixiopr,false,
L2004-01-22_pamjativ,18,L2004-01-22, pamjativ,false,
L2004-01-22_esli,19,L2004-01-22, esli,false,
L2004-01-22_suhumi,20,L2004-01-22, suhumi,false,
L2004-01-22_podzname,21,L2004-01-22, podzname,false,
L2004-01-22_panorama,22,L2004-01-22, panorama,false,
L2004-01-22_nemo,23,L2004-01-22, nemo,false,
L2004-01-22_deja,24,L2004-01-22, deja,false,
L2004-01-22_mneniche,25,L2004-01-22, mneniche,false,
L2004-01-22_inicialy,26,L2004-01-22, inicialy,false,
L2004-01-22_zastolnaya,27,L2004-01-22, zastolnaya,false,


2003 г. ▼ ▲

31.10.2003 пт – Москва, Политехнический музей, премьера
L2003-10-31_zhizn,01,L2003-10-31, zhizn,false,
L2003-10-31_nerazmen,02,L2003-10-31, nerazmen,false,
L2003-10-31_votpodni,03,L2003-10-31, votpodni,false,
L2003-10-31_rodljuds,04,L2003-10-31, rodljuds,false,
L2003-10-31_suhumi,05,L2003-10-31, suhumi,false,
L2003-10-31_volhonka,06,L2003-10-31, volhonka,false,
L2003-10-31_dendensk,07,L2003-10-31, dendensk,false,
L2003-10-31_1990,08,L2003-10-31, 1990,false,
L2003-10-31_volk,09,L2003-10-31, volk,false,
L2003-10-31_bystrov,10,L2003-10-31, bystrov,false,
L2003-10-31_sharmans,11,L2003-10-31, sharmans,false,
L2003-10-31_pamjativ,12,L2003-10-31, pamjativ,false,
L2003-10-31_moekoro3,13,L2003-10-31, moekoro3,false,
L2003-10-31_kuznechiki,14,L2003-10-31, kuznechiki,false,
L2003-10-31_mneniche,15,L2003-10-31, mneniche,true,
L2003-10-31_kovcheg,16,L2003-10-31, kovcheg,false,
L2003-10-31_istorija,17,L2003-10-31, istorija,false,
L2003-10-31_deja,18,L2003-10-31, deja,false,
L2003-10-31_inicialy,19,L2003-10-31, inicialy,false,
L2003-10-31_esli,20,L2003-10-31, esli,false,
L2003-10-31_privelse,21,L2003-10-31, privelse,false,
L2003-10-31_zavescha,22,L2003-10-31, zavescha,false,
L2003-10-31_zastolnaya,23,L2003-10-31, zastolnaya,false,
L2003-10-31_sentenci,24,L2003-10-31, sentenci,false,

29.10.2003 ср – Москва, домашний концерт у В. Палта, премьера
L2003-10-29_romans2,01,L2003-10-29, romans2,false,
L2003-10-29_brodjagi,02,L2003-10-29, brodjagi,false,
L2003-10-29_vpoxodny,03,L2003-10-29, vpoxodny,false,
L2003-10-29_temapoleta,04,L2003-10-29, temapoleta,false,
L2003-10-29_prenebre,05,L2003-10-29, prenebre,false,
L2003-10-29_bereg,06,L2003-10-29, bereg,false,
L2003-10-29_poslexol,07,L2003-10-29, poslexol,false,
L2003-10-29_peterbur,08,L2003-10-29, peterbur,false,
L2003-10-29_etodolzh,09,L2003-10-29, etodolzh,false,
L2003-10-29_posledet,10,L2003-10-29, posledet,false,
L2003-10-29_ryba,11,L2003-10-29, ryba,false,
L2003-10-29_natura,12,L2003-10-29, natura,false,
L2003-10-29_kuznechiki,13,L2003-10-29, kuznechiki,false,
L2003-10-29_kordebal,14,L2003-10-29, kordebal,false,
L2003-10-29_nemo,15,L2003-10-29, nemo,false,
L2003-10-29_zastolnaya,16,L2003-10-29, zastolnaya,false,
L2003-10-29_privelse,17,L2003-10-29, privelse,true,
L2003-10-29_esli,18,L2003-10-29, esli,false,
L2003-10-29_volhonka,19,L2003-10-29, volhonka,false,
L2003-10-29_volk,20,L2003-10-29, volk,false,
L2003-10-29_moekoro3,21,L2003-10-29, moekoro3,false,
L2003-10-29_istorija,22,L2003-10-29, istorija,false,
L2003-10-29_inicialy,23,L2003-10-29, inicialy,false,

03.10.2003 пт – Москва, Филипповская школа

08.06.2003 вс – США, Los Angeles, CA

07.06.2003 сб – США, San Diego, CA

06.06.2003 пт – США, Irvine, CA

31.05.2003 сб – США, Sacramento, CA

30.05.2003 пт – США, Palo Alto, CA, Cubberley Community Centre
L2003-05-30_zhizn,01,L2003-05-30, zhizn,false,
L2003-05-30_nerazmen,02,L2003-05-30, nerazmen,false,
L2003-05-30_deja,03,L2003-05-30, deja,false,
L2003-05-30_stixiopr,04,L2003-05-30, stixiopr,false,
L2003-05-30_votpodni,05,L2003-05-30, votpodni,false,
L2003-05-30_zavescha,06,L2003-05-30, zavescha,false,
L2003-05-30_temapoleta,07,L2003-05-30, temapoleta,false,
L2003-05-30_serenada,08,L2003-05-30, serenada,false,
L2003-05-30_kuznechiki,09,L2003-05-30, kuznechiki,false,
L2003-05-30_trubach,10,L2003-05-30, trubach,false,
L2003-05-30_traviata,11,L2003-05-30, traviata,false,
L2003-05-30_duet,12,L2003-05-30, duet,false,
L2003-05-30_podzname,13,L2003-05-30, podzname,false,
L2003-05-30_etiglaza,14,L2003-05-30, etiglaza,false,
---
L2003-05-30_krasnye,15,L2003-05-30, krasnye,false,
L2003-05-30_dendensk,16,L2003-05-30, dendensk,false,
L2003-05-30_odnazhdy,17,L2003-05-30, odnazhdy,false,
L2003-05-30_suhumi,18,L2003-05-30, suhumi,false,
L2003-05-30_kupljubi,19,L2003-05-30, kupljubi,false,
L2003-05-30_volhonka,20,L2003-05-30, volhonka,false,
L2003-05-30_alliluja,21,L2003-05-30, alliluja,false,
L2003-05-30_zastolnaya,22,L2003-05-30, zastolnaya,false,
L2003-05-30_bystrov,23,L2003-05-30, bystrov,false,
L2003-05-30_sentenci,24,L2003-05-30, sentenci,false,

18.05.2003 вс – США, Saint Louis, MO

17.05.2003 сб – США, Chicago, IL, ORT Technical Institute

16.05.2003 пт – США, Milwaukee, WI

15.05.2003 чт – США, Detroit, MI

13.05.2003 вт – США, Cleveland, OH

11.05.2003 вс – США, Ithaca, NY, Cornell Univercity

10.05.2003 сб – США, Pittsburgh, PA

09.05.2003 пт – США, Gaithersburg, MD, Londonderry Apartments

07.05.2003 ср – США, New York, NY

06.05.2003 вт – США, Fair Lawn, NJ

05.05.2003 пн – США, Princeton, NJ

04.05.2003 вс – США, New York, NY

03.05.2003 сб – США, Baltimore, MD

02.05.2003 пт – США, Philadelphia, PA, магазин "Книжник"

30.04.2003 сб – США, Boston, MA, Temple Israel

27.04.2003 вс – США, Hartford, CT

26.04.2003 сб – США, Boston, MA, Temple Israel

25.04.2003 пт – США, Stamford, CT

24.04.2003 чт – США, Morristown, NJ

14.03.2003 пт – Санкт-Петербург, КЗ "У Финляндского", Щербаков и Ким
L2003-03-14_nerazmen,01,L2003-03-14, nerazmen,false,
L2003-03-14_avtoparo,02,L2003-03-14, avtoparo,false,
L2003-03-14_kuznechiki,03,L2003-03-14, kuznechiki,false,
L2003-03-14_serenada,04,L2003-03-14, serenada,false,
L2003-03-14_podzname,05,L2003-03-14, podzname,false,
L2003-03-14_esli,06,L2003-03-14, esli,false,
L2003-03-14_suhumi,07,L2003-03-14, suhumi,false,
L2003-03-14_traviata,08,L2003-03-14, traviata,false,
L2003-03-14_descensu,09,L2003-03-14, descensu,false,
L2003-03-14_nemo,10,L2003-03-14, nemo,false,
L2003-03-14_zavescha,11,L2003-03-14, zavescha,false,
L2003-03-14_zastolnaya,12,L2003-03-14, zastolnaya,false,
---
15.
L2003-03-14_ryba,16,L2003-03-14, ryba,false,
L2003-03-14_volhonka,17,L2003-03-14, volhonka,false,
L2003-03-14_dendensk,18,L2003-03-14, dendensk,false,
L2003-03-14_london,19,L2003-03-14, london,false,
L2003-03-14_udachny,20,L2003-03-14, udachny,false,
L2003-03-14_temapoleta,21,L2003-03-14, temapoleta,false,
L2003-03-14_inicialy,22,L2003-03-14, inicialy,false,
L2003-03-14_bystrov,23,L2003-03-14, bystrov,false,
L2003-03-14_sharmans,24,L2003-03-14, sharmans,false,
L2003-03-14_alliluja,25,L2003-03-14, alliluja,false,
L2003-03-14_zhizn,26,L2003-03-14, zhizn,false,
L2003-03-14_nepokijk,27*,L2003-03-14, (Ю. Ким, М. Щербаков) nepokijk,false,

13.03.2003 чт – Санкт-Петербург, КЗ "У Финляндского", Ким и Щербаков
---
L2003-03-14_popdorog,28*,L2003-03-14, popdorog,false,
L2003-03-14_eiproxoz,29*,L2003-03-14, (Ю. Ким, М. Щербаков) eiproxoz,false,
L2003-03-14_nepokijk,31*,L2003-03-14, (Ю. Ким, М. Щербаков) nepokijk,false,

09.03.2003 вс – Москва, Политехнический музей, второй акт дуэт ()

02.03.2003 вс – домашний концерт, 4 премьеры
L2003-03-02_nerazmen,01,L2003-03-02, nerazmen,false,
L2003-03-02_avtoparo,02,L2003-03-02, avtoparo,false,
L2003-03-02_1991,03,L2003-03-02, 1991,false,
L2003-03-02_esli,04,L2003-03-02, esli,false,
L2003-03-02_podzname,05,L2003-03-02, podzname,false,
L2003-03-02_zastolnaya,06,L2003-03-02, zastolnaya,false,
L2003-03-02_moekoro2,07,L2003-03-02, moekoro2,false,
L2003-03-02_descensu,08,L2003-03-02, descensu,false,
L2003-03-02_kuznechiki,09,L2003-03-02, kuznechiki,false,
L2003-03-02_london,10,L2003-03-02, london,true,
L2003-03-02_1992,11,L2003-03-02, 1992,false,
L2003-03-02_vpoxodny,12,L2003-03-02, vpoxodny,false,
L2003-03-02_udachny,13,L2003-03-02, udachny,false,
L2003-03-02_pamjativ,14,L2003-03-02, pamjativ,false,
L2003-03-02_nemo,15,L2003-03-02, nemo,true,
L2003-03-02_peshkom,16,L2003-03-02, peshkom (не допел),false,
L2003-03-02_vekaplyv,17,L2003-03-02, vekaplyv (не допел),false,
L2003-03-02_serenada,18,L2003-03-02, serenada,false,
L2003-03-02_temapoleta,19,L2003-03-02, temapoleta,false,
L2003-03-02_chepuxa,20,L2003-03-02, chepuxa,false,
L2003-03-02_volhonka,21,L2003-03-02, volhonka,false,
L2003-03-02_traviata,22,L2003-03-02, traviata,true,
L2003-03-02_zavescha,23,L2003-03-02, zavescha,false,
L2003-03-02_interme5,24,L2003-03-02, interme5,true,
L2003-03-02_bystrov,25,L2003-03-02, bystrov,false,
L2003-03-02_zhizn,26,L2003-03-02, zhizn,false,


2002 г. ▼ ▲

01.12.2002 вс – Москва, Политех, "Чтобы помнили", памяти Наташи Юфтяевой
L2002-12-01_nerazmen,01,L2002-12-01, nerazmen,false,
L2002-12-01_kovcheg,02,L2002-12-01, kovcheg,false,
L2002-12-01_suhumi,03,L2002-12-01, suhumi,false,
L2002-12-01_alliluja,04,L2002-12-01, alliluja,false,
L2002-12-01_pamjativ,05,L2002-12-01, pamjativ,false,
L2002-12-01_zastolnaya,06,L2002-12-01, zastolnaya,false,

15.11.2002 пт – Москва, Политехнический музей, дуэт (гитара), 2 премьеры
L2002-11-15_sharmans,01,L2002-11-15, sharmans,false,
L2002-11-15_kovcheg,02,L2002-11-15, kovcheg,false,
L2002-11-15_ryba,03,L2002-11-15, ryba,false,
L2002-11-15_adleucon,04,L2002-11-15, adleucon,false,
L2002-11-15_marija,05,L2002-11-15, marija,false,
L2002-11-15_kuznechiki,06,L2002-11-15, kuznechiki,false,
L2002-11-15_jachashu,07,L2002-11-15, jachashu,false,
L2002-11-15_sezondoz,08,L2002-11-15, sezondoz,false,
L2002-11-15_molitva,09,L2002-11-15, molitva,false,
L2002-11-15_voslavug,10,L2002-11-15, voslavug,false,
L2002-11-15_zhizn,11,L2002-11-15, zhizn,false,
L2002-11-15_esli,12,L2002-11-15, esli,false,
L2002-11-15_suhumi,13,L2002-11-15, suhumi,false,
L2002-11-15_svidanie,14,L2002-11-15, svidanie,false,
L2002-11-15_zastolnaya,15,L2002-11-15, zastolnaya,false,
L2002-11-15_ljubov,16,L2002-11-15, ljubov,false,
---
L2002-11-15_navsejz1,17,L2002-11-15, navsejz1,false,
L2002-11-15_volk,18,L2002-11-15, volk,false,
L2002-11-15_puskaj,19,L2002-11-15, puskaj,false,
L2002-11-15_serenada,20,L2002-11-15, serenada,false,
L2002-11-15_okean,21,L2002-11-15, okean,false,
L2002-11-15_temapoleta,22,L2002-11-15, temapoleta,true,
L2002-11-15_bereg,23,L2002-11-15, bereg,true,
L2002-11-15_korablik,24,L2002-11-15, korablik,false,
L2002-11-15_kolybeln,25,L2002-11-15, kolybeln,false,

12.05.2002 вс – Киев, Музыкальный театр
L2002-05-12_kovcheg,01,L2002-05-12, kovcheg,false,
L2002-05-12_sharmans,02,L2002-05-12, sharmans,false,
L2002-05-12_voslavug,03,L2002-05-12, voslavug,false,
L2002-05-12_kuznechiki,04,L2002-05-12, kuznechiki,false,
L2002-05-12_jachashu,05,L2002-05-12, jachashu,false,
L2002-05-12_vpoxodny,06,L2002-05-12, vpoxodny,false,
L2002-05-12_esli,07,L2002-05-12, esli,false,
L2002-05-12_dendensk,08,L2002-05-12, dendensk,false,
L2002-05-12_odnazhdy,09,L2002-05-12, odnazhdy,false,
L2002-05-12_volhonka,10,L2002-05-12, volhonka,false,
L2002-05-12_avtoparo,11,L2002-05-12, avtoparo,false,
L2002-05-12_moekoro2,12,L2002-05-12, moekoro2,false,
L2002-05-12_zastolnaya,13,L2002-05-12, zastolnaya,false,
L2002-05-12_zhizn,14,L2002-05-12, zhizn,false,
---
L2002-05-12_ryba,15,L2002-05-12, ryba,false,
L2002-05-12_bystrov,16,L2002-05-12, bystrov,false,
L2002-05-12_serenada,17,L2002-05-12, serenada,false,
L2002-05-12_pamjativ,18,L2002-05-12, pamjativ,false,
L2002-05-12_alliluja,19,L2002-05-12, alliluja,false,
L2002-05-12_suhumi,20,L2002-05-12, suhumi,false,
L2002-05-12_nerazmen,21,L2002-05-12, nerazmen,false,

21.04.2002 вс – Санкт-Петербург, КЗ "У Финляндского"

07.04.2002 вс – Харьков

12.04.2002 пт – ???

05.04.2002 пт – Днепропетровск, Дворец национального университета

29.03.2002 пт – Москва, Политехнический музей, дуэт (гитара)
L2002-03-29_kovcheg,01,L2002-03-29, kovcheg,false,
L2002-03-29_sharmans,02,L2002-03-29, sharmans,false,
L2002-03-29_adleucon,03,L2002-03-29, adleucon,false,
L2002-03-29_vekaplyv,04,L2002-03-29, vekaplyv,false,
L2002-03-29_puskaj,05,L2002-03-29, puskaj,false,
L2002-03-29_marija,06,L2002-03-29, marija,false,
L2002-03-29_navsejz1,07,L2002-03-29, navsejz1,false,
L2002-03-29_proschan,08,L2002-03-29, proschan,false,
L2002-03-29_sezondoz,09,L2002-03-29, sezondoz,false,
L2002-03-29_poshlyj,10,L2002-03-29, poshlyj,false,
L2002-03-29_svidanie,11,L2002-03-29, svidanie,false,
L2002-03-29_ljubov,12,L2002-03-29, ljubov,false,
L2002-03-29_ryba,13,L2002-03-29, ryba,false,
L2002-03-29_zhizn,14,L2002-03-29, zhizn,false,
L2002-03-29_esli,15,L2002-03-29, esli,false,
L2002-03-29_suhumi,16,L2002-03-29, suhumi,false,
L2002-03-29_volhonka,17,L2002-03-29, volhonka,false,
L2002-03-29_bystrov,18,L2002-03-29, bystrov,false,
L2002-03-29_zastolnaya,19,L2002-03-29, zastolnaya,false,
L2002-03-29_molitva,20,L2002-03-29, molitva,false,
L2002-03-29_voslavug,21,L2002-03-29, voslavug,false,
L2002-03-29_serenada,22,L2002-03-29, serenada,false,
L2002-03-29_kuznechiki,23,L2002-03-29, kuznechiki,false,
L2002-03-29_okean,24,L2002-03-29, okean,false,
L2002-03-29_vtornik,25,L2002-03-29, vtornik,false,

20.01.2002 вс – США, Palo Alto, СА, JCC


2001 г. ▼ ▲

22.10.2001 пн – Москва, Политехнический музей
L2001-10-22_1992,01,L2001-10-22, 1992,false,
L2001-10-22_romans2,02,L2001-10-22, romans2,false,
L2001-10-22_vechnoes,03,L2001-10-22, vechnoes,false,
L2001-10-22_ubykagol,04,L2001-10-22, ubykagol,false,
L2001-10-22_nebyvaet,05,L2001-10-22, nebyvaet,false,
L2001-10-22_ballada,06,L2001-10-22, ballada,false,
L2001-10-22_propadu,07,L2001-10-22, propadu,false,
L2001-10-22_1990,08,L2001-10-22, 1990,false,
L2001-10-22_dendensk,09,L2001-10-22, dendensk,false,
L2001-10-22_sharmans,10,L2001-10-22, sharmans,false,
L2001-10-22_avtoparo,11,L2001-10-22, avtoparo,false,
L2001-10-22_serenada,12,L2001-10-22, serenada,false,
L2001-10-22_kuznechiki,13,L2001-10-22, kuznechiki,false,
L2001-10-22_andante,14,L2001-10-22, andante,false,
L2001-10-22_popdorog,15*,L2001-10-22, popdorog,false,
L2001-10-22_pustyjeb,16,L2001-10-22, pustyjeb,false,
L2001-10-22_jachashu,17,L2001-10-22, jachashu,false,
L2001-10-22_pamjativ,18,L2001-10-22, pamjativ,false,
L2001-10-22_nichemun,19,L2001-10-22, nichemun,false,
L2001-10-22_farmacev,20,L2001-10-22, farmacev,false,
L2001-10-22_kovcheg,21,L2001-10-22, kovcheg,false,
L2001-10-22_unknown,22,L2001-10-22, unknown,false,

21.10.2001 вс – Москва, домашний концерт у В. Палта, 4 премьеры
L2001-10-21_moekoro2,01,L2001-10-21, moekoro2,false,
L2001-10-21_menuet,02,L2001-10-21, menuet,false,
L2001-10-21_avtoparo,03,L2001-10-21, avtoparo,false,
L2001-10-21_serenada,04,L2001-10-21, serenada,false,
L2001-10-21_duet,05,L2001-10-21, duet,false,
L2001-10-21_tochtoxo,06,L2001-10-21, tochtoxo,false,
L2001-10-21_1991,07,L2001-10-21, 1991,false,
L2001-10-21_kuznechiki,08,L2001-10-21, kuznechiki,false,
L2001-10-21_esli,09,L2001-10-21, esli,false,
L2001-10-21_baltijsk,10,L2001-10-21, baltijsk,false,
L2001-10-21_deja,11,L2001-10-21, deja,false,
L2001-10-21_vrjadli,12,L2001-10-21, vrjadli,false,
L2001-10-21_udachny,13,L2001-10-21, udachny,true,
L2001-10-21_dendensk,14,L2001-10-21, dendensk,false,
L2001-10-21_volhonka,15,L2001-10-21, volhonka,false,
L2001-10-21_descensu,16,L2001-10-21, descensu,false,
L2001-10-21_bystrov,17,L2001-10-21, bystrov,true,
L2001-10-21_zastolnaya,18,L2001-10-21, zastolnaya,true,
L2001-10-21_nerazmen,19,L2001-10-21, nerazmen,false,
L2001-10-21_alliluja,20,L2001-10-21, alliluja,false,
L2001-10-21_suhumi,21,L2001-10-21, suhumi,true,
L2001-10-21_sharmans,22,L2001-10-21, sharmans,false,
L2001-10-21_zhizn,23,L2001-10-21, zhizn,false,

27.05.2001 вс – США, Seattle, WA

25.05.2001 пт – США, Palo Alto, CA, домашний концерт

22.05.2001 вт – США, Denver, CO

20.05.2001 вс – США, Cleveland, OH

19.05.2001 сб – США, Chicago, IL

18.05.2001 пт – США, Detroit, MI

13.05.2001 вс – США, Boston, MA

06.05.2001 вс – США, New York, NY
L2001-05-06_sharmans,01,L2001-05-06, sharmans,false,
L2001-05-06_vechnoes,02,L2001-05-06, vechnoes,false,
L2001-05-06_andante,03,L2001-05-06, andante,false,
L2001-05-06_avtoparo,04,L2001-05-06, avtoparo,false,
L2001-05-06_jachashu,05,L2001-05-06, jachashu,false,
L2001-05-06_pamjativ,06,L2001-05-06, pamjativ,false,
L2001-05-06_serenada,07,L2001-05-06, serenada,false,
L2001-05-06_kuznechiki,08,L2001-05-06, kuznechiki,false,
L2001-05-06_prenebre,09,L2001-05-06, prenebre,false,
L2001-05-06_stixiopr,10,L2001-05-06, stixiopr,false,
L2001-05-06_ubykagol,11,L2001-05-06, ubykagol,false,
L2001-05-06_esli,12,L2001-05-06, esli,false,
L2001-05-06_volhonka,13,L2001-05-06, volhonka,false,
L2001-05-06_1992,14,L2001-05-06, 1992,false,
L2001-05-06_1991,15,L2001-05-06, 1991,false,
L2001-05-06_deja,16,L2001-05-06, deja,false,
L2001-05-06_ryba,17,L2001-05-06, ryba,false,
L2001-05-06_alliluja,18,L2001-05-06, alliluja,false,
L2001-05-06_propadu,19,L2001-05-06, propadu,false,
L2001-05-06_nerazmen,20,L2001-05-06, nerazmen,false,
L2001-05-06_odnazhdy,21,L2001-05-06, odnazhdy,false,
L2001-05-06_chepuxa,22,L2001-05-06, chepuxa,false,
L2001-05-06_dendensk,23,L2001-05-06, dendensk,false,
L2001-05-06_podzname,24,L2001-05-06, podzname,false,
L2001-05-06_zhizn,25,L2001-05-06, zhizn,false,

04.05.2001 пт – США, Ringwood, NJ, 2 премьеры
L2001-05-04_sharmans,01,L2001-05-04, sharmans,false,
L2001-05-04_vechnoes,02,L2001-05-04, vechnoes,false,
L2001-05-04_jachashu,03,L2001-05-04, jachashu,false,
L2001-05-04_pamjativ,04,L2001-05-04, pamjativ,false,
L2001-05-04_serenada,05,L2001-05-04, serenada,false,
L2001-05-04_kuznechiki,06,L2001-05-04, kuznechiki,false,
L2001-05-04_volhonka,07,L2001-05-04, volhonka,true,
L2001-05-04_esli,08,L2001-05-04, esli,true,
L2001-05-04_odnazhdy,09,L2001-05-04, odnazhdy,false,
L2001-05-04_stixiopr,10,L2001-05-04, stixiopr,false,
L2001-05-04_nerazmen,11,L2001-05-04, nerazmen,false,
L2001-05-04_volk,12,L2001-05-04, volk,false,
L2001-05-04_1991,13,L2001-05-04, 1991,false,
L2001-05-04_propadu,14,L2001-05-04, propadu,false,
L2001-05-04_chepuxa,15,L2001-05-04, chepuxa,false,
L2001-05-04_kovcheg,16,L2001-05-04, kovcheg,false,
L2001-05-04_deja,17,L2001-05-04, deja,false,
L2001-05-04_ubykagol,18,L2001-05-04, ubykagol,false,
L2001-05-04_1992,19,L2001-05-04, 1992,false,
L2001-05-04_pustyjeb,20,L2001-05-04, pustyjeb,false,
L2001-05-04_vpoxodny,21,L2001-05-04, vpoxodny,false,
L2001-05-04_alliluja,22,L2001-05-04, alliluja,false,
L2001-05-04_ryba,23,L2001-05-04, ryba,false,
L2001-05-04_zhizn,24,L2001-05-04, zhizn,false,

17.02.2001 сб – Санкт-Петербург, ЛКЗ, премьера
L2001-02-17_sharmans,01,L2001-02-17, sharmans,false,
L2001-02-17_romans2,02,L2001-02-17, romans2,false,
L2001-02-17_jachashu,03,L2001-02-17, jachashu,false,
L2001-02-17_vechnoes,04,L2001-02-17, vechnoes,false,
L2001-02-17_stixiopr,05,L2001-02-17, stixiopr,false,
L2001-02-17_itakdruz,06,L2001-02-17, itakdruz,false,
L2001-02-17_peshkom,07,L2001-02-17, peshkom,false,
L2001-02-17_avtoparo,08,L2001-02-17, avtoparo,false,
L2001-02-17_kuznechiki,09,L2001-02-17, kuznechiki,false,
L2001-02-17_serenada,10,L2001-02-17, serenada,false,
L2001-02-17_vpoxodny,11,L2001-02-17, vpoxodny,false,
L2001-02-17_podzname,12,L2001-02-17, podzname,false,
L2001-02-17_dendensk,13,L2001-02-17, dendensk,false,
L2001-02-17_deja,14,L2001-02-17, deja,false,
L2001-02-17_andante,15,L2001-02-17, andante,false,
L2001-02-17_pustyjeb,16,L2001-02-17, pustyjeb,false,
L2001-02-17_1992,17,L2001-02-17, 1992,false,
L2001-02-17_ballada,18,L2001-02-17, ballada,false,
L2001-02-17_nichemun,19,L2001-02-17, nichemun,false,
L2001-02-17_propadu,20,L2001-02-17, propadu,false,
L2001-02-17_odnazhdy,21,L2001-02-17, odnazhdy,false,
L2001-02-17_nebyvaet,22,L2001-02-17, nebyvaet,false,
L2001-02-17_zhizn,23,L2001-02-17, zhizn,true,

03.02.2001 сб – Протвино
L2001-02-03_sharmans,01,L2001-02-03, sharmans,false,
L2001-02-03_descensu,02,L2001-02-03, descensu,false,
L2001-02-03_vechnoes,03,L2001-02-03, vechnoes,false,
L2001-02-03_romans2,04,L2001-02-03, romans2,false,
L2001-02-03_stixiopr,05,L2001-02-03, stixiopr,false,
L2001-02-03_sentenci,06,L2001-02-03, sentenci,false,
L2001-02-03_moekoro2,07,L2001-02-03, moekoro2,false,
L2001-02-03_zavescha,08,L2001-02-03, zavescha,false,
L2001-02-03_nichemun,09,L2001-02-03, nichemun,false,
L2001-02-03_brodjagi,10,L2001-02-03, brodjagi,false,
L2001-02-03_ubykagol,11,L2001-02-03, ubykagol,false,
L2001-02-03_1990,12,L2001-02-03, 1990,false,
L2001-02-03_alliluja,13,L2001-02-03, alliluja,false,
L2001-02-03_1991,14,L2001-02-03, 1991,false,
L2001-02-03_pamjativ,15,L2001-02-03, pamjativ,false,
L2001-02-03_kovcheg,16,L2001-02-03, kovcheg,false,
L2001-02-03_avtoparo,17,L2001-02-03, avtoparo,false,
L2001-02-03_serenada,18,L2001-02-03, serenada,false,
L2001-02-03_kuznechiki,19,L2001-02-03, kuznechiki,false,
L2001-02-03_1992,20,L2001-02-03, 1992,false,
L2001-02-03_vpoxodny,21,L2001-02-03, vpoxodny,false,
L2001-02-03_dendensk,22,L2001-02-03, dendensk,false,
L2001-02-03_pustyjeb,23,L2001-02-03, pustyjeb,false,
L2001-02-03_chepuxa,24,L2001-02-03, chepuxa,false,
L2001-02-03_ballada,25,L2001-02-03, ballada,false,
L2001-02-03_jachashu,26,L2001-02-03, jachashu,false,
L2001-02-03_trubach,27,L2001-02-03, trubach,false,
L2001-02-03_podzname,28,L2001-02-03, podzname,false,
L2001-02-03_nerazmen,29,L2001-02-03, nerazmen,false,


2000 г. ▼ ▲

22.12.2000 пт – Москва, Политехнический музей, премьера
02.12.2000 пт – Минск, ДК Ветеранов, премьера
26.10.2000 чт – Москва, ЦАТ, второй акт дуэт (гитара), премьера
25.10.2000 ср – Москва, ЦАТ, второй акт дуэт (гитара), 3 премьеры
22.06.2000 чт – Франция, Париж
17.06.2000 сб – Германия, Франкфурт на Майне
16.06.2000 пт – Германия, Вупперталь
14.06.2000 ср – Германия, Ганновер
12.06.2000 пн – Германия, Берлин, Club Voltaire
11.06.2000 вс – Германия, Нюрнберг
10.06.2000 сб – Германия, Мюнхен
24.05.2000 ср – Москва, ЦАТ
19.05.2000 пт – Санкт-Петербург, КЗ "У Финляндского"
13.05.2000 сб – Киев, Дом Учителя
17.02.2000 чт – Израиль, Тель-Авив
16.02.2000 ср – Израиль, Хайфа
11.02.2000 пт – Израиль, Беер-Шева
02.02.2000 ср – Москва, ЦАТ, дуэт (гитара), текст

1999 г. ▼ ▲

25.11.1999 чт – Москва, ЦАТ, благотворительный Юлию Киму, премьера
L1999-11-25_vechnoes,01,L1999-11-25, vechnoes,false,
L1999-11-25_sharmans,02,L1999-11-25, sharmans,false,
L1999-11-25_pustyjeb,03,L1999-11-25, pustyjeb,false,
L1999-11-25_ubykagol,04,L1999-11-25, ubykagol,false,
L1999-11-25_1991,05,L1999-11-25, 1991,false,
L1999-11-25_brodjagi,06,L1999-11-25, brodjagi,false,
L1999-11-25_stixiopr,07,L1999-11-25, stixiopr,false,
L1999-11-25_ryba,08,L1999-11-25, ryba,false,
L1999-11-25_duet,09,L1999-11-25, duet,false,
L1999-11-25_prenebre,10,L1999-11-25, prenebre,false,
L1999-11-25_romans2,11,L1999-11-25, romans2,false,
L1999-11-25_alliluja,12,L1999-11-25, alliluja,false,
L1999-11-25_pamjativ,13,L1999-11-25, pamjativ,false,
L1999-11-25_serenada,14,L1999-11-25, serenada,true,
L1999-11-25_propadu,15,L1999-11-25, propadu,false,
L1999-11-25_panorama,16,L1999-11-25, panorama,false,
L1999-11-25_dendensk,17,L1999-11-25, dendensk,false,
L1999-11-25_chepuxa,18,L1999-11-25, chepuxa,false,
L1999-11-25_sentenci,19,L1999-11-25, sentenci,false,
L1999-11-25_moekoro2,20,L1999-11-25, moekoro2,false,
L1999-11-25_1992,21,L1999-11-25, 1992,false,
L1999-11-25_epilog,22,L1999-11-25, epilog,false,
L1999-11-25_deklarac,23,L1999-11-25, deklarac,false,
L1999-11-25_nerazmen,24,L1999-11-25, nerazmen,false,
L1999-11-25_trubach,25,L1999-11-25, trubach,false,

29.10.1999 пт – США, Hollywood, Los Angeles, CA

17.10.1999 вс – США, Palo Alto, CA, JCC
L1999-10-17_sharmans,01,L1999-10-17, sharmans,false,
L1999-10-17_pustyjeb,02,L1999-10-17, pustyjeb,false,
L1999-10-17_vechnoes,03,L1999-10-17, vechnoes,false,
L1999-10-17_ubykagol,04,L1999-10-17, ubykagol,false,
L1999-10-17_1991,05,L1999-10-17, 1991,false,
L1999-10-17_brodjagi,06,L1999-10-17, brodjagi,false,
L1999-10-17_stixiopr,07,L1999-10-17, stixiopr,false,
L1999-10-17_ryba,08,L1999-10-17, ryba,false,
L1999-10-17_duet,09,L1999-10-17, duet,false,
L1999-10-17_pamjativ,10,L1999-10-17, pamjativ,false,
L1999-10-17_1992,11,L1999-10-17, 1992,false,
L1999-10-17_chepuxa,12,L1999-10-17, chepuxa,false,
---
L1999-10-17_propadu,13,L1999-10-17, propadu,false,
L1999-10-17_dendensk,14,L1999-10-17, dendensk,false,
L1999-10-17_volk,15,L1999-10-17, volk,false,
L1999-10-17_epilog,16,L1999-10-17, epilog,false,
L1999-10-17_romans2,17,L1999-10-17, romans2,false,
L1999-10-17_alliluja,18,L1999-10-17, alliluja,false,
L1999-10-17_zhaloba,19,L1999-10-17, zhaloba,false,
L1999-10-17_farmacev,20,L1999-10-17, farmacev,false,
L1999-10-17_deklarac,21,L1999-10-17, deklarac,false,
L1999-10-17_panorama,22,L1999-10-17, panorama,false,
L1999-10-17_nerazmen,23,L1999-10-17, nerazmen,false,
L1999-10-17_trubach,24,L1999-10-17, trubach,false,

15.10.1999 пт – США, Chicago, IL
L1999-10-15_sharmans,01,L1999-10-15, sharmans,false,
L1999-10-15_pustyjeb,02,L1999-10-15, pustyjeb,false,
L1999-10-15_vechnoes,03,L1999-10-15, vechnoes,false,
L1999-10-15_ubykagol,04,L1999-10-15, ubykagol,false,
L1999-10-15_1991,05,L1999-10-15, 1991,false,
L1999-10-15_brodjagi,06,L1999-10-15, brodjagi,false,
L1999-10-15_stixiopr,07,L1999-10-15, stixiopr,false,
L1999-10-15_ryba,08,L1999-10-15, ryba,false,
L1999-10-15_duet,09,L1999-10-15, duet,false,
L1999-10-15_pamjativ,10,L1999-10-15, pamjativ,false,
L1999-10-15_1992,11,L1999-10-15, 1992,false,
L1999-10-15_chepuxa,12,L1999-10-15, chepuxa,false,
L1999-10-15_propadu,13,L1999-10-15, propadu,false,
L1999-10-15_volk,14,L1999-10-15, volk,false,
L1999-10-15_dendensk,15,L1999-10-15, dendensk,false,
L1999-10-15_avstrali,16,L1999-10-15, avstrali,false,
L1999-10-15_alliluja,17,L1999-10-15, alliluja,false,
L1999-10-15_panorama,18,L1999-10-15, panorama,false,
L1999-10-15_romans2,19,L1999-10-15, romans2,false,
L1999-10-15_nerazmen,20,L1999-10-15, nerazmen,false,
L1999-10-15_trubach,21,L1999-10-15, trubach,false,

08.10.1999 пт – Канада, Toronto, York Woods Library Theatre
L1999-10-08_sharmans,01,L1999-10-08, sharmans,false,
L1999-10-08_pustyjeb,02,L1999-10-08, pustyjeb,false,
L1999-10-08_vechnoes,03,L1999-10-08, vechnoes,false,
L1999-10-08_ubykagol,04,L1999-10-08, ubykagol,false,
L1999-10-08_1991,05,L1999-10-08, 1991,false,
L1999-10-08_brodjagi,06,L1999-10-08, brodjagi,false,
L1999-10-08_stixiopr,07,L1999-10-08, stixiopr,false,
L1999-10-08_ryba,08,L1999-10-08, ryba,false,
L1999-10-08_pamjativ,09,L1999-10-08, pamjativ,false,
L1999-10-08_chepuxa,10,L1999-10-08, chepuxa,false,
L1999-10-08_propadu,11,L1999-10-08, propadu,false,
L1999-10-08_duet,12,L1999-10-08, duet,false,
---
L1999-10-08_1992,13,L1999-10-08, 1992,false,
L1999-10-08_romans2,14,L1999-10-08, romans2,false,
L1999-10-08_dendensk,15,L1999-10-08, dendensk,false,
L1999-10-08_deklarac,16,L1999-10-08, deklarac,false,
L1999-10-08_alliluja,17,L1999-10-08, alliluja,false,
L1999-10-08_epilog,18,L1999-10-08, epilog,false,
L1999-10-08_zhaloba,19,L1999-10-08, zhaloba,false,
L1999-10-08_farmacev,20,L1999-10-08, farmacev,false,
L1999-10-08_nichemun,21,L1999-10-08, nichemun,false,
L1999-10-08_trubach,22,L1999-10-08, trubach,false,
L1999-10-08_nerazmen,23,L1999-10-08, nerazmen,false,

06.10.1999 ср – США, Washington, DC
L1999-10-06_sharmans,01,L1999-10-06, sharmans,false,
L1999-10-06_pustyjeb,02,L1999-10-06, pustyjeb,false,
L1999-10-06_vechnoes,03,L1999-10-06, vechnoes,false,
L1999-10-06_ubykagol,04,L1999-10-06, ubykagol,false,
L1999-10-06_1991,05,L1999-10-06, 1991,false,
L1999-10-06_brodjagi,06,L1999-10-06, brodjagi,false,
L1999-10-06_sentenci,07,L1999-10-06, sentenci,false,
L1999-10-06_moekoro2,08,L1999-10-06, moekoro2,false,
L1999-10-06_zavescha,09,L1999-10-06, zavescha,false,
L1999-10-06_pamjativ,10,L1999-10-06, pamjativ,false,
L1999-10-06_ryba,11,L1999-10-06, ryba,false,
L1999-10-06_stixiopr,12,L1999-10-06, stixiopr,false,
---
L1999-10-06_chepuxa,13,L1999-10-06, chepuxa,false,
L1999-10-06_propadu,14,L1999-10-06, propadu,false,
L1999-10-06_duet,15,L1999-10-06, duet,false,
L1999-10-06_dendensk,16,L1999-10-06, dendensk,false,
L1999-10-06_deklarac,17,L1999-10-06, deklarac,false,
L1999-10-06_romans2,18,L1999-10-06, romans2,false,
L1999-10-06_epilog,19,L1999-10-06, epilog,false,
L1999-10-06_zhaloba,20,L1999-10-06, zhaloba,false,
L1999-10-06_trubach,21,L1999-10-06, trubach,false,

04.10.1999 пн – США, Brooklyn, NY
L1999-10-04_sharmans,01,L1999-10-04, sharmans,false,
L1999-10-04_pustyjeb,02,L1999-10-04, pustyjeb,false,
L1999-10-04_vechnoes,03,L1999-10-04, vechnoes,false,
L1999-10-04_ubykagol,04,L1999-10-04, ubykagol,false,
L1999-10-04_brodjagi,05,L1999-10-04, brodjagi,false,
L1999-10-04_1991,06,L1999-10-04, 1991,false,
L1999-10-04_pamjativ,07,L1999-10-04, pamjativ,false,
L1999-10-04_sentenci,08,L1999-10-04, sentenci,false,
L1999-10-04_moekoro2,09,L1999-10-04, moekoro2,false,
L1999-10-04_stixiopr,10,L1999-10-04, stixiopr,false,
L1999-10-04_ryba,11,L1999-10-04, ryba,false,
L1999-10-04_zhaloba,12,L1999-10-04, zhaloba,false,
---
L1999-10-04_kovcheg,13,L1999-10-04, kovcheg,false,
L1999-10-04_propadu,14,L1999-10-04, propadu,false,
L1999-10-04_duet,15,L1999-10-04, duet,false,
L1999-10-04_dendensk,16,L1999-10-04, dendensk,false,
L1999-10-04_deklarac,17,L1999-10-04, deklarac,false,
L1999-10-04_alliluja,18,L1999-10-04, alliluja,false,
L1999-10-04_descensu,19,L1999-10-04, descensu,false,
L1999-10-04_nichemun,20,L1999-10-04, nichemun,false,
L1999-10-04_chepuxa,21,L1999-10-04, chepuxa,false,
L1999-10-04_nerazmen,22,L1999-10-04, nerazmen,false,
L1999-10-04_trubach,23,L1999-10-04, trubach,false,

02.10.1999 сб – США, New York, NY
L1999-10-02_nichemun,01,L1999-10-02, nichemun,false,
L1999-10-02_romans2,02,L1999-10-02, romans2,false,
L1999-10-02_epilog,03,L1999-10-02, epilog,false,
L1999-10-02_volk,04,L1999-10-02, volk,false,
L1999-10-02_prenebre,05,L1999-10-02, prenebre,false,
L1999-10-02_farmacev,06,L1999-10-02, farmacev,false,
L1999-10-02_svidanie,07,L1999-10-02, svidanie,false,
L1999-10-02_sentenci,08,L1999-10-02, sentenci,false,
L1999-10-02_moekoro2,09,L1999-10-02, moekoro2,false,
L1999-10-02_pamjativ,10,L1999-10-02, pamjativ,false,
L1999-10-02_1992,11,L1999-10-02, 1992,false,
L1999-10-02_dendensk,12,L1999-10-02, dendensk,false,
L1999-10-02_deklarac,13,L1999-10-02, deklarac,false,
L1999-10-02_ubykagol,14,L1999-10-02, ubykagol,false,
L1999-10-02_ljubov,15,L1999-10-02, ljubov,false,
---
L1999-10-02_voslavug,16,L1999-10-02, voslavug,false,
L1999-10-02_panorama,17,L1999-10-02, panorama,false,
L1999-10-02_stixiopr,18,L1999-10-02, stixiopr,false,
L1999-10-02_ryba,19,L1999-10-02, ryba,false,
L1999-10-02_propadu,20,L1999-10-02, propadu,false,
L1999-10-02_nerazmen,21,L1999-10-02, nerazmen,false,
L1999-10-02_alliluja,22,L1999-10-02, alliluja,false,
L1999-10-02_etodolzh,23,L1999-10-02, etodolzh,false,
L1999-10-02_trubach,24,L1999-10-02, trubach,false,
L1999-10-02_chepuxa,25,L1999-10-02, chepuxa,false,

21.09.1999 вт – Санкт-Петербург, ЛКЗ
L1999-09-21_1992,01,L1999-09-21, 1992,false,
L1999-09-21_nichemun,02,L1999-09-21, nichemun,false,
L1999-09-21_ubykagol,03,L1999-09-21, ubykagol,false,
L1999-09-21_propadu,04,L1999-09-21, propadu,false,
L1999-09-21_1991,05,L1999-09-21, 1991,false,
L1999-09-21_brodjagi,06,L1999-09-21, brodjagi,false,
L1999-09-21_avstrali,07,L1999-09-21, avstrali,false,
L1999-09-21_duet,08,L1999-09-21, duet,false,
L1999-09-21_dendensk,09,L1999-09-21, dendensk,false,
L1999-09-21_sharmans,10,L1999-09-21, sharmans,false,
L1999-09-21_moekoro2,11,L1999-09-21, moekoro2,false,
L1999-09-21_sentenci,12,L1999-09-21, sentenci,false,
L1999-09-21_ljubov,13,L1999-09-21, ljubov,false,
L1999-09-21_zavescha,14,L1999-09-21, zavescha,false,
L1999-09-21_pamjativ,15,L1999-09-21, pamjativ,false,
L1999-09-21_chepuxa,16,L1999-09-21, chepuxa,false,
L1999-09-21_pustyjeb,17,L1999-09-21, pustyjeb,false,
L1999-09-21_vechnoes,18,L1999-09-21, vechnoes,false,
L1999-09-21_prenebre,19,L1999-09-21, prenebre,false,
L1999-09-21_epilog,20,L1999-09-21, epilog,false,
L1999-09-21_ryba,21,L1999-09-21, ryba,false,
L1999-09-21_deklarac,22,L1999-09-21, deklarac,false,
L1999-09-21_farmacev,23,L1999-09-21, farmacev,false,
L1999-09-21_trubach,24,L1999-09-21, trubach,false,
L1999-09-21_nerazmen,25,L1999-09-21, nerazmen,false,

20.09.1999 пн – Москва, Политехнический музей
L1999-09-20_nichemun,01,L1999-09-20, nichemun,false,
L1999-09-20_romans2,02,L1999-09-20, romans2,false,
L1999-09-20_brodjagi,03,L1999-09-20, brodjagi,false,
L1999-09-20_diktant,04,L1999-09-20, diktant,false,
L1999-09-20_propadu,05,L1999-09-20, propadu,false,
L1999-09-20_ubykagol,06,L1999-09-20, ubykagol,false,
L1999-09-20_alliluja,07,L1999-09-20, alliluja,false,
L1999-09-20_ryba,08,L1999-09-20, ryba,false,
L1999-09-20_moekoro2,09,L1999-09-20, moekoro2,false,
L1999-09-20_sentenci,10,L1999-09-20, sentenci,false,
L1999-09-20_ljubov,11,L1999-09-20, ljubov,false,
L1999-09-20_zavescha,12,L1999-09-20, zavescha,false,
L1999-09-20_pamjativ,13,L1999-09-20, pamjativ,false,
---
L1999-09-20_1991,14,L1999-09-20, 1991,false,
L1999-09-20_chepuxa,15,L1999-09-20, chepuxa,false,
L1999-09-20_dendensk,16,L1999-09-20, dendensk,false,
L1999-09-20_avstrali,17,L1999-09-20, avstrali,false,
L1999-09-20_duet,18,L1999-09-20, duet,false,
L1999-09-20_epilog,19,L1999-09-20, epilog,false,
L1999-09-20_trubach,20,L1999-09-20, trubach,false,
L1999-09-20_farmacev,21,L1999-09-20, farmacev,false,
L1999-09-20_nerazmen,22,L1999-09-20, nerazmen,false,

25.07.1999 вс – Москва, домашний концерт у Л. Блехера, 2 премьеры
L1999-07-25_sentenci,01,L1999-07-25, sentenci,false,
L1999-07-25_menuet,02,L1999-07-25, menuet,false,
L1999-07-25_moekoro2,03,L1999-07-25, moekoro2,false,
L1999-07-25_zavescha,04,L1999-07-25, zavescha,false,
L1999-07-25_chepuxa,05,L1999-07-25, chepuxa,false,
L1999-07-25_volk,06,L1999-07-25, volk,false,
L1999-07-25_vpoxodny,07,L1999-07-25, vpoxodny,false,
L1999-07-25_sharmans,08,L1999-07-25, sharmans,false,
L1999-07-25_1991,09,L1999-07-25, 1991,false,
L1999-07-25_farmacev,10,L1999-07-25, farmacev,false,
L1999-07-25_duet,11,L1999-07-25, duet,false,
L1999-07-25_vekaplyv,12,L1999-07-25, vekaplyv,false,
L1999-07-25_prenebre,13,L1999-07-25, prenebre,false,
L1999-07-25_pamjativ,14,L1999-07-25, pamjativ (фонограмма),false,
L1999-07-25_descensu,15,L1999-07-25, descensu,false,
L1999-07-25_kogoljub,16,L1999-07-25, kogoljub,false,
L1999-07-25_vbelojmg,17,L1999-07-25, vbelojmg,false,
L1999-07-25_poslexol,18,L1999-07-25, poslexol,false,
L1999-07-25_dendensk,19,L1999-07-25, dendensk,false,
L1999-07-25_1992,20,L1999-07-25, 1992,false,
L1999-07-25_pustyjeb,21,L1999-07-25, pustyjeb,false,
L1999-07-25_jachashu,22,L1999-07-25, jachashu,false,
L1999-07-25_etodolzh,23,L1999-07-25, etodolzh,false,
L1999-07-25_deklarac,24,L1999-07-25, deklarac,false,
L1999-07-25_baltijsk,25,L1999-07-25, baltijsk,false,
L1999-07-25_ubykagol,26,L1999-07-25, ubykagol (фонограмма),false,
L1999-07-25_nerazmen,27,L1999-07-25, nerazmen,true, (фонограмма),false,
L1999-07-25_epilog,28,L1999-07-25, epilog,true, (фонограмма),false,

30.05.1999 вс – Москва, домашний концерт у Л. Блехера
L1999-05-30_1992,01,L1999-05-30, 1992,false,
L1999-05-30_1991,02,L1999-05-30, 1991,false,
L1999-05-30_alliluja,03,L1999-05-30, alliluja,false,
L1999-05-30_dendensk,04,L1999-05-30, dendensk,false,
L1999-05-30_kinemat2,05,L1999-05-30, kinemat2,false,
L1999-05-30_istorija,06,L1999-05-30, istorija,false,
L1999-05-30_drugoe,07,L1999-05-30, drugoe,false,
L1999-05-30_vpoxodny,08,L1999-05-30, vpoxodny,false,
L1999-05-30_rodljuds,09,L1999-05-30, rodljuds,false,
L1999-05-30_kadril,10,L1999-05-30, kadril,false,
L1999-05-30_kogdajab,11,L1999-05-30, kogdajab,false,
L1999-05-30_propadu,12,L1999-05-30, propadu,false,
L1999-05-30_trubach,13,L1999-05-30, trubach,false,
L1999-05-30_inicialy,14,L1999-05-30, inicialy,false,
L1999-05-30_ubykagol,15,L1999-05-30, ubykagol,false,
L1999-05-30_etiglaza,16,L1999-05-30, etiglaza,false,
---
L1999-05-30_voslavug,17,L1999-05-30, voslavug,false,
L1999-05-30_kakojkos,18,L1999-05-30, kakojkos,false,
L1999-05-30_fontanka,19,L1999-05-30, fontanka,false,
L1999-05-30_moiraket,20,L1999-05-30, moiraket,false,
L1999-05-30_jim,21,L1999-05-30, jim,false,
L1999-05-30_vbelojmg,22,L1999-05-30, vbelojmg,false,
L1999-05-30_navescha,23,L1999-05-30, navescha,false,
L1999-05-30_prenebre,24,L1999-05-30, prenebre,false,
L1999-05-30_etodolzh,25,L1999-05-30, etodolzh,false,
L1999-05-30_vrjadli,26,L1999-05-30, vrjadli,false,
L1999-05-30_poslexol,27,L1999-05-30, poslexol,false,
L1999-05-30_baltijsk,28,L1999-05-30, baltijsk,false,
L1999-05-30_paris,29,L1999-05-30, paris,false,
L1999-05-30_pamjativ,30,L1999-05-30, pamjativ (фонограмма),false,

29.05.1999 сб – Москва, домашний концерт у Ю. Шапиро, премьера
L1999-05-29_sharmans,01,L1999-05-29, sharmans,false,
L1999-05-29_pustyjeb,02,L1999-05-29, pustyjeb,false,
L1999-05-29_brodjagi,03,L1999-05-29, brodjagi,false,
L1999-05-29_romans2,04,L1999-05-29, romans2,false,
L1999-05-29_volk,05,L1999-05-29, volk,false,
L1999-05-29_propadu,06,L1999-05-29, propadu,false,
L1999-05-29_trubach,07,L1999-05-29, trubach,false,
L1999-05-29_1992,08,L1999-05-29, 1992,false,
L1999-05-29_ubykagol,09,L1999-05-29, ubykagol,false,
L1999-05-29_moiraket,10,L1999-05-29, moiraket,false,
L1999-05-29_dendensk,11,L1999-05-29, dendensk,false,
L1999-05-29_alliluja,12,L1999-05-29, alliluja,false,
L1999-05-29_1991,13,L1999-05-29, 1991,false,
L1999-05-29_baltijsk,14,L1999-05-29, baltijsk,false,
L1999-05-29_piesa,15,L1999-05-29, piesa,false,
L1999-05-29_kakojkos,16,L1999-05-29, kakojkos,false,
L1999-05-29_nichemun,17,L1999-05-29, nichemun,false,
L1999-05-29_ryba,18,L1999-05-29, ryba,false,
L1999-05-29_poslexol,19,L1999-05-29, poslexol,false,
L1999-05-29_chepuxa,20,L1999-05-29, chepuxa,false,
L1999-05-29_pamjativ,21,L1999-05-29, pamjativ,true,
L1999-05-29_vosxodja,22,L1999-05-29, vosxodja,false,

15.05.1999 сб – Киев
L1999-05-15_kovcheg,01,L1999-05-15, kovcheg,false,
L1999-05-15_sharmans,02,L1999-05-15, sharmans,false,
L1999-05-15_descensu,03,L1999-05-15, descensu,false,
L1999-05-15_1991,04,L1999-05-15, 1991,false,
L1999-05-15_dendensk,05,L1999-05-15, dendensk,false,
L1999-05-15_stixiopr,06,L1999-05-15, stixiopr,false,
L1999-05-15_sentenci,07,L1999-05-15, sentenci,false,
L1999-05-15_svidanie,08,L1999-05-15, svidanie,false,
L1999-05-15_zavescha,09,L1999-05-15, zavescha,false,
L1999-05-15_pustyjeb,10,L1999-05-15, pustyjeb,false,
L1999-05-15_romans2,11,L1999-05-15, romans2,false,
L1999-05-15_alliluja,12,L1999-05-15, alliluja,false,
L1999-05-15_zhaloba,13,L1999-05-15, zhaloba,false,
L1999-05-15_trubach,14,L1999-05-15, trubach,false,
L1999-05-15_vishnevo,15,L1999-05-15, vishnevo,false,
L1999-05-15_propadu,16,L1999-05-15, propadu,false,
L1999-05-15_ubykagol,17,L1999-05-15, ubykagol,false,
L1999-05-15_avstrali,18,L1999-05-15, avstrali,false,
L1999-05-15_ryba,19,L1999-05-15, ryba,false,
L1999-05-15_inicialy,20,L1999-05-15, inicialy,false,
L1999-05-15_korablik,21,L1999-05-15, korablik,false,
L1999-05-15_chepuxa,22,L1999-05-15, chepuxa,false,

26.04.1999 пн – Ростов-на-Дону, Дом офицеров, фестиваль "Ростовский фонарь"
L1999-04-26_kovcheg,01,L1999-04-26, kovcheg,false,
L1999-04-26_sharmans,02,L1999-04-26, sharmans,false,
L1999-04-26_descensu,03,L1999-04-26, descensu,false,
L1999-04-26_1991,04,L1999-04-26, 1991,false,
L1999-04-26_stixiopr,05,L1999-04-26, stixiopr,false,
L1999-04-26_sentenci,06,L1999-04-26, sentenci,false,
L1999-04-26_svidanie,07,L1999-04-26, svidanie,false,
L1999-04-26_zavescha,08,L1999-04-26, zavescha,false,
L1999-04-26_pustyjeb,09,L1999-04-26, pustyjeb,false,
L1999-04-26_romans2,10,L1999-04-26, romans2,false,
L1999-04-26_alliluja,11,L1999-04-26, alliluja,false,
L1999-04-26_zhaloba,12,L1999-04-26, zhaloba,false,
L1999-04-26_trubach,13,L1999-04-26, trubach,false,
---
L1999-04-26_vishnevo,14,L1999-04-26, vishnevo,false,
L1999-04-26_propadu,15,L1999-04-26, propadu,false,
L1999-04-26_dendensk,16,L1999-04-26, dendensk,false,
L1999-04-26_avstrali,17,L1999-04-26, avstrali,false,
L1999-04-26_ubykagol,18,L1999-04-26, ubykagol,false,
L1999-04-26_ryba,19,L1999-04-26, ryba,false,
L1999-04-26_chepuxa,20,L1999-04-26, chepuxa,false,

23.04.1999 пт – Москва, Политехнический музей, второй акт дуэт ()
L1999-04-23_nichemun,01,L1999-04-23, nichemun,false,
L1999-04-23_vishnevo,02,L1999-04-23, vishnevo,false,
L1999-04-23_1991,03,L1999-04-23, 1991,false,
L1999-04-23_rozhdest,04,L1999-04-23, rozhdest,false,
L1999-04-23_volk,05,L1999-04-23, volk,false,
L1999-04-23_pustyjeb,06,L1999-04-23, pustyjeb,false,
L1999-04-23_dendensk,07,L1999-04-23, dendensk,false,
L1999-04-23_diktant,08,L1999-04-23, diktant,false,
L1999-04-23_alliluja,09,L1999-04-23, alliluja,false,
L1999-04-23_propadu,10,L1999-04-23, propadu,false,
L1999-04-23_panorama,11,L1999-04-23, panorama,false,
L1999-04-23_romans2,12,L1999-04-23, romans2,false,
L1999-04-23_trubach,13,L1999-04-23, trubach,false,
---
L1999-04-23_navsejz1,14,L1999-04-23, navsejz1,false,
L1999-04-23_kolybeln,15,L1999-04-23, kolybeln,false,
L1999-04-23_eccehomo,16,L1999-04-23, eccehomo,false,
L1999-04-23_marija,17,L1999-04-23, marija,false,
L1999-04-23_sezondoz,18,L1999-04-23, sezondoz,false,
L1999-04-23_poshlyj,19,L1999-04-23, poshlyj,false,
L1999-04-23_chuzhaj1,20,L1999-04-23, chuzhaj1,false,
L1999-04-23_ryba,21,L1999-04-23, ryba,false,
L1999-04-23_vosxodja,22,L1999-04-23, vosxodja,false,
L1999-04-23_ubykagol,23,L1999-04-23, ubykagol,false,
L1999-04-23_slezazol,24,L1999-04-23, slezazol,false,
L1999-04-23_korablik,25,L1999-04-23, korablik,false,

17.04.1999 сб – Санкт-Петербург, ЛКЗ
L1999-04-17_sharmans,01,L1999-04-17, sharmans,false,
L1999-04-17_1991,02,L1999-04-17, 1991,false,
L1999-04-17_descensu,03,L1999-04-17, descensu,false,
L1999-04-17_rozhdest,04,L1999-04-17, rozhdest,false,
L1999-04-17_dendensk,05,L1999-04-17, dendensk,false,
L1999-04-17_piesa,06,L1999-04-17, piesa,false,
L1999-04-17_sentenci,07,L1999-04-17, sentenci,false,
L1999-04-17_svidanie,08,L1999-04-17, svidanie,false,
L1999-04-17_propadu,09,L1999-04-17, propadu,false,
L1999-04-17_pustyjeb,10,L1999-04-17, pustyjeb,false,
L1999-04-17_romans2,11,L1999-04-17, romans2,false,
L1999-04-17_zavescha,12,L1999-04-17, zavescha,false,
L1999-04-17_nichemun,13,L1999-04-17, nichemun,false,
L1999-04-17_volk,14,L1999-04-17, volk,false,
L1999-04-17_ubykagol,15,L1999-04-17, ubykagol,false,
L1999-04-17_panorama,16,L1999-04-17, panorama,false,
L1999-04-17_ryba,17,L1999-04-17, ryba,false,
L1999-04-17_alliluja,18,L1999-04-17, alliluja,false,
L1999-04-17_inicialy,19,L1999-04-17, inicialy,false,
L1999-04-17_trubach,20,L1999-04-17, trubach,false,

09.04.1999 пт – Екатеринбург
L1999-04-09_kovcheg,01,L1999-04-09, kovcheg,false,
L1999-04-09_sharmans,02,L1999-04-09, sharmans,false,
L1999-04-09_kalejdos,03,L1999-04-09, kalejdos,false,
L1999-04-09_descensu,04,L1999-04-09, descensu,false,
L1999-04-09_stixiopr,05,L1999-04-09, stixiopr,false,
L1999-04-09_svidanie,06,L1999-04-09, svidanie,false,
L1999-04-09_sentenci,07,L1999-04-09, sentenci,false,
L1999-04-09_menuet,08,L1999-04-09, menuet,false,
L1999-04-09_zavescha,09,L1999-04-09, zavescha,false,
L1999-04-09_propadu,10,L1999-04-09, propadu,false,
L1999-04-09_1991,11,L1999-04-09, 1991,false,
L1999-04-09_pustyjeb,12,L1999-04-09, pustyjeb,false,
L1999-04-09_romans2,13,L1999-04-09, romans2,false,
L1999-04-09_alliluja,14,L1999-04-09, alliluja,false,
L1999-04-09_vishnevo,15,L1999-04-09, vishnevo,false,
L1999-04-09_trubach,16,L1999-04-09, trubach,false,
L1999-04-09_nichemun,17,L1999-04-09, nichemun,false,
L1999-04-09_diktant,18,L1999-04-09, diktant,false,
L1999-04-09_zaklinan,19,L1999-04-09, zaklinan,false,
L1999-04-09_ryba,20,L1999-04-09, ryba,false,
L1999-04-09_avstrali,21,L1999-04-09, avstrali,false,
L1999-04-09_brodjagi,22,L1999-04-09, brodjagi,false,
L1999-04-09_inicialy,23,L1999-04-09, inicialy,false,
L1999-04-09_vtornik,24,L1999-04-09, vtornik,false,
L1999-04-09_chepuxa,25,L1999-04-09, chepuxa,false,

26.03.1999 пт – Москва, ЦАТ, дуэт (), 2 премьеры
L1999-03-26_kovcheg,01,L1999-03-26, kovcheg,false,
L1999-03-26_sharmans,02,L1999-03-26, sharmans,false,
L1999-03-26_kalejdos,03,L1999-03-26, kalejdos,false,
L1999-03-26_eccehomo,04,L1999-03-26, eccehomo,false,
L1999-03-26_navsejz1,05,L1999-03-26, navsejz1,false,
L1999-03-26_marija,06,L1999-03-26, marija,false,
L1999-03-26_chuzhaj1,07,L1999-03-26, chuzhaj1,false,
L1999-03-26_vekaplyv,08,L1999-03-26, vekaplyv,false,
L1999-03-26_poshlyj,09,L1999-03-26, poshlyj,false,
L1999-03-26_sezondoz,10,L1999-03-26, sezondoz,false,
L1999-03-26_kolybeln,11,L1999-03-26, kolybeln,false,
L1999-03-26_kibitka,12,L1999-03-26, kibitka,false,
L1999-03-26_vtornik,13,L1999-03-26, vtornik,false,
L1999-03-26_svidanie,14,L1999-03-26, svidanie,false,
L1999-03-26_ljubov,15,L1999-03-26, ljubov,false,
L1999-03-26_ryba,16,L1999-03-26, ryba,false,
L1999-03-26_vosxodja,17,L1999-03-26, vosxodja,false,
L1999-03-26_interme3,18,L1999-03-26, interme3,false,
L1999-03-26_korablik,19,L1999-03-26, korablik,false,
L1999-03-26_ubykagol,20,L1999-03-26, ubykagol,true,
L1999-03-26_etoja,21,L1999-03-26, etoja,false,
L1999-03-26_slezazol,22,L1999-03-26, slezazol,true,
L1999-03-26_avstrali,23,L1999-03-26, avstrali,false,
L1999-03-26_balagan2,24,L1999-03-26, balagan2,false,

20.02.1999 сб – Москва, театр "Перекрёсток"
L1999-02-20_sharmans,01,L1999-02-20, sharmans,false,
L1999-02-20_descensu,02,L1999-02-20, descensu,false,
L1999-02-20_menuet,03,L1999-02-20, menuet,false,
L1999-02-20_svidanie,04,L1999-02-20, svidanie,false,
L1999-02-20_sentenci,05,L1999-02-20, sentenci,false,
L1999-02-20_zavescha,06,L1999-02-20, zavescha,false,
L1999-02-20_stixiopr,07,L1999-02-20, stixiopr,false,
L1999-02-20_voslavug,08,L1999-02-20, voslavug,false,
L1999-02-20_kalejdos,09,L1999-02-20, kalejdos,false,
L1999-02-20_nichemun,10,L1999-02-20, nichemun,false,
L1999-02-20_diktant,11,L1999-02-20, diktant,false,
L1999-02-20_pustyjeb,12,L1999-02-20, pustyjeb,false,
L1999-02-20_alliluja,13,L1999-02-20, alliluja,false,
L1999-02-20_panorama,14,L1999-02-20, panorama,false,
L1999-02-20_dendensk,15,L1999-02-20, dendensk,false,
L1999-02-20_volk,16,L1999-02-20, volk,false,
L1999-02-20_chepuxa,17,L1999-02-20, chepuxa,false,
L1999-02-20_vtornik,18,L1999-02-20, vtornik,false,


1998 г. ▼ ▲

12.12.1998 сб – Москва, домашний концерт у Л. Блехера, премьера
L1998-12-12_kinemat2,01,L1998-12-12, kinemat2,false,
L1998-12-12_kibitka,02,L1998-12-12, kibitka,false,
L1998-12-12_kadril,03,L1998-12-12, kadril,false,
L1998-12-12_eschemla,04,L1998-12-12, eschemla,false,
L1998-12-12_cirkachk,05,L1998-12-12, cirkachk,false,
L1998-12-12_rusalka,06,L1998-12-12, rusalka,false,
L1998-12-12_proschan,07,L1998-12-12, proschan,false,
L1998-12-12_kogdajab,08,L1998-12-12, kogdajab,false,
L1998-12-12_aneta,09,L1998-12-12, aneta,false,
L1998-12-12_panorama,10,L1998-12-12, panorama,false,
L1998-12-12_drugoe,11,L1998-12-12, drugoe,false,
L1998-12-12_paris,12,L1998-12-12, paris,false,
L1998-12-12_volk,13,L1998-12-12, volk,false,
L1998-12-12_shkolat2,14,L1998-12-12, shkolat2,false,
L1998-12-12_natura,15,L1998-12-12, natura,false,
L1998-12-12_menuet,16,L1998-12-12, menuet,false,
L1998-12-12_chuzhaj2,17,L1998-12-12, chuzhaj2,false,
L1998-12-12_propadu,18,L1998-12-12, propadu,false,
L1998-12-12_kordebal,19,L1998-12-12, kordebal,false,
L1998-12-12_dendensk,20,L1998-12-12, dendensk,false,
L1998-12-12_nadpis,21,L1998-12-12, nadpis,false,
L1998-12-12_nochnoj,22,L1998-12-12, nochnoj,true,
L1998-12-12_kogoljub,23,L1998-12-12, kogoljub,false,
L1998-12-12_kinemat1,24,L1998-12-12, kinemat1,false,
L1998-12-12_ryba,25,L1998-12-12, ryba,false,
L1998-12-12_vtornik,26,L1998-12-12, vtornik,false,

11.12.1998 пт – Москва, Олимпийская деревня
L1998-12-11_sharmans,01,L1998-12-11, sharmans,false,
L1998-12-11_kovcheg,02,L1998-12-11, kovcheg,false,
L1998-12-11_stixiopr,03,L1998-12-11, stixiopr,false,
L1998-12-11_sentenci,04,L1998-12-11, sentenci,false,
L1998-12-11_svidanie,05,L1998-12-11, svidanie,false,
L1998-12-11_zavescha,06,L1998-12-11, zavescha,false,
L1998-12-11_descensu,07,L1998-12-11, descensu,false,
L1998-12-11_zhaloba,08,L1998-12-11, zhaloba,false,
L1998-12-11_vishnevo,09,L1998-12-11, vishnevo,false,
L1998-12-11_kalejdos,10,L1998-12-11, kalejdos,false,
L1998-12-11_ryba,11,L1998-12-11, ryba,false,
L1998-12-11_lunnaja,12,L1998-12-11, lunnaja,false,
L1998-12-11_romans2,13,L1998-12-11, romans2,false,
L1998-12-11_alliluja,14,L1998-12-11, alliluja,false,
L1998-12-11_propadu,15,L1998-12-11, propadu,false,
L1998-12-11_krasnye,16,L1998-12-11, krasnye,false,
L1998-12-11_dendensk,17,L1998-12-11, dendensk,false,
L1998-12-11_1991,18,L1998-12-11, 1991,false,
L1998-12-11_inicialy,19,L1998-12-11, inicialy,false,
L1998-12-11_nichemun,20,L1998-12-11, nichemun,false,
L1998-12-11_avstrali,21,L1998-12-11, avstrali,false,

22.11.1998 вс – Тверь
L1998-11-22_sharmans,01,L1998-11-22, sharmans,false,
L1998-11-22_kovcheg,02,L1998-11-22, kovcheg,false,
L1998-11-22_stixiopr,03,L1998-11-22, stixiopr,false,
L1998-11-22_sentenci,04,L1998-11-22, sentenci,false,
L1998-11-22_svidanie,05,L1998-11-22, svidanie,false,
L1998-11-22_zavescha,06,L1998-11-22, zavescha,false,
L1998-11-22_descensu,07,L1998-11-22, descensu,false,
L1998-11-22_zhaloba,08,L1998-11-22, zhaloba,false,
L1998-11-22_vishnevo,09,L1998-11-22, vishnevo,false,
L1998-11-22_kalejdos,10,L1998-11-22, kalejdos,false,
L1998-11-22_podzname,11,L1998-11-22, podzname,false,
L1998-11-22_trubach,12,L1998-11-22, trubach,false,
L1998-11-22_ryba,13,L1998-11-22, ryba,false,
L1998-11-22_avstrali,14,L1998-11-22, avstrali,false,
L1998-11-22_propadu,15,L1998-11-22, propadu,false,
L1998-11-22_inicialy,16,L1998-11-22, inicialy,false,
L1998-11-22_piesa,17,L1998-11-22, piesa,false,
L1998-11-22_alliluja,18,L1998-11-22, alliluja,false,
L1998-11-22_romans2,19,L1998-11-22, romans2,false,
L1998-11-22_1991,20,L1998-11-22, 1991,false,
L1998-11-22_dendensk,21,L1998-11-22, dendensk,false,
L1998-11-22_chepuxa,22,L1998-11-22, chepuxa,false,

21.11.1998 сб – Санкт-Петербург, ЛКЗ
L1998-11-21_sharmans,01,L1998-11-21, sharmans,false,
L1998-11-21_chepuxa,02,L1998-11-21, chepuxa,false,
L1998-11-21_kovcheg,03,L1998-11-21, kovcheg,false,
L1998-11-21_stixiopr,04,L1998-11-21, stixiopr,false,
L1998-11-21_sentenci,05,L1998-11-21, sentenci,false,
L1998-11-21_svidanie,06,L1998-11-21, svidanie,false,
L1998-11-21_zavescha,07,L1998-11-21, zavescha,false,
L1998-11-21_propadu,08,L1998-11-21, propadu,false,
L1998-11-21_interme4,09,L1998-11-21, interme4,false,
L1998-11-21_chuzhaj2,10,L1998-11-21, chuzhaj2,false,
L1998-11-21_ryba,11,L1998-11-21, ryba,false,
L1998-11-21_alliluja,12,L1998-11-21, alliluja,false,
L1998-11-21_romans2,13,L1998-11-21, romans2,false,
L1998-11-21_inicialy,14,L1998-11-21, inicialy,false,
L1998-11-21_dendensk,15,L1998-11-21, dendensk,false,
L1998-11-21_vtornik,16,L1998-11-21, vtornik,false,
L1998-11-21_krasnye,17,L1998-11-21, krasnye,false,

20.11.1998 пт – Москва, Политехнический музей, 2 премьеры
L1998-11-20_sharmans,01,L1998-11-20, sharmans,false,
L1998-11-20_chepuxa,02,L1998-11-20, chepuxa,false,
L1998-11-20_kovcheg,03,L1998-11-20, kovcheg,false,
L1998-11-20_stixiopr,04,L1998-11-20, stixiopr,false,
L1998-11-20_chuzhaj1,05,L1998-11-20, chuzhaj1,false,
L1998-11-20_sentenci,06,L1998-11-20, sentenci,false,
L1998-11-20_svidanie,07,L1998-11-20, svidanie,false,
L1998-11-20_zavescha,08,L1998-11-20, zavescha,false,
L1998-11-20_lunnaja,09,L1998-11-20, lunnaja,false,
L1998-11-20_chuzhaj2,10,L1998-11-20, chuzhaj2,false,
L1998-11-20_alliluja,11,L1998-11-20, alliluja,false,
L1998-11-20_romans2,12,L1998-11-20, romans2,false,
L1998-11-20_interme4,13,L1998-11-20, interme4,true,
L1998-11-20_inicialy,14,L1998-11-20, inicialy,false,
---
L1998-11-20_ryba,15,L1998-11-20, ryba,false,
L1998-11-20_propadu,16,L1998-11-20, propadu,false,
L1998-11-20_piesa,17,L1998-11-20, piesa,false,
L1998-11-20_krasnye,18,L1998-11-20, krasnye,false,
L1998-11-20_dendensk,19,L1998-11-20, dendensk,true,
L1998-11-20_descensu,20,L1998-11-20, descensu,false,
L1998-11-20_peshkom,21,L1998-11-20, peshkom,false,
L1998-11-20_vtornik,22,L1998-11-20, vtornik,false,

13.11.1998 пт – Минск, ДК Ветеранов
L1998-11-13_chepuxa,01,L1998-11-13, chepuxa,false,
L1998-11-13_sharmans,02,L1998-11-13, sharmans,false,
L1998-11-13_kovcheg,03,L1998-11-13, kovcheg,false,
L1998-11-13_zhaloba,04,L1998-11-13, zhaloba,false,
L1998-11-13_sentenci,05,L1998-11-13, sentenci,false,
L1998-11-13_svidanie,06,L1998-11-13, svidanie,false,
L1998-11-13_zavescha,07,L1998-11-13, zavescha,false,
L1998-11-13_stixiopr,08,L1998-11-13, stixiopr,false,
L1998-11-13_chuzhaj1,09,L1998-11-13, chuzhaj1,false,
L1998-11-13_kalejdos,10,L1998-11-13, kalejdos,false,
L1998-11-13_propadu,11,L1998-11-13, propadu,false,
L1998-11-13_chuzhaj2,12,L1998-11-13, chuzhaj2,false,
L1998-11-13_krasnye,13,L1998-11-13, krasnye,false,
L1998-11-13_voslavug,14,L1998-11-13, voslavug,false,
---
L1998-11-13_alliluja,15,L1998-11-13, alliluja,false,
L1998-11-13_romans2,16,L1998-11-13, romans2 (аранжировка Романс 1),false,
L1998-11-13_etoneja,17,L1998-11-13, etoneja,false,
L1998-11-13_1991,18,L1998-11-13, 1991,false,
L1998-11-13_inicialy,19,L1998-11-13, inicialy,false,
L1998-11-13_avstrali,20,L1998-11-13, avstrali,false,
L1998-11-13_ryba,21,L1998-11-13, ryba,false,
L1998-11-13_vrjadli,22,L1998-11-13, vrjadli,false,
L1998-11-13_peshkom,23,L1998-11-13, peshkom,false,

01.10.1998 чт – Москва, ЦАТ, 2 премьеры
L1998-10-01_chepuxa,01,L1998-10-01, chepuxa,false,
L1998-10-01_sharmans,02,L1998-10-01, sharmans,false,
L1998-10-01_kovcheg,03,L1998-10-01, kovcheg,false,
L1998-10-01_chuzhaj1,04,L1998-10-01, chuzhaj1,false,
L1998-10-01_kalejdos,05,L1998-10-01, kalejdos,false,
L1998-10-01_sentenci,06,L1998-10-01, sentenci,false,
L1998-10-01_svidanie,07,L1998-10-01, svidanie,false,
L1998-10-01_zavescha,08,L1998-10-01, zavescha,false,
L1998-10-01_stixiopr,09,L1998-10-01, stixiopr,false,
L1998-10-01_vrjadli,10,L1998-10-01, vrjadli,false,
L1998-10-01_inicialy,11,L1998-10-01, inicialy,false,
L1998-10-01_1991,12,L1998-10-01, 1991,false,
L1998-10-01_piesa,13,L1998-10-01, piesa,false,
L1998-10-01_propadu,14,L1998-10-01, propadu,true,
L1998-10-01_krasnye,15,L1998-10-01, krasnye,false,
L1998-10-01_voslavug,16,L1998-10-01, voslavug,false,
L1998-10-01_alliluja,17,L1998-10-01, alliluja,false,
L1998-10-01_romans2,18,L1998-10-01, romans2,false,
L1998-10-01_etoneja,19,L1998-10-01, etoneja,false,
L1998-10-01_etodolzh,20,L1998-10-01, etodolzh,false,
L1998-10-01_cirkachk,21,L1998-10-01, cirkachk,false,
L1998-10-01_vtornik,22,L1998-10-01, vtornik,false,
L1998-10-01_zhaloba,23,L1998-10-01, zhaloba,false,
L1998-10-01_lunnaja,24,L1998-10-01, lunnaja,true,

21.05.1998 чт – Москва, ЦАТ
L1998-05-21_peshkom,01,L1998-05-21, peshkom,false,
L1998-05-21_sharmans,02,L1998-05-21, sharmans,false,
L1998-05-21_stixiopr,03,L1998-05-21, stixiopr,false,
L1998-05-21_krasnye,04,L1998-05-21, krasnye,false,
L1998-05-21_theraven,05,L1998-05-21, theraven,false,
L1998-05-21_zavescha,06,L1998-05-21, zavescha,false,
L1998-05-21_1992,07,L1998-05-21, 1992,false,
L1998-05-21_rozhdest,08,L1998-05-21, rozhdest,false,
L1998-05-21_piesa,09,L1998-05-21, piesa,false,
L1998-05-21_avstrali,10,L1998-05-21, avstrali,false,
L1998-05-21_alliluja,11,L1998-05-21, alliluja,false,
L1998-05-21_zhaloba,12,L1998-05-21, zhaloba,false,
L1998-05-21_rodljuds,13,L1998-05-21, rodljuds,false,
L1998-05-21_kinemat1,14,L1998-05-21, kinemat1,false,
L1998-05-21_kovcheg,15,L1998-05-21, kovcheg,false,
L1998-05-21_inicialy,16,L1998-05-21, inicialy,false,
L1998-05-21_etiglaza,17,L1998-05-21, etiglaza,false,
L1998-05-21_ryba,18,L1998-05-21, ryba,false,

07.05.1998 чт – Москва, ЦДХ
L1998-05-07_descensu,01,L1998-05-07, descensu,false,
L1998-05-07_tochtoxo,02,L1998-05-07, tochtoxo,false,
L1998-05-07_moekoro3,03,L1998-05-07, moekoro3,false,
L1998-05-07_chuzhaj1,04,L1998-05-07, chuzhaj1,false,
L1998-05-07_kakojkos,05,L1998-05-07, kakojkos,false,
L1998-05-07_pustyjeb,06,L1998-05-07, pustyjeb,false,
L1998-05-07_jachashu,07,L1998-05-07, jachashu,false,
L1998-05-07_trubach,08,L1998-05-07, trubach,false,
L1998-05-07_inicialy,09,L1998-05-07, inicialy,false,
L1998-05-07_1991,10,L1998-05-07, 1991,false,
L1998-05-07_rodljuds,11,L1998-05-07, rodljuds,false,
L1998-05-07_brodjagi,12,L1998-05-07, brodjagi,false,
L1998-05-07_paris,13,L1998-05-07, paris,false,
L1998-05-07_krasnye,14,L1998-05-07, krasnye,false,
L1998-05-07_panorama,15,L1998-05-07, panorama,false,
L1998-05-07_kovcheg,16,L1998-05-07, kovcheg,false,
L1998-05-07_ryba,17,L1998-05-07, ryba,false,
L1998-05-07_zhaloba,18,L1998-05-07, zhaloba,false,
L1998-05-07_chepuxa,19,L1998-05-07, chepuxa,false,

26.04.1998 вс – Санкт-Петербург, ЛКЗ
L1998-04-26_descensu,01,L1998-04-26, descensu,false,
L1998-04-26_moekoro3,02,L1998-04-26, moekoro3,false,
L1998-04-26_chuzhaj1,03,L1998-04-26, chuzhaj1,false,
L1998-04-26_pustyjeb,04,L1998-04-26, pustyjeb,false,
L1998-04-26_jachashu,05,L1998-04-26, jachashu,false,
L1998-04-26_trubach,06,L1998-04-26, trubach,false,
L1998-04-26_brodjagi,07,L1998-04-26, brodjagi,false,
L1998-04-26_istorija,08,L1998-04-26, istorija,false,
L1998-04-26_fontanka,09,L1998-04-26, fontanka,false,
L1998-04-26_paris,10,L1998-04-26, paris,false,
L1998-04-26_kovcheg,11,L1998-04-26, kovcheg,false,
L1998-04-26_krasnye,12,L1998-04-26, krasnye,false,
L1998-04-26_piesa,13,L1998-04-26, piesa,false,
L1998-04-26_zhaloba,14,L1998-04-26, zhaloba,false,
L1998-04-26_ryba,15,L1998-04-26, ryba,false,
L1998-04-26_chepuxa,16,L1998-04-26, chepuxa,false,

15.02.1998 вс – Израль, Хайфа
L1998-02-15_nichemun,01,L1998-02-15, nichemun,false,
L1998-02-15_descensu,02,L1998-02-15, descensu,false,
L1998-02-15_kalejdos,03,L1998-02-15, kalejdos,false,
L1998-02-15_fontanka,04,L1998-02-15, fontanka,false,
L1998-02-15_chuzhaj1,05,L1998-02-15, chuzhaj1,false,
L1998-02-15_ochnulsj,06,L1998-02-15, ochnulsj,false,
L1998-02-15_inicialy,07,L1998-02-15, inicialy,false,
L1998-02-15_zaklinan,08,L1998-02-15, zaklinan,false,
L1998-02-15_krasnye,09,L1998-02-15, krasnye,false,
L1998-02-15_kovcheg,10,L1998-02-15, kovcheg,false,
L1998-02-15_ryba,11,L1998-02-15, ryba,false,
L1998-02-15_zhaloba,12,L1998-02-15, zhaloba,false,
L1998-02-15_avtoparo,13,L1998-02-15, avtoparo,false,
---
L1998-02-15_menuet,14,L1998-02-15, menuet,false,
L1998-02-15_svidanie,15,L1998-02-15, svidanie,false,
L1998-02-15_zavescha,16,L1998-02-15, zavescha,false,
L1998-02-15_sharmans,17,L1998-02-15, sharmans,false,
L1998-02-15_alliluja,18,L1998-02-15, alliluja,false,
L1998-02-15_etiglaza,19,L1998-02-15, etiglaza,false,
L1998-02-15_panorama,20,L1998-02-15, panorama,false,
L1998-02-15_baltijsk,21,L1998-02-15, baltijsk,false,
L1998-02-15_vtornik,22,L1998-02-15, vtornik,false,
L1998-02-15_sentenci,23,L1998-02-15, sentenci,false,
L1998-02-15_chepuxa,24,L1998-02-15, chepuxa,false,

06.02.1998 пт – Москва, Политехнический музей, 2 премьеры
L1998-02-06_nichemun,01,L1998-02-06, nichemun,false,
L1998-02-06_descensu,02,L1998-02-06, descensu,false,
L1998-02-06_kalejdos,03,L1998-02-06, kalejdos,false,
L1998-02-06_fontanka,04,L1998-02-06, fontanka,false,
L1998-02-06_ochnulsj,05,L1998-02-06, ochnulsj,false,
L1998-02-06_krasnye,06,L1998-02-06, krasnye,false,
L1998-02-06_vekaplyv,07,L1998-02-06, vekaplyv,false,
L1998-02-06_chuzhaj1,08,L1998-02-06, chuzhaj1,false,
L1998-02-06_inicialy,09,L1998-02-06, inicialy,false,
L1998-02-06_zaklinan,10,L1998-02-06, zaklinan,false,
L1998-02-06_ryba,11,L1998-02-06, ryba,false,
L1998-02-06_zavescha,12,L1998-02-06, zavescha,false,
L1998-02-06_panorama,13,L1998-02-06, panorama,false,
L1998-02-06_zhaloba,14,L1998-02-06, zhaloba,true,
L1998-02-06_vtornik,15,L1998-02-06, vtornik,false,
L1998-02-06_baltijsk,16,L1998-02-06, baltijsk,false,
L1998-02-06_zvezdoch,17,L1998-02-06, zvezdoch,true,
L1998-02-06_1992,18,L1998-02-06, 1992,false,
L1998-02-06_menuet,19,L1998-02-06, menuet,false,
L1998-02-06_chepuxa,20,L1998-02-06, chepuxa,false,

25.01.1998 вс – Новосибирск, Академгородок
L1998-01-25_kovcheg,01,L1998-01-25, kovcheg,false,
L1998-01-25_kalejdos,02,L1998-01-25, kalejdos,false,
L1998-01-25_vekaplyv,03,L1998-01-25, vekaplyv,false,
L1998-01-25_zaklinan,04,L1998-01-25, zaklinan,false,
L1998-01-25_fontanka,05,L1998-01-25, fontanka,false,
L1998-01-25_chuzhaj1,06,L1998-01-25, chuzhaj1,false,
L1998-01-25_istorija,07,L1998-01-25, istorija,false,
L1998-01-25_prenebre,08,L1998-01-25, prenebre,false,
L1998-01-25_ochnulsj,09,L1998-01-25, ochnulsj,false,
L1998-01-25_avtoparo,10,L1998-01-25, avtoparo,false,
L1998-01-25_panorama,11,L1998-01-25, panorama,false,
L1998-01-25_svidanie,12,L1998-01-25, svidanie,false,
L1998-01-25_sentenci,13,L1998-01-25, sentenci,false,
L1998-01-25_menuet,14,L1998-01-25, menuet,false,
L1998-01-25_zavescha,15,L1998-01-25, zavescha,false,
L1998-01-25_inicialy,16,L1998-01-25, inicialy,false,
L1998-01-25_vtornik,17,L1998-01-25, vtornik,false,
L1998-01-25_baltijsk,18,L1998-01-25, baltijsk,false,
L1998-01-25_moiraket,19,L1998-01-25, moiraket,false,
L1998-01-25_peshkom,20,L1998-01-25, peshkom,false,
L1998-01-25_ryba,21,L1998-01-25, ryba,false,
L1998-01-25_chepuxa,22,L1998-01-25, chepuxa,false,

24.01.1998 сб – Новосибирск
L1998-01-24_pustyjeb,01,L1998-01-24, pustyjeb,false,
L1998-01-24_romans2,02,L1998-01-24, romans2,false,
L1998-01-24_zatemzhe,03,L1998-01-24, zatemzhe,false,
L1998-01-24_vishnevo,04,L1998-01-24, vishnevo,false,
L1998-01-24_nichemun,05,L1998-01-24, nichemun,false,
L1998-01-24_stixiopr,06,L1998-01-24, stixiopr,false,
L1998-01-24_rodljuds,07,L1998-01-24, rodljuds,false,
L1998-01-24_podzname,08,L1998-01-24, podzname,false,
L1998-01-24_trubach,09,L1998-01-24, trubach,false,
L1998-01-24_vpoxodny,10,L1998-01-24, vpoxodny,false,
L1998-01-24_brodjagi,11,L1998-01-24, brodjagi,false,
L1998-01-24_odnazhdy,12,L1998-01-24, odnazhdy,false,
L1998-01-24_1991,13,L1998-01-24, 1991,false,
L1998-01-24_alliluja,14,L1998-01-24, alliluja,false,
L1998-01-24_vechnoes,15,L1998-01-24, vechnoes,false,
L1998-01-24_jachashu,16,L1998-01-24, jachashu,false,
L1998-01-24_moekoro3,17,L1998-01-24, moekoro3,false,
L1998-01-24_diktant,18,L1998-01-24, diktant,false,
L1998-01-24_descensu,19,L1998-01-24, descensu,false,
L1998-01-24_krasnye,20,L1998-01-24, krasnye,false,
L1998-01-24_1992,21,L1998-01-24, 1992,false,
L1998-01-24_avstrali,22,L1998-01-24, avstrali,false,
L1998-01-24_sharmans,23,L1998-01-24, sharmans,false,


1997 г. ▼ ▲

23.11.1997 вс – Санкт-Петербург, ЛКЗ, дуэт (гитара)
L1997-11-23_kibitka,01,L1997-11-23, kibitka,false,
L1997-11-23_kovcheg,02,L1997-11-23, kovcheg,false,
L1997-11-23_kalejdos,03,L1997-11-23, kalejdos,false,
L1997-11-23_adleucon,04,L1997-11-23, adleucon,false,
L1997-11-23_dusha,05,L1997-11-23, dusha,false,
L1997-11-23_kolybeln,06,L1997-11-23, kolybeln,false,
L1997-11-23_etoja,07,L1997-11-23, etoja,false,
L1997-11-23_navsejz1,08,L1997-11-23, navsejz1,false,
L1997-11-23_eccehomo,09,L1997-11-23, eccehomo,false,
L1997-11-23_vtornik,10,L1997-11-23, vtornik,false,
L1997-11-23_volk,11,L1997-11-23, volk,false,
L1997-11-23_okean,12,L1997-11-23, okean,false,
L1997-11-23_poshlyj,13,L1997-11-23, poshlyj,false,
L1997-11-23_sezondoz,14,L1997-11-23, sezondoz,false,
L1997-11-23_voslavug,15,L1997-11-23, voslavug,false,
L1997-11-23_vekaplyv,16,L1997-11-23, vekaplyv,false,
L1997-11-23_korablik,17,L1997-11-23, korablik,false,
L1997-11-23_vozvrasc,18,L1997-11-23, vozvrasc,false,
L1997-11-23_karavan,19,L1997-11-23, karavan,false,
L1997-11-23_interme3,20,L1997-11-23, interme3,false,
L1997-11-23_marija,21,L1997-11-23, marija,false,
L1997-11-23_sharmans,22,L1997-11-23, sharmans,false,
L1997-11-23_vosxodja,23,L1997-11-23, vosxodja,false,

22.11.1997 сб – Санкт-Петербург, ЛКЗ
L1997-11-22_pustyjeb,01,L1997-11-22, pustyjeb,false,
L1997-11-22_romans2,02,L1997-11-22, romans2,false,
L1997-11-22_zatemzhe,03,L1997-11-22, zatemzhe,false,
L1997-11-22_vishnevo,04,L1997-11-22, vishnevo,false,
L1997-11-22_nichemun,05,L1997-11-22, nichemun,false,
L1997-11-22_vpoxodny,06,L1997-11-22, vpoxodny,false,
L1997-11-22_inicialy,07,L1997-11-22, inicialy,false,
L1997-11-22_vechnoes,08,L1997-11-22, vechnoes,false,
L1997-11-22_podzname,09,L1997-11-22, podzname,false,
L1997-11-22_trubach,10,L1997-11-22, trubach,false,
L1997-11-22_brodjagi,11,L1997-11-22, brodjagi,false,
L1997-11-22_istorija,12,L1997-11-22, istorija,false,
L1997-11-22_stixiopr,13,L1997-11-22, stixiopr,false,
L1997-11-22_vrjadli,14,L1997-11-22, vrjadli,false,
L1997-11-22_avtoparo,15,L1997-11-22, avtoparo,false,
L1997-11-22_avstrali,16,L1997-11-22, avstrali,false,
L1997-11-22_krasnye,17,L1997-11-22, krasnye,false,
L1997-11-22_baltijsk,18,L1997-11-22, baltijsk,false,
L1997-11-22_zavescha,19,L1997-11-22, zavescha,false,
L1997-11-22_menuet,20,L1997-11-22, menuet,false,
L1997-11-22_inicialy,21,L1997-11-22, inicialy,false,
L1997-11-22_chuzhaj2,22,L1997-11-22, chuzhaj2,false,
L1997-11-22_chuzhaj1,23,L1997-11-22, chuzhaj1,false,
L1997-11-22_zaklinan,24,L1997-11-22, zaklinan,false,
L1997-11-22_ryba,25,L1997-11-22, ryba,false,
L1997-11-22_chepuxa,26,L1997-11-22, chepuxa,false,

18.11.1997 вт – Москва, ЦДХ, 2 премьеры
L1997-11-18_pustyjeb,01,L1997-11-18, pustyjeb,false,
L1997-11-18_vechnoes,02,L1997-11-18, vechnoes,false,
L1997-11-18_nichemun,03,L1997-11-18, nichemun,false,
L1997-11-18_brodjagi,04,L1997-11-18, brodjagi (не допел),false,
L1997-11-18_inicialy,05,L1997-11-18, inicialy,false,
L1997-11-18_avtoparo,06,L1997-11-18, avtoparo,false,
L1997-11-18_romans2,07,L1997-11-18, romans2,false,
L1997-11-18_chuzhaj1,08,L1997-11-18, chuzhaj1,false,
L1997-11-18_vrjadli,09,L1997-11-18, vrjadli,false,
L1997-11-18_vpoxodny,10,L1997-11-18, vpoxodny,false,
L1997-11-18_zaklinan,11,L1997-11-18, zaklinan,false,
L1997-11-18_krasnye,12,L1997-11-18, krasnye,false,
---
L1997-11-18_sharmans,13,L1997-11-18, sharmans,false,
L1997-11-18_chuzhaj2,14,L1997-11-18, chuzhaj2,true,
L1997-11-18_alliluja,15,L1997-11-18, alliluja,false,
L1997-11-18_zavescha,16,L1997-11-18, zavescha,false,
L1997-11-18_ljubov,17,L1997-11-18, ljubov,false,
L1997-11-18_menuet,18,L1997-11-18, menuet,false,
L1997-11-18_svidanie,19,L1997-11-18, svidanie,false,
L1997-11-18_baltijsk,20,L1997-11-18, baltijsk,false,
L1997-11-18_vekaplyv,21,L1997-11-18, vekaplyv,false,
L1997-11-18_vosxodja,22,L1997-11-18, vosxodja,false,
L1997-11-18_ryba,23,L1997-11-18, ryba,true,
L1997-11-18_chepuxa,24,L1997-11-18, chepuxa,false,

26.10.1997 вс – США, Los Angeles, CA

25.10.1997 сб – США, Palo Alto, CA, JCC

24.10.1997 пт – США, San Francisco, CA, Luteran Church

22.10.1997 ср – США, Seattle, WA
L1997-10-22_pustyjeb,01,L1997-10-22, pustyjeb,false,
L1997-10-22_romans2,02,L1997-10-22, romans2,false,
L1997-10-22_vishnevo,03,L1997-10-22, vishnevo,false,
L1997-10-22_nichemun,04,L1997-10-22, nichemun,false,
L1997-10-22_podzname,05,L1997-10-22, podzname,false,
L1997-10-22_alliluja,06,L1997-10-22, alliluja,false,
L1997-10-22_vpoxodny,07,L1997-10-22, vpoxodny,false,
L1997-10-22_zatemzhe,08,L1997-10-22, zatemzhe,false,
L1997-10-22_moekoro3,09,L1997-10-22, moekoro3,false,
L1997-10-22_1991,10,L1997-10-22, 1991,false,
L1997-10-22_trubach,11,L1997-10-22, trubach,false,
L1997-10-22_stixiopr,12,L1997-10-22, stixiopr,false,
L1997-10-22_vechnoes,13,L1997-10-22, vechnoes,false,
L1997-10-22_jachashu,14,L1997-10-22, jachashu,false,
L1997-10-22_descensu,15,L1997-10-22, descensu,false,
L1997-10-22_avtoparo,16,L1997-10-22, avtoparo,false,
L1997-10-22_baltijsk,17,L1997-10-22, baltijsk,false,
L1997-10-22_krasnye,18,L1997-10-22, krasnye,false,
L1997-10-22_sharmans,19,L1997-10-22, sharmans,false,
L1997-10-22_avstrali,20,L1997-10-22, avstrali,false,
L1997-10-22_brodjagi,21,L1997-10-22, brodjagi,false,
L1997-10-22_istorija,22,L1997-10-22, istorija,false,
L1997-10-22_zaklinan,23,L1997-10-22, zaklinan,false,
L1997-10-22_inicialy,24,L1997-10-22, inicialy,false,
L1997-10-22_vtornik,25,L1997-10-22, vtornik,false,
L1997-10-22_vrjadli,26,L1997-10-22, vrjadli,false,
L1997-10-22_chepuxa,27,L1997-10-22, chepuxa,false,

18.10.1997 сб – США, Chicago, IL

15.10.1997 ср – Канада, Toronto
L1997-10-15_pustyjeb,01,L1997-10-15, pustyjeb,false,
L1997-10-15_romans2,02,L1997-10-15, romans2,false,
L1997-10-15_vishnevo,03,L1997-10-15, vishnevo,false,
L1997-10-15_nichemun,04,L1997-10-15, nichemun,false,
L1997-10-15_podzname,05,L1997-10-15, podzname,false,
L1997-10-15_alliluja,06,L1997-10-15, alliluja,false,
L1997-10-15_vpoxodny,07,L1997-10-15, vpoxodny,false,
L1997-10-15_zatemzhe,08,L1997-10-15, zatemzhe,false,
L1997-10-15_moekoro3,09,L1997-10-15, moekoro3,false,
L1997-10-15_1991,10,L1997-10-15, 1991,false,
L1997-10-15_trubach,11,L1997-10-15, trubach,false,
L1997-10-15_stixiopr,12,L1997-10-15, stixiopr,false,
L1997-10-15_voslavug,13,L1997-10-15, voslavug,false,
L1997-10-15_jachashu,14,L1997-10-15, jachashu,false,
L1997-10-15_descensu,15,L1997-10-15, descensu,false,
L1997-10-15_avtoparo,16,L1997-10-15, avtoparo,false,
L1997-10-15_istorija,17,L1997-10-15, istorija,false,
L1997-10-15_avstrali,18,L1997-10-15, avstrali,false,
L1997-10-15_vtornik,19,L1997-10-15, vtornik,false,
L1997-10-15_inicialy,20,L1997-10-15, inicialy,false,
L1997-10-15_zaklinan,21,L1997-10-15, zaklinan,false,
L1997-10-15_sharmans,22,L1997-10-15, sharmans,false,
L1997-10-15_krasnye,23,L1997-10-15, krasnye,false,
L1997-10-15_moiraket,24,L1997-10-15, moiraket,false,
L1997-10-15_chepuxa,25,L1997-10-15, chepuxa,false,

14.10.1997 вт – Канада, Montreal

11.10.1997 сб – США, Boston, MA
L1997-10-11_pustyjeb,01,L1997-10-11, pustyjeb,false,
L1997-10-11_romans2,02,L1997-10-11, romans2,false,
L1997-10-11_vishnevo,03,L1997-10-11, vishnevo,false,
L1997-10-11_nichemun,04,L1997-10-11, nichemun,false,
L1997-10-11_podzname,05,L1997-10-11, podzname,false,
L1997-10-11_alliluja,06,L1997-10-11, alliluja,false,
L1997-10-11_vpoxodny,07,L1997-10-11, vpoxodny,false,
L1997-10-11_zatemzhe,08,L1997-10-11, zatemzhe,false,
L1997-10-11_moekoro3,09,L1997-10-11, moekoro3,false,
L1997-10-11_1991,10,L1997-10-11, 1991,false,
L1997-10-11_vechnoes,11,L1997-10-11, vechnoes,false,
L1997-10-11_voslavug,12,L1997-10-11, voslavug,false,
L1997-10-11_trubach,13,L1997-10-11, trubach,false,
L1997-10-11_descensu,14,L1997-10-11, descensu,false,
L1997-10-11_stixiopr,15,L1997-10-11, stixiopr,false,
L1997-10-11_chuzhaj1,16,L1997-10-11, chuzhaj1,false,
L1997-10-11_krasnye,17,L1997-10-11, krasnye,false,
L1997-10-11_sharmans,18,L1997-10-11, sharmans,false,
L1997-10-11_inicialy,19,L1997-10-11, inicialy,false,
L1997-10-11_avstrali,20,L1997-10-11, avstrali,false,
L1997-10-11_moiraket,21,L1997-10-11, moiraket,false,
L1997-10-11_chepuxa,22,L1997-10-11, chepuxa,false,

07.10.1997 вт – США, Brooklyn, NY

04.10.1997 сб – США, Rockville, MD
L1997-10-04_pustyjeb,01,L1997-10-04, pustyjeb,false,
L1997-10-04_romans2,02,L1997-10-04, romans2,false,
L1997-10-04_vishnevo,03,L1997-10-04, vishnevo,false,
L1997-10-04_nichemun,04,L1997-10-04, nichemun,false,
L1997-10-04_podzname,05,L1997-10-04, podzname,false,
L1997-10-04_alliluja,06,L1997-10-04, alliluja,false,
L1997-10-04_navsejz1,07,L1997-10-04, navsejz1,false,
L1997-10-04_vpoxodny,08,L1997-10-04, vpoxodny,false,
L1997-10-04_zatemzhe,09,L1997-10-04, zatemzhe,false,
L1997-10-04_moekoro3,10,L1997-10-04, moekoro3,false,
L1997-10-04_1991,11,L1997-10-04, 1991,false,
L1997-10-04_trubach,12,L1997-10-04, trubach,false,
L1997-10-04_vechnoes,13,L1997-10-04, vechnoes,false,
L1997-10-04_kovcheg,14,L1997-10-04, kovcheg,false,
L1997-10-04_avtoparo,15,L1997-10-04, avtoparo,false,
L1997-10-04_stixiopr,16,L1997-10-04, stixiopr,false,
L1997-10-04_descensu,17,L1997-10-04, descensu,false,
L1997-10-04_sharmans,18,L1997-10-04, sharmans,false,
L1997-10-04_krasnye,19,L1997-10-04, krasnye,false,
L1997-10-04_chuzhaj1,20,L1997-10-04, chuzhaj1,false,
L1997-10-04_zaklinan,21,L1997-10-04, zaklinan,false,
L1997-10-04_vrjadli,22,L1997-10-04, vrjadli,false,
L1997-10-04_moiraket,23,L1997-10-04, moiraket,false,
L1997-10-04_inicialy,24,L1997-10-04, inicialy,false,
L1997-10-04_vtornik,25,L1997-10-04, vtornik,false,
L1997-10-04_chepuxa,26,L1997-10-04, chepuxa,false,

03.10.1997 пт – США, Philadelphia, PA

26.09.1997 пт – Москва, театр "Перекрёсток", премьера
L1997-09-26_avtoparo,01,L1997-09-26, avtoparo,false,
L1997-09-26_voslavug,02,L1997-09-26, voslavug,false,
L1997-09-26_istorija,03,L1997-09-26, istorija,false,
L1997-09-26_kordebal,04,L1997-09-26, kordebal,false,
L1997-09-26_instrukc,05,L1997-09-26, instrukc,false,
L1997-09-26_paris,06,L1997-09-26, paris,false,
L1997-09-26_sharmans,07,L1997-09-26, sharmans,false,
L1997-09-26_rodljuds,08,L1997-09-26, rodljuds,false,
L1997-09-26_vishnevo,09,L1997-09-26, vishnevo,false,
L1997-09-26_nichemun,10,L1997-09-26, nichemun (не допел),false,
L1997-09-26_chuzhaj1,11,L1997-09-26, chuzhaj1,false,
L1997-09-26_diktant,12,L1997-09-26, diktant,false,
L1997-09-26_vrjadli,13,L1997-09-26, vrjadli,false,
L1997-09-26_zaklinan,14,L1997-09-26, zaklinan,false,
L1997-09-26_krasnye,15,L1997-09-26, krasnye,true,
L1997-09-26_1992,16,L1997-09-26, 1992,false,
L1997-09-26_panorama,17,L1997-09-26, panorama,false,
L1997-09-26_1991,18,L1997-09-26, 1991,false,
L1997-09-26_etodolzh,19,L1997-09-26, etodolzh,false,
L1997-09-26_inicialy,20,L1997-09-26, inicialy,false,
L1997-09-26_jachashu,21,L1997-09-26, jachashu,false,
L1997-09-26_vtornik,22,L1997-09-26, vtornik,false,
L1997-09-26_moiraket,23,L1997-09-26, moiraket,false,
L1997-09-26_cirkach,24,L1997-09-26, cirkach,false,
L1997-09-26_chepuxa,25,L1997-09-26, chepuxa,false,

16.05.1997 пт – Москва, Олимпийская деревня, премьера
L1997-05-16_etiglaza,01,L1997-05-16, etiglaza,false,
L1997-05-16_chtotako,02,L1997-05-16, chtotako,false,
L1997-05-16_moekoro2,03,L1997-05-16, moekoro2,false,
L1997-05-16_menuet,04,L1997-05-16, menuet,false,
L1997-05-16_sentenci,05,L1997-05-16, sentenci,false,
L1997-05-16_vechnoes,06,L1997-05-16, vechnoes,false,
L1997-05-16_1992,07,L1997-05-16, 1992,false,
L1997-05-16_zavescha,08,L1997-05-16, zavescha,false,
L1997-05-16_theraven,09,L1997-05-16, theraven,false,
L1997-05-16_vademecu,10,L1997-05-16, vademecu,false,
L1997-05-16_ballada,11,L1997-05-16, ballada,false,
L1997-05-16_rusalka,12,L1997-05-16, rusalka,false,
L1997-05-16_burja,13,L1997-05-16, burja,false,
L1997-05-16_inicialy,14,L1997-05-16, inicialy,false,
L1997-05-16_kakojkos,15,L1997-05-16, kakojkos,false,
L1997-05-16_chepuxa,16,L1997-05-16, chepuxa,false,
L1997-05-16_chuzhaj1,17,L1997-05-16, chuzhaj1,false,
L1997-05-16_cirkach,18,L1997-05-16, cirkach,true,

24.04.1997 чт – Зеленоград, МИЭТ
L1997-04-24_pustyjeb,01,L1997-04-24, pustyjeb,false,
L1997-04-24_romans2,02,L1997-04-24, romans2,false,
L1997-04-24_moiraket,03,L1997-04-24, moiraket,false,
L1997-04-24_kogoljub,04,L1997-04-24, kogoljub,false,
L1997-04-24_ochnulsj,05,L1997-04-24, ochnulsj,false,
L1997-04-24_cirkachk,06,L1997-04-24, cirkachk,false,
L1997-04-24_descensu,07,L1997-04-24, descensu,false,
L1997-04-24_rodljuds,08,L1997-04-24, rodljuds,false,
L1997-04-24_alliluja,09,L1997-04-24, alliluja,false,
L1997-04-24_diktant,10,L1997-04-24, diktant,false,
L1997-04-24_inicialy,11,L1997-04-24, inicialy,false,
L1997-04-24_avstrali,12,L1997-04-24, avstrali,false,
L1997-04-24_1991,13,L1997-04-24, 1991,false,
L1997-04-24_kordebal,14,L1997-04-24, kordebal,false,
L1997-04-24_shkolat2,15,L1997-04-24, shkolat2,false,
L1997-04-24_paris,16,L1997-04-24, paris,false,
L1997-04-24_vishnevo,17,L1997-04-24, vishnevo,false,
L1997-04-24_trubach,18,L1997-04-24, trubach,false,
L1997-04-24_vtornik,19,L1997-04-24, vtornik,false,
L1997-04-24_etiglaza,20,L1997-04-24, etiglaza,false,
L1997-04-24_kinemat2,21,L1997-04-24, kinemat2,false,
L1997-04-24_zaklinan,22,L1997-04-24, zaklinan,false,
L1997-04-24_chuzhaj1,23,L1997-04-24, chuzhaj1,false,
L1997-04-24_chepuxa,24,L1997-04-24, chepuxa,false,
L1997-04-24_zavescha,25,L1997-04-24, zavescha,false,

11.04.1997 пт – Москва, ДК МГУ, премьера
L1997-04-11_pustyjeb,01,L1997-04-11, pustyjeb,false,
L1997-04-11_prenebre,02,L1997-04-11, prenebre,false,
L1997-04-11_brodjagi,03,L1997-04-11, brodjagi,false,
L1997-04-11_moekoro3,04,L1997-04-11, moekoro3,false,
L1997-04-11_kordebal,05,L1997-04-11, kordebal,false,
L1997-04-11_zatemzhe,06,L1997-04-11, zatemzhe,false,
L1997-04-11_vishnevo,07,L1997-04-11, vishnevo,false,
L1997-04-11_alliluja,08,L1997-04-11, alliluja,false,
L1997-04-11_diktant,09,L1997-04-11, diktant,false,
L1997-04-11_instrukc,10,L1997-04-11, instrukc,false,
L1997-04-11_inicialy,11,L1997-04-11, inicialy,false,
L1997-04-11_zaklinan,12,L1997-04-11, zaklinan,false,
L1997-04-11_gorestn2,13,L1997-04-11, gorestn2,false,
L1997-04-11_kinemat2,14,L1997-04-11, kinemat2,false,
L1997-04-11_chuzhaj1,15,L1997-04-11, chuzhaj1,true,
L1997-04-11_chepuxa,16,L1997-04-11, chepuxa,false,
L1997-04-11_trubach,17,L1997-04-11, trubach,false,
L1997-04-11_moekoro2,18,L1997-04-11, moekoro2,false,
L1997-04-11_sentenci,19,L1997-04-11, sentenci,false,
L1997-04-11_1992,20,L1997-04-11, 1992,false,
L1997-04-11_vechnoes,21,L1997-04-11, vechnoes,false,
L1997-04-11_zavescha,22,L1997-04-11, zavescha,false,

08.04.1997 вт – Москва, ЦДХ, второй акт дуэт (гитара)
L1997-04-08_nichemun,01,L1997-04-08, nichemun,false,
L1997-04-08_romans2,02,L1997-04-08, romans2,false,
L1997-04-08_descensu,03,L1997-04-08, descensu,false,
L1997-04-08_ochnulsj,04,L1997-04-08, ochnulsj,false,
L1997-04-08_kordebal,05,L1997-04-08, kordebal,false,
L1997-04-08_alliluja,06,L1997-04-08, alliluja,false,
L1997-04-08_peshkom,07,L1997-04-08, peshkom,false,
L1997-04-08_kogoljub,08,L1997-04-08, kogoljub,false,
L1997-04-08_prenebre,09,L1997-04-08, prenebre,false,
L1997-04-08_fontanka,10,L1997-04-08, fontanka,false,
L1997-04-08_stixiopr,11,L1997-04-08, stixiopr,false,
L1997-04-08_moekoro3,12,L1997-04-08, moekoro3,false,
L1997-04-08_sentenci,13,L1997-04-08, sentenci,false,
L1997-04-08_zavescha,14,L1997-04-08, zavescha,false,
L1997-04-08_1992,15,L1997-04-08, 1992,false,
L1997-04-08_chepuxa,16,L1997-04-08, chepuxa,false,
---
L1997-04-08_sharmans,17,L1997-04-08, sharmans,false,
L1997-04-08_vtornik,18,L1997-04-08, vtornik,false,
L1997-04-08_puskaj,19,L1997-04-08, puskaj,false,
L1997-04-08_kolybeln,20,L1997-04-08, kolybeln,false,
L1997-04-08_kibitka,21,L1997-04-08, kibitka,false,
L1997-04-08_okean,22,L1997-04-08, okean,false,
L1997-04-08_poshlyj,23,L1997-04-08, poshlyj,false,
L1997-04-08_konecned,24,L1997-04-08, konecned,false,
L1997-04-08_interme3,25,L1997-04-08, interme3,false,
L1997-04-08_balagan2,26,L1997-04-08, balagan2,false,

06.04.1997 вc – Москва, домашний концерт у Л. Блехера
L1997-04-06_panorama,01,L1997-04-06, panorama,false,
L1997-04-06_alliluja,02,L1997-04-06, alliluja,false,
L1997-04-06_1992,03,L1997-04-06, 1992,false,
L1997-04-06_kordebal,04,L1997-04-06, kordebal,false,
L1997-04-06_ochnulsj,05,L1997-04-06, ochnulsj,false,
L1997-04-06_moiraket,06,L1997-04-06, moiraket,false,
L1997-04-06_zavescha,07,L1997-04-06, zavescha,false,
L1997-04-06_inicialy,08,L1997-04-06, inicialy,false,
L1997-04-06_shkolat2,09,L1997-04-06, shkolat2,false,
L1997-04-06_sharmans,10,L1997-04-06, sharmans,false,
L1997-04-06_chinatow,11,L1997-04-06, chinatow,false,
L1997-04-06_zaklinan,12,L1997-04-06, zaklinan,false,
L1997-04-06_aneta,13,L1997-04-06, aneta,false,
L1997-04-06_istorija,14,L1997-04-06, istorija,false,
L1997-04-06_kinemat2,15,L1997-04-06, kinemat2,false,
L1997-04-06_brodjagi,16,L1997-04-06, brodjagi,false,
L1997-04-06_nichemun,17,L1997-04-06, nichemun,false,
L1997-04-06_sentenci,18,L1997-04-06, sentenci,false,
L1997-04-06_interme3,19,L1997-04-06, interme3,false,

05.04.1997 сб – Санкт-Петербург, ЛКЗ

07.02.1997 пт – Москва, Политехнический музей, дуэт (гитара), 2 премьеры
L1997-02-07_voslavug,01,L1997-02-07, voslavug,false,
L1997-02-07_molitva,02,L1997-02-07, molitva,false,
L1997-02-07_kalejdos,03,L1997-02-07, kalejdos,false,
L1997-02-07_navsejz1,04,L1997-02-07, navsejz1,false,
L1997-02-07_eccehomo,05,L1997-02-07, eccehomo,false,
L1997-02-07_marija,06,L1997-02-07, marija,false,
L1997-02-07_muzhajsj,07,L1997-02-07, muzhajsj,false,
L1997-02-07_okean,08,L1997-02-07, okean,false,
L1997-02-07_etoja,09,L1997-02-07, etoja,false,
L1997-02-07_kovcheg,10,L1997-02-07, kovcheg,false,
L1997-02-07_vozvrasc,11,L1997-02-07, vozvrasc,false,
L1997-02-07_vtornik,12,L1997-02-07, vtornik,false,
L1997-02-07_poshlyj,13,L1997-02-07, poshlyj,false,
L1997-02-07_sezondoz,14,L1997-02-07, sezondoz,false,
L1997-02-07_avstrali,15,L1997-02-07, avstrali,false,
L1997-02-07_karavan,16,L1997-02-07, karavan,false,
L1997-02-07_gorestn2,17,L1997-02-07, gorestn2,false,
L1997-02-07_switzerl,18,L1997-02-07, switzerl,false,
L1997-02-07_cirkachk,19,L1997-02-07, cirkachk,false,
L1997-02-07_inicialy,20,L1997-02-07, inicialy,false,
L1997-02-07_volk,21,L1997-02-07, volk,true,
L1997-02-07_konecned,22,L1997-02-07, konecned,true,
L1997-02-07_kolybeln,23,L1997-02-07, kolybeln,false,

17.01.1997 пт – Москва, Олимпийская деревня
L1997-01-17_kordebal,01,L1997-01-17, kordebal,false,
L1997-01-17_voslavug,02,L1997-01-17, voslavug,false,
L1997-01-17_paris,03,L1997-01-17, paris,false,
L1997-01-17_nichemun,04,L1997-01-17, nichemun,false,
L1997-01-17_podzname,05,L1997-01-17, podzname,false,
L1997-01-17_istorija,06,L1997-01-17, istorija,false,
L1997-01-17_inicialy,07,L1997-01-17, inicialy,false,
L1997-01-17_moiraket,08,L1997-01-17, moiraket,false,
L1997-01-17_chepuxa,09,L1997-01-17, chepuxa,false,
L1997-01-17_menuet,10,L1997-01-17, menuet,false,
L1997-01-17_ljubov,11,L1997-01-17, ljubov,false,
L1997-01-17_zavescha,12,L1997-01-17, zavescha,false,
L1997-01-17_sharmans,13,L1997-01-17, sharmans,false,
L1997-01-17_svidanie,14,L1997-01-17, svidanie,false,
L1997-01-17_chtotako,15,L1997-01-17, chtotako,false,
L1997-01-17_moekoro2,16,L1997-01-17, moekoro2,false,
L1997-01-17_sentenci,17,L1997-01-17, sentenci,false,
L1997-01-17_kupljubi,18,L1997-01-17, kupljubi,false,
L1997-01-17_aneta,19,L1997-01-17, aneta,false,
L1997-01-17_fontanka,20,L1997-01-17, fontanka,false,
L1997-01-17_rozhdest,21,L1997-01-17, rozhdest,false,
L1997-01-17_deklarac,22,L1997-01-17, deklarac,false,
L1997-01-17_farewell,23,L1997-01-17, farewell,false,
L1997-01-17_1992,24,L1997-01-17, 1992,false,
L1997-01-17_vechnoes,25,L1997-01-17, vechnoes,false,

09.01.1997 чт – Москва, ЦАТ
L1997-01-09_zatemzhe,01,L1997-01-09, zatemzhe,false,
L1997-01-09_romans2,02,L1997-01-09, romans2,false,
L1997-01-09_izdaleka,03,L1997-01-09, izdaleka,false,
L1997-01-09_istorija,04,L1997-01-09, istorija,false,
